cartodb_id,the_geom,fuel_type_code,station_name,street_address,intersection_directions,plus4,station_phone,status_code,expected_date,groups_with_access_code,access_days_time,cards_accepted,bd_blends,ng_fill_type_code,ng_psi,ev_level1_evse_num,ev_level2_evse_num,ev_dc_fast_count,ev_other_info,ev_network,ev_network_web,date_last_confirmed,id,updated_at,owner_type_code,federal_agency_id,federal_agency_name,open_date,hydrogen_status_link,ng_vehicle_class,lpg_primary,e85_blender_pump,ev_connector_types,address,latitude,longitude,affgeoid,median_household_income
12132,0101000020E61000000B123697762A5EC0EE28290BBAA64140,ELEC,CALPOLY,University Dr,"LOT H2 EV3; Lot H2 adjacent to Kennedy Library off of Highland and University Dr. .
LOT H2 EV2; Lot H2 adjacent to Kennedy Library off of Highland and University Dr. 
LOT H2 EV1; Lot H2 adjacent to Kennedy Library off of Highland and University Dr. 
LOT H2 EV4; Lot H2 adjacent to Kennedy Library off of Highland and University Dr. .",,888-758-4389,E,,Public,24 hours daily,,,,,,8,,,ChargePoint Network,http://www.mychargepoint.net/,10/09/2015,66490,2015-10-09 07:46:46+00,,,,,,,,,J1772,"University Dr
San Luis Obispo, CA 93405",35.3025526,-120.6634882,1400000US06079010901,4541
20843,0101000020E610000030F2B226162A5EC088C7348930A64140,ELEC,CALPOLY,Tahoe Rd,"GRAND EV1; Grand Avenue Structure, Level 1, Staff side
GRAND EV2; Grand Avenue Structure, Level 1, Staff Side",,888-758-4389,E,,Public,24 hours daily,,,,,,4,,,ChargePoint Network,http://www.mychargepoint.net/,10/09/2015,66491,2015-10-09 07:46:48+00,,,,,,,,,J1772,"Tahoe Rd
San Luis Obispo, CA 93405",35.2983562,-120.657602,1400000US06079010901,4541
14467,0101000020E61000001081D9F36B925DC0899B53C900034140,ELEC,University of Southern California - Lot 6,941 W 35th St,,,213-740-2787,E,,Public,"24 hours daily; pay lot",,,,,,2,,,,,08/04/2015,21407,2015-08-04 12:19:56+00,P,,,01/31/2002,,,,,J1772,"941 W 35th St
Los Angeles, CA 90089",34.0234615,-118.2878389,1400000US06037222700,9236
14459,0101000020E6100000C8563C9A8F925DC0B9E4130DAD024140,ELEC,USC CAMPUS,3667 McClintock Ave,"PSA LEVEL #1; Enter PSA from McClintock entrance, chargers are at the bottom of the ramp on the right hand side",,888-758-4389,E,,Public,24 hours daily,,,,,,2,,,ChargePoint Network,http://www.mychargepoint.net/,10/09/2015,62347,2015-10-09 07:50:27+00,,,,,,,,,J1772,"3667 McClintock Ave
Los Angeles, CA 90089",34.0209061,-118.2900148,1400000US06037222700,9236
6316,0101000020E6100000B9AC1D2073925DC00AD1C6B6B1024140,ELEC,USC CAMPUS,933-999 Downey Way,"LOT #2, #1; Enter from Downey Way",,888-758-4389,E,,Public,24 hours daily,,,,,,2,,,ChargePoint Network,http://www.mychargepoint.net/,10/09/2015,62344,2015-10-09 07:50:25+00,,,,,,,,,J1772,"933-999 Downey Way
Los Angeles, CA 90089",34.0210484,-118.2882767,1400000US06037222700,9236
1886,0101000020E61000002A74B91C0A925DC0250C5E4FCF024140,ELEC,USC CAMPUS,649 W 34th St,"PSD BASEMENT #1; Inside Structure at bottom of first floor ramp going down to the basement level",,888-758-4389,E,,Public,24 hours daily,,,,,,2,,,ChargePoint Network,http://www.mychargepoint.net/,10/09/2015,62346,2015-10-09 07:50:26+00,,,,,,,,,J1772,"649 W 34th St
Los Angeles, CA 90089",34.0219516,-118.2818672,1400000US06037222700,9236
20418,0101000020E61000000BB5A679C7915DC0C190D5AD9E034140,ELEC,"AAA - Auto Club of Southern California, Los Angeles Branch",2601 S Figueroa St,At W Adams Blvd,,213-741-3686,E,,Public,9am-5pm M-F,,,,,,2,,,,,05/05/2015,48358,2015-05-05 11:57:10+00,P,,,04/20/2012,,,,,J1772,"2601 S Figueroa St
Los Angeles, CA 90007",34.02828,-118.2778,1400000US06037224700,10560
9050,0101000020E6100000A06F0B96EA8F5DC0BDC282FB01074140,ELEC,The Emerson,225 S. Grand Avenue,,,888-998-2546,E,,Public,MON: 24 hours | TUE: 24 hours | WED: 24 hours | THU: 24 hours | FRI: 24 hours | SAT: 24 hours | SUN: 24 hours,,,,,,1,,,Blink Network,http://www.blinknetwork.com/,10/09/2015,67002,2015-10-09 07:12:46+00,,,,,,,,,J1772,"225 S. Grand Avenue
Los Angeles, CA 90012",34.054748,-118.248693,1400000US06037207400,10598
9146,0101000020E6100000A4DE5339ED8F5DC040BD19355F074140,ELEC,LADWP - Parking,111 N Hope St,Across Hope,,800-473-3652,E,,Public,24 hours daily,,,,,,51,,,,,03/04/2015,1525,2015-03-04 15:19:41+00,LG,,,10/15/1999,,,,,J1772,"111 N Hope St
Los Angeles, CA 90012",34.057593,-118.248854,1400000US06037207400,10598
6927,0101000020E6100000569A9482EE8F5DC0049E6AE33E074140,ELEC,Music Center Parking,135 N Grand Ave,"Music Center Parking Lot 14, level 3",,213-972-7211  323-267-2023,E,,Public,"Garage business hours; pay lot; keypad activated, instructions on EVSE",,,,,,3,,,,,06/02/2015,63051,2015-06-02 18:19:29+00,LG,,,08/01/2014,,,,,J1772,"135 N Grand Ave
Los Angeles, CA 90012",34.0566067,-118.2489325,1400000US06037207400,10598
2010,0101000020E6100000227F7A7DF78F5DC0E6F16A6FA6074140,ELEC,Department of Health Services Administration,313 N Figueroa,Enter on N Figueroa,,213-972-7211  323-267-2023,E,,Public,"Garage business hours; pay lot; keypad activated, instructions on EVSE",,,,,,4,,,,,06/02/2015,63052,2015-06-02 18:02:01+00,LG,,,08/01/2014,,,,,J1772,"313 N Figueroa
Los Angeles, CA 90012",34.0597667,-118.2494806,1400000US06037207400,10598
8861,0101000020E6100000A7CF0EB8AE8F5DC0ACA8C1340C074140,ELEC,Los Angeles Law Library,145 N Broadway,Parking Lot 10,,323-881-3919 ,E,,Public,"Garage business hours; pay lot; keypad activated, instructions on EVSE",,,,,,3,,,,,06/02/2015,63050,2015-06-02 18:01:49+00,LG,,,08/01/2014,,,,,J1772,"145 N Broadway
Los Angeles, CA 90012",34.05506,-118.245039,1400000US06037207400,10598
3253,0101000020E61000009886E123E28F5DC0FF1AB5673B074140,ELEC,Hall of Administration,140 N Grand Ave,"Located in Internal Services Department  Lot 18, lower level",,,E,,Private,Los Angeles County fleet use only,,,,,,2,,,,,06/02/2015,63048,2015-06-02 18:02:02+00,LG,,,08/01/2014,,,,,J1772,"140 N Grand Ave
Los Angeles, CA 90012",34.0565004,-118.2481775,1400000US06037207400,10598
17296,0101000020E6100000E66E21D9ED8F5DC0B1BE26101B074140,ELEC,Walt Disney Concert Hall,115 S Grand Ave,Disney Concert Hall Parking Lot 16,,323-881-3919 ,E,,Public,"Garage business hours; pay lot; keypad activated, instructions on EVSE",,,,,,6,,,,,06/02/2015,63047,2015-06-02 18:01:50+00,LG,,,08/01/2014,,,,,J1772,"115 S Grand Ave
Los Angeles, CA 90012",34.0555134,-118.2488921,1400000US06037207400,10598
20405,0101000020E6100000FFDCE1C0F58F5DC052FD39BB6B074140,ELEC,LADWP,111 N Hope St,JFB Lot 6 - 2nd floor,,,E,,Private,User account required,,,,,4,,,,,,03/04/2015,60132,2015-03-04 14:25:19+00,SG,,,01/01/2014,,,,,NEMA515,"111 N Hope St
Los Angeles, CA 90012",34.0579752,-118.2493746,1400000US06037207400,10598
14147,0101000020E61000009886E123E28F5DC0FF1AB5673B074140,ELEC,Hall of Administration,140 N Grand Ave,"Located in Internal Services Department  Lot 18, upper level",,,E,,Private,"Permitted employee parking only Upper Level; keypad activated, instructions on EVSE ",,,,,,4,,,,,06/02/2015,63049,2015-06-02 18:19:27+00,LG,,,08/01/2014,,,,,J1772,"140 N Grand Ave
Los Angeles, CA 90012",34.0565004,-118.2481775,1400000US06037207400,10598
12180,0101000020E6100000B49E10F0DA8F5DC073E60DE665074140,ELEC,Music Center Parking,135 N Grand Ave,"Music Center Parking Lot 14, level 2",,213-972-7211  323-267-2023,E,,Public,"Garage business hours; pay lot; keypad activated, instructions on EVSE",,,,,,3,,,,,06/02/2015,21374,2015-06-02 18:19:30+00,P,,,01/31/2002,,,,,J1772,"135 N Grand Ave
Los Angeles, CA 90012",34.0577972,-118.2477379,1400000US06037207400,10598
17118,0101000020E61000006D29D65FE5F25DC05EC60380995E4240,ELEC,Fresno Area Hispanic Foundation,1444 Fulton St,,,877-455-3833,E,,Public - Card key at all times,"24 hours daily; EVgo network subscription and key fob required",,,,,,4,,,eVgo Network,https://www.evgonetwork.com/,10/09/2015,69299,2015-10-09 08:49:13+00,,,,,,,,,J1772,"1444 Fulton St
fresno, CA 93721",36.73905945,-119.7952499,1400000US06019000100,10979
18827,0101000020E610000030A589D2B95F5EC061116855F04A4340,ELEC,Sacramento County Garage,625 7th St,,,,E,,Private,Employee use only,,,,,,6,,,,,10/06/2015,70075,2015-10-06 22:11:59+00,LG,,,07/01/2014,,,,,J1772,"625 7th St
Sacramento, CA 95814",38.5854594,-121.4957167,1400000US06067005301,11572
5877,0101000020E6100000A2EF6E65895F5EC01BBD1AA0344C4340,ELEC,California Office of State Publishing,344 N 7th St,,,916-445-5386,E,,Public,24 hours daily,,,,,,2,,,,,10/06/2015,70069,2015-10-06 21:39:32+00,SG,,,07/01/2015,,,,,J1772,"344 N 7th St
Sacramento, CA 95814",38.595356,-121.492761,1400000US06067005301,11572
3998,0101000020E610000078E5C468E75F5EC04F97207E594C4340,ELEC,SACRAMENTO,N 3rd St,RICHARDS ST 1,,888-758-4389,E,,Public,24 hours daily,,,,,,1,,,ChargePoint Network,http://www.mychargepoint.net/,10/09/2015,57804,2015-10-09 08:15:37+00,,,,,,,,,J1772,"N 3rd St
Sacramento, CA 95811",38.5964811,-121.4984991,1400000US06067005301,11572
1445,0101000020E6100000BF10CD97F25F5EC0BF4F0B14674C4340,ELEC,SACRAMENTO,300 Richards Blvd,"RICHARDS ST 4
RICHARDS ST 2
RICHARDS ST 3",,888-758-4389,E,,Public,24 hours daily,,,,,,3,,,ChargePoint Network,http://www.mychargepoint.net/,10/09/2015,53072,2015-10-09 08:17:29+00,,,,,,,,,J1772,"300 Richards Blvd
Sacramento, CA 95811",38.5968957,-121.4991817,1400000US06067005301,11572
21361,0101000020E6100000EACDA8F92A605EC058CB9D99604A4340,ELEC,SACRAMENTO,312 K St,"LOT G #2; -
LOT G #3; -
LOT G #1; -",,888-758-4389,E,,Public,24 hours daily,,,,,,3,,,ChargePoint Network,http://www.mychargepoint.net/,10/09/2015,51721,2015-10-09 08:14:06+00,,,,,,,,,J1772,"312 K St
Sacramento, CA 95814",38.581073,-121.502623,1400000US06067000700,12068
9141,0101000020E6100000672D605DF05F5EC0DCBF0D8C174A4340,ELEC,621 CAPITOL MAL,621 Capitol Mall,"STATION 1; -
STATION 3; -
STATION 4; -
STATION 2; -",,888-758-4389,E,,Public,24 hours daily,,,,,,4,,,ChargePoint Network,http://www.mychargepoint.net/,10/09/2015,51235,2015-10-09 08:16:51+00,,,,,,,,,J1772,"621 Capitol Mall
Sacramento, CA 95814",38.5788436,-121.4990457,1400000US06067000700,12068
2937,0101000020E61000007192E68F69605EC024D5777E514A4340,ELEC,SACRAMENTO,135 Neasham Cir,"LOT R #4; -
LOT R #5; -
LOT R #3; -
LOT R #2; -
LOT R #1; -",,888-758-4389,E,,Public,24 hours daily,,,,,,5,,,ChargePoint Network,http://www.mychargepoint.net/,10/09/2015,50433,2015-10-09 08:15:23+00,,,,,,,,,J1772,"135 Neasham Cir
Sacramento, CA 95814",38.580612,-121.506443,1400000US06067000700,12068
18251,0101000020E6100000D34B8C65FA5F5EC060014C19384A4340,ELEC,SACRAMENTO,597 L St,"LOT K #3
LOT K #2",,888-758-4389,E,,Public,24 hours daily,,,,,,3,,,ChargePoint Network,http://www.mychargepoint.net/,10/09/2015,50740,2015-10-09 08:13:38+00,,,,,,,,,J1772,"597 L St
Sacramento, CA 95814",38.579837,-121.499658,1400000US06067000700,12068
5763,0101000020E610000094DA8B683B605EC0B7F8CA72C84A4340,ELEC,SACRAMENTO,200 I St,"LOT P #2; -
LOT P #1
LOT P #4
LOT P #3",,888-758-4389,E,,Public,24 hours daily,,,,,,5,,,ChargePoint Network,http://www.mychargepoint.net/,10/09/2015,50432,2015-10-09 08:14:09+00,,,,,,,,,J1772,"200 I St
Sacramento, CA 95814",38.5842422,-121.503626,1400000US06067000700,12068
17573,0101000020E610000087F4801E0F605EC0E987C734894A4340,ELEC,SACRAMENTO,414 J St,"LOT U #2; -
LOT U #1; -",,888-758-4389,E,,Public,24 hours daily,,,,,,4,,,ChargePoint Network,http://www.mychargepoint.net/,10/09/2015,50434,2015-10-09 08:15:06+00,,,,,,,,,J1772,"414 J St
Sacramento, CA 95814",38.5823122,-121.5009228,1400000US06067000700,12068
12366,0101000020E61000000ABDFE243E535DC04208C897500D4140,ELEC,Fairview Ford,292 N G St,,,909-884-9261,E,,Public,Dealership business hours,,,,,,1,,,,,05/05/2015,53680,2015-05-05 11:54:15+00,P,,,10/01/2013,,,,,J1772,"292 N G St
San Bernardino, CA 92410",34.104022,-117.300668,1400000US06071005701,12847
6384,0101000020E6100000B4C876BE9F525DC08CBE8234630D4140,ELEC,San Bernadino City Hall,300 N D St,,,909-384-5211,E,,Public,24 hours daily,,,,,,4,,,,,08/04/2015,21545,2015-08-04 12:50:05+00,P,,,05/30/2002,,,,,J1772,"300 N D St
San Bernardino, CA 92401",34.10459,-117.291,1400000US06071005701,12847
6963,0101000020E610000062105839B4905EC05BD3BCE3140D4340,ELEC,Vallejo City Hall,555 Santa Clara St,,,707-648-4209,E,,Public,24 hours daily,,,,,,2,,,,,05/05/2015,49350,2015-05-05 11:54:55+00,LG,,,08/29/2012,,,,,J1772,"555 Santa Clara St
Vallejo, CA 94590",38.1022,-122.261,1400000US06095250900,14183
8788,0101000020E610000031C6D166E6905EC01ABF95911F0D4340,ELEC,Vallejo Ferry Terminal,495 Mare Island Way,,,707-449-5424,E,,Public,24 hours daily,,,,,,,,2 SP Inductive  1 Avcon Conductive  1 Tesla Conductive,,,06/02/2015,27335,2015-06-02 18:04:50+00,LG,,,07/15/2005,,,,,,"495 Mare Island Way
Vallejo, CA 94590",38.1025259,-122.2640626,1400000US06095250900,14183
1555,0101000020E61000008D41CCCA9B905EC0DFE819B105EF4240,ELEC,CITYOFBERKELEY,2450 Durant Ave,"T-C GARAGE #3; Telegraph-Channing Parking Garage, 5th floor. Serves spaces labeled 565 and 568.
T-C GARAGE #2; Telegraph-Channing Parking Garage, 5th floor. Serves spaces labeled 564 and 569.
T-C GARAGE #1; Telegraph-Channing Parking Garage, 2nd floor, adjacent to the elevator. This location provides universal accessibility; please use stations on 5th floor if able.",,888-758-4389,E,,Public,24 hours daily,,,,,,6,,,ChargePoint Network,http://www.mychargepoint.net/,10/09/2015,69871,2015-10-09 07:41:18+00,,,,,,,,,J1772,"2450 Durant Ave
Berkeley, CA 94704",37.8673612,-122.2595088,1400000US06001422800,14196
7346,0101000020E6100000F4A78DEA74905DC0876BB587BD064140,ELEC,Union Bank Bldg,445 S. Figueroa St.,,,888-998-2546,E,,Private,MON: 24 hours | TUE: 24 hours | WED: 24 hours | THU: 24 hours | FRI: 24 hours | SAT: 24 hours | SUN: 24 hours,,,,,,6,,,Blink Network,http://www.blinknetwork.com/,10/09/2015,47622,2015-10-09 07:10:58+00,,,,,,,,,J1772,"445 S. Figueroa St.
Los Angeles, CA 90071",34.052659,-118.257136,1400000US06037207502,14639
20066,0101000020E6100000908653E6E68F5DC0596C938AC6064140,ELEC,BROOKFIELD WEST,235 S Hill St,"WFC HILL ST 02; Parking Rates Apply: Stations are on P1 by entrance.
WFC HILL ST 01; Parking Rates Apply: Station is on P1",,888-758-4389,E,,Public,24 hours daily,,,,,,4,,,ChargePoint Network,http://www.mychargepoint.net/,10/09/2015,66853,2015-10-09 07:41:44+00,,,,,,,,,J1772,"235 S Hill St
LA, CA 90012",34.052934,-118.248468,1400000US06037207502,14639
4907,0101000020E61000009B4649FE16905DC0D9F9C8F7D6064140,ELEC,G&K,255 S Grand Ave,"GRAND TOWER 02; Located directly in front of gate in garage, parking fee apply
GRAND TOWER 01; Located directly in front of gate in garage, parking fee apply",,888-758-4389,E,,Public,24 hours daily,,,,,,2,,,ChargePoint Network,http://www.mychargepoint.net/,10/09/2015,53387,2015-10-09 07:54:26+00,,,,,,,,,J1772,"255 S Grand Ave
Los Angeles, CA 90012",34.0534353,-118.2514034,1400000US06037207502,14639
15266,0101000020E61000001D226E4E25905DC018A023A8D0064140,ELEC,BROOKFIELD WEST,330 S Grand Ave,"WFC 333 P3 01; Station is at 333 S. Grand on P3.",,888-758-4389,E,,Public,24 hours daily,,,,,,2,,,ChargePoint Network,http://www.mychargepoint.net/,10/09/2015,67182,2015-10-09 07:48:13+00,,,,,,,,,J1772,"330 S Grand Ave
LA, CA 90071",34.0532427,-118.252277,1400000US06037207502,14639
386,0101000020E6100000C99FB99830905DC0D15735ADB9064140,ELEC,BROOKFIELD WEST,355 S Grand Ave,"WFC 355 P3 02; Station is a 355 S. Grand at P3.",,888-758-4389,E,,Public,24 hours daily,,,,,,2,,,ChargePoint Network,http://www.mychargepoint.net/,10/09/2015,66679,2015-10-09 07:48:12+00,,,,,,,,,J1772,"355 S Grand Ave
LA, CA 90071",34.0525414,-118.2529661,1400000US06037207502,14639
13392,0101000020E6100000BBA35A9F4D905DC0FB2FC676AD064140,ELEC,CITYNATNL PLAZA,400 S Flower St,"CITYNATNL-J2 #7; located on the 5th Floor
CITYNATNL-J2 #6; Located on the 5th Floor
CITYNATNL-J2 #8; Stations are on the 5th Floor",,888-758-4389,E,,Public,24 hours daily,,,,,,3,,,ChargePoint Network,http://www.mychargepoint.net/,10/09/2015,42257,2015-10-09 07:59:41+00,,,,,,,,,J1772,"400 S Flower St
Los Angeles, CA 90071",34.0521687,-118.2547377,1400000US06037207502,14639
14016,0101000020E6100000AD8CA1F721905DC042DC8B1EAE064140,ELEC,Wells Fargo,355 S Grand Ave,Suite 2500,,,E,,Private,,,,,,,2,,,,,03/04/2015,46735,2015-03-04 14:12:46+00,P,,,07/23/2011,,,,,J1772,"355 S Grand Ave
Los Angeles, CA 90071",34.0521887,-118.2520732,1400000US06037207502,14639
17976,0101000020E61000005B1A097E65905DC04D4E48C6C5064140,ELEC,The Westin Bonaventure Hotel & Suites - Tesla,404 S Figueroa St,,,213-624-1000  877-798-3752,E,,Public,"24 hours daily; for Tesla use only; for guest use only; see valet for access",,,,,,3,,,Tesla,http://www.teslamotors.com/supercharger,,70419,2015-10-09 20:44:17+00,P,,,06/01/2015,,,,,TESLA,"404 S Figueroa St
Los Angeles, CA 90071",34.0529106,-118.2561946,1400000US06037207502,14639
20878,0101000020E6100000FDA60B0C34905DC071AC8BDB68064140,ELEC,BROOKFIELD WEST,555 W 5th St,"GAS CO TWR 3-4; Stations are on P1 by the parking office.
GAS CO TWR 5-6; Stations are on P1 adjacent to the parking office.
GAS CO TWR 1-2; Stations are on P1 adjacent to the parking office.",,888-758-4389,E,,Public,24 hours daily,,,,,,6,,,ChargePoint Network,http://www.mychargepoint.net/,10/09/2015,65528,2015-10-09 07:48:11+00,,,,,,,,,J1772,"555 W 5th St
Los Angeles, CA 90013",34.050075,-118.2531767,1400000US06037207502,14639
11715,0101000020E610000034BBEEAD48905DC0376DC66988064140,ELEC,WESTLAWN,633 W 5th St,STATION 1,,888-758-4389,E,,Public,24 hours daily,,,,,,2,,,ChargePoint Network,http://www.mychargepoint.net/,10/09/2015,53672,2015-10-09 08:20:12+00,,,,,,,,,J1772,"633 W 5th St
Los Angeles, CA 90071",34.051038,-118.254436,1400000US06037207502,14639
20992,0101000020E6100000BA8A2029FD8F5DC01FBFB7E9CF064140,ELEC,G&K,225 S Olive St,"MUSEUM TOWERS 1; Located on right just inside garage, parking fee apply
MUSEUM TOWERS 2; Located on right just inside garage, parking fee apply",,888-758-4389,E,,Public,24 hours daily,,,,,,2,,,ChargePoint Network,http://www.mychargepoint.net/,10/09/2015,53388,2015-10-09 07:54:27+00,,,,,,,,,J1772,"225 S Olive St
Los Angeles, CA 90012",34.05322,-118.2498267,1400000US06037207502,14639
12587,0101000020E6100000307A13E838905DC0FEA7D19AD5064140,ELEC,BROOKFIELD WEST,333 S Hope St,"333 S HOPE EV4; Enter parking structure, go to Level A, follow signs.
333 S HOPE EV1; Enter parking structure, go to Level A, follow signs.
333 S HOPE EV3; Enter parking structure, go to Level A, follow signs.
333 S HOPE EV5; Enter Parking Structure, go to Level F, Station by Elevator
333 S HOPE EV7; Level G Near the Elevator
333 S HOPE EV9; The station is on Level H near the elevator. 
333 S HOPE EV2; Enter parking structure, go to Level A, follow signs.",,888-758-4389,E,,Public,24 hours daily,,,,,,10,,,ChargePoint Network,http://www.mychargepoint.net/,10/09/2015,40396,2015-10-09 07:48:06+00,,,,,,,,,J1772,"333 S Hope St
Los Angeles, CA 90071",34.0533937,-118.2534733,1400000US06037207502,14639
5429,0101000020E61000002707FD964A905DC07A5F4B7E7A064140,ELEC,US BANK TOWER,663 W 5th St,"STATION  1
STATION  2",,888-758-4389,E,,Public,24 hours daily,,,,,,4,,,ChargePoint Network,http://www.mychargepoint.net/,10/09/2015,53390,2015-10-09 08:20:09+00,,,,,,,,,J1772,"663 W 5th St
Los Angeles, CA 90071",34.0506132,-118.2545526,1400000US06037207502,14639
19047,0101000020E6100000D341A89C40555DC0F111312592FC4040,ELEC,UCR,W Campus Dr,"LOT 1 STATION 1; -
LOT 1 STATION 2; -",,888-758-4389,E,,Public,24 hours daily,,,,,,4,,,ChargePoint Network,http://www.mychargepoint.net/,10/09/2015,53068,2015-10-09 07:42:11+00,,,,,,,,,J1772,"W Campus Dr
Riverside, CA 92507",33.97321,-117.3320686,1400000US06065046500,16314
3546,0101000020E6100000189F5D192F555DC07104A9143BFC4040,ELEC,UCR,3901-4013 Canyon Crest Dr,LOT 30 STATION1,,888-758-4389,E,,Public,24 hours daily,,,,,,2,,,ChargePoint Network,http://www.mychargepoint.net/,10/09/2015,53070,2015-10-09 07:42:10+00,,,,,,,,,J1772,"3901-4013 Canyon Crest Dr
Riverside, CA 92507",33.970553,-117.3309997,1400000US06065046500,16314
10616,0101000020E6100000F1A611E9ED545DC0EB49AA0029FC4040,ELEC,UCR,Citrus Dr,"LOT 6 STATION 2; -",,888-758-4389,E,,Public,24 hours daily,,,,,,2,,,ChargePoint Network,http://www.mychargepoint.net/,10/09/2015,67106,2015-10-09 07:42:12+00,,,,,,,,,J1772,"Citrus Dr
Riverside, CA 92507",33.9700013,-117.3270209,1400000US06065046500,16314
19769,0101000020E61000004690EFF730555DC0A6FFF6860CFD4040,ELEC,UCR,3654-3710 Canyon Crest Dr,"LOT 24 STATION1; -
LOT 24 STATION2; -",,888-758-4389,E,,Public,24 hours daily,,,,,,4,,,ChargePoint Network,http://www.mychargepoint.net/,10/09/2015,69902,2015-10-09 07:42:11+00,,,,,,,,,J1772,"3654-3710 Canyon Crest Dr
Riverside, CA 92507",33.9769448,-117.3311138,1400000US06065046500,16314
255,0101000020E61000000ED18D55EF545DC0A249BD022CFC4040,ELEC,UCR,900 University Ave,LOT 6 STATION 1,,888-758-4389,E,,Public,24 hours daily,,,,,,2,,,ChargePoint Network,http://www.mychargepoint.net/,10/09/2015,53071,2015-10-09 07:42:10+00,,,,,,,,,J1772,"900 University Ave
Riverside, CA 92507",33.9700931,-117.3271078,1400000US06065046500,16314
19962,0101000020E61000006B22D85DC5545DC0EDC49BEBEAFC4040,ELEC,UCR,513 N Campus Dr,LOT 15 STATION1,,888-758-4389,E,,Public,24 hours daily,,,,,,2,,,ChargePoint Network,http://www.mychargepoint.net/,10/09/2015,53069,2015-10-09 07:42:10+00,,,,,,,,,J1772,"513 N Campus Dr
Riverside, CA 92507",33.9759192,-117.3245463,1400000US06065046500,16314
10249,0101000020E6100000DBA91496D3995EC076A49F15BDE54240,ELEC,CITY PARK,601 Montgomery St,"601MONTGOMERY2; City Park parking garage
601 MONTGOMERY; Enter Garage from Clay Street",,888-758-4389,E,,Public,24 hours daily,,,,,,2,,,ChargePoint Network,http://www.mychargepoint.net/,10/09/2015,57937,2015-10-09 08:16:52+00,,,,,,,,,J1772,"601 Montgomery St
San Francisco, CA 94111",37.7948329,-122.4035392,1400000US06075061100,16545
4021,0101000020E6100000B1E5F0A4E0995EC03EFE77E9CBE54240,ELEC,Hilton San Francisco Financial District,750 Kearny St,At Washington Street,,415-433-6600,E,,Public - Call ahead,"24 hours daily; for monthly parking use only",,,,,,1,,,,,06/02/2015,36236,2015-06-02 18:09:32+00,P,,,08/15/2010,,,,,J1772,"750 Kearny St
San Francisco, CA 94115",37.7952854,-122.4043362,1400000US06075061100,16545
20831,0101000020E61000008CAD56DCEE995EC0CD53C2B8C0E54240,ELEC,CCSF-SFMTA,733 Kearny St,"PORTSMOUTH SQ 2; Located in garage
PORTSMOUTH SQUR; Located in garage",,888-758-4389,E,,Public,24 hours daily,,,,,,2,,,ChargePoint Network,http://www.mychargepoint.net/,10/09/2015,33700,2015-10-09 08:13:41+00,,,,,,,,,J1772,"733 Kearny St
San Francisco, CA 94108",37.7949439,-122.4052039,1400000US06075061100,16545
6902,0101000020E61000000F4757E9EE995EC020240B98C0E54240,ELEC,Hilton San Francisco Financial District Parking Garage,750 Kearny Street,,,888-998-2546,E,,Private,MON: 24 hours | TUE: 24 hours | WED: 24 hours | THU: 24 hours | FRI: 24 hours | SAT: 24 hours | SUN: 24 hours,,,,,,4,,,Blink Network,http://www.blinknetwork.com/,10/09/2015,68287,2015-10-09 07:11:18+00,,,,,,,,,J1772,"750 Kearny Street
San Francisco, CA 94108",37.79494,-122.405207,1400000US06075061100,16545
20121,0101000020E6100000D1860D60DB995EC0B5FB5580EFE54240,ELEC,CARCHARGING,528 Jackson St,"ACE PARKING #21; Station is located to the left of the Columbus ave entrance.",,888-758-4389,E,,Public,24 hours daily,,,,,,1,,,ChargePoint Network,http://www.mychargepoint.net/,10/09/2015,48982,2015-10-09 07:55:38+00,,,,,,,,,J1772,"528 Jackson St
San Francisco, CA 94133",37.7963715,-122.4040146,1400000US06075061100,16545
13920,0101000020E61000008DD88239D5995EC0B2E5A617C6E54240,ELEC,CITY PARK,600-698 Merchant St,"CITY PARK 1; Chargers available Monday - Friday 6AM to 7PM. Please valet park and request a vehicle charge.",,888-758-4389,E,,Public,24 hours daily,,,,,,1,,,ChargePoint Network,http://www.mychargepoint.net/,10/09/2015,51243,2015-10-09 08:15:37+00,,,,,,,,,J1772,"600-698 Merchant St
San Francisco, CA 94108",37.7951078,-122.4036392,1400000US06075061100,16545
1208,0101000020E610000029F4B006DE995EC04E67823C16E44240,ELEC,ACE PKG - 875 HOWARD GRG,875 Howard Street,,,800-663-5633,E,,Public - Card key at all times,"MO: Not Specified; TU: Not Specified; WE: Not Specified; TH: Not Specified; FR: Not Specified; SA: Not Specified; SU: Not Specified",,,,,,1,,,SemaCharge Network,http://www.semacharge.com/,10/09/2015,66343,2015-10-09 07:37:16+00,,,,,,,,,J1772,"875 Howard Street
San Francisco, CA 94103",37.7819286,-122.4041764,1400000US06075017801,16837
22506,0101000020E6100000B2570EE3249A5EC0B256A30D76E44240,ELEC,Parc 55 Hotel,55 Cyril Magnin,,,415-392-8000,E,,Public,"24 hours daily; pay lot",,,,,2,2,,,,,03/04/2015,38517,2015-03-04 14:25:05+00,P,,,02/01/2011,,,,,NEMA515 J1772,"55 Cyril Magnin
San Francisco, CA 94102",37.7848527,-122.4085014,1400000US06075012501,16902
17986,0101000020E6100000C9C6832D76915DC0C2FA3F87F9064140,ELEC,Hotel Solaire Los Angeles,1710 West 7th Street,,,888-998-2546,E,,Public,MON: 24 hours | TUE: 24 hours | WED: 24 hours | THU: 24 hours | FRI: 24 hours | SAT: 24 hours | SUN: 24 hours,,,,,,3,,,Blink Network,http://www.blinknetwork.com/,10/09/2015,49982,2015-10-09 07:11:13+00,,,,,,,,,J1772,"1710 West 7th Street
Los Angeles, CA 90017",34.05449,-118.272838,1400000US06037209403,16997
20920,0101000020E610000091F3FE3F4E915EC0E84EB0FF3AE74240,ELEC,CARCHARGING,1611 Telegraph Ave,"ACE PARKING #23; See valet attendant for station location.",,888-758-4389,E,,Public,24 hours daily,,,,,1,1,,,ChargePoint Network,http://www.mychargepoint.net/,10/09/2015,49335,2015-10-09 07:55:57+00,,,,,,,,,NEMA520 J1772,"1611 Telegraph Ave
Oakland, CA 94612",37.806488,-122.270401,1400000US06001402800,17278
18821,0101000020E6100000626534F279915EC039B69E211CE74240,ELEC,City Center Oakland,525 14th Street,,,888-998-2546,E,,Private,MON: 24 hours | TUE: 24 hours | WED: 24 hours | THU: 24 hours | FRI: 24 hours | SAT: 24 hours | SUN: 24 hours,,,,,,4,,,Blink Network,http://www.blinknetwork.com/,10/09/2015,66480,2015-10-09 07:11:21+00,,,,,,,,,J1772,"525 14th Street
Oakland, CA 94612",37.805546,-122.273068,1400000US06001402800,17278
11606,0101000020E6100000A47213B534915DC000C1C1830B054140,ELEC,AVANT II,1362-1458 S Figueroa St,"STATION 2; Ground Level Parking",,888-758-4389,E,,Public,24 hours daily,,,,,,2,,,ChargePoint Network,http://www.mychargepoint.net/,10/09/2015,69958,2015-10-09 07:40:47+00,,,,,,,,,J1772,"1362-1458 S Figueroa St
Los Angeles, CA 90015",34.0394139,-118.268842,1400000US06037224010,17843
8641,0101000020E61000009840005F40915DC052ABF93B25054140,ELEC,Los Angeles Convention Center,1201 S Figueroa St,West hall,,213-741-1151,E,,Public,"24 hours daily; pay lot",,,,,1,2,,,,,05/05/2015,1523,2015-05-05 11:51:19+00,P,,,08/30/1995,,,,,NEMA515 J1772,"1201 S Figueroa St
Los Angeles, CA 90015",34.0401988,-118.2695539,1400000US06037224010,17843
21835,0101000020E6100000217711A628915DC082734694F6044140,ELEC,ESSEX,1355 S Flower St,STATION 01,,888-758-4389,E,,Public,24 hours daily,,,,,,2,,,ChargePoint Network,http://www.mychargepoint.net/,10/09/2015,69194,2015-10-09 07:42:25+00,,,,,,,,,J1772,"1355 S Flower St
Los Angeles, CA 90015",34.038775,-118.268106,1400000US06037224010,17843
858,0101000020E61000000E7FF21C36915DC0C75E944506054140,ELEC,AVANT II,1420 S Figueroa St,"STATION 1;  Ground Level Parking",,888-758-4389,E,,Public,24 hours daily,,,,,,2,,,ChargePoint Network,http://www.mychargepoint.net/,10/09/2015,69959,2015-10-09 07:40:48+00,,,,,,,,,J1772,"1420 S Figueroa St
LA, CA 90015",34.0392539,-118.2689278,1400000US06037224010,17843
7637,0101000020E6100000E22021CA17915DC09CC24A0515074140,ELEC,Good Samaritan Hospital - Level 3,1317 Shatto St,,,213-977-2121,E,,Public,24 hours daily,,,,,,15,,,,,10/06/2015,70006,2015-10-06 22:10:33+00,P,,,09/01/2014,,,,,J1772,"1317 Shatto St
Los Angeles, CA 90017",34.055329,-118.267077,1400000US06037209102,17869
13157,0101000020E6100000E22021CA17915DC09CC24A0515074140,ELEC,Good Samaritan Hospital - Level 1,1317 Shatto St,,,213-977-2121,E,,Public,24 hours daily,,,,,,3,,,,,10/06/2015,69997,2015-10-06 21:34:24+00,P,,,09/01/2014,,,,,J1772,"1317 Shatto St
Los Angeles, CA 90017",34.055329,-118.267077,1400000US06037209102,17869
7456,0101000020E61000004FA26F1CC2EF5DC081559A39C9674240,ELEC,California State University - Fresno,5241 N Maple Ave,Located at in Lot PS2 at N Woodrow Avenue and Matoian Way on the west side of the Save-Mart center,,559-278-2950,E,,Public,"Lot business hours; pay lot",,,,,,4,2,,,,07/08/2015,61815,2015-07-08 14:54:48+00,P,,,05/01/2015,,,,,CHADEMO J1772,"5241 N Maple Ave
Fresno, CA 93740",36.8108284,-119.7462226,1400000US06019005408,18661
19980,0101000020E6100000E3D58393FE8E5DC0F82A436678084140,ELEC,Los Angeles State Historic Park,1245 N Spring St,,,323-441-8819,P,12/31/2015 12:00:00 AM,PLANNED - not yet accessible (Public),Park business hours,,,,,,1,,,,,05/05/2015,63472,2015-05-05 11:52:12+00,P,,,,,,,,J1772,"1245 N Spring St
Los Angeles, CA 90012",34.0661743,-118.2342881,1400000US06037206010,19213
6158,0101000020E610000040D2F1E28E8E5DC0ABCDFFAB8E084140,ELEC,LADWP - EV Service Center,1630 N Main St,,,,E,,Private - Government only,,,,,,,3,,,,,03/04/2015,1572,2015-03-04 14:16:37+00,LG,,,10/15/1999,,,,,J1772,"1630 N Main St
Los Angeles, CA 90012",34.066854,-118.2274711,1400000US06037206010,19213
12719,0101000020E6100000275D4425BF885DC07C8F447930594140,ELEC,Lancaster Metrolink Station,44812 N Sierra Hwy,,,661-723-6000  800-371-5465,E,,Public,"Lot business hours; pay lot",,,,,1,4,,,,,06/02/2015,7276,2015-06-02 18:16:49+00,LG,,,12/07/2012,,,,,NEMA520 J1772,"44812 N Sierra Hwy
Lancaster, CA 93534",34.6967918,-118.1366666,1400000US06037900806,19254
2679,0101000020E6100000A2B437F842895DC03A8D599B6B594140,ELEC,City of Lancaster - City Hall,44933 Fern Ave,Located in the north side parking lot under the solar sun shade parking.,,661-723-6000,E,,Public,24 hours daily,,,,,,3,,,,,06/02/2015,7275,2015-06-02 18:10:17+00,T,,,06/30/1998,,,,,J1772,"44933 Fern Ave
Lancaster, CA 93534",34.6985964,-118.1447125,1400000US06037900806,19254
19807,0101000020E6100000EEE5E37F17895DC062F804606E594140,ELEC,SA10/665 W Lancaster Blvd,665 W Lancaster Blvd,,,877-455-3833,E,,Public - Card key at all times,"24 hours daily; EVgo network subscription and key fob required",,,,,,,1,,eVgo Network,https://www.evgonetwork.com/,10/09/2015,69429,2015-10-09 08:52:26+00,,,,,,,,,CHADEMO,"665 W Lancaster Blvd
Lancaster, CA 93534",34.69868088,-118.1420593,1400000US06037900806,19254
21543,0101000020E61000005ECB756476055FC0901D0A55206F4440,ELEC,RCEA EV NETWORK,601 8th St,CITY OF ARCATA,,888-758-4389,E,,Public,24 hours daily,,,,,,1,,,ChargePoint Network,http://www.mychargepoint.net/,10/09/2015,60054,2015-10-09 07:47:48+00,,,,,,,,,J1772,"601 8th St
Arcata, CA 95521",40.8681742,-124.0853511,1400000US06023001000,19538
16697,0101000020E61000008DCF64FF3C605EC0AFB48CD47B524340,ELEC,NRG eVgo - Coke,4101 Gateway Park Blvd,,,,E,,Private,Employee use only,,,,,,1,,,eVgo Network,https://www.evgonetwork.com/,07/08/2015,67950,2015-07-08 15:15:30+00,P,,,04/01/2015,,,,,J1772,"4101 Gateway Park Blvd
Sacramento, CA 95834",38.644404,-121.503723,1400000US06067007019,19592
6656,0101000020E6100000C19778F6CB8D5DC001DD9733DBE54040,ELEC,Long Beach - Admiral Kidd Park,2125 Santa Fe Ave,,,888-998-2546,E,,Public,MON: 24 hours | TUE: 24 hours | WED: 24 hours | THU: 24 hours | FRI: 24 hours | SAT: 24 hours | SUN: 24 hours,,,,,,2,,,Blink Network,http://www.blinknetwork.com/,10/09/2015,52729,2015-10-09 07:09:47+00,,,,,,,,,J1772,"2125 Santa Fe Ave
Long Beach, CA 90810",33.795752,-118.2155739,1400000US06037572800,20234
22017,0101000020E6100000E3C9C91F675B5EC0558F8F7120484340,ELEC,California State University - Sacramento State - Lot 1,6000 J St,,,916-278-7275,E,,Public,"Garage business hours; must have parking permit",,,,,,1,,,,,10/06/2015,70074,2015-10-06 21:39:34+00,P,,,08/01/2012,,,,,J1772,"6000 J St
Sacramento, CA 95819",38.5634901,-121.4281692,1400000US06067005201,20268
7268,0101000020E610000017A06D35EB5A5EC0DD5ED218AD474340,ELEC,California State University - Sacramento State - Parking Structure 1,6000 J St,,,916-278-7275,E,,Public,"Garage business hours; must have parking permit",,,,,,1,,,,,10/06/2015,70072,2015-10-06 21:39:35+00,P,,,08/21/2012,,,,,J1772,"6000 J St
Sacramento, CA 95819",38.55997,-121.420606,1400000US06067005201,20268
2723,0101000020E610000017A06D35EB5A5EC0DD5ED218AD474340,ELEC,California State University - Sacramento State - Parking Structure 2,6000 J St,,,916-278-7275,E,,Public,"Garage business hours; must have parking permit",,,,,,1,,,,,10/06/2015,70073,2015-10-06 21:39:36+00,P,,,08/24/2012,,,,,J1772,"6000 J St
Sacramento, CA 95819",38.55997,-121.420606,1400000US06067005201,20268
15893,0101000020E6100000ADF9F197168E5DC084F4143944024140,ELEC,"Carl's Jr - 1751 S. Soto St., Los Angeles",1751 S. Soto Street,,,888-998-2546,E,,Public,MON: 24 hours | TUE: 24 hours | WED: 24 hours | THU: 24 hours | FRI: 24 hours | SAT: 24 hours | SUN: 24 hours,,,,,,2,,,Blink Network,http://www.blinknetwork.com/,10/09/2015,61803,2015-10-09 07:11:34+00,,,,,,,,,J1772,"1751 S. Soto Street
Los Angeles, CA 90023",34.017707,-118.220129,1400000US06037206050,21299
9560,0101000020E61000003F8974E46D915DC02836D5496C044140,ELEC,Nissan of Downtown Los Angeles,635 W Washington Blvd,,,213-748-4501,E,,Private,,,,,,,1,1,,,,07/08/2015,48129,2015-07-08 14:25:27+00,P,,,03/15/2011,,,,,J1772 CHADEMO,"635 W Washington Blvd
Los Angeles, CA 90015",34.0345547,-118.2723323,1400000US06037224020,21507
13342,0101000020E6100000078C3F9B66915DC0E5C97F924C044140,ELEC,DOWNTOWN L.A,1900 S Figueroa St,"VW_422144_A; HOURS OF OPERATION 9:30AM - 8:00PM",,888-758-4389,E,,Public,24 hours daily,,,,,,2,,,ChargePoint Network,http://www.mychargepoint.net/,10/09/2015,64152,2015-10-09 07:47:52+00,,,,,,,,,J1772,"1900 S Figueroa St
Los Angeles, CA 90007",34.0335868,-118.2718876,1400000US06037224020,21507
2540,0101000020E61000003F8974E46D915DC02836D5496C044140,ELEC,Nissan of Downtown Los Angeles,635 W Washington Blvd,,,213-748-4501,E,,Public - Call ahead,Dealership business hours,,,,,,1,,,,,07/08/2015,39906,2015-07-08 14:25:27+00,P,,,03/15/2011,,,,,J1772,"635 W Washington Blvd
Los Angeles, CA 90015",34.0345547,-118.2723323,1400000US06037224020,21507
7157,0101000020E6100000873E0E396C915DC06FEE546584044140,ELEC,DTLA NISSAN,635 W. Washington Blvd,QUICK CHARGER1,,888-758-4389,E,,Public,24 hours daily,,,,,,,1,,ChargePoint Network,http://www.mychargepoint.net/,10/09/2015,61027,2015-10-09 07:52:27+00,,,,,,,,,CHADEMO,"635 W. Washington Blvd
Los Angeles, CA 90015",34.0352904,-118.2722304,1400000US06037224020,21507
16174,0101000020E6100000C08C73E57D915DC03DBE182543044140,ELEC,Sage Kia of Downtown,1945 S Figueroa St,,,855-900-7584,E,,Public,24 hours daily,,,,,,,2,,Greenlots,http://greenlots.com/,08/04/2015,68310,2015-08-04 12:55:33+00,P,,,11/01/2014,,,,,CHADEMO J1772COMBO,"1945 S Figueroa St
Los Angeles, CA 90007",34.0332991,-118.2733091,1400000US06037224020,21507
1991,0101000020E610000096986725AD635EC00C0742B280494340,ELEC,California Fuel Cell Partnership,3300 Industrial Blvd,,,916-371-2870,T,,TEMPORARILY UNAVAILABLE (Public),24 hours daily,,,,,,1,,,,,05/05/2015,33548,2015-05-05 11:50:37+00,P,,,,,,,,J1772,"3300 Industrial Blvd
West Sacramento, CA 95691",38.57424,-121.557443,1400000US06113010203,21631
19078,0101000020E6100000350708E6E8F45DC08CBE823463614240,ELEC,Caltrans District 6 - Tower Building,855 M St,,,,E,,Private,Fleet vehicle use only,,,,,,1,,,,,10/06/2015,69987,2015-10-06 21:56:43+00,SG,,,07/01/2015,,,,,J1772,"855 M St
Fresno, CA 93721",36.76084,-119.826715,1400000US06019002000,21832
10233,0101000020E6100000A69718CBF4F45DC0B96DDFA3FE604240,ELEC,Caltrans District 6,1352 W Olive Ave,,,,P,02/01/2016 12:00:00 AM,PLANNED - not yet accessible (Private),Fleet vehicle use only,,,,,,2,,,,,10/06/2015,69988,2015-10-06 21:56:42+00,SG,,,,,,,,J1772,"1352 W Olive Ave
Fresno, CA 93728",36.757771,-119.827441,1400000US06019002000,21832
17367,0101000020E6100000D31ADE077B9E5EC08761D1BE03DD4240,ELEC,Trader Joe's,265 Winston Dr,,,415-564-8848,E,,Public,Store business hours,,,,,,2,,,,,05/05/2015,63882,2015-05-05 11:52:30+00,P,,,08/01/2014,,,,,J1772,"265 Winston Dr
San Francisco, CA 94132",37.7266768,-122.4762592,1400000US06075033201,22250
12883,0101000020E6100000F0C000C2879E5EC03CC093162EDD4240,ELEC,Stonestown Mall,1 Stonestown Mall,,,415-564-8848,E,,Public,Mall business hours,,,,,,2,,,,,05/05/2015,63881,2015-05-05 11:52:21+00,P,,,08/01/2014,,,,,J1772,"1 Stonestown Mall
San Francisco, CA 94132",37.727969,-122.477036,1400000US06075033201,22250
5119,0101000020E61000004166C28AAE9E5EC023997A8269DC4240,ELEC,San Francisco State University,1600 Holloway Ave,Located in parking lot 20,,415-338-1441,E,,Public,"24 hours daily; permit required",,,,,,9,,,,,05/05/2015,52748,2015-05-05 11:55:40+00,SG,,,07/16/2013,,,,,J1772,"1600 Holloway Ave
San Francisco, CA 94132",37.7219699,-122.4794032,1400000US06075033201,22250
15716,0101000020E610000085398B28379A5EC0C5758C2B2EE64240,ELEC,CCSF-SFMTA,735 Vallejo St,"NORTH BEACH 2; Located against wall next to pay booth 
NORTH BEACH 3; Located against wall next to pay booth 
NORTH BEACH 1; Located against wall next to pay booth",,888-758-4389,E,,Public,24 hours daily,,,,,3,3,,,ChargePoint Network,http://www.mychargepoint.net/,10/09/2015,51063,2015-10-09 08:15:46+00,,,,,,,,,NEMA520 J1772,"735 Vallejo St
San Francisco, CA 94133",37.798284,-122.4096166,1400000US06075010700,22260
4173,0101000020E610000054CFDD0951905DC04074F7EFB0124140,ELEC,GCC,101 N Brand Blvd,"STATION 1; First entrance off Orange and Broadway 
STATION 2; First entrance off Orange and Broadway 
STATION 3; First entrance off Orange and Broadway ",,888-758-4389,E,,Public,24 hours daily,,,,,,6,,,ChargePoint Network,http://www.mychargepoint.net/,10/09/2015,70026,2015-10-09 07:41:32+00,,,,,,,,,J1772,"101 N Brand Blvd
Glendale, CA 91204",34.1460247,-118.2549462,1400000US06037302201,22324
15492,0101000020E61000005CE84A042AC15DC0B43A394371B04140,ELEC,Kern Community College District Weill Institute,2100 Chester Ave,,,800-663-5633,E,,Public - Card key at all times,"MO: Not Specified; TU: Not Specified; WE: Not Specified; TH: Not Specified; FR: Not Specified; SA: Not Specified; SU: Not Specified",,,,,,4,,,SemaCharge Network,http://www.semacharge.com/,10/09/2015,68439,2015-10-09 07:37:21+00,,,,,,,,,J1772,"2100 Chester Ave
Bakersfield, CA 93301",35.3784565,-119.0181895,1400000US06029001600,22350
13410,0101000020E610000093A23AC20E775EC072924149DCA84240,ELEC,SAN JOSE,1601-1677 Senter Rd,CITYOFSANJOSE,,888-758-4389,E,,Public,24 hours daily,,,,,,2,,,ChargePoint Network,http://www.mychargepoint.net/,10/09/2015,52756,2015-10-09 07:51:34+00,,,,,,,,,J1772,"1601-1677 Senter Rd
San Jose, CA 95112",37.3192226,-121.8602758,1400000US06085503122,22357
19418,0101000020E6100000989130C24A8C5DC0E36E10AD15E34040,ELEC,Long Beach - City Place Parking Structure,50 E 6th Street,"To report gas vehicles parked in EVSE 
spaces... - Parking Enforcement: (562) 
570-2866

To report gas vehicles parked in EVSE 
spaces... - Parking Enforcement: (562) 
570-2866

To report gas vehicles parked in EVSE 
spaces... - Parking Enforcement: (562) 
570-2866

To report gas vehicles parked in EVSE 
spaces... - Parking Enforcement: (562) 
570-2866

To report gas vehicles parked in EVSE 
spaces... - Parking Enforcement: (562) 
570-2866

To report gas vehicles parked in EVSE 
spaces... - Parking Enforcement: (562) 
570-2866
",,888-998-2546,E,,Private,MON: 24 hours | TUE: 24 hours | WED: 24 hours | THU: 24 hours | FRI: 24 hours | SAT: 24 hours | SUN: 24 hours,,,,,,6,,,Blink Network,http://www.blinknetwork.com/,10/09/2015,52089,2015-10-09 07:09:46+00,,,,,,,,,J1772,"50 E 6th Street
Long Beach, CA 90844",33.774099,-118.1920629,1400000US06037576200,22656
11844,0101000020E61000007B2E5393E0465DC000FE2955A2604040,ELEC,The Famous Pearson Fuel Depot,4067 El Cajon Blvd.,,,888-998-2546,E,,Public,MON: 24 hours | TUE: 24 hours | WED: 24 hours | THU: 24 hours | FRI: 24 hours | SAT: 24 hours | SUN: 24 hours,,,,,,5,,,Blink Network,http://www.blinknetwork.com/,10/09/2015,29684,2015-10-09 07:11:33+00,,,,,,,,,J1772,"4067 El Cajon Blvd.
San Diego, CA 92105",32.754954,-117.107457,1400000US06073002202,22713
21402,0101000020E610000089B48D3F51925DC0AAD5575705024140,ELEC,California Science Center,700 Exposition Park Dr,,,323-724-3623,E,,Public,24 hours daily,,,,,,4,,,,,10/06/2015,70013,2015-10-06 22:10:24+00,P,,,03/27/2014,,,,,J1772,"700 Exposition Park Dr
Los Angeles, CA 90037",34.015788,-118.286209,1400000US06037231220,23031
1781,0101000020E6100000D47C3AC379925DC02F826B932F024140,ELEC,Natural History Museum,900 Exposition Blvd,Lower level of parking structure,,323-267-2023,E,,Public,Museum business hours,,,,,,4,,,,,06/02/2015,67309,2015-06-02 18:07:20+00,LG,,,01/02/2014,,,,,J1772,"900 Exposition Blvd
Los Angeles, CA 90007",34.0170769,-118.2886818,1400000US06037231220,23031
813,0101000020E610000090C07A37F16F5EC09CDB847B65444340,ELEC,UC DAVIS TAPS,1 Shields Ave,"NEPS #2
WEPS #2
LOT 1 #1
SEPS; South Entry Parking Structure
LOT 1 #2
LOT 1 #3
NEPS #1
WEPS
LOT 56
LOT 44
LOT 35
LOT 55",,888-758-4389,E,,Public,24 hours daily,,,,,12,12,,,ChargePoint Network,http://www.mychargepoint.net/,10/09/2015,43463,2015-10-09 08:10:21+00,,,,,,,,,NEMA520 J1772,"1 Shields Ave
Davis, CA 95616",38.534347,-121.7490977,1400000US06113010501,23632
21148,0101000020E6100000877CE1DFB1725EC07980DD9F41444340,ELEC,UC DAVIS TAPS,Apiary Dr,"HOPKINS 2
HOPKINS 1",,888-758-4389,E,,Public,24 hours daily,,,,,2,2,,,ChargePoint Network,http://www.mychargepoint.net/,10/09/2015,45312,2015-10-09 08:11:37+00,,,,,,,,,NEMA520 J1772,"Apiary Dr
Davis, CA 95616",38.5332527,-121.7921066,1400000US06113010501,23632
10757,0101000020E610000077D3D28151715EC0BC5983F755454340,ELEC,WEST VILLAGE,Tilia St,"PH&EV CENTER; Access behind 1590 Tilia Street towards the East. From Village Square, look for building to the east of the fountain. ",,888-758-4389,E,,Public,24 hours daily,,,,,1,1,,,ChargePoint Network,http://www.mychargepoint.net/,10/09/2015,51653,2015-10-09 08:17:44+00,,,,,,,,,NEMA520 J1772,"Tilia St
Davis, CA 95616",38.541686,-121.7705998,1400000US06113010501,23632
460,0101000020E610000000F8F1E1A3705EC0488F3A9567444340,ELEC,UC Davis - Lot 49 Visitor Parking,La Rue Rd and Garrod Dr,,,530-752-8277,E,,Public,24 hours daily,,,,,,2,,,,,07/08/2015,53373,2015-07-08 15:22:47+00,P,,,03/06/2013,,,,,J1772,"La Rue Rd and Garrod Dr
Davis, CA 95616",38.5344111,-121.7600026,1400000US06113010501,23632
22510,0101000020E6100000EDAAF69F6B6F5EC00D14FC5F43454340,ELEC,Whole Foods - Davis,500 1st Street,,,877-455-3833,E,,Public - Card key at all times,"24 hours daily; EVgo network subscription and key fob required",,,,,,1,2,,eVgo Network,https://www.evgonetwork.com/,10/09/2015,69390,2015-10-09 08:51:31+00,,,,,,,,,CHADEMO J1772,"500 1st Street
Davis, CA 95616",38.54111862,-121.7409439,1400000US06113010501,23632
15850,0101000020E6100000CEDF844204705EC0DD5ED218AD454340,ELEC,UC Davis Parking Garage,6 Howard Way,Between Russell Blvd & North Quad,,530-752-8277,E,,Public,"24 hours daily; pay lot; permit required 7am-10pm M-F",,,,,2,1,,1 SP Inductive,,,07/08/2015,33557,2015-07-08 15:22:48+00,P,,,12/01/2008,,,,,NEMA520 J1772,"6 Howard Way
Davis, CA 95616",38.544345,-121.75026,1400000US06113010501,23632
19771,0101000020E6100000D34D621058715EC0B79C4B7155454340,ELEC,University of California Davis - Plug-In Hybrid and Electric Vehicle Research Center,1590 Tilia St,,,530-752-2570,E,,Public,24 hours daily,,,,,,6,,,,,06/02/2015,51001,2015-06-02 18:17:07+00,P,,,01/25/2013,,,,,J1772,"1590 Tilia St
Davis, CA 95616",38.54167,-121.771,1400000US06113010501,23632
10410,0101000020E61000003748D27F20715EC0CB3049C043444340,ELEC,UC DAVIS TAPS,W Health Science Dr,LOT 57,,888-758-4389,E,,Public,24 hours daily,,,,,1,1,,,ChargePoint Network,http://www.mychargepoint.net/,10/09/2015,46719,2015-10-09 08:12:39+00,,,,,,,,,NEMA520 J1772,"W Health Science Dr
Davis, CA 95616",38.5333176,-121.7676086,1400000US06113010501,23632
9006,0101000020E6100000D34D621058715EC061C3D32B65454340,ELEC,University of California Davis - Institute of Transportation Studies,1605 Tilia St,,,530-752-2570,E,,Public,24 hours daily,,,,,,2,,,,,06/02/2015,51002,2015-06-02 18:16:55+00,P,,,01/25/2013,,,,,J1772,"1605 Tilia St
Davis, CA 95616",38.54215,-121.771,1400000US06113010501,23632
17185,0101000020E6100000A855F48766715EC08A22A46E67454340,ELEC,University of California Davis - Institute of Transportation Studies,1715 Tilia St,,,530-752-2570,E,,Public,24 hours daily,,,,,,1,,,,,06/02/2015,63094,2015-06-02 18:02:26+00,P,,,08/01/2014,,,,,J1772,"1715 Tilia St
Davis, CA 95616",38.542219,-121.771883,1400000US06113010501,23632
7906,0101000020E61000005008D3E6EE995EC0B408201043E44240,ELEC,CCSF-SFMTA,833 Mission Street,"833 MISSION ST3; Public Parking Level 1 - Parking Rates Apply
833 MISSION ST2; Public Parking Level 1 - Parking Rates Apply
833 MISSION ST1; Public Parking Level 1 - Parking Rates Apply
833 MISSION ST4; Public Parking Basement Level - Praking Rates Apply
833 MISSION ST8; Public Parking Basement Level - Parking Rates Apply
833 MISSION ST6; Public Parking Basement Level - Praking Rates Apply",,888-758-4389,E,,Public,24 hours daily,,,,,6,6,,,ChargePoint Network,http://www.mychargepoint.net/,10/09/2015,44977,2015-10-09 08:16:46+00,,,,,,,,,NEMA520 J1772,"833 Mission Street
San Francisco, CA 94103",37.7832966,-122.4052064,1400000US06075017601,23757
2837,0101000020E6100000CE91F018F9995EC0E3699EC838E44240,ELEC,CCSF-SFMTA,863 Mission St,"833 MISSION ST7; Public Parking Basement Level - Parking Rates Apply",,888-758-4389,E,,Public,24 hours daily,,,,,1,1,,,ChargePoint Network,http://www.mychargepoint.net/,10/09/2015,64740,2015-10-09 08:16:09+00,,,,,,,,,NEMA520 J1772,"863 Mission St
SF, CA 94103",37.7829829,-122.4058287,1400000US06075017601,23757
1426,0101000020E610000048A643A7E7995EC0B7F1272A1BE44240,ELEC,InterContinental Hotel - San Francisco,888 Howard St,,,415-616-6500,E,,Public,"24 hours daily; pay lot",,,,,,2,,,,,05/05/2015,50011,2015-05-05 11:55:25+00,P,,,08/01/2011,,,,,J1772,"888 Howard St
San Francisco, CA 94103",37.782079,-122.404764,1400000US06075017601,23757
18615,0101000020E6100000FFA2BA6FEB995EC02FDB4E5B23E44240,ELEC,DUGONI,155 5th Street,"EVSE #1; Located in parking garage entrance via alley between Mina St. and Howard down ramp on left side.",,888-758-4389,E,,Public,24 hours daily,,,,,,2,,,ChargePoint Network,http://www.mychargepoint.net/,10/09/2015,61114,2015-10-09 08:18:28+00,,,,,,,,,J1772,"155 5th Street
San Francisco, CA 94103",37.782329,-122.4049949,1400000US06075017601,23757
12009,0101000020E6100000116F9D7FBB9A5EC0BEDEFDF15EE34240,ELEC,NEMA Apartments,1411 Market Street,,,888-998-2546,E,,Public,MON: 24 hours | TUE: 24 hours | WED: 24 hours | THU: 24 hours | FRI: 24 hours | SAT: 24 hours | SUN: 24 hours,,,,,,1,,,Blink Network,http://www.blinknetwork.com/,10/09/2015,69741,2015-10-09 07:10:25+00,,,,,,,,,J1772,"1411 Market Street
San Francisco, CA 94103",37.776335,-122.417694,1400000US06075017601,23757
17760,0101000020E61000003FF1AD59F8995EC03753211E89E44240,ELEC,Pacific Place Garage,22 4th St,,,415-348-1602,E,,Public,Garage business hours,,,,,,1,,,,,05/05/2015,63877,2015-05-05 11:52:29+00,P,,,08/01/2014,,,,,J1772,"22 4th St
San Francisco, CA 94103",37.7854345,-122.4057831,1400000US06075017601,23757
4446,0101000020E61000000FB8AE98116A5EC0F052EA9271564240,ELEC,Salinas,200 Lincoln Ave,,,888-998-2546,E,,Public,MON: 24 hours | TUE: 24 hours | WED: 24 hours | THU: 24 hours | FRI: 24 hours | SAT: 24 hours | SUN: 24 hours,,,,,,1,,,Blink Network,http://www.blinknetwork.com/,10/09/2015,61838,2015-10-09 07:11:40+00,,,,,,,,,J1772,"200 Lincoln Ave
Salinas, CA 93901",36.675341,-121.657324,1400000US06053001300,24047
5064,0101000020E6100000F72CBE57E3695EC02216D632BE564240,ELEC,CITY OF SALINAS,20 E Market Street,"STEINBECK 2; The charging stations are inside the parking garage on the ground level
STEINBECK 1; the charging stations are inside of the parking garage on the ground level",,888-758-4389,E,,Public,24 hours daily,,,,,2,2,,,ChargePoint Network,http://www.mychargepoint.net/,10/09/2015,51722,2015-10-09 08:03:32+00,,,,,,,,,NEMA520 J1772,"20 E Market Street
Salinas, CA 93901",36.6776794,-121.6545009,1400000US06053001300,24047
9385,0101000020E61000003C0E2840396A5EC0C037972C38564240,ELEC,COOFMONTEREY,168 W. Alisal,"GOV CENTER 1; -",,888-758-4389,E,,Public,24 hours daily,,,,,1,1,,,ChargePoint Network,http://www.mychargepoint.net/,10/09/2015,62026,2015-10-09 08:16:28+00,,,,,,,,,NEMA520 J1772,"168 W. Alisal
Salinas, CA 93901",36.6735893,-121.6597443,1400000US06053001300,24047
17547,0101000020E610000068FD778E12915EC0C8D864E833EF4240,ELEC,CITYOFBERKELEY,2165 Kittredge St,"OXFORD GARAGE 2; Oxford Parking Garage. Serves spaces labeled 58 and 59. May also be used at space 57 by those with ADA placards. 
OXFORD GARAGE 1; Oxford Parking Garage. Serves spaces labeled 12 and 13.",,888-758-4389,E,,Public,24 hours daily,,,,,,4,,,ChargePoint Network,http://www.mychargepoint.net/,10/09/2015,69869,2015-10-09 07:41:18+00,,,,,,,,,J1772,"2165 Kittredge St
Berkeley, CA 94704",37.8687716,-122.2667576,1400000US06001422900,24702
7807,0101000020E61000000A05B6943D915EC0DCBEA2B668EF4240,ELEC,CITY CARSHARE,2055 Center St,BERK CENTRAL,,888-758-4389,E,,Public,24 hours daily,,,,,,2,,,ChargePoint Network,http://www.mychargepoint.net/,10/09/2015,64741,2015-10-09 08:24:24+00,,,,,,,,,J1772,"2055 Center St
Berkeley, CA 94704",37.8703831,-122.2693836,1400000US06001422900,24702
21877,0101000020E6100000B66224204B915EC03A28BC5F60EF4240,ELEC,CTY OF BERKELEY,2025 Center St,"CENTER ST 3; Center St Garage, upper level of 1st floor (level 1b) next to City CarShare parking spots",,888-758-4389,E,,Public,24 hours daily,,,,,,1,,,ChargePoint Network,http://www.mychargepoint.net/,10/09/2015,51052,2015-10-09 08:13:55+00,,,,,,,,,J1772,"2025 Center St
Berkeley, CA 94704",37.8701286,-122.2702103,1400000US06001422900,24702
18395,0101000020E6100000B66224204B915EC0E794FC5F60EF4240,ELEC,Center Street Garage,2025 Center St,Between Shattuck and Milvia Streets,,510-843-1788,E,,Public,"Garage business hours; pay lot",,,,,,1,,1 SP Inductive,,,05/05/2015,33551,2015-05-05 11:51:30+00,P,,,11/30/2008,,,,,J1772,"2025 Center St
Berkeley, CA 94704",37.87012863,-122.2702103,1400000US06001422900,24702
4999,0101000020E6100000FE65F7E461CD5EC03333333333934340,ELEC,City of Ukiah - Public Parking Lot,N Oak & W Standley St,,,707-467-5711,E,,Public,24 hours daily,,,,,,1,,1 SP Inductive,,,06/02/2015,33544,2015-06-02 18:04:32+00,LG,,,11/30/2008,,,,,J1772,"N Oak &amp; W Standley St
Ukiah, CA 95482",39.15,-123.2091,1400000US06045011600,24915
2403,0101000020E6100000450B75FDA79C5DC0960E31B9AC074140,ELEC,UCLA PARKING,1070 Veteran Ave,"PS 32 LVL1 EV02; Enter PS 32 at Kinross EV on aisle leading to L2 NE area
PS 32 LVL1 EV01; Stations are inside the PS 32 Garage.",,888-758-4389,E,,Public,24 hours daily,,,,,2,2,,,ChargePoint Network,http://www.mychargepoint.net/,10/09/2015,41793,2015-10-09 07:59:55+00,,,,,,,,,NEMA520 J1772,"1070 Veteran Ave
Los Angeles, CA 90095",34.0599586,-118.4477533,1400000US06037265305,25048
9612,0101000020E6100000109546CCEC3D5DC0B212F3ACA4DF4040,ELEC,City of Hemet Civic Center,445 E Florida Ave,,,951-765-2300,E,,Public,24 hours daily,,,,,,2,,,,,10/06/2015,69992,2015-10-06 21:56:50+00,LG,,,04/09/2013,,,,,J1772,"445 E Florida Ave
Hemet, CA 92543",33.747213,-116.967578,1400000US06065043401,25285
8122,0101000020E6100000A4744419850A5FC0DE663BF07B664440,ELEC,McCrea Nissan,601 7th St,,,707-442-1741,E,,Private,,,,,,,1,,,,,07/08/2015,47610,2015-07-08 14:24:59+00,P,,,03/15/2011,,,,,J1772,"601 7th St
Eureka, CA 95501",40.8006573,-124.1643737,1400000US06023000100,26083
22011,0101000020E61000009EB5DB2E340B5FC0100533A660654440,ELEC,CalTrans District Office,1656 Union St,,,707-445-6454  855-885-9571,E,,Private,Employee use only,,,,,,4,,,OpConnect,http://www.opconnect.com/,03/04/2015,51913,2015-03-04 14:19:26+00,P,,,03/27/2013,,,,,J1772,"1656 Union St
Eureka, CA 95501",40.792012,-124.17506,1400000US06023000100,26083
16978,0101000020E6100000A180ED60C40A5FC086CABF9657664440,ELEC,Northwood Chevrolet,212 7th St,,,707-443-4861,E,,Private,Service Center use only,,,,,1,,,,,,05/05/2015,60197,2015-05-05 11:51:13+00,P,,,11/01/2011,,,,,NEMA520,"212 7th St
Eureka, CA 95501",40.799548,-124.168236,1400000US06023000100,26083
16470,0101000020E6100000E5D8D53FE30A5FC0B106DE7F1A674440,ELEC,CITY OF EUREKA,4 C Street,4 C STREET #1,,888-758-4389,E,,Public,24 hours daily,,,,,1,1,,,ChargePoint Network,http://www.mychargepoint.net/,10/09/2015,40952,2015-10-09 07:57:53+00,,,,,,,,,NEMA520 J1772,"4 C Street
Eureka, CA 95501",40.8054962,-124.1701202,1400000US06023000100,26083
20401,0101000020E6100000A4744419850A5FC0DE663BF07B664440,ELEC,McCrea Nissan,601 7th St,,,707-442-1741,E,,Public - Call ahead,Dealership business hours,,,,,,1,,,,,07/08/2015,39890,2015-07-08 14:24:59+00,P,,,03/15/2011,,,,,J1772,"601 7th St
Eureka, CA 95501",40.8006573,-124.1643737,1400000US06023000100,26083
18211,0101000020E6100000CBBDC0AC50465DC072C3EFA65B564040,ELEC,Walmart #5023 - National City CA,1200 Highland Ave,,,888-998-2546,E,,Public,MON: 24 hours | TUE: 24 hours | WED: 24 hours | THU: 24 hours | FRI: 24 hours | SAT: 24 hours | SUN: 24 hours,,,,,,2,,,Blink Network,http://www.blinknetwork.com/,10/09/2015,48364,2015-10-09 07:13:39+00,,,,,,,,,J1772,"1200 Highland Ave
National City, CA 91950",32.674672,-117.098674,1400000US06073011700,26264
1287,0101000020E6100000B187F6B182465DC0E2900DA48B594040,ELEC,Educational Cultural Complex,4343 Ocean View Blvd.,,,888-998-2546,E,,Private,MON: 24 hours | TUE: 24 hours | WED: 24 hours | THU: 24 hours | FRI: 24 hours | SAT: 24 hours | SUN: 24 hours,,,,,,4,,,Blink Network,http://www.blinknetwork.com/,10/09/2015,51778,2015-10-09 07:11:54+00,,,,,,,,,J1772,"4343 Ocean View Blvd.
San Diego, CA 92113",32.699574,-117.101727,1400000US06073003301,26298
9427,0101000020E6100000E73922DFA5855DC09E29745E63494140,ELEC,Antelope Valley Union School District - Palmdale High School,2137 E Ave R,,,,E,,Private,Employee use only,,,,,,2,,,,,01/06/2015,42266,2015-05-20 14:37:55+00,LG,,,11/15/2011,,,,,J1772,"2137 E Ave R
Palmdale, CA 93550",34.573345,-118.088249,1400000US06037910602,26594
14612,0101000020E6100000D53C47E4BB925DC08F006E162F0C4140,ELEC,Extra Space Storage,4728 Fountain Ave,,,323-663-4829,E,,Public - Call ahead,9:30am-6:30pm M-F,,,,,,1,,,,,07/08/2015,64777,2015-07-08 15:02:28+00,T,,,09/01/2014,,,,,J1772,"4728 Fountain Ave
Los Angeles, CA 90039",34.095187,-118.292718,1400000US06037191203,26618
1464,0101000020E6100000329FBD4406925DC017A5DF19C8DE4040,ELEC,LA Harbor Department Headquarters,425 S Palos Verdes St,,,310-732-7678,E,,Public,8am-5pm daily,,,,,,4,,,,,05/05/2015,21402,2015-05-05 11:55:34+00,P,,,03/26/2013,,,,,J1772,"425 S Palos Verdes St
San Pedro, CA 90731",33.7404816,-118.2816326,1400000US06037296220,26696
5584,0101000020E61000002A60F18A16925DC0D4ED91729CDE4040,ELEC,TOPAZ,222 W 6th St,"STATION 01; Parking Rates Apply: Stations are on Level 2 of the Parking Garage.",,888-758-4389,E,,Public,24 hours daily,,,,,,2,,,ChargePoint Network,http://www.mychargepoint.net/,10/09/2015,61935,2015-10-09 07:50:32+00,,,,,,,,,J1772,"222 W 6th St
Los Angeles, CA 90731",33.7391494,-118.2826259,1400000US06037296220,26696
14570,0101000020E610000096E24FF97C0A5FC0E5208DAFE2664440,ELEC,RCEA EV NETWORK,718 3rd St,GHD INC.,,888-758-4389,E,,Public,24 hours daily,,,,,,1,,,ChargePoint Network,http://www.mychargepoint.net/,10/09/2015,60026,2015-10-09 07:47:48+00,,,,,,,,,J1772,"718 3rd St
Eureka, CA 95501",40.8037929,-124.1638778,1400000US06023000500,26741
2030,0101000020E610000066E54D347E695DC004C4C9A255084140,ELEC,ONT CITY HALL,303 East B Street,"ONT CITY HALL; Station is next to the ADA stalls in the main City Hall parking lot closest to the City Hall entrance ",,888-758-4389,E,,Public,24 hours daily,,,,,,2,,,ChargePoint Network,http://www.mychargepoint.net/,10/09/2015,69004,2015-10-09 08:31:35+00,,,,,,,,,J1772,"303 East B Street
Ontario, CA 91764",34.0651134,-117.6483279,1400000US06071001400,26773
15084,0101000020E6100000209BE447FC9D5DC054C72AA5671C4140,ELEC,Galpin Motors,15421 Roscoe Blvd,,,800-256-6219,E,,Public,Dealership business hours,,,,,,2,,,,,05/05/2015,6405,2015-05-05 11:58:05+00,P,,,12/11/2012,,,,,J1772,"15421 Roscoe Blvd
Sepulveda, CA 91343",34.221913,-118.468523,1400000US06037117408,26912
17658,0101000020E6100000AD0100B672905DC076DEC66647044140,ELEC,LADWP - Central District,1324 S Wall St,North of 15th St,,,E,,Private - Government only,,,,,,,6,,1 Conductive,,,03/04/2015,33178,2015-03-04 14:16:36+00,LG,,,10/15/1999,,,,,J1772,"1324 S Wall St
Los Angeles, CA 90015",34.033429,-118.2570014,1400000US06037226002,27017
10719,0101000020E610000012B23DC450205EC041182E6123A74240,ELEC,Merced Toyota,1400 Auto Center Dr,,,800-287-2778,E,,Public - Call ahead,Dealership business hours,,,,,,1,,,,,08/04/2015,68390,2015-08-04 13:08:58+00,P,,,04/01/2015,,,,,J1772,"1400 Auto Center Dr
Merced, CA 95340",37.3057672,-120.5049296,1400000US06047001301,27308
1311,0101000020E610000018963FDF16205EC06FBC3B3256A74240,ELEC,Razzari Ford,1234 Auto Center Dr,,,888-782-6034,E,,Public - Call ahead,Dealership business hours,,,,,,1,,,,,08/04/2015,68391,2015-08-04 13:09:05+00,P,,,04/01/2015,,,,,J1772,"1234 Auto Center Dr
Merced, CA 95340",37.307318,-120.501396,1400000US06047001301,27308
6713,0101000020E6100000C44FD2B224205EC0FB29E9BC21A74240,ELEC,Razzari Nissan,1675 Auto Center Dr,,,209-383-0100,E,,Private,,,,,,,1,,,,,07/08/2015,48122,2015-07-08 14:26:27+00,P,,,03/15/2011,,,,,J1772,"1675 Auto Center Dr
Merced, CA 95340",37.3057171,-120.5022399,1400000US06047001301,27308
22000,0101000020E6100000C44FD2B224205EC0FB29E9BC21A74240,ELEC,Razzari Nissan,1675 Auto Center Dr,,,209-383-0100,E,,Public - Call ahead,Dealership business hours,,,,,,1,,,,,07/08/2015,39908,2015-07-08 14:26:27+00,P,,,03/15/2011,,,,,J1772,"1675 Auto Center Dr
Merced, CA 95340",37.3057171,-120.5022399,1400000US06047001301,27308
11158,0101000020E610000036AE7FD767455DC060B01BB62D904040,ELEC,"Walgreens - Escondido, CA #5455",111 W Washington Ave,,,800-663-5633,E,,Public - Card key at all times,"MO: Not Specified; TU: Not Specified; WE: Not Specified; TH: Not Specified; FR: Not Specified; SA: Not Specified; SU: Not Specified",,,,,,1,,,SemaCharge Network,http://www.semacharge.com/,10/09/2015,43816,2015-10-09 07:36:35+00,,,,,,,,,J1772,"111 W Washington Ave
Escondido, CA 92025",33.126395,-117.084463,1400000US06073020214,27601
7038,0101000020E6100000E09C11A5BD915DC019541B9C88024140,ELEC,USC CAMPUS,3401 S Grand Ave,"USC UPX LVL2,#1; Enter from 35th Street, up ramp to 2nd level
USC UPX LVL2,#2; Enter from 35th Street, up ramp to 2nd level",,888-758-4389,E,,Public,24 hours daily,,,,,,4,,,ChargePoint Network,http://www.mychargepoint.net/,10/09/2015,62334,2015-10-09 07:50:25+00,,,,,,,,,J1772,"3401 S Grand Ave
Los Angeles, CA 90007",34.019794,-118.2772,1400000US06037231100,27696
2003,0101000020E6100000EB048FCA284A5DC03291D26C1E5A4040,ELEC,Port of San Diego - Hilton San Diego Bayfront,1 Park Blvd,,,888-998-2546,E,,Private,MON: 24 hours | TUE: 24 hours | WED: 24 hours | THU: 24 hours | FRI: 24 hours | SAT: 24 hours | SUN: 24 hours,,,,,,3,,,Blink Network,http://www.blinknetwork.com/,10/09/2015,47633,2015-10-09 07:09:51+00,,,,,,,,,J1772,"1 Park Blvd
San Diego, CA 92101",32.7040535,-117.1587397,1400000US06073005100,27793
14899,0101000020E610000041B8020AF5495DC0E6CAA0DAE05A4040,ELEC,Padres Parkade Garage,440 10th Ave,,,888-998-2546,E,,Public,MON: 24 hours | TUE: 24 hours | WED: 24 hours | THU: 24 hours | FRI: 24 hours | SAT: 24 hours | SUN: 24 hours,,,,,,5,,,Blink Network,http://www.blinknetwork.com/,10/09/2015,50958,2015-10-09 07:10:53+00,,,,,,,,,J1772,"440 10th Ave
San Diego, CA 92101",32.709987,-117.155581,1400000US06073005100,27793
7006,0101000020E6100000B4226AA2CF3D5DC0782AE09EE7654040,ELEC,Solterra North,151Chambers Street,,,888-998-2546,E,,Public,MON: 24 hours | TUE: 24 hours | WED: 24 hours | THU: 24 hours | FRI: 24 hours | SAT: 24 hours | SUN: 24 hours,,,,,,1,,,Blink Network,http://www.blinknetwork.com/,10/09/2015,62075,2015-10-09 07:13:35+00,,,,,,,,,J1772,"151Chambers Street
El Cajon, CA 92020",32.796131,-116.965798,1400000US06073015801,27803
4232,0101000020E6100000F7C77BD5CA3D5DC0572426A8E1654040,ELEC,Solterra South,131 Chambers Street,,,888-998-2546,E,,Public,MON: 24 hours | TUE: 24 hours | WED: 24 hours | THU: 24 hours | FRI: 24 hours | SAT: 24 hours | SUN: 24 hours,,,,,,1,,,Blink Network,http://www.blinknetwork.com/,10/09/2015,62919,2015-10-09 07:13:35+00,,,,,,,,,J1772,"131 Chambers Street
El Cajon, CA 92020",32.795949,-116.965505,1400000US06073015801,27803
1165,0101000020E61000008AF5FC1F16745EC0217DEE5FB4DC4340,ELEC,SIERRA NEVADA,1075 E 20th St,BREWING CO 001,,888-758-4389,E,,Public,24 hours daily,,,,,1,1,,,ChargePoint Network,http://www.mychargepoint.net/,10/09/2015,35143,2015-10-09 08:01:33+00,,,,,,,,,NEMA520 J1772,"1075 E 20th St
Chico, CA 95928",39.7242546,-121.8138504,1400000US06007001300,27804
10319,0101000020E610000076E3DD9131D55DC090A4A487A1174240,ELEC,Southern California Edison - San Joaquin Service Center,2425 S Blackstone St,,,,E,,Private,,,,,,,,,1 SP Inductive,,,04/03/2015,27318,2015-04-03 17:10:26+00,T,,,07/15/2005,,,,,,"2425 S Blackstone St
Tulare, CA 93274",36.184617,-119.3311505,1400000US06107002901,28009
7529,0101000020E6100000B4F51D0D71555DC0AE10566309004140,ELEC,University of California - Center for Environmental Research & Technology,1084 Columbia Ave,,,951-781-5791,E,,Public,24 hours daily,,,,,,4,,,,,07/08/2015,50739,2015-07-08 14:39:40+00,SG,,,12/10/2012,,,,,J1772,"1084 Columbia Ave
Riverside, CA 92507",34.0002865,-117.3350251,1400000US06065042209,28047
8633,0101000020E6100000572250FD83915DC0162FBBCC55034140,ELEC,Department of Public Social Services - County Auto Park 46,318 W Adams Blvd,,,,P,06/15/2015 12:00:00 AM,PLANNED - not yet accessible (Private),,,,,,,2,,,,,06/02/2015,67299,2015-09-23 13:11:12+00,LG,,,,,,,,J1772,"318 W Adams Blvd
Los Angeles, CA 90007",34.0260559,-118.273681,1400000US06037224600,28650
2947,0101000020E6100000713C9F01F5A75CC065A54929E86C4140,ELEC,Westside Shell - Tesla,2451 Needles Hwy,,,877-798-3752,E,,Public,"24 hours daily; for Tesla use only",,,,,,,4,,Tesla,http://www.teslamotors.com/supercharger,03/04/2015,65723,2015-03-04 01:16:23+00,P,,,02/01/2015,,,,,TESLA,"2451 Needles Hwy
Needles, CA 92363",34.850835,-114.624329,1400000US06071025100,28698
11235,0101000020E6100000958334BE0A585DC03494241983FD4040,ELEC,CITYOFRIVERSIDE,3900 Main St.,"CITY HALL #1
CITY HALL #2",,888-758-4389,E,,Public,24 hours daily,,,,,2,2,,,ChargePoint Network,http://www.mychargepoint.net/,10/09/2015,45262,2015-10-09 07:40:34+00,,,,,,,,,NEMA520 J1772,"3900 Main St.
Riverside, CA 92501",33.9805633,-117.3756557,1400000US06065030300,28700
8627,0101000020E61000009A67DB1FDE575DC09414580053FD4040,ELEC,CNTYOFRIVERSIDE,3403 10th Street,RIVERSIDE CTR,,888-758-4389,E,,Public,24 hours daily,,,,,,1,,,ChargePoint Network,http://www.mychargepoint.net/,10/09/2015,50428,2015-10-09 08:15:27+00,,,,,,,,,J1772,"3403 10th Street
Riverside, CA 92501",33.9790955,-117.3729324,1400000US06065030300,28700
264,0101000020E6100000AB3DEC8502585DC013584AE020FD4040,ELEC,CNTYOFRIVERSIDE,3535 12th St,"12TH ST PRKNG#2
12TH ST PRKNG#1",,888-758-4389,E,,Public,24 hours daily,,,,,,2,,,ChargePoint Network,http://www.mychargepoint.net/,10/09/2015,7205,2015-10-09 08:15:28+00,,,,,,,,,J1772,"3535 12th St
Riverside, CA 92501",33.9775658,-117.375154,1400000US06065030300,28700
22249,0101000020E6100000F997EEBFDF575DC0E84EB0FF3AFD4040,ELEC,CNTYOFRIVERSIDE,3444 10th St,"RIV CAC SUPERVS; RIV CAC-Supervisor's Parking Lot",,888-758-4389,E,,Public,24 hours daily,,,,,,2,,,ChargePoint Network,http://www.mychargepoint.net/,10/09/2015,50429,2015-10-09 08:14:16+00,,,,,,,,,J1772,"3444 10th St
Riverside, CA 92501",33.978363,-117.3730316,1400000US06065030300,28700
312,0101000020E6100000109D54EAC8575DC07B0F3C6304FE4040,ELEC,CITYOFRIVERSIDE,3637 5th St,CON CENTER #1,,888-758-4389,E,,Public,24 hours daily,,,,,,2,,,ChargePoint Network,http://www.mychargepoint.net/,10/09/2015,61108,2015-10-09 07:40:35+00,,,,,,,,,J1772,"3637 5th St
Riverside, CA 92501",33.9845089,-117.3716379,1400000US06065030300,28700
13036,0101000020E61000002A0F1CE1FE575DC0D7C5C8EDF2FD4040,ELEC,CITYOFRIVERSIDE,3634 Market,"FOX PLAZA #2; Fox Plaza Garage #7 3634 Market between Mission Inn and 6th Street",,888-758-4389,E,,Public,24 hours daily,,,,,1,1,,,ChargePoint Network,http://www.mychargepoint.net/,10/09/2015,62969,2015-10-09 07:40:34+00,,,,,,,,,NEMA520 J1772,"3634 Market
Riverside, CA 92501",33.9839761,-117.3749316,1400000US06065030300,28700
22146,0101000020E6100000FAD170CADC575DC07C61325530FE4040,ELEC,Marriott Riverside Convention Center - Tesla,3400 Market St,,,951-784-8000  877-798-3752,E,,Public,"24 hours daily; for Tesla use only; for guest use only",,,,,,3,,,Tesla,http://www.teslamotors.com/supercharger,,70328,2015-10-08 18:33:59+00,P,,,06/01/2015,,,,,TESLA,"3400 Market St
Riverside, CA 92501",33.98585,-117.372851,1400000US06065030300,28700
13561,0101000020E61000005C21078005585DC09F82B2DFC9FD4040,ELEC,CITYOFRIVERSIDE,3780 Market St,"PARK GARAGE 3; Rear of parking garage",,888-758-4389,E,,Public,24 hours daily,,,,,1,1,,,ChargePoint Network,http://www.mychargepoint.net/,10/09/2015,45264,2015-10-09 07:40:32+00,,,,,,,,,NEMA520 J1772,"3780 Market St
Riverside, CA 92501",33.9827232,-117.3753357,1400000US06065030300,28700
17220,0101000020E6100000020CCB9FEF575DC0D817BFDF1EFD4040,ELEC,CNTYOFRIVERSIDE,4090 Lemon St,RIVERSIDE CAC,,888-758-4389,E,,Public,24 hours daily,,,,,,1,,,ChargePoint Network,http://www.mychargepoint.net/,10/09/2015,50430,2015-10-09 08:15:27+00,,,,,,,,,J1772,"4090 Lemon St
Riverside, CA 92501",33.9775047,-117.3740005,1400000US06065030300,28700
1057,0101000020E610000012E9C8DB5B1D5DC0598BAABAA2E64040,ELEC,EVSP WALGREENS,33975 Date Palm Dr,STORE 5301,,888-758-4389,E,,Public,24 hours daily,,,,,,1,,,ChargePoint Network,http://www.mychargepoint.net/,10/09/2015,68863,2015-10-09 07:42:54+00,,,,,,,,,J1772,"33975 Date Palm Dr
Cathedral City, CA 92234",33.8018411,-116.4587316,1400000US06065044915,28899
2372,0101000020E61000003E0B9D3292815EC0AF642200937C4240,ELEC,Soquel & Front Garage,601 Front St,,,831-420-5184,E,,Public,24 hours daily,,,,,,3,,2 SP Inductive,,,05/05/2015,21794,2015-05-05 11:54:37+00,P,,,06/30/1998,,,,,J1772,"601 Front St
Santa Cruz, CA 95061",36.9732361,-122.0245482,1400000US06087101000,29183
21294,0101000020E6100000A46A60504B825EC075D7C86427FD4240,ELEC,TODOS SANTOS,2051 Salvio St,"STATION 1; Conveniently located on the first floor of the Todos Santos Plaza Parking Structure",,888-758-4389,E,,Public,24 hours daily,,,,,,2,,,ChargePoint Network,http://www.mychargepoint.net/,10/09/2015,65010,2015-10-09 07:48:04+00,,,,,,,,,J1772,"2051 Salvio St
Concord, CA 94520",37.9777647,-122.0358468,1400000US06013328000,29250
16793,0101000020E610000027BD6F7CED815EC08080B56AD7FC4240,ELEC,CARCHARGING,2300 Clayton Rd,"CONCORD CENTER; Charging station is located in One Concord Center building. The station is located near the parking garage entrance on the right",,888-758-4389,E,,Public,24 hours daily,,,,,,1,,,ChargePoint Network,http://www.mychargepoint.net/,10/09/2015,53369,2015-10-09 07:55:28+00,,,,,,,,,J1772,"2300 Clayton Rd
Concord, CA 94520",37.975324,-122.03012,1400000US06013328000,29250
17643,0101000020E61000003248B02770755EC04FBF55E8CDDC4340,ELEC,CHICO VW,902 Oroville Ave,VW_426109_A,,888-758-4389,E,,Public,24 hours daily,,,,,,2,,,ChargePoint Network,http://www.mychargepoint.net/,10/09/2015,65026,2015-10-09 08:27:31+00,,,,,,,,,J1772,"902 Oroville Ave
Chico, CA 95928",39.7250338,-121.8349704,1400000US06007001000,29367
12368,0101000020E61000005D0828C3A7545DC0B3C2E3912E094140,ELEC,Colton City Hall,650 N La Cadena,,,909-370-5099,E,,Public,24 hours daily,,,,,,1,,,,,05/05/2015,51207,2015-05-05 11:44:28+00,LG,,,02/27/2013,,,,,J1772,"650 N La Cadena
Colton, CA 92324",34.0717337,-117.3227394,1400000US06071012500,29516
18253,0101000020E61000002294ADE499545DC0F3AA73B10E084140,ELEC,Colton Utility Yard,150 S 10th St,,,909-370-5099,E,,Public,7am-6pm M-Th,,,,,,1,,,,,05/05/2015,51208,2015-05-05 11:57:16+00,LG,,,02/27/2013,,,,,J1772,"150 S 10th St
Colton, CA 92324",34.0629484,-117.3218929,1400000US06071012500,29516
13542,0101000020E61000002294ADE499545DC0F3AA73B10E084140,ELEC,Colton Utility Yard,150 S 10th St,,,909-370-5099,E,,Private,Employee use only,,,,,,2,,,,,05/05/2015,66750,2015-05-05 11:57:16+00,LG,,,04/01/2015,,,,,J1772,"150 S 10th St
Colton, CA 92324",34.0629484,-117.3218929,1400000US06071012500,29516
3503,0101000020E6100000A516A5DF998D5DC0AB178DC6EB074140,ELEC,Los Angeles County - University of Southern California Medical Center,1214 N Mission Rd,Located in lot 10,,,E,,Private,Employee use only,,,,,,4,,,,,06/02/2015,63056,2015-06-02 18:01:30+00,LG,,,08/01/2014,,,,,J1772,"1214 N Mission Rd
Los Angeles, CA 90033",34.0618828,-118.2125167,1400000US06037203300,29583
18688,0101000020E61000006EA296E6568D5DC07C8159A148074140,ELEC,Los Angeles County - University of Southern California Medical Center,Brittania St,Located in Lot 9 D,,323-267-2023,P,09/01/2015 12:00:00 AM,PLANNED - not yet accessible (Public),"24 hours daily; keypad activated, instructions on EVSE",,,,,,10,,,,,06/02/2015,67304,2015-09-23 13:11:14+00,LG,,,,,,,,J1772,"Brittania St
Los Angeles, CA 90033",34.056904,-118.208429,1400000US06037203300,29583
13868,0101000020E610000010632D993E8D5DC014371378CC074140,ELEC,USC CAMPUS,1334 Biggy St,"HSC BIGGY #1; Enter using the right-hand ramp from Biggy Street. ID required to open gate arm.
HSC BIGGY #2; Enter using the right-hand ramp from Biggy Street. ID required to open gate arm.",,888-758-4389,E,,Public,24 hours daily,,,,,,4,,,ChargePoint Network,http://www.mychargepoint.net/,10/09/2015,62345,2015-10-09 07:50:25+00,,,,,,,,,J1772,"1334 Biggy St
Los Angeles, CA 90033",34.0609274,-118.2069457,1400000US06037203300,29583
20410,0101000020E610000060C0DC38738C5DC09D8F21B6AAE24040,ELEC,SOFI APARTMENTS,225 W 3rd St,"SOFI AT 3RD; near lobby entrance ",,888-758-4389,E,,Public,24 hours daily,,,,,,2,,,ChargePoint Network,http://www.mychargepoint.net/,10/09/2015,69891,2015-10-09 08:32:29+00,,,,,,,,,J1772,"225 W 3rd St
Long Beach, CA 90802",33.7708347,-118.1945326,1400000US06037575902,29768
541,0101000020E6100000448B6CE7FB655DC080B74082E2074140,ELEC,Ontario International Airport,Terminal Way,Daily Lots 2 and 4,,909-937-1240,E,,Public,"24 hours daily; pay lot",,,,,,6,,,,,02/03/2015,49131,2015-02-03 18:14:16+00,LG,,,06/18/2012,,,,,J1772,"Terminal Way
Ontario, CA 91761",34.0616,-117.5935,1400000US06071001600,29856
9382,0101000020E610000012729472AD665DC0FED71423A6084140,ELEC,Enterprise Rent-A-Car,2131 Convention Center Way,,,,E,,Private,,,,,,2,2,,,OpConnect,http://www.opconnect.com/,03/04/2015,61874,2015-03-04 14:19:25+00,P,,,12/01/2013,,,,,NEMA520 J1772,"2131 Convention Center Way
Ontario, CA 91764",34.0675701,-117.6043364,1400000US06071001600,29856
11720,0101000020E6100000E44C13B61F675DC07EBD0C1016084140,ELEC,Propel Fuels - 76,1850 E Holt Blvd,,,909-467-1809,P,10/30/2015 12:00:00 AM,PLANNED - not yet accessible (Public - Credit card at all times),24 hours daily,A D M V Voyager,,,,,,3,,,,06/02/2015,67199,2015-06-02 18:18:03+00,P,,,,,,,,CHADEMO,"1850 E Holt Blvd
Ontario, CA 91761",34.0631733,-117.6113105,1400000US06071001600,29856
11415,0101000020E6100000EF8D2100B85F5EC0153902C0CA4A4340,ELEC,Sacramento County Public Garage,725 7th St,7th St & G St,,916-876-6192,E,,Public,"24 hours daily; pay lot",,,,,,,,1 SP Inductive,,,07/08/2015,1495,2015-07-08 14:39:52+00,P,,,08/30/1995,,,,,,"725 7th St
Sacramento, CA 95814",38.58431244,-121.4956055,1400000US06067000600,30000
11578,0101000020E610000009CB338AC05F5EC0B2F6D26FBA4A4340,ELEC,COUNTY EVSE,725 7th St,"PUBLIC GARAGE 1; Paid Parking - Public Entrance on G Street
PUBLIC GARAGE 3; Paid Parking - Public Entrance on G Street
PUBLIC GARAGE 2; Paid Parking - Public Entrance on G Street
PUBLIC GARAGE 7; Paid Parking - Public Entrance on G Street
PUBLIC GARAGE 5; Paid Parking - Public Entrance on G Street
PUBLIC GARAGE 4; Paid Parking - Public Entrance on G Street
PUBLIC GARAGE 6; Paid Parking - Public Entrance on G Street",,888-758-4389,E,,Public,24 hours daily,,,,,3,9,,,ChargePoint Network,http://www.mychargepoint.net/,10/09/2015,41326,2015-10-09 08:08:52+00,,,,,,,,,NEMA520 J1772,"725 7th St
Sacramento, CA 95814",38.5838146,-121.4961267,1400000US06067000600,30000
15952,0101000020E6100000013E2E60B85F5EC0F2C4FF5FED4A4340,ELEC,Sacramento County Public Garage ,615 7th St,,,,E,,Private,Employee use only,,,,,,6,,,,,07/08/2015,44968,2015-07-08 15:22:59+00,LG,,,01/15/2012,,,,,J1772,"615 7th St
Sacramento, CA 95814",38.58536911,-121.4956284,1400000US06067000600,30000
21179,0101000020E61000005976775300915DC0002C3C79A2E24040,ELEC,LADWP - Wilmington,161 N Island Ave,At B St,,,E,,Private - Government only,,,,,,,,,4 Conductive 240V,,,03/04/2015,1552,2015-03-04 14:22:59+00,LG,,,10/15/1999,,,,,,"161 N Island Ave
Wilmington, CA 90744",33.7705833,-118.2656449,1400000US06037294830,30042
20941,0101000020E6100000FE21A23D03915DC0D841CAF4F0E24040,ELEC,LADWP - Wilmington District Yard,315 N Island Ave,,,,E,,Private - Government only,,,,,,,,,1 Conductive 240V,,,03/04/2015,25171,2015-03-04 14:23:00+00,LG,,,10/15/1999,,,,,,"315 N Island Ave
Wilmington, CA 90744",33.7729784,-118.2658228,1400000US06037294830,30042
14613,0101000020E6100000349CD77D6C955DC0D1178C5B160D4140,ELEC,Cherokee-Whitley Garage,1718 N Cherokee Ave,,,323-957-9211,E,,Public,"24 hours daily; pay lot",,,,,,4,,,,,03/04/2015,1526,2015-03-04 15:19:34+00,P,,,08/15/1995,,,,,J1772,"1718 N Cherokee Ave
Los Angeles, CA 90028",34.1022448,-118.3347468,1400000US06037190202,30131
22169,0101000020E610000051DA1B7C61465DC0554FE61F7D514040,ELEC,Seven Mile Casino - Tesla,285 Bay Blvd,,,619-425-3333  877-798-3752,E,,Public,"24 hours daily; for Tesla use only; for guest use only; see valet for access",,,,,,4,,,Tesla,http://www.teslamotors.com/supercharger,,70386,2015-10-09 20:28:56+00,P,,,07/01/2015,,,,,TESLA,"285 Bay Blvd
Chula Vista, CA 91910",32.636631,-117.0997,1400000US06073012502,30132
16120,0101000020E610000017A29E993B855DC0E3A6069ACF064140,ELEC,Southern California Edison - Rosemead Office Building 1 ,2244 Walnut Grove Ave,,,888-758-4389,E,,Private,Employee use only,,,,,22,22,,,Greenlots,http://greenlots.com/,04/03/2015,1520,2015-04-03 17:10:38+00,T,,,08/01/2011,,,,,NEMA520 J1772,"2244 Walnut Grove Ave
Rosemead, CA 91770",34.0532105,-118.0817627,1400000US06037433602,30170
17684,0101000020E6100000009AF7EE45905DC0AC634B4519124140,ELEC,Car Pros Kia Glendale,400 S Brand Blvd,,,855-900-7584,E,,Public,24 hours daily,,,,,,,2,,Greenlots,http://greenlots.com/,08/04/2015,68323,2015-08-04 12:55:52+00,P,,,11/01/2014,,,,,CHADEMO J1772COMBO,"400 S Brand Blvd
Glendale, CA 91204",34.1413962,-118.2542684,1400000US06037302202,30196
21280,0101000020E6100000FE99417C600E5DC01631EC3026114140,ELEC,Mount Shasta,65911 29 Palms Hwy,Chargers are located inside the locked yellow building,,760-366-3068  760-366-8229,E,,Public - Call ahead,"1 hour after sunrise - 1 hour before sunset;  call for access at 760-366-3068",,,,,,,1,,,,05/05/2015,64083,2015-05-05 11:54:18+00,P,,,10/15/2014,,,,,CHADEMO,"65911 29 Palms Hwy
Joshua Tree, CA 92252",34.133978,-116.224639,1400000US06071010416,30275
8102,0101000020E6100000FE99417C600E5DC01631EC3026114140,ELEC,Mount Shasta,65911 29 Palms Hwy,Chargers are located inside the locked yellow building,,760-366-3068  760-366-8229,E,,Public - Call ahead,"24 hours daily;  call for access at 760-366-3068",,,,,,1,,,,,05/05/2015,64084,2015-05-05 11:44:46+00,P,,,10/15/2014,,,,,J1772,"65911 29 Palms Hwy
Joshua Tree, CA 92252",34.133978,-116.224639,1400000US06071010416,30275
13058,0101000020E61000001CF80780605B5EC0C79DD2C1FA4C4340,ELEC,Arden Fair Mall,1689 Arden Way,,,916-920-1167,E,,Public,24 hours daily,,,,,,3,,,,,05/05/2015,7286,2015-05-05 11:49:27+00,P,,,06/15/1998,,,,,J1772,"1689 Arden Way
Sacramento, CA 95815",38.6014025,-121.4277649,1400000US06067005502,30424
17737,0101000020E6100000BC934F8F6D755EC09758198D7C004340,ELEC,McDonald's #2637 - Mahogany Way - Antioch CA,2424 Mahogany Way,,,888-998-2546,E,,Public,MON: 24 hours | TUE: 24 hours | WED: 24 hours | THU: 24 hours | FRI: 24 hours | SAT: 24 hours | SUN: 24 hours,,,,,,3,,,Blink Network,http://www.blinknetwork.com/,10/09/2015,67769,2015-10-09 07:09:34+00,,,,,,,,,J1772,"2424 Mahogany Way
Antioch, CA 94509",38.003801,-121.834812,1400000US06013307202,30587
2645,0101000020E61000001A88653387465DC0672783A3E45F4040,ELEC,Kalos,3795 Florida St,,,888-998-2546,E,,Public,MON: 24 hours | TUE: 24 hours | WED: 24 hours | THU: 24 hours | FRI: 24 hours | SAT: 24 hours | SUN: 24 hours,,,,,,1,,,Blink Network,http://www.blinknetwork.com/,10/09/2015,52746,2015-10-09 07:12:50+00,,,,,,,,,J1772,"3795 Florida St
San Diego, CA 92105",32.749165,-117.102002,1400000US06073002402,30635
8347,0101000020E61000004C8A8F4FC8175DC03604C765DCA04040,ELEC,Borrego Springs Chamber of Commerce,"786 Palm Canyon Dr., P.O. Box 420",,,888-998-2546,E,,Public,MON: 24 hours | TUE: 24 hours | WED: 24 hours | THU: 24 hours | FRI: 24 hours | SAT: 24 hours | SUN: 24 hours,,,,,,5,,,Blink Network,http://www.blinknetwork.com/,10/09/2015,51503,2015-10-09 07:13:08+00,,,,,,,,,J1772,"786 Palm Canyon Dr., P.O. Box 420
Borrego Springs, CA 92004",33.256726,-116.371601,1400000US06073021000,30661
14669,0101000020E610000012B00C60805A5DC0100B1060ECF54040,ELEC,CITYOFRIVERSIDE,2911 Adams St,"UOC #1; Employee Parking Lot",,888-758-4389,E,,Public,24 hours daily,,,,,1,1,,,ChargePoint Network,http://www.mychargepoint.net/,10/09/2015,45265,2015-10-09 07:40:32+00,,,,,,,,,NEMA520 J1772,"2911 Adams St
Riverside, CA 92504",33.9212761,-117.4140854,1400000US06065031300,30671
13127,0101000020E6100000A4EA0DAD845A5DC0D8E5A5ACF0F54040,ELEC,CITYOFRIVERSIDE,2901-2981 Adams St,UOC #2,,888-758-4389,E,,Public,24 hours daily,,,,,1,1,,,ChargePoint Network,http://www.mychargepoint.net/,10/09/2015,57212,2015-10-09 08:08:44+00,,,,,,,,,NEMA520 J1772,"2901-2981 Adams St
Riverside, CA 92504",33.9214073,-117.4143479,1400000US06065031300,30671
13251,0101000020E6100000829A10293C5A5DC0610AC50C43F64040,ELEC,CITYOFRIVERSIDE,8095 Lincoln Ave,"CORP TYARD #1; AFV Fuel Island
CORP YARD #2",,888-758-4389,E,,Public,24 hours daily,,,,,2,2,,,ChargePoint Network,http://www.mychargepoint.net/,10/09/2015,45263,2015-10-09 07:40:33+00,,,,,,,,,NEMA520 J1772,"8095 Lincoln Ave
Riverside, CA 92504",33.9239212,-117.4099219,1400000US06065031300,30671
18285,0101000020E6100000D466F73F9B595DC0C1142F6013F74040,ELEC,CITYOFRIVERSIDE,2985 Madison St,CB FAM LRN CTR,,888-758-4389,E,,Public,24 hours daily,,,,,1,1,,,ChargePoint Network,http://www.mychargepoint.net/,10/09/2015,45261,2015-10-09 07:40:33+00,,,,,,,,,NEMA520 J1772,"2985 Madison St
Riverside, CA 92504",33.9302788,-117.4001007,1400000US06065031300,30671
20651,0101000020E61000002B85402E710F5DC0DBA50D87A5DD4040,ELEC,Best Western Date Tree Hotel,81909 Indio Blvd,,,760-347-3421,E,,Public,24 hours daily. Guests only,,,,,1,,,,,,05/05/2015,50149,2015-05-05 11:54:37+00,P,,,12/01/2012,,,,,NEMA520,"81909 Indio Blvd
Indio, CA 92201",33.731614,-116.241283,1400000US06065045209,30711
2204,0101000020E610000033CCBF4C4ABA5EC0C675429E13954340,ELEC,Tallman Hotel and Blue Wing Restaurant - Tesla,9500 Main St,,,707-275-2244  877-798-3752,E,,Public,"24 hours daily; for Tesla use only",,,,,,2,,,Tesla,http://www.teslamotors.com/supercharger,,70395,2015-10-09 20:33:48+00,P,,,06/01/2015,,,,,TESLA,"9500 Main St
Upper Lake, CA 95485",39.1646612,-122.9107849,1400000US06033000100,30825
18792,0101000020E6100000B0E831256D765DC027C2E160CADD4040,ELEC,Southern California Edison - Central Orange County,1241 S Grande Ave,,,,E,,Private,Employee use only,,,,,4,4,,,Greenlots,http://greenlots.com/,04/03/2015,66301,2015-04-03 17:10:42+00,T,,,01/01/2015,,,,,NEMA520 J1772,"1241 S Grande Ave
Santa Ana, CA 92705",33.7327386,-117.8504117,1400000US06059074403,31010
21941,0101000020E6100000A0596D5999755DC0C9CA2F8331DD4040,ELEC,CREVIER BMW,1500 Auto Mall Dr,"STATION 01; -
STATION 02; -
STATION 03; -
FAST CHARGER 02
FAST CHARGER 01; -
FAST CHARGER 04; -
STATION SA01; -",,888-758-4389,E,,Public,24 hours daily,,,,,,7,3,,ChargePoint Network,http://www.mychargepoint.net/,10/09/2015,63438,2015-10-09 08:21:40+00,,,,,,,,,J1772 J1772COMBO,"1500 Auto Mall Dr
Santa Ana, CA 92705",33.7280735,-117.8374847,1400000US06059074403,31010
8315,0101000020E6100000B0E831256D765DC027C2E160CADD4040,ELEC,Southern California Edison - Central Orange County,1241 S Grande Ave,,,,E,,Private,,,,,,,4,,23 SP Inductive,,,04/03/2015,27307,2015-04-03 17:10:42+00,T,,,07/15/2005,,,,,J1772,"1241 S Grande Ave
Santa Ana, CA 92705",33.7327386,-117.8504117,1400000US06059074403,31010
2302,0101000020E610000002D2A34EE5445EC069D4320862724340,ELEC,Courtview,200 Auburn Folsom Rd,,,,E,,Private,Employee use only,,,,,,2,,,,,05/05/2015,53365,2015-05-05 11:54:28+00,P,,,03/15/2013,,,,,J1772,"200 Auburn Folsom Rd
Auburn, CA 95603",38.8936167,-121.0764958,1400000US06061020401,31205
2801,0101000020E6100000BC95253ACB445EC0A52C431CEB724340,ELEC,City of Auburn,1225 Lincoln Way,City Hall Parking Lot,,530-823-4211,E,,Public,24 hours daily,,,,,,1,,,,,05/05/2015,64697,2015-05-05 11:55:31+00,LG,,,12/01/2014,,,,,J1772,"1225 Lincoln Way
Auburn, CA 95603",38.8978,-121.074904,1400000US06061020401,31205
10744,0101000020E61000003AC0DDA3C8035DC05F27F56569114140,ELEC,BUCKLIN PARK,73484 Twentynine Palms Hwy,"29 PALMS 1; -",,888-758-4389,E,,Public,24 hours daily,,,,,,1,,,ChargePoint Network,http://www.mychargepoint.net/,10/09/2015,58292,2015-10-09 08:20:45+00,,,,,,,,,J1772,"73484 Twentynine Palms Hwy
Twentynine Palms, CA 92277",34.136029,-116.0591211,1400000US06071010421,31213
8466,0101000020E6100000406260C28D5A5EC05DFE9EB3604C4340,ELEC,EVSP WALGREENS,2201 Arden Way,"STORE 6193; The station is located to the left of the store's entrance",,888-758-4389,E,,Public,24 hours daily,,,,,,1,,,ChargePoint Network,http://www.mychargepoint.net/,10/09/2015,41804,2015-10-09 07:43:02+00,,,,,,,,,J1772,"2201 Arden Way
Sacramento, CA 95825",38.5967011,-121.4149023,1400000US06067005505,31285
19138,0101000020E610000085402E71E4905EC05ABA826DC4E74240,ELEC,Propark - Lake Merritt Tower,155 Grand Ave,,,510-268-8605,E,,Public,"Restricted to garage hours; pay lot",,,,,4,2,,,,,03/04/2015,61854,2015-03-04 14:27:25+00,P,,,02/01/2011,,,,,J1772 NEMA515,"155 Grand Ave
Oakland, CA 94612",37.810682,-122.263943,1400000US06001402900,31319
10436,0101000020E6100000BC40498105885DC09EEDD11BEE594140,ELEC,Antelope Valley Union School District - Antelope Valley Adult School,45110 3rd St E,,,,E,,Private,Employee use only,,,,,,1,,,,,01/06/2015,42250,2015-05-20 14:38:00+00,LG,,,11/15/2011,,,,,J1772,"45110 3rd St E
Lancaster, CA 93535",34.702579,-118.125336,1400000US06037900606,31513
18594,0101000020E610000045F5D6C056885DC0A73B4F3C67594140,ELEC,Antelope Valley Union School District - Antelope Valley High School,44900 Division St,,,,E,,Private,Employee use only,,,,,,2,,,,,01/06/2015,42251,2015-05-20 14:38:03+00,LG,,,11/15/2011,,,,,J1772,"44900 Division St
Lancaster, CA 93535",34.698463,-118.130295,1400000US06037900606,31513
10336,0101000020E610000072D6F1A92D5F5EC0831EC594A3494340,ELEC,DGS MAIN,1501 Capitol Ave,"1501 STATION 3
1501 STATION 1
1501 STATION 5; -
1501 STATION 2
1501 STATION 4; -
1501 STATION 6",,888-758-4389,E,,Public,24 hours daily,,,,,,6,,,ChargePoint Network,http://www.mychargepoint.net/,10/09/2015,51940,2015-10-09 07:40:58+00,,,,,,,,,J1772,"1501 Capitol Ave
Sacramento, CA 95814",38.5753046,-121.4871621,1400000US06067001101,31651
9631,0101000020E61000008F6104438C5F5EC0A906ABFB114A4340,ELEC,SACRAMENTO,1106 11th St,"CAPITAL GARAGE1; -",,888-758-4389,E,,Public,24 hours daily,,,,,,2,,,ChargePoint Network,http://www.mychargepoint.net/,10/09/2015,63360,2015-10-09 08:15:14+00,,,,,,,,,J1772,"1106 11th St
Sacramento, CA 95814",38.5786738,-121.4929359,1400000US06067001101,31651
14580,0101000020E61000000B0C59DD6A5F5EC080CFB469114A4340,ELEC,Southern California Edison - Sacramento Office,1201 K St,,,,E,,Private,,,,,,,1,,,,,04/03/2015,32850,2015-04-03 17:10:36+00,T,,,01/15/2008,,,,,J1772,"1201 K St
Sacramento, CA 95831",38.5786564,-121.4908975,1400000US06067001101,31651
14430,0101000020E6100000B17AD168BC5F5EC0F6B4C35F93494340,ELEC,DGS MAIN,1500 10th St,"LOT 24 STATION1; -
LOT 24 STATION2; -
LOT 24 STATION3
LOT 24 STATION4; -",,888-758-4389,E,,Public,24 hours daily,,,,,,4,,,ChargePoint Network,http://www.mychargepoint.net/,10/09/2015,1567,2015-10-09 07:40:50+00,,,,,,,,,J1772,"1500 10th St
Sacramento, CA 95814",38.57481,-121.4958746,1400000US06067001101,31651
21896,0101000020E610000048E17A14AE5F5EC0EFE6A90EB9494340,ELEC,State Capitol Parking Garage,1303 10th St,At 12th and N St,,,E,,Private - Government only,Permitted state employees only,,,,,,4,,1 LP Inductive  1 SP Inductive  1 Avcon Conductive  1 Other Conductive,,,05/05/2015,1533,2015-05-05 11:52:45+00,SG,,,10/15/1996,,,,,J1772,"1303 10th St
Sacramento, CA 95814",38.57596,-121.495,1400000US06067001101,31651
14670,0101000020E610000094EAF1318E5F5EC0E025DD3B0F4A4340,ELEC,SACRAMENTO,1110 11th St,"CAPITAL GARAGE2; -",,888-758-4389,E,,Public,24 hours daily,,,,,,2,,,ChargePoint Network,http://www.mychargepoint.net/,10/09/2015,63359,2015-10-09 08:15:05+00,,,,,,,,,J1772,"1110 11th St
Sacramento, CA 95814",38.5785899,-121.4930539,1400000US06067001101,31651
17730,0101000020E6100000643BDF4F8D5F5EC0A6D0798D5D4A4340,ELEC,City of Sacramento - City Hall Public Parking Garage,10th St & I St,"Lot I, Level 8, Waterfall Building.",,916-264-5011,E,,Public,"24 hours daily; pay lot",,,,,7,14,,1 SP Inductive,,,05/05/2015,49568,2015-05-05 11:55:02+00,LG,,,10/31/2012,,,,,NEMA520 J1772,"10th St &amp; I St
Sacramento, CA 95814",38.58098,-121.493,1400000US06067001101,31651
14776,0101000020E610000034F790F0BD5F5EC075FD27243E4A4340,ELEC,RENAISSANCE,801 K St,"GARAGE 2ND FL B
GARAGE 2ND FL A",,888-758-4389,E,,Public,24 hours daily,,,,,,2,,,ChargePoint Network,http://www.mychargepoint.net/,10/09/2015,42666,2015-10-09 07:47:05+00,,,,,,,,,J1772,"801 K St
Sacramento, CA 95814",38.5800214,-121.495968,1400000US06067001101,31651
1313,0101000020E61000003BC780ECF55F5EC08C2BD3D457494340,ELEC,DGS MAIN,800 Q St,"LOT 55 STATION1
LOT 55 STATION2
LOT 55 STATION5
LOT 55 STATION3
LOT 55 STATION4",,888-758-4389,E,,Public,24 hours daily,,,,,,5,,,ChargePoint Network,http://www.mychargepoint.net/,10/09/2015,44971,2015-10-09 07:40:49+00,,,,,,,,,J1772,"800 Q St
Sacramento, CA 95811",38.5729929,-121.499385,1400000US06067001101,31651
14965,0101000020E610000048E17A14AE5F5EC0EFE6A90EB9494340,ELEC,State Capitol Parking Garage,1303 10th St,At 12th and N St,,,E,,Private - Government only,Permitted state employees only,,,,,,,,1 SP Inductive  4 Avcon Conductive,,,05/05/2015,1594,2015-05-05 11:52:45+00,SG,,,10/15/1996,,,,,,"1303 10th St
Sacramento, CA 95814",38.57596,-121.495,1400000US06067001101,31651
18928,0101000020E610000063FCEA60335F5EC065F95F538C494340,ELEC,DGS MAIN,1500 Capitol Ave,"1500 STATION 2
1500 STATION 3; -
1500 STATION 4
1500 STATION 1",,888-758-4389,E,,Public,24 hours daily,,,,,,4,,,ChargePoint Network,http://www.mychargepoint.net/,10/09/2015,57970,2015-10-09 07:40:59+00,,,,,,,,,J1772,"1500 Capitol Ave
Sacramento, CA 95814",38.5745949,-121.4875109,1400000US06067001101,31651
21106,0101000020E6100000643BDF4F8D5F5EC0A6D0798D5D4A4340,ELEC,City of Sacramento - City Hall Public Parking Garage,10th St & I St,"Lot I, Level 8, Waterfall Building.",,916-264-5011,E,,Public,"24 hours daily; pay lot",,,,,10,5,,"7 SP Inductive; 10 Avcon Inductive",,,05/05/2015,25493,2015-05-05 11:55:02+00,LG,,,05/30/2004,,,,,J1772 NEMA520,"10th St &amp; I St
Sacramento, CA 95814",38.58098,-121.493,1400000US06067001101,31651
15556,0101000020E61000005D6DC5FEB25F5EC0D8F0F44A594A4340,ELEC,Park Tower,1010 8th St,,,916-442-2217,E,,Public,"Garage business hours; pay lot; 4 hour parking limit",,,,,,4,,,,,05/05/2015,1515,2015-05-05 11:55:39+00,P,,,09/01/1995,,,,,J1772,"1010 8th St
Sacramento, CA 95814",38.58085,-121.4953,1400000US06067001101,31651
15749,0101000020E6100000112C58F4185F5EC0AC38D55A98494340,ELEC,DGS MAIN,1615 Capitol Ave,"1615 STATION 2
1615 STATION 4
1615 STATION 1
1615 STATION 3",,888-758-4389,E,,Public,24 hours daily,,,,,,4,,,ChargePoint Network,http://www.mychargepoint.net/,10/09/2015,62337,2015-10-09 07:40:57+00,,,,,,,,,J1772,"1615 Capitol Ave
Sacramento, CA 95814",38.574962,-121.4858981,1400000US06067001101,31651
2563,0101000020E610000050DE6C18AA5F5EC006137F1475494340,ELEC,DGS MAIN,1517 11th St,"LOT 50 STATION5; -
LOT 50 STATION3; -
LOT 50 STATION2; -",,888-758-4389,E,,Public,24 hours daily,,,,,,3,,,ChargePoint Network,http://www.mychargepoint.net/,10/09/2015,63231,2015-10-09 07:41:28+00,,,,,,,,,J1772,"1517 11th St
Sacramento, CA 95814",38.5738855,-121.4947568,1400000US06067001101,31651
19252,0101000020E61000001101E209985F5EC0B2A43737014A4340,ELEC,SACRAMENTO,1013 L St,"CAPITAL GARAGE3; -",,888-758-4389,E,,Public,24 hours daily,,,,,,1,,,ChargePoint Network,http://www.mychargepoint.net/,10/09/2015,65949,2015-10-09 08:15:25+00,,,,,,,,,J1772,"1013 L St
Sacramento, CA 95814",38.5781621,-121.4936547,1400000US06067001101,31651
11131,0101000020E6100000148D5A06415F5EC08DF4FD2F324A4340,ELEC,DGS MAIN,1300 I St,"1300 STATION 2
1300 STATION 3
1300 STATION 1
1300 STATION 4",,888-758-4389,E,,Public,24 hours daily,,,,,,4,,,ChargePoint Network,http://www.mychargepoint.net/,10/09/2015,51942,2015-10-09 07:40:57+00,,,,,,,,,J1772,"1300 I St
Sacramento, CA 95814",38.5796566,-121.4883438,1400000US06067001101,31651
4465,0101000020E610000016ECD0FA255F5EC01CC418A2544A4340,ELEC,SACRAMENTO,801 14th St,"MEMORIAL 3
MEMORIAL 2
MEMORIAL 1
MEMORIAL 4
MEMORIAL 6
MEMORIAL 5",,888-758-4389,E,,Public,24 hours daily,,,,,,6,,,ChargePoint Network,http://www.mychargepoint.net/,10/09/2015,50741,2015-10-09 08:14:08+00,,,,,,,,,J1772,"801 14th St
Sacramento, CA 95814",38.5807078,-121.4866931,1400000US06067001101,31651
3379,0101000020E610000091D61874425F5EC0A4897780274A4340,ELEC,DGS MAIN,1325 J St,1300 STATION 5,,888-758-4389,E,,Public,24 hours daily,,,,,,1,,,ChargePoint Network,http://www.mychargepoint.net/,10/09/2015,62327,2015-10-09 07:41:07+00,,,,,,,,,J1772,"1325 J St
Sacramento, CA 95814",38.5793305,-121.488431,1400000US06067001101,31651
3471,0101000020E610000038DC476E4D5F5EC0501BD5E9404A4340,ELEC,CARCHARGING / ACE PARKING #18,900 13th St,,,888-998-2546,E,,Private,MON: 24 hours | TUE: 24 hours | WED: 24 hours | THU: 24 hours | FRI: 24 hours | SAT: 24 hours | SUN: 24 hours,,,,,,1,,,Blink Network,http://www.blinknetwork.com/,10/09/2015,68413,2015-10-09 07:10:24+00,,,,,,,,,J1772,"900 13th St
Sacramento, CA 95814",38.580106,-121.489101,1400000US06067001101,31651
16622,0101000020E61000008A39083ADA5F5EC002CB5BBFAA494340,ELEC,Caspar Headlands State Beach,1416 9th St,,,707-937-5804,P,09/01/2016 12:00:00 AM,PLANNED - not yet accessible (Public),,,,,,,2,,,,,10/06/2015,69972,2015-10-06 21:56:45+00,SG,,,,,,,,J1772,"1416 9th St
Sacramento, CA 95814",38.5755233,-121.4976945,1400000US06067001101,31651
16569,0101000020E6100000F61D0DF1595F5EC07795FFDA0B4A4340,ELEC,ESQUIRE PLAZA,1215 K St,"1215 K ST.; Entrance on corner of J & K St Alley and 13th St
1215 K ST; Entrance on corner of J & K St Alley and 13th St",,888-758-4389,E,,Public,24 hours daily,,,,,,2,,,ChargePoint Network,http://www.mychargepoint.net/,10/09/2015,25499,2015-10-09 08:12:22+00,,,,,,,,,J1772,"1215 K St
Sacramento, CA 95814",38.5784868,-121.4898646,1400000US06067001101,31651
13662,0101000020E61000002B61B719B8475DC0D13E56F0DB564040,ELEC,NAVY EXCHANGE,3301 Ward Rd,"SAN DIEGO FLEET; In front of McDonalds and NEX",,888-758-4389,E,,Public,24 hours daily,,,,,,2,,,ChargePoint Network,http://www.mychargepoint.net/,10/09/2015,61435,2015-10-09 07:50:28+00,,,,,,,,,J1772,"3301 Ward Rd
National City, CA 92135",32.678587,-117.1206116,1400000US06073021900,31771
8912,0101000020E6100000BCCADAA678465DC04EED0C535B544040,ELEC,Mossy Nissan,2700 National City Blvd,,,619-474-7011,E,,Private,,,,,,,1,,,,,07/08/2015,48154,2015-07-08 14:25:10+00,P,,,03/15/2011,,,,,J1772,"2700 National City Blvd
National City, CA 91950",32.659037,-117.101114,1400000US06073021900,31771
10467,0101000020E61000000019DFBC5D475DC07A53910A63554040,ELEC,Port of San Diego - General Services Building,1400 Tidelands,,,888-998-2546,E,,Public,MON: 24 hours | TUE: 24 hours | WED: 24 hours | THU: 24 hours | FRI: 24 hours | SAT: 24 hours | SUN: 24 hours,,,,,,1,,,Blink Network,http://www.blinknetwork.com/,10/09/2015,54162,2015-10-09 07:09:02+00,,,,,,,,,J1772,"1400 Tidelands
National City, CA 91950",32.667085,-117.1150963,1400000US06073021900,31771
20116,0101000020E6100000BCCADAA678465DC04EED0C535B544040,ELEC,Mossy Nissan,2700 National City Blvd,,,619-474-7011,E,,Public - Call ahead,Dealership business hours,,,,,,1,,,,,07/08/2015,39915,2015-07-08 14:25:10+00,P,,,03/15/2011,,,,,J1772,"2700 National City Blvd
National City, CA 91950",32.659037,-117.101114,1400000US06073021900,31771
21878,0101000020E6100000081D740987465DC0BD72BD6DA6544040,ELEC,Frank Toyota,2400 National City Blvd,,,,E,,Private,Customer use only,,,,,1,1,,,,,05/18/2015,60180,2015-05-18 20:36:37+00,P,,,02/01/2013,,,,,NEMA520 J1772,"2400 National City Blvd
National City, CA 91950",32.661329,-117.101992,1400000US06073021900,31771
249,0101000020E6100000E560360186785DC06257491A92F04040,ELEC,CSU FULLERTON,800 N. State College,"DCQC 1; Station is Free. It's located in the SGMH parking lot.",,888-758-4389,E,,Public,24 hours daily,,,,,,,1,,ChargePoint Network,http://www.mychargepoint.net/,10/09/2015,61092,2015-10-09 07:45:01+00,,,,,,,,,CHADEMO,"800 N. State College
Fullerton, CA 92831",33.8794587,-117.883179,1400000US06059011504,31793
3939,0101000020E6100000A4FE7A8585785DC0546F0D6C95F04040,ELEC,CSU FULLERTON,800 N. State College Blvd.,"SGMH LOT 001; Station is in the SGMH Lot",,888-758-4389,E,,Public,24 hours daily,,,,,,2,,,ChargePoint Network,http://www.mychargepoint.net/,10/09/2015,61522,2015-10-09 07:45:01+00,,,,,,,,,J1772,"800 N. State College Blvd.
Fullerton, CA 92831",33.87956,-117.8831495,1400000US06059011504,31793
1512,0101000020E61000001A1DEB3DF0785DC0CCD1E3F736F14040,ELEC,CSU FULLERTON,1300 N State College Blvd,"PHY PLANT 001; From State College Blvd, turn into Entrance 8, Follow Signs
PHY PLANT 002; From State College Blvd, turn into Entrance 8, Follow Signs.",,888-758-4389,E,,Public,24 hours daily,,,,,2,2,,,ChargePoint Network,http://www.mychargepoint.net/,10/09/2015,38906,2015-10-09 07:44:56+00,,,,,,,,,NEMA520 J1772,"1300 N State College Blvd
Fullerton, CA 92831",33.88449,-117.8896632,1400000US06059011504,31793
16859,0101000020E61000007C94B65D8D785DC0D6EF784952F04040,ELEC,CSU FULLERTON,2600 Nutwood Ave,"COLLEGE PARK 01; ** Parking Permit Required ** Stations are near corner of Nutwood Ave and Langsdorf Dr.
COLLEGE PARK 02; ** Parking Permit Required ** Stations are near corner of Nutwood Ave. and Langsdorf Dr.
COLLEGE PARK 04; ** Parking Permit Required ** Stations are near corner of Nutwood Ave. and Langsdorf Dr.
COLLEGE PARK 05; ** Parking Permit Required ** Stations are near corner of Nutwood Ave., and Langsdorf Dr.
COLLEGE PARK 03; ** Parking Permit Required ** Stations are near corner of Nutwood Ave., and Langsdorf Dr.",,888-758-4389,E,,Public,24 hours daily,,,,,5,5,,,ChargePoint Network,http://www.mychargepoint.net/,10/09/2015,51917,2015-10-09 07:44:58+00,,,,,,,,,NEMA520 J1772,"2600 Nutwood Ave
Fullerton, CA 92831",33.8775112,-117.8836283,1400000US06059011504,31793
10282,0101000020E61000008F60996DDD785DC0A49AA3D81BF14040,ELEC,CSU FULLERTON,Gymnasium Campus Dr,"GYM DR 01; Stations are on Gym Drive",,888-758-4389,E,,Public,24 hours daily,,,,,,2,,,ChargePoint Network,http://www.mychargepoint.net/,10/09/2015,66829,2015-10-09 07:45:00+00,,,,,,,,,J1772,"Gymnasium Campus Dr
Fullerton, CA 92831",33.8836623,-117.8885149,1400000US06059011504,31793
15256,0101000020E6100000CF32E609DF3B5DC0E94DA0E3FE654040,ELEC,"Walgreens - El Cajon, CA #5844",215 N 2nd St,,,800-663-5633,E,,Public - Card key at all times,"MO: Not Specified; TU: Not Specified; WE: Not Specified; TH: Not Specified; FR: Not Specified; SA: Not Specified; SU: Not Specified",,,,,,1,,,SemaCharge Network,http://www.semacharge.com/,10/09/2015,43813,2015-10-09 07:36:35+00,,,,,,,,,J1772,"215 N 2nd St
El Cajon, CA 92021",32.7968411,-116.9354882,1400000US06073015701,31839
17465,0101000020E6100000957B26A02E1E5EC02222EB5F48524140,ELEC,COUNTY OF SB,1201 W Chestnut Ave,"LOMPOC HEATH; Open 4:30pm to 6:00am Weekdays, Open all day on weekends",,888-758-4389,E,,Public,24 hours daily,,,,,,2,,,ChargePoint Network,http://www.mychargepoint.net/,10/09/2015,62350,2015-10-09 07:57:49+00,,,,,,,,,J1772,"1201 W Chestnut Ave
Lompoc, CA 93436",34.6428337,-120.4715958,1400000US06083002702,31839
278,0101000020E610000062A1D6346F225DC07F6EC383C1E94040,ELEC,City of Palm Springs - Convention Center,277 Avenida Caballeros,,,760-323-8214,E,,Public,24 hours daily,,,,,,4,,,,,10/06/2015,52528,2015-10-06 22:01:00+00,LG,,,08/05/2013,,,,,J1772,"277 Avenida Caballeros
Palm Springs, CA 92262",33.8262181,-116.5380375,1400000US06065941400,31875
6887,0101000020E610000019332EC1CE215DC09EFD929E33E94040,ELEC,City of Palm Springs - Library,300 S Sunrise Way,,,760-323-8214,E,,Public,24 hours daily,,,,,,1,,,,,10/06/2015,52608,2015-10-06 22:11:10+00,LG,,,03/11/2013,,,,,J1772,"300 S Sunrise Way
Palm Springs, CA 92264",33.8218878,-116.5282443,1400000US06065941400,31875
14663,0101000020E6100000C286A757CA225DC0200890A163E94040,ELEC,Hilton Palm Springs,400 E Tahquitz Canyon Way,,,760-320-6868,E,,Public,"24 hours daily; pay lot; priority given to registered guests",,,,,1,1,,,,,05/05/2015,7196,2015-05-05 11:53:19+00,P,,,12/12/2011,,,,,NEMA520 J1772,"400 E Tahquitz Canyon Way
Palm Springs, CA 92262",33.823353,-116.5436,1400000US06065941400,31875
20856,0101000020E6100000DF701FB935545DC002ABD9B91F094140,ELEC,City of Colton - Community Center,670 N Colton Ave,,,909-370-5099,P,01/01/2016 12:00:00 AM,PLANNED - not yet accessible (Public),,,,,,,2,,,,,05/05/2015,63071,2015-05-05 11:52:51+00,T,,,,,,,,J1772,"670 N Colton Ave
Colton, CA 92324",34.0712807,-117.315779,1400000US06071007000,31875
9387,0101000020E610000058C6866EF6835DC0FE261422E04C4240,ELEC,Lone Pine Film History Museum - Tesla,701 S Main St,,,877-798-3752,E,,Public,"24 hours daily; for Tesla use only",,,,,,,4,,Tesla,http://www.teslamotors.com/supercharger,03/04/2015,65721,2015-03-04 14:15:42+00,P,,,02/01/2015,,,,,TESLA,"701 S Main St
Lone Pine, CA 93545",36.60059,-118.061916,1400000US06027000800,32000
14849,0101000020E61000005CB7F75F9D815DC078700380DB084140,ELEC,Ross Nissan El Monte/3428 N Peck Rd,3428 N Peck Rd,,,877-455-3833,E,,Public - Card key at all times,"24 hours daily; EVgo network subscription and key fob required",,,,,,,1,,eVgo Network,https://www.evgonetwork.com/,10/09/2015,69505,2015-10-09 08:53:41+00,,,,,,,,,CHADEMO,"3428 N Peck Rd
El Monte, CA 91731",34.06919861,-118.0252304,1400000US06037433304,32220
10717,0101000020E610000006F8C9ACB9815DC08582AD6DE5084140,ELEC,Ross Nissan of El Monte,3428 N Peck Rd,,,800-859-8445,E,,Private,,,,,,,1,,,,,07/08/2015,48180,2015-07-08 14:26:34+00,P,,,03/15/2011,,,,,J1772,"3428 N Peck Rd
El Monte, CA 91731",34.0695016,-118.0269577,1400000US06037433304,32220
6087,0101000020E610000006F8C9ACB9815DC08582AD6DE5084140,ELEC,Ross Nissan of El Monte,3428 N Peck Rd,,,800-859-8445,E,,Public - Call ahead,Dealership business hours,,,,,,1,,,,,07/08/2015,39887,2015-07-08 14:26:34+00,P,,,03/15/2011,,,,,J1772,"3428 N Peck Rd
El Monte, CA 91731",34.0695016,-118.0269577,1400000US06037433304,32220
1987,0101000020E61000009E5C5320B3EE5DC04628B682A6674240,ELEC,Toyota of Clovis,895 W Shaw Ave,West of Shaw and Willow Ave,,559-291-5544,E,,Private,,,,,,,1,,,,,05/05/2015,60228,2015-05-05 11:42:33+00,P,,,08/01/2012,,,,,J1772,"895 W Shaw Ave
Clovis, CA 93612",36.809769,-119.729683,1400000US06019005608,32244
828,0101000020E6100000FD885FB186F25DC0B9A81611C5684240,ELEC,Lithia Nissan of Fresno,5580 N Blackstone Ave,,,559-435-3500,E,,Private,,,,,,,1,,,,,07/08/2015,48184,2015-07-08 14:24:53+00,P,,,03/15/2011,,,,,J1772,"5580 N Blackstone Ave
Fresno, CA 93710",36.818514,-119.789471,1400000US06019004505,32266
5597,0101000020E6100000FD885FB186F25DC0B9A81611C5684240,ELEC,Lithia Nissan of Fresno,5580 N Blackstone Ave,,,559-435-3500,E,,Public - Call ahead,Dealership business hours,,,,,,1,,,,,07/08/2015,39894,2015-07-08 14:24:53+00,P,,,03/15/2011,,,,,J1772,"5580 N Blackstone Ave
Fresno, CA 93710",36.818514,-119.789471,1400000US06019004505,32266
21468,0101000020E6100000063065E080655EC075CDE49B6D924340,ELEC,Caltrans District 3,703 B St,,,,P,11/01/2015 12:00:00 AM,PLANNED - not yet accessible (Private),Fleet vehicle use only,,,,,,8,,,,,10/06/2015,70015,2015-10-06 22:10:09+00,SG,,,,,,,,J1772,"703 B St
Marysville, CA 95901",39.14397,-121.585991,1400000US06115040100,32376
17133,0101000020E610000015CB886679655EC0821145926A924340,ELEC,DISTRICT OFFICE,700-798 Chestnut St,CHARGER EV-2,,888-758-4389,E,,Public,24 hours daily,,,,,,2,,,ChargePoint Network,http://www.mychargepoint.net/,10/09/2015,70085,2015-10-09 08:32:35+00,,,,,,,,,J1772,"700-798 Chestnut St
Marysville, CA 95901",39.1438773,-121.5855347,1400000US06115040100,32376
15778,0101000020E6100000063065E080655EC09E4C929D6D924340,ELEC,DISTRICT OFFICE,703 B St,"CHARGER EV-4
GATEWAY CH EV-3
CHARGER EV-1",,888-758-4389,E,,Public,24 hours daily,,,,,,6,,,ChargePoint Network,http://www.mychargepoint.net/,10/09/2015,70084,2015-10-09 08:32:36+00,,,,,,,,,J1772,"703 B St
Marysville, CA 95901",39.1439702,-121.585991,1400000US06115040100,32376
19523,0101000020E61000004B90115061655EC0271D401AA9924340,ELEC,DISTRICT OFFICE,903 Yuba Street,YUBA ST EV-2,,888-758-4389,E,,Public,24 hours daily,,,,,,2,,,ChargePoint Network,http://www.mychargepoint.net/,10/09/2015,70099,2015-10-09 08:32:35+00,,,,,,,,,J1772,"903 Yuba Street
Marysville, CA 95901",39.1457856,-121.5840645,1400000US06115040100,32376
11873,0101000020E6100000FA08FCE1E7905DC0C16F438CD7064140,ELEC,Good Samaritan Hospital - Level 2,636 Lucas Ave,,,213-977-2121,E,,Public - Call ahead,Garage business hours,,,,,,3,,,,,10/06/2015,70011,2015-10-06 22:10:30+00,P,,,07/01/2015,,,,,J1772,"636 Lucas Ave
Los Angeles, CA 90017",34.053453,-118.264153,1400000US06037209200,32407
22489,0101000020E6100000FA08FCE1E7905DC0C16F438CD7064140,ELEC,Good Samaritan Hospital - Level 3,636 Lucas Ave,,,213-977-2121,E,,Public - Call ahead,Garage business hours,,,,,,3,,,,,10/06/2015,70012,2015-10-06 22:10:32+00,P,,,07/01/2015,,,,,J1772,"636 Lucas Ave
Los Angeles, CA 90017",34.053453,-118.264153,1400000US06037209200,32407
20987,0101000020E61000004214820BE8905DC05F57DD34C7064140,ELEC,Good Samaritan Hospital - Medical Tower - Tesla,1127 Wilshire Blvd,,,818-350-6093  877-798-3752,E,,Public,"24 hours daily; for Tesla use only",,,,,,4,,,Tesla,http://www.teslamotors.com/supercharger,,70376,2015-10-09 20:24:18+00,P,,,06/01/2015,,,,,TESLA,"1127 Wilshire Blvd
Los Ageless, CA 90017",34.0529543,-118.2641629,1400000US06037209200,32407
16539,0101000020E6100000CCC529849FF35EC079814875F0BA4340,ELEC,Beachcomber Motel and Spa,1111 N Main St,,,707-964-2402  877-798-3752,E,,Public - Call ahead,"24 hours daily; guest use only",,,,,,2,,,Tesla,http://www.teslamotors.com/supercharger,09/01/2015,66533,2015-09-01 23:06:19+00,P,,,03/01/2010,,,,,J1772 TESLA,"1111 N Main St
Fort Bragg, CA 95437",39.4604632,-123.8066111,1400000US06045010400,32428
13748,0101000020E610000077BE9F1A2F955DC06DAE9AE7880C4140,ELEC,Tops Auto Park Garage,6464 Sunset Blvd,,,323-462-6727,E,,Public,24 hours daily,,,,,,2,,,,,05/05/2015,21388,2015-05-05 11:59:20+00,P,,,06/15/2012,,,,,J1772,"6464 Sunset Blvd
Hollywood, CA 90028",34.097928,-118.331,1400000US06037190802,32468
2124,0101000020E610000077BE9F1A2F955DC06DAE9AE7880C4140,ELEC,Tops Auto Park Garage,6464 Sunset Blvd,,,323-462-6727,P,08/01/2015 12:00:00 AM,PLANNED - not yet accessible (Public),24 hours daily,,,,,,,1,,,,05/05/2015,66932,2015-05-05 11:59:20+00,P,,,,,,,,J1772COMBO,"6464 Sunset Blvd
Hollywood, CA 90028",34.097928,-118.331,1400000US06037190802,32468
1747,0101000020E61000005D56BCEC32FC5DC08951C6AEA3774340,ELEC,Heavenly Mountain Resort - Tesla,3860 Saddle Rd,,,530-542-6900  877-798-3752,E,,Public,"24 hours daily; for Tesla use only",,,,,,1,,,Tesla,http://www.teslamotors.com/supercharger,09/02/2015,68980,2015-09-02 02:45:03+00,P,,,05/01/2015,,,,,TESLA,"3860 Saddle Rd
South Lake Tahoe, CA 96150",38.9346827,-119.9406082,1400000US06017031600,32476
17108,0101000020E6100000D757B2BE5CFC5DC0847357C04E7A4340,ELEC,Grand Residences by Marriott - Tesla,1001 Heavenly Village Way,,,530-542-8400  877-798-3752,E,,Public,"24 hours daily; for Tesla use only; for guest use only; see valet for access",,,,,,1,,,Tesla,http://www.teslamotors.com/supercharger,09/02/2015,68977,2015-09-02 02:46:09+00,P,,,02/01/2015,,,,,TESLA,"1001 Heavenly Village Way
South Lake Tahoe, CA 96150",38.9555283,-119.9431607,1400000US06017031600,32476
11568,0101000020E61000005BDBCA0171FC5DC055E46B2AE67A4340,ELEC,Basecamp Hotel,4143 Cedar Ave,,,530-208-0180  877-798-3752,E,,Public,"24 hours daily; for guest use only; see front desk for access",,,,,,3,,,Tesla,http://www.teslamotors.com/supercharger,09/02/2015,68908,2015-09-02 02:43:04+00,P,,,04/01/2015,,,,,TESLA J1772,"4143 Cedar Ave
South Lake Tahoe, CA 96150",38.9601491,-119.9443974,1400000US06017031600,32476
22107,0101000020E6100000C5B1892796825EC0B7CAB84EC81F4340,ELEC,Solano County - County Administration Center Parking Structure,675 Texas St,,,707-784-6335,E,,Public,24 hours daily,,,,,,4,,,,,05/05/2015,52737,2015-05-05 11:55:45+00,LG,,,07/23/2013,,,,,J1772,"675 Texas St
Fairfield, CA 94533",38.2483004,-122.0404147,1400000US06095252502,32589
20331,0101000020E610000017940E7BC6825EC0D6DA45E22F204340,ELEC,Fairfield City Hall,1000 Webster St,,,707-428-7414,E,,Public,24 hours daily,,,,,,2,,,,,05/05/2015,27328,2015-05-05 11:44:40+00,LG,,,08/27/2012,,,,,J1772,"1000 Webster St
Fairfield, CA 94533",38.2514613,-122.0433643,1400000US06095252502,32589
20908,0101000020E6100000770481DF50465DC0C26DC89AEC534040,ELEC,SOUTH BAY VW,3131 National City Blvd,VW_422580_A,,888-758-4389,E,,Public,24 hours daily,,,,,,2,,,ChargePoint Network,http://www.mychargepoint.net/,10/09/2015,65937,2015-10-09 08:26:16+00,,,,,,,,,J1772,"3131 National City Blvd
National City, CA 91950",32.6556581,-117.0986861,1400000US06073011602,32679
2840,0101000020E61000003E682C50C19C5DC0E652019C831A4140,ELEC,Los Angeles County - Mid-Valley Comprehensive Health Center,7515 Van Nuys Blvd,Parking structure ground Floor,,213-972-7211  323-267-2023,E,,Public,"6am-6pm M-F; keypad activated, instructions on EVSE",,,,,,5,,,,,06/02/2015,67306,2015-06-02 18:07:17+00,LG,,,04/01/2015,,,,,J1772,"7515 Van Nuys Blvd
Van Nuys, CA 91405",34.2071414,-118.4492989,1400000US06037127220,32721
15475,0101000020E6100000FFD0CC936B935DC0C939B187F6F64040,ELEC,SOUTHWEST CLG,S Denker Ave,"GARAGE 8 UNIT 3
GARAGE 8 UNIT 4; Charger is located in Garage 8, Parking Rates Apply. Garage is closed from 10PM - 6AM
GARAGE 8 UNIT 2
GARAGE 8 UNIT 5; Charger is located in Garage 8, Parking Rates Apply. Garage is closed from 10PM - 6AM
GARAGE 8 UNIT 1; Charger is located in Garage 8, Parking Rates Apply. Garage is closed from 10PM - 6AM
GARAGE 8 UNIT 6; Charger is located in Garage 8, Parking Rates Apply. Garage is closed from 10PM - 6AM",,888-758-4389,E,,Public,24 hours daily,,,,,6,6,,,ChargePoint Network,http://www.mychargepoint.net/,10/09/2015,51658,2015-10-09 08:14:42+00,,,,,,,,,NEMA520 J1772,"S Denker Ave
Los Angeles, CA 90047",33.9293985,-118.303441,1400000US06037602801,32865
13530,0101000020E6100000D030105F816F5DC0868CECEF11084140,ELEC,EVSP WALGREENS,495 E Holt Ave,"STORE 7230; The station is located near the entrance",,888-758-4389,E,,Public,24 hours daily,,,,,,1,,,ChargePoint Network,http://www.mychargepoint.net/,10/09/2015,50737,2015-10-09 07:42:58+00,,,,,,,,,J1772,"495 E Holt Ave
Pomona, CA 91767",34.0630474,-117.7422712,1400000US06037408800,32931
12966,0101000020E61000005245F12A6B445DC05A48C0E8F2624040,ELEC,SDSU Lot G,5500 Campanile Dr,"East side of College Ave, south of I-8 
& PS 1. Parking Pass required: N side 
PS 6 approx 300ft E. Level 2 chargers 
reserved for Car2Go, DCFC available 
publicly.

East side of College Ave, south of I-8 
& PS 1. Parking Pass required: N side 
PS 6 approx 300ft E. Level 2 chargers 
reserved for Car2Go, DCFC available 
publicly.

East side of College Ave, south of I-8 
& PS 1. Parking Pass required: N side 
PS 6 approx 300ft E. Level 2 chargers 
reserved for Car2Go, DCFC available 
publicly.

East side of College Ave, south of I-8 
& PS 1. Parking Pass required: N side 
PS 6 approx 300ft E. Level 2 chargers 
reserved for Car2Go, DCFC available 
publicly.

East side of College Ave, south of I-8 
& PS 1. Parking Pass required: N side 
PS 6 approx 300ft E. Level 2 chargers 
reserved for Car2Go, DCFC available 
publicly.
",,888-998-2546,E,,Public,MON: 24 hours | TUE: 24 hours | WED: 24 hours | THU: 24 hours | FRI: 24 hours | SAT: 24 hours | SUN: 24 hours,,,,,,5,,,Blink Network,http://www.blinknetwork.com/,10/09/2015,50961,2015-10-09 07:12:25+00,,,,,,,,,J1772,"5500 Campanile Dr
San Diego, CA 92182",32.773038,-117.069041,1400000US06073002904,32961
1087,0101000020E6100000395E81E849445DC03BAA9A20EA624040,ELEC,San Diego State University - Parking Structure 6,5500 Campanile,"Located on ground level, south side on 
the outside wall of the parking 
structure.

Located on ground level, south side on 
the outside wall of the parking 
structure.

Located on ground level, south side on 
the outside wall of the parking 
structure.
",,888-998-2546,E,,Public,MON: 24 hours | TUE: 24 hours | WED: 24 hours | THU: 24 hours | FRI: 24 hours | SAT: 24 hours | SUN: 24 hours,,,,,,3,,,Blink Network,http://www.blinknetwork.com/,10/09/2015,48835,2015-10-09 07:12:52+00,,,,,,,,,J1772,"5500 Campanile
San Diego, CA 92182",32.77277,-117.067011,1400000US06073002904,32961
15506,0101000020E61000004B3ACAC16C445DC0C1A90F24EF624040,ELEC,DCFC - SDSU Lot G,5500 Campanile Dr,"East side of College Ave, south of I-8 
& PS 1. Parking Pass required: N side 
PS 6 approx 300ft E. DCFC available 
publicly.
",,888-998-2546,E,,Public,MON: 24 hours | TUE: 24 hours | WED: 24 hours | THU: 24 hours | FRI: 24 hours | SAT: 24 hours | SUN: 24 hours,,,,,,,2,,Blink Network,http://www.blinknetwork.com/,10/09/2015,55434,2015-10-09 07:13:26+00,,,,,,,,,CHADEMO,"5500 Campanile Dr
San Diego, CA 92182",32.772923,-117.069138,1400000US06073002904,32961
14611,0101000020E6100000C539EAE8B8435DC06B0F7BA180634040,ELEC,STERLING APTS,6625 Alvarado Rd,"STERLING APTS 1; -",,888-758-4389,E,,Public,24 hours daily,,,,,,1,,,ChargePoint Network,http://www.mychargepoint.net/,10/09/2015,65579,2015-10-09 08:16:53+00,,,,,,,,,J1772,"6625 Alvarado Rd
San Diego, CA 92120",32.777363,-117.058161,1400000US06073002904,32961
14514,0101000020E6100000711E4E603A445DC0F88C446804634040,ELEC,San Diego State University - Child Center,5500 Campanile,,,888-998-2546,E,,Private,MON: 24 hours | TUE: 24 hours | WED: 24 hours | THU: 24 hours | FRI: 24 hours | SAT: 24 hours | SUN: 24 hours,,,,,,2,,,Blink Network,http://www.blinknetwork.com/,10/09/2015,48832,2015-10-09 07:12:52+00,,,,,,,,,J1772,"5500 Campanile
San Diego, CA 92182",32.773572,-117.066063,1400000US06073002904,32961
7902,0101000020E6100000503AEC199D455DC0505CE91093504040,ELEC,Macy's #71-546 - Broadway Ave -  Chula Vista CA,555 Broadway Avenue,,,888-998-2546,E,,Public,MON: 24 hours | TUE: 24 hours | WED: 24 hours | THU: 24 hours | FRI: 24 hours | SAT: 24 hours | SUN: 24 hours,,,,,,2,,,Blink Network,http://www.blinknetwork.com/,10/09/2015,43461,2015-10-09 07:08:37+00,,,,,,,,,J1772,"555 Broadway Avenue
Chula Vista, CA 91910",32.6294881,-117.0877137,1400000US06073012700,33028
801,0101000020E61000005649641F64595EC07A4A73D0CA504340,ELEC,Maita's Nissan of Sacramento,2820 Auburn Blvd,,,916-488-5400,E,,Public - Call ahead,Dealership business hours,,,,,,1,1,,,,07/08/2015,39929,2015-07-08 14:24:57+00,P,,,03/15/2011,,,,,J1772 CHADEMO,"2820 Auburn Blvd
Sacramento, CA 95821",38.6311894,-121.396736,1400000US06067006101,33051
11293,0101000020E61000005649641F64595EC07A4A73D0CA504340,ELEC,Maita's Nissan of Sacramento,2820 Auburn Blvd,,,916-488-5400,E,,Private,,,,,,,1,,,,,07/08/2015,48166,2015-07-08 14:24:57+00,P,,,03/15/2011,,,,,J1772,"2820 Auburn Blvd
Sacramento, CA 95821",38.6311894,-121.396736,1400000US06067006101,33051
16612,0101000020E6100000CB845FEAE7925DC0DA1D520C900C4140,ELEC,Kaiser Permanente - LA Med Ctr.,4867 Sunset Blvd,,,888-998-2546,E,,Public,MON: 24 hours | TUE: 24 hours | WED: 24 hours | THU: 24 hours | FRI: 24 hours | SAT: 24 hours | SUN: 24 hours,,,,,,2,,,Blink Network,http://www.blinknetwork.com/,10/09/2015,21394,2015-10-09 07:09:27+00,,,,,,,,,J1772,"4867 Sunset Blvd
Los Angeles, CA 90017",34.098146,-118.295405,1400000US06037191201,33056
8880,0101000020E61000002F89B322EA5D5EC034620BE654494340,ELEC,Sutter Galleria Mall - University of California - Davis Extension,2901 K St,,,916-327-7072,E,,Public,"24 hours daily; pay lot; visitor and student use only",,,,,1,2,,,,,07/08/2015,25494,2015-07-08 14:55:02+00,P,,,05/30/2004,,,,,NEMA520 J1772,"2901 K St
Sacramento, CA 95816",38.5729034,-121.4674155,1400000US06067001400,33058
16211,0101000020E61000007349D57613955DC03EB324404D0B4140,ELEC,6300 STATION 1,6300 Romaine St,"TV CENTER; Located in the Television Center parking lot, ground level",,888-758-4389,E,,Public,24 hours daily,,,,,,2,,,ChargePoint Network,http://www.mychargepoint.net/,10/09/2015,63272,2015-10-09 07:47:04+00,,,,,,,,,J1772,"6300 Romaine St
Los Angeles, CA 90038",34.088295,-118.329313,1400000US06037191810,33106
12316,0101000020E6100000B7B3AF3C48905DC06116DA39CD104140,ELEC,NEW CENTURY VW,1220 S Brand Blvd,VW_422595,,888-758-4389,E,,Public,24 hours daily,,,,,,2,,,ChargePoint Network,http://www.mychargepoint.net/,10/09/2015,70152,2015-10-09 08:24:54+00,,,,,,,,,J1772,"1220 S Brand Blvd
Glendale, CA 91205",34.131263,-118.254409,1400000US06037302505,33125
3927,0101000020E6100000392BFDDF6CCB5DC02B2FF99FFC1D4140,ELEC,Esplanade Shopping Center,195 W. Esplanade Dr,,,877-455-3833,E,,Public - Card key at all times,"24 hours daily; EVgo network subscription and key fob required",,,,,,1,2,,eVgo Network,https://www.evgonetwork.com/,10/09/2015,69754,2015-10-09 08:49:58+00,,,,,,,,,CHADEMO J1772,"195 W. Esplanade Dr
Oxnard, CA 93036",34.234272,-119.1785202,1400000US06111003012,33194
6079,0101000020E61000009B9548FD50955DC0F945AE40990C4140,ELEC,Tops Auto Park Garage,6565 Sunset Blvd,,,323-462-6727,E,,Public,24 hours daily,,,,,,2,,,,,05/05/2015,66933,2015-05-05 11:44:53+00,P,,,01/15/2012,,,,,J1772,"6565 Sunset Blvd
Hollywood, CA 90028",34.0984269,-118.3330682,1400000US06037190700,33203
14523,0101000020E610000075F16DB0A68B5EC03D06D09442B74240,ELEC,STANFORD,360 Oak Rd,"STATION 1 PS-5; Located in the northwest corner on Level 1 in this garage at 360 Oak Road, Stanford CA, 94305
STATION 3 PS-5; This Station is in the northwest corner on the first level of the garage.
STATION 2 PS-5; Located in the northwest corner on Level 1 in this garage at 360 Oak Road, Stanford CA, 94305",,888-758-4389,E,,Public,24 hours daily,,,,,,6,,,ChargePoint Network,http://www.mychargepoint.net/,10/09/2015,41332,2015-10-09 07:54:35+00,,,,,,,,,J1772,"360 Oak Rd
Stanford, CA 94305",37.4317194,-122.1820489,1400000US06085511608,33269
13106,0101000020E6100000013BEDDFAB8B5EC03E060A404CB74240,ELEC,Stanford University,360 Oak Rd,Parking Structure 5,,650-723-9362,E,,Public,"24 hours daily; permit required 6am-4pm M-F",,,,,,,,1 SP Inductive,,,05/05/2015,33539,2015-05-05 11:51:33+00,P,,,11/15/2008,,,,,,"360 Oak Rd
Stanford, CA 94305",37.43201447,-122.1823654,1400000US06085511608,33269
11823,0101000020E610000054A9D9032D8D5DC08651B5824BFA4040,ELEC,South Gate City Hall,8650 California Ave,,,323-563-5785,E,,Public,24 hours daily,,,,,,1,,,,,07/08/2015,51961,2015-07-08 15:02:15+00,LG,,,03/21/2013,,,,,J1772,"8650 California Ave
South Gate, CA 90280",33.9554294,-118.2058725,1400000US06037535702,33342
3720,0101000020E61000000AE0C1AA556E5DC0B672E5A210084140,ELEC,Southern California Edison - Pomona Service Center,265 SE End Ave,,,800-438-4636,E,,Private,Employee use only,,,,,,4,,2 SP Inductive,,,05/05/2015,1592,2015-05-05 11:54:08+00,T,,,10/15/1996,,,,,J1772,"265 SE End Ave
Pomona, CA 91767",34.0630077,-117.7239787,1400000US06037402702,33408
9366,0101000020E6100000DD9A745BA25F5EC042F5C594FE474340,ELEC,EVSP WALGREENS,1401 Broadway,STORE 6613,,888-758-4389,E,,Public,24 hours daily,,,,,,1,,,ChargePoint Network,http://www.mychargepoint.net/,10/09/2015,43213,2015-10-09 07:43:12+00,,,,,,,,,J1772,"1401 Broadway
Sacramento, CA 95818",38.5624567,-121.4942845,1400000US06067002000,33578
7461,0101000020E6100000978FA4A4875F5EC0A46DFC89CA484340,ELEC,California Air Resources Board,1900 14th St,,,916-322-3309,E,,Public,24 hours daily,,,,,,2,,,,,05/05/2015,51234,2015-05-05 11:51:43+00,SG,,,02/21/2013,,,,,J1772,"1900 14th St
Sacramento, CA 95811",38.568681,-121.492654,1400000US06067002000,33578
19272,0101000020E610000096760F75C4495DC04C55DAE21A5B4040,ELEC,UDR,310 Market St,"13TH MARKET - 1; -",,888-758-4389,E,,Public,24 hours daily,,,,,,2,,,ChargePoint Network,http://www.mychargepoint.net/,10/09/2015,55763,2015-10-09 07:54:30+00,,,,,,,,,J1772,"310 Market St
San Diego, CA 92101",32.711758,-117.1526158,1400000US06073005200,33673
8251,0101000020E610000056D4601A86495DC09E0B23BDA85B4040,ELEC,City College - Parking Structure - 2nd Floor,1060 16th St,,,888-998-2546,E,,Public,MON: 6:00am-11:00pm | TUE: 6:00am-11:00pm | WED: 6:00am-11:00pm | THU: 6:00am-11:00pm | FRI: 6:00am-5:00pm,,,,,,6,,,Blink Network,http://www.blinknetwork.com/,10/09/2015,46481,2015-10-09 07:11:35+00,,,,,,,,,J1772,"1060 16th St
San Diego, CA 92101",32.716087,-117.14881,1400000US06073005200,33673
9876,0101000020E61000007E4B4A8BC4495DC080D82D5D1C5B4040,ELEC,UDR,613-23 13th St,"13TH MARKET - 2; -",,888-758-4389,E,,Public,24 hours daily,,,,,,2,,,ChargePoint Network,http://www.mychargepoint.net/,10/09/2015,55762,2015-10-09 07:54:29+00,,,,,,,,,J1772,"613-23 13th St
San Diego, CA 92101",32.7118031,-117.1526211,1400000US06073005200,33673
2374,0101000020E6100000FF8469CEB09C5DC0B57C6EB257254140,ELEC,Sylmar Metrolink Station,2100 Frank Modugno Dr,,,818-237-7641,E,,Public,24 hours daily,,,,,,2,,,,,05/05/2015,21414,2015-05-05 11:51:12+00,P,,,01/31/2002,,,,,J1772,"2100 Frank Modugno Dr
San Fernando, CA 91342",34.2917388,-118.4482914,1400000US06037320201,33791
6463,0101000020E6100000A01A2FDD241E5DC023BE13B35EE44040,ELEC,Palm Springs Nissan,68177 Kyle Rd,,,760-328-2828,E,,Public - Call ahead,Dealership business hours,,,,,,1,,,,,07/08/2015,39874,2015-07-08 14:26:04+00,P,,,03/15/2011,,,,,J1772,"68177 Kyle Rd
Cathedral City, CA 92234",33.78414,-116.471,1400000US06065045000,33801
18299,0101000020E6100000A01A2FDD241E5DC023BE13B35EE44040,ELEC,Palm Springs Nissan,68177 Kyle Rd,,,760-328-2828,E,,Private,,,,,,,1,,,,,07/08/2015,47594,2015-07-08 14:26:04+00,P,,,03/15/2011,,,,,J1772,"68177 Kyle Rd
Cathedral City, CA 92234",33.78414,-116.471,1400000US06065045000,33801
10827,0101000020E6100000B891B245D21D5DC02BBF0CC688E44040,ELEC,Southern California Edison - Palm Springs Service Center,36100 Cathedral Canyon Dr,,,,E,,Private,,,,,,,,,3 SP Inductive,,,04/03/2015,27316,2015-04-03 17:10:31+00,T,,,07/15/2005,,,,,,"36100 Cathedral Canyon Dr
Cathedral City, CA 92234",33.785424,-116.465959,1400000US06065045000,33801
20962,0101000020E6100000601F9DBAF2875DC090792E9D205A4140,ELEC,Los Angeles County - High Desert Regional Health Center,335 E Ave I,Located in employee parking,,323-881-3919,E,,Public,"Business hours; use buzzer to summon security for access to parking lot",,,,,,4,,,,,06/02/2015,63046,2015-06-02 18:19:50+00,LG,,,08/01/2014,,,,,J1772,"335 E Ave I
Lancaster, CA 93535",34.7041203,-118.12419,1400000US06037900602,33895
14941,0101000020E610000076A0F3BF01485EC041672D605D1B4240,ELEC,HARTNELLCOLLEGE,117 N 2nd St,KING CITY,,888-758-4389,E,,Public,24 hours daily,,,,,1,1,,,ChargePoint Network,http://www.mychargepoint.net/,10/09/2015,49331,2015-10-09 08:16:25+00,,,,,,,,,NEMA520 J1772,"117 N 2nd St
King City, CA 93930",36.2137871,-121.1251068,1400000US06053011302,34006
5305,0101000020E6100000B26323102F485EC099CCC2E8031C4240,ELEC,MOCO AG COMM,522 N Second Street,"522 N 2ND ST 01; Agricultural Commissioner's South County Office, available 7:00 am - 4:00 pm",,888-758-4389,E,,Public,24 hours daily,,,,,1,1,,,ChargePoint Network,http://www.mychargepoint.net/,10/09/2015,62858,2015-10-09 08:14:43+00,,,,,,,,,NEMA520 J1772,"522 N Second Street
King City, CA 93930",36.2188693,-121.1278725,1400000US06053011302,34006
2603,0101000020E6100000207AF76C429A5EC0418F62CAD1E44240,ELEC,BMW GROUP,433 Mason St,"433 MASON #6
433 MASON #3
433 MASON #1",,888-758-4389,E,,Public,24 hours daily,,,,,,3,,,ChargePoint Network,http://www.mychargepoint.net/,10/09/2015,48696,2015-10-09 08:16:17+00,,,,,,,,,J1772,"433 Mason St
San Francisco, CA 94102",37.7876523,-122.4103043,1400000US06075012302,34189
6896,0101000020E61000000DDC2681F28A5EC0BBAEA93D36B64240,ELEC,STANFORD,526-566 Stanford UniversityLagunita Dr,"STATION 1 TMU; This station is on Lagunita Drive across from Tresidder Memorial Union",,888-758-4389,E,,Public,24 hours daily,,,,,,2,,,ChargePoint Network,http://www.mychargepoint.net/,10/09/2015,66428,2015-10-09 07:54:36+00,,,,,,,,,J1772,"526-566 Stanford UniversityLagunita Dr
Stanford, CA 94305",37.4235303,-122.1710513,1400000US06085513000,34434
12814,0101000020E61000001E447C71F38A5EC00E09298936B64240,ELEC,STANFORD,526-566 Lagunita Dr,"STATION 2 TMU; Located across Lagunita Drive from Tresidder Memorial Union",,888-758-4389,E,,Public,24 hours daily,,,,,,2,,,ChargePoint Network,http://www.mychargepoint.net/,10/09/2015,66549,2015-10-09 07:54:35+00,,,,,,,,,J1772,"526-566 Lagunita Dr
Stanford, CA 94305",37.4235393,-122.1711086,1400000US06085513000,34434
19307,0101000020E61000001148D3EA758A5EC0CA1C26755DB74240,ELEC,STANFORD,295 Galvez St,"TH WALL MOUNT; This Station is located in front of the Stanford Athletics Shop in L-95 Track House Lot
TH STATION 1; This Station is located in front of the Stanford Athletics Shop in L-95 Track House Lot",,888-758-4389,E,,Public,24 hours daily,,,,,,4,,,ChargePoint Network,http://www.mychargepoint.net/,10/09/2015,41432,2015-10-09 07:54:36+00,,,,,,,,,J1772,"295 Galvez St
Stanford, CA 94305",37.4325396,-122.1634471,1400000US06085513000,34434
3906,0101000020E6100000036A204CC0955EC00C25EE0CAEFA4240,ELEC,"Walgreens - San Pablo, CA #2435",13751 San Pablo Avenue,,,800-663-5633,E,,Public - Card key at all times,"MO: Not Specified; TU: Not Specified; WE: Not Specified; TH: Not Specified; FR: Not Specified; SA: Not Specified; SU: Not Specified",,,,,,1,,,SemaCharge Network,http://www.semacharge.com/,10/09/2015,43825,2015-10-09 07:36:24+00,,,,,,,,,J1772,"13751 San Pablo Avenue
San Pablo, CA 94806",37.9584366,-122.3398619,1400000US06013369001,34619
13697,0101000020E610000016EA9F96D5955EC045E33F93B3FA4240,ELEC,CITY HALL,13831 San Pablo Avenue,"CITYHALLOT; In front of Lot 
CITYHALLOT02; In front of Lot ",,888-758-4389,E,,Public,24 hours daily,,,,,,2,,,ChargePoint Network,http://www.mychargepoint.net/,10/09/2015,60588,2015-10-09 08:21:58+00,,,,,,,,,J1772,"13831 San Pablo Avenue
San Pablo, CA 94806",37.9586052,-122.3411614,1400000US06013369001,34619
21556,0101000020E610000001310917F2885DC0FA0CA837A3544140,ELEC,NRG eVgo - Kaiser Permanente,615 W Ave,,,877-455-3833,E,,Public - Card key at all times,"24 hours daily; eVgo network subscription and key fob required",,,,,,6,,,eVgo Network,https://www.evgonetwork.com/,07/08/2015,67927,2015-07-08 15:14:45+00,P,,,04/01/2015,,,,,J1772,"615 W Ave
Lancaster, CA 93534",34.661231,-118.139776,1400000US06037900704,34622
8343,0101000020E610000027F911BF62895DC0E4816D69DA554140,ELEC,PARRIS LAW,43364 10th St W,EV STATION,,888-758-4389,E,,Public,24 hours daily,,,,,,2,,,ChargePoint Network,http://www.mychargepoint.net/,10/09/2015,52293,2015-10-09 08:18:17+00,,,,,,,,,J1772,"43364 10th St W
Lancaster, CA 93534",34.6707279,-118.146652,1400000US06037900704,34622
15791,0101000020E6100000FB84A22F73895DC0127E4EE6C4524140,ELEC,Southern California Edison - Antelope Valley Service Center,42060 10th St W,,,,E,,Private,,,,,,,,,2 SP Inductive,,,04/03/2015,27304,2015-04-03 17:10:33+00,T,,,07/15/2005,,,,,,"42060 10th St W
Lancaster, CA 93539",34.6466339,-118.1476554,1400000US06037900704,34622
20667,0101000020E6100000134F2CA688985DC0DF066B52C0194140,ELEC,Burger King,11546 Sherman Way,Located near the Home Depot,,818-392-7903,E,,Public,24 hours daily,,,,,,1,,,,,01/06/2015,60805,2015-05-29 17:46:58+00,P,,,01/15/2013,,,,,J1772,"11546 Sherman Way
North Hollywood, CA 91605",34.2011817,-118.3833404,1400000US06037122420,34630
6401,0101000020E61000007DB08C0DDD1B5EC0014D840D4F774140,ELEC,Rabobank - Santa Maria,1554 S Broadway St,,,805-922-6951,E,,Public,24 hours daily,,,,,,1,,,,,05/05/2015,35994,2015-05-05 11:51:24+00,P,,,12/15/2009,,,,,J1772,"1554 S Broadway St
Santa Maria, CA 93454",34.9321,-120.435367,1400000US06083002103,34667
17599,0101000020E6100000EB025E66D81A5EC0B64B1B0E4B774140,ELEC,Santa Maria Ford,1035 E Battles Rd,,,805-925-2445,E,,Public,Dealership business hours,,,,,,2,,,,,05/05/2015,53920,2015-05-05 11:55:42+00,P,,,11/01/2013,,,,,J1772,"1035 E Battles Rd
Santa Maria, CA 93454",34.931978,-120.419458,1400000US06083002103,34667
16791,0101000020E61000000068DEBB17EA5DC031EC3026FD284240,ELEC,Keller Motors,700 W Cadillac Ln,,,559-582-1000,E,,Private,Service center use only,,,,,,1,,,,,08/04/2015,68385,2015-08-04 13:08:56+00,P,,,04/01/2015,,,,,J1772,"700 W Cadillac Ln
Hanford, CA 93230",36.3202255,-119.6576986,1400000US06031001002,34676
21115,0101000020E6100000CC9717601F535DC020C0F93FCD0A4140,ELEC,Inland Center Mall,500 Inland Center Dr,,,877-455-3833,E,,Public - Card key at all times,"24 hours daily; EVgo network subscription and key fob required",,,,,,1,2,,eVgo Network,https://www.evgonetwork.com/,10/09/2015,69360,2015-10-09 08:50:49+00,,,,,,,,,CHADEMO J1772,"500 Inland Center Dr
San Bernardino, CA 92408",34.08438873,-117.29879,1400000US06071012400,34760
20740,0101000020E61000003ABEAC3FF8525DC0D81A00602B094140,ELEC,SAN BERNARDINO,1600 Cam Real,VW_422184_A,,888-758-4389,E,,Public,24 hours daily,,,,,,2,,,ChargePoint Network,http://www.mychargepoint.net/,10/09/2015,64743,2015-10-09 08:26:50+00,,,,,,,,,J1772,"1600 Cam Real
San Bernardino, CA 92408",34.0716362,-117.2964019,1400000US06071012400,34760
19251,0101000020E6100000A2ED98BA2B535DC09E21C1F979094140,ELEC,Toyota of San Bernardino,765 Show Case Dr N,,,888-473-1611,E,,Public,Dealership business hours,,,,,,1,,,,,06/02/2015,53913,2015-06-02 17:41:24+00,P,,,11/01/2013,,,,,J1772,"765 Show Case Dr N
San Bernardino, CA 92408",34.0740349,-117.299544,1400000US06071012400,34760
21445,0101000020E6100000508D976E12535DC05DC5E23785094140,ELEC,Nissan of San Bernardino,735 Show Case Dr S,,,909-885-3883,E,,Public - Call ahead,Dealership business hours,,,,,,1,1,,,,07/08/2015,39931,2015-07-08 14:45:20+00,P,,,03/15/2011,,,,,J1772 CHADEMO,"735 Show Case Dr S
San Bernardino, CA 92408",34.074378,-117.298,1400000US06071012400,34760
21673,0101000020E6100000508D976E12535DC05DC5E23785094140,ELEC,Nissan of San Bernardino,735 Show Case Dr S,,,909-885-3883,E,,Private,,,,,,,1,,,,,07/08/2015,48168,2015-07-08 14:45:20+00,P,,,03/15/2011,,,,,J1772,"735 Show Case Dr S
San Bernardino, CA 92408",34.074378,-117.298,1400000US06071012400,34760
773,0101000020E610000099A322A9E0995EC0C852358B61E54240,ELEC,Saint Mary's Square Garage,433 Kearny St,"At Pine St, Level 4",,415-956-8106,E,,Public,"24 hours daily; pay lot",,,,,,,,1 SP Inductive,,,06/02/2015,21354,2015-06-02 18:34:25+00,LG,,,01/31/2002,,,,,,"433 Kearny St
San Francisco, CA 94104",37.7920393,-122.4043372,1400000US06075011700,34914
22464,0101000020E610000089C1B28897995EC0DD29786572E54240,ELEC,345 California Center - Parking Garage - Tesla,115 Battery St,,,415-434-7743  877-798-3752,E,,Public,"Garage business hours; for Tesla use only; see valet for access",,,,,,1,,,Tesla,http://www.teslamotors.com/supercharger,09/02/2015,68891,2015-09-02 02:42:41+00,P,,,03/01/2015,,,,,TESLA,"115 Battery St
San Francisco, CA 94111",37.7925536,-122.3998739,1400000US06075011700,34914
16248,0101000020E610000081632A58BE995EC01586127706E54240,ELEC,BRACKET,1 Montgomery St,"PMC2; Stations are in underground parking; entrance off of Sutter.
PMC1; Stations are in underground parking; entrance off of Sutter.",,888-758-4389,E,,Public,24 hours daily,,,,,2,2,,,ChargePoint Network,http://www.mychargepoint.net/,10/09/2015,38927,2015-10-09 08:04:04+00,,,,,,,,,NEMA520 J1772,"1 Montgomery St
San Francisco, CA 94104",37.7892598,-122.4022427,1400000US06075011700,34914
3722,0101000020E610000010751F80D4995EC0AFCE31207BE54240,ELEC,CARCHARGING,550 California St,"ACE PARKING #15; See Valet Attendant ",,888-758-4389,E,,Public,24 hours daily,,,,,,1,,,ChargePoint Network,http://www.mychargepoint.net/,10/09/2015,49569,2015-10-09 07:55:39+00,,,,,,,,,J1772,"550 California St
San Francisco, CA 94104",37.79282,-122.403595,1400000US06075011700,34914
16244,0101000020E6100000F296AB1F9B995EC04CE0D6DD3CE54240,ELEC,Tishman Speyer,1 Bush Street,"The hours of operation is: -  - Monday 
to Friday - 4:00 am to 8:00 pm - 
Weekend & Holidays - Closed

The hours of operation is: -  - Monday 
to Friday - 4:00 am to 8:00 pm - 
Weekend & Holidays - Closed
",,888-998-2546,E,,Private,MON: 24 hours | TUE: 24 hours | WED: 24 hours | THU: 24 hours | FRI: 24 hours | SAT: 24 hours | SUN: 24 hours,,,,,,2,,,Blink Network,http://www.blinknetwork.com/,10/09/2015,65110,2015-10-09 07:13:13+00,,,,,,,,,J1772,"1 Bush Street
San Francisco, CA 94104",37.79092,-122.400093,1400000US06075011700,34914
20028,0101000020E61000008D1315600E9A5EC0F299EC9FA7E44240,ELEC,CCSF-SFMTA,123 O'Farrell St,"ELLIS O'FARRELL; Enter on Ellis Street - Lower Level Entrance - Lev B1       ",,888-758-4389,E,,Public,24 hours daily,,,,,1,1,,,ChargePoint Network,http://www.mychargepoint.net/,10/09/2015,41339,2015-10-09 08:09:11+00,,,,,,,,,NEMA520 J1772,"123 O'Farrell St
San Francisco, CA 94102",37.7863655,-122.4071274,1400000US06075011700,34914
8748,0101000020E6100000296E26F098995EC010FD7F4177E54240,ELEC,345 CAL EVCS,123 Battery St,"345 CALIFORNIA; Enter Garage on right side of Battery St, just before Papyrus",,888-758-4389,E,,Public,24 hours daily,,,,,,2,,,ChargePoint Network,http://www.mychargepoint.net/,10/09/2015,55734,2015-10-09 07:54:19+00,,,,,,,,,J1772,"123 Battery St
San Francisco, CA 94111",37.7927019,-122.3999596,1400000US06075011700,34914
14154,0101000020E6100000B54D96FFB5995EC0F65C4B6D4EE54240,ELEC,BMW GROUP,220 Bush St,"MILLS BLDG 02; Valet Parking Required, Parking Fees Apply",,888-758-4389,E,,Public,24 hours daily,,,,,,1,,,ChargePoint Network,http://www.mychargepoint.net/,10/09/2015,66524,2015-10-09 08:16:20+00,,,,,,,,,J1772,"220 Bush St
San Francisco, CA 94104",37.7914559,-122.4017333,1400000US06075011700,34914
7818,0101000020E6100000355EBA490C9A5EC0DAE1AFC91AE54240,ELEC,Sutter Stockton Garage,444 Stockton St,At Sutter Street,,415-982-7275,E,,Public,"Garage business hours; pay lot",,,,,,,,1 SP Inductive,,,05/05/2015,21355,2015-05-05 11:55:17+00,LG,,,01/31/2002,,,,,,"444 Stockton St
San Francisco, CA 94108",37.78988,-122.407,1400000US06075011700,34914
13001,0101000020E61000009FD1B1DE039A5EC0020D36751EE54240,ELEC,CCSF-SFMTA,444 Stockton St,"SUTTERSTOCKTON2; Public Parking Sutter and Stockton Lobbies - Parking Rates A
SUTTER STOCKTON; Public Parking Sutter and Stockton Lobbies - Parking Rates A
SUTTERSTOCKTON3; Public Parking Sutter and Stockton Lobbies - Parking Rates A
SUTTER 6; Public Parking Sutter and Stockton G-1st Floor - Parking Rates Apply
SUTTER 4; Public Parking Sutter and Stockton G-1st Floor - Parking Rates Apply
SUTTER 3; Public Parking Sutter and Stockton G-1st Floor - Parking Rates Apply
SUTTER 5; Public Parking Sutter and Stockton G-1st Floor - Parking Rates Apply",,888-758-4389,E,,Public,24 hours daily,,,,,7,7,,,ChargePoint Network,http://www.mychargepoint.net/,10/09/2015,46477,2015-10-09 08:09:13+00,,,,,,,,,NEMA520 J1772,"444 Stockton St
San Francisco, CA 94108",37.789992,-122.4064862,1400000US06075011700,34914
12827,0101000020E6100000C09BC992149A5EC0ADD804BDDCE44240,ELEC,CCSF-SFMTA,333 Post St,"UNION SQUARE 2; Public Parking Union Square Level G2-2A - Parking Rates Apply
UNION SQUARE 3; Public Parking Union Square G2-2A 1st Floor - Parking Rates Apply
UNION SQUARE 4; Public Parking Union Square Level G2-2A - Parking Rates Apply
UNION SQUARE 1; Public Parking Union Square Level G2-2A - Parking Rates Apply",,888-758-4389,E,,Public,24 hours daily,,,,,4,4,,,ChargePoint Network,http://www.mychargepoint.net/,10/09/2015,50061,2015-10-09 08:16:06+00,,,,,,,,,NEMA520 J1772,"333 Post St
San Francisco, CA 94108",37.7879864,-122.4075057,1400000US06075011700,34914
5387,0101000020E61000002B06FEA6E6995EC05B62C0ED64E54240,ELEC,CCSF-SFMTA,433 Kearny St,"ST. MARY'S SQ 3; On the left against the wall
ST. MARY'S SQ 2; On the left against the wall
ST. MARY'S SQ 1; To the left against the wall",,888-758-4389,E,,Public,24 hours daily,,,,,3,3,,,ChargePoint Network,http://www.mychargepoint.net/,10/09/2015,51064,2015-10-09 08:14:51+00,,,,,,,,,NEMA520 J1772,"433 Kearny St
San Francisco, CA 94108",37.7921426,-122.4047029,1400000US06075011700,34914
11351,0101000020E61000005254EC1E0F9A5EC00C9BB7A0ADE44240,ELEC,Ellis O'Farrell Garage,123 O'Farrell St,At Powell Street,,415-986-4800,E,,Public,"24 hours daily; pay lot",,,,,,,,1 SP Inductive,,,05/05/2015,21367,2015-05-05 11:54:39+00,LG,,,01/31/2002,,,,,,"123 O'Farrell St
San Francisco, CA 94102",37.7865487,-122.4071729,1400000US06075011700,34914
18036,0101000020E610000064D1CF2FA5995EC09C82A1B371E54240,ELEC,Loews Regency San Francisco - Tesla,222 Sansome St,,,415-276-9888  877-798-3752,E,,Public,"24 hours daily; for Tesla use only; for guest use only; see valet for access",,,,,,1,,,Tesla,http://www.teslamotors.com/supercharger,,70324,2015-10-08 18:33:17+00,P,,,08/01/2015,,,,,TESLA,"222 Sansome St
San Francisco, CA 94104",37.7925324,-122.4007072,1400000US06075011700,34914
14624,0101000020E6100000DE4724C09F995EC01A38FB5E9EE54240,ELEC,Battery Street Garage,275 Battery St,4th floor of parking garage,,415-981-9435,E,,Public,"Restricted to garage hours; pay lot",,,,,4,2,,,,,03/04/2015,65679,2015-03-04 01:14:22+00,P,,,04/15/2014,,,,,NEMA515 J1772,"275 Battery St
San Francisco, CA 94102",37.7938956,-122.4003754,1400000US06075011700,34914
125,0101000020E610000016681C8FBE935DC0D410B0B1A6E84040,ELEC,EVSP WALGREENS,22930 Western Ave,"STORE 7481; The station is located left of the store's entrance",,888-758-4389,E,,Public,24 hours daily,,,,,,1,,,ChargePoint Network,http://www.mychargepoint.net/,10/09/2015,69139,2015-10-09 07:42:56+00,,,,,,,,,J1772,"22930 Western Ave
Torrance, CA 90501",33.8175871,-118.3085058,1400000US06037293202,34967
19543,0101000020E6100000DFF8DA334B5F5EC005F060D56A494340,ELEC,DGS MAIN,1421 15th St,1430 STATION 3,,888-758-4389,E,,Public,24 hours daily,,,,,,1,,,ChargePoint Network,http://www.mychargepoint.net/,10/09/2015,62338,2015-10-09 07:41:01+00,,,,,,,,,J1772,"1421 15th St
Sacramento, CA 95814",38.5735728,-121.488965,1400000US06067001200,35000
8796,0101000020E6100000293630035F5F5EC0D674988AE8484340,ELEC,R Street Parking Plaza,1515 R St,Located on the 4th floor by the catwalk,,916-497-0111,E,,Public,24 hours daily,,,,,,2,,,,,07/08/2015,68001,2015-07-08 15:17:51+00,P,,,06/16/2015,,,,,J1772,"1515 R St
Sacramento, CA 95811",38.5695966,-121.4901741,1400000US06067001200,35000
21254,0101000020E61000001D210379765F5EC08DD5E6FF55494340,ELEC,DGS MAIN,1517 13th St,"LOT 14 STATION2
LOT 14 STATION8; -
LOT 14 STATION4; -
LOT 14 STATION1
LOT 14 STATION5; -
LOT 14 STATION7; -
LOT 14 STATION6; -
LOT 14 STATION3",,888-758-4389,E,,Public,24 hours daily,,,,,,8,,,ChargePoint Network,http://www.mychargepoint.net/,10/09/2015,62351,2015-10-09 07:40:49+00,,,,,,,,,J1772,"1517 13th St
Sacramento, CA 95814",38.572937,-121.491606,1400000US06067001200,35000
17785,0101000020E610000028092EFB1A5F5EC0046CAC6983494340,ELEC,DGS MAIN,1616 Capitol Ave,"1616 STATION 3; -
1616 STATION 2
1616 STATION 1
1616 STATION 4; -",,888-758-4389,E,,Public,24 hours daily,,,,,,4,,,ChargePoint Network,http://www.mychargepoint.net/,10/09/2015,62326,2015-10-09 07:40:59+00,,,,,,,,,J1772,"1616 Capitol Ave
Sacramento, CA 95822",38.5743229,-121.4860218,1400000US06067001200,35000
11663,0101000020E610000085A4051E4E5F5EC03C5A8B0574494340,ELEC,DGS MAIN,1430 N St.,"1430 STATION 4; -
1430 STATION 7
1430 STATION 6
1430 STATION 5
1430 STATION 2
1430 STATION 1; -",,888-758-4389,E,,Public,24 hours daily,,,,,,6,,,ChargePoint Network,http://www.mychargepoint.net/,10/09/2015,51939,2015-10-09 07:41:06+00,,,,,,,,,J1772,"1430 N St.
Sacramento, CA 95814",38.5738532,-121.4891429,1400000US06067001200,35000
16053,0101000020E61000008542041C425E5EC0513239B533484340,ELEC,Sacramento Natural Foods Co-Op,2815 S St,,,916-455-2667,E,,Public,24 hours daily,,,,,,1,,,,,10/06/2015,70068,2015-10-06 22:03:00+00,P,,,07/01/2015,,,,,J1772,"2815 S St
Sacramento, CA 95816",38.564078,-121.472785,1400000US06067001900,35147
16190,0101000020E6100000736E6EA788D55DC09CB4BAE69F154240,ELEC,City of Tulare,3981 S K St,,,559-685-2300,E,,Public,24 hours daily,,,,,,1,,,,,08/04/2015,68406,2015-08-04 13:08:51+00,P,,,04/01/2015,,,,,J1772,"3981 S K St
Tulare, CA 93274",36.1689423,-119.3364657,1400000US06107003100,35175
19631,0101000020E6100000BB511A20879B5DC0FC8E02C0081C4140,ELEC,Kaiser Permanente,13652 Cantara st,,,877-455-3833,E,,Public - Card key at all times,"24 hours daily; EVgo network subscription and key fob required",,,,,,4,,,eVgo Network,https://www.evgonetwork.com/,10/09/2015,69252,2015-10-09 08:48:08+00,,,,,,,,,J1772,"13652 Cantara st
Panorama City, CA 91402",34.21901703,-118.4301224,1400000US06037120400,35408
17565,0101000020E6100000BB511A20879B5DC0FC8E02C0081C4140,ELEC,Kaiser Permanente,13652 Cantara st.,,,877-455-3833,E,,Public - Card key at all times,"24 hours daily; EVgo network subscription and key fob required",,,,,,4,,,eVgo Network,https://www.evgonetwork.com/,10/09/2015,69261,2015-10-09 08:48:19+00,,,,,,,,,J1772,"13652 Cantara st.
Panorama City, CA 91402",34.21901703,-118.4301224,1400000US06037120400,35408
10813,0101000020E61000005DDC4603789B5DC000C63368E81B4140,ELEC,Kaiser Permanete - Panorama City Med Ctr,13651 Willard street,,,888-998-2546,E,,Public,MON: 24 hours | TUE: 24 hours | WED: 24 hours | THU: 24 hours | FRI: 24 hours | SAT: 24 hours | SUN: 24 hours,,,,,,2,,,Blink Network,http://www.blinknetwork.com/,10/09/2015,50950,2015-10-09 07:12:01+00,,,,,,,,,J1772,"13651 Willard street
Panorama City, CA 91402",34.21803,-118.4292,1400000US06037120400,35408
12534,0101000020E6100000BB511A20879B5DC0FC8E02C0081C4140,ELEC,Kaiser Permanente,13652 Cantara st,,,877-455-3833,E,,Public - Card key at all times,"24 hours daily; EVgo network subscription and key fob required",,,,,,2,,,eVgo Network,https://www.evgonetwork.com/,10/09/2015,69262,2015-10-09 08:48:21+00,,,,,,,,,J1772,"13652 Cantara st
Panorama City, CA 91402",34.21901703,-118.4301224,1400000US06037120400,35408
18413,0101000020E61000003E271829EF185DC04434BA83D8DD4040,ELEC,PD,43-500 Monterey Ave,"C.O.D.; S/B on Monterey Ave, turn left into college campus, go around round about and turn right into first parking lot entrance",,888-758-4389,E,,Public,24 hours daily,,,,,,2,,,ChargePoint Network,http://www.mychargepoint.net/,10/09/2015,66717,2015-10-09 08:26:25+00,,,,,,,,,J1772,"43-500 Monterey Ave
Palm Desert, CA 92260",33.73317,-116.3895972,1400000US06065045118,35446
2768,0101000020E61000004FCFBBB120195DC0521BE61599DC4040,ELEC,PD,72840 Hwy 111,"WESTFIELD WEST; S/B on Town Center Way enter at intersection and drive to 1st drive isle under structure
WESTFIELD EAST; S/B on Monterey Ave. turn right into center and drive to 1st drive aisle under structure",,888-758-4389,E,,Public,24 hours daily,,,,,,4,,,ChargePoint Network,http://www.mychargepoint.net/,10/09/2015,64978,2015-10-09 08:26:24+00,,,,,,,,,J1772,"72840 Hwy 111
Palm Desert, CA 92260",33.7234218,-116.3926205,1400000US06065045118,35446
9944,0101000020E61000008716D9CEF7935DC005C078060D0D4140,ELEC,Hollywood Rent-A-Car,5619 Hollywood Blvd,,,,E,,Private,,,,,,,1,,,,,05/05/2015,48827,2015-05-05 11:54:31+00,P,,,07/15/2012,,,,,J1772,"5619 Hollywood Blvd
Hollywood, CA 90028",34.10196,-118.312,1400000US06037190301,35507
5214,0101000020E610000068D59DDD10ED5DC0BB534B8457364140,ELEC,CITY OF SB EV2,1221 Anacapa St,"STATION 1
STATION 2",,888-758-4389,E,,Public,24 hours daily,,,,,2,2,,,ChargePoint Network,http://www.mychargepoint.net/,10/09/2015,47356,2015-10-09 07:50:35+00,,,,,,,,,NEMA520 J1772,"1221 Anacapa St
Santa Barbara, CA 93101",34.4245458,-119.7041544,1400000US06083000900,35528
1682,0101000020E61000004D80064001ED5DC03DDF05007D364140,ELEC,Santa Barbara County Building,105 E. Anapamu St.,,,877-455-3833,E,,Public - Card key at all times,"24 hours daily; EVgo network subscription and key fob required",,,,,,,1,,eVgo Network,https://www.evgonetwork.com/,10/09/2015,69548,2015-10-09 08:54:37+00,,,,,,,,,CHADEMO,"105 E. Anapamu St.
Santa Barbara, CA 93101",34.4256897,-119.7032013,1400000US06083000900,35528
21207,0101000020E6100000FD9FC37CF9EC5DC08B8FAA8141364140,ELEC,CITY OF SB EV2,1115 Anacapa St,"STATION 3
STATION 4",,888-758-4389,E,,Public,24 hours daily,,,,,2,2,,,ChargePoint Network,http://www.mychargepoint.net/,10/09/2015,21557,2015-10-09 07:50:35+00,,,,,,,,,NEMA520 J1772,"1115 Anacapa St
Santa Barbara, CA 93101",34.4238741,-119.7027275,1400000US06083000900,35528
5273,0101000020E6100000D4997B48F8EC5DC011C30E63D2354140,ELEC,The Canary Hotel - Tesla,31 W Carillo St,,,877-468-3515  877-798-3752,E,,Public,"24 hours daily; for Tesla use only; for guest use only; see valet for access",,,,,,2,,,Tesla,http://www.teslamotors.com/supercharger,,70400,2015-10-09 20:36:19+00,P,,,08/01/2015,,,,,TESLA,"31 W Carillo St
Santa Barbara, CA 93101",34.420483,-119.702654,1400000US06083000900,35528
6099,0101000020E6100000276893C327EC5DC0569E40D829364140,ELEC,SB MTD,550 Olive St,"STAFF PARKING; Guest Parking Spot Staff Parking Lot",,888-758-4389,E,,Public,24 hours daily,,,,,1,1,,,ChargePoint Network,http://www.mychargepoint.net/,10/09/2015,53405,2015-10-09 07:54:33+00,,,,,,,,,NEMA520 J1772,"550 Olive St
Santa Barbara, CA 93101",34.423152,-119.689927,1400000US06083000900,35528
17825,0101000020E61000004A80F513A9925DC01B2E724F57FB4040,ELEC,Department of Children & Family Services,8300 S Vermont Ave,Located in the parking structure,,323-267-2023,P,09/01/2015 12:00:00 AM,PLANNED - not yet accessible (Public),"6am-6pm M-F; keypad activated, instructions on EVSE",,,,,,16,,,,,06/02/2015,67308,2015-09-23 13:11:08+00,LG,,,,,,,,J1772,"8300 S Vermont Ave
Los Angeles, CA 90044",33.963602,-118.2915697,1400000US06037238200,35563
4908,0101000020E6100000907F0B57AC925DC07AC784F304FB4040,ELEC,City of Los Angeles - Constituent Service Center,8475 S Vermont Ave,,,213-485-7616,E,,Public,24 hours daily,,,,,,,,1 SP Inductive,,,07/08/2015,21405,2015-07-08 15:07:39+00,P,,,01/31/2002,,,,,,"8475 S Vermont Ave
Los Angeles, CA 90044",33.9610886,-118.2917688,1400000US06037238200,35563
5699,0101000020E610000074345882D6985DC0B44B659B65184140,ELEC,CARL'S JR.,6601 Lankershim Blvd,"#1
#4
#3",,888-758-4389,E,,Public,24 hours daily,,,,,,3,,,ChargePoint Network,http://www.mychargepoint.net/,10/09/2015,61636,2015-10-09 07:51:55+00,,,,,,,,,J1772,"6601 Lankershim Blvd
Los Angeles, CA 91606",34.1906008,-118.3880926,1400000US06037123203,35648
2464,0101000020E6100000C86361E3D59D5DC06FFDAA121B1E4140,ELEC,EVSP WALGREENS,15316 Nordhoff St,STORE 7950,,888-758-4389,E,,Public,24 hours daily,,,,,,1,,,ChargePoint Network,http://www.mychargepoint.net/,10/09/2015,68995,2015-10-09 07:43:00+00,,,,,,,,,J1772,"15316 Nordhoff St
Los Angeles, CA 91343",34.2352012,-118.4661797,1400000US06037117510,35714
20389,0101000020E61000007B336ABE4A455DC0EB7420EBA9514040,ELEC,City of Chula Vista - Parkway Community Center & Gym,373 Park Way,,,888-998-2546,E,,Public,MON: 24 hours | TUE: 24 hours | WED: 24 hours | THU: 24 hours | FRI: 24 hours | SAT: 24 hours | SUN: 24 hours,,,,,,7,,,Blink Network,http://www.blinknetwork.com/,10/09/2015,51773,2015-10-09 07:14:01+00,,,,,,,,,J1772,"373 Park Way
Chula Vista, CA 91910",32.637998,-117.082687,1400000US06073012302,35729
17940,0101000020E6100000C5C6BC8E38455DC087BDF50604524040,ELEC,City of Chula Vista - Towne Center Parking Structure,340 F Street,"Unit is located behind a Marie 
Calendars and in front of a 2 story 
parking garage.

Unit is located behind a Marie 
Calendars and in front of a 2 story 
parking garage.

Unit is located behind a Marie 
Calendars and in front of a 2 story 
parking garage.

Unit is located behind a Marie 
Calendars and in front of a 2 story 
parking garage.

Unit is located behind a Marie 
Calendars and in front of a 2 story 
parking garage.

Unit is located behind a Marie 
Calendars and in front of a 2 story 
parking garage.

Unit is located behind a Marie 
Calendars and in front of a 2 story 
parking garage.
",,888-998-2546,E,,Public,MON: 24 hours | TUE: 24 hours | WED: 24 hours | THU: 24 hours | FRI: 24 hours | SAT: 24 hours | SUN: 24 hours,,,,,,6,2,,Blink Network,http://www.blinknetwork.com/,10/09/2015,61857,2015-10-09 07:11:36+00,,,,,,,,,CHADEMO J1772,"340 F Street
Chula Vista, CA 91910",32.6407479,-117.081577,1400000US06073012302,35729
21184,0101000020E6100000941051F1248B5DC0B6EC5A8CCB884140,ELEC,Anthony's Grill - Tesla,16940 California 14,,,877-798-3752,E,,Public,"24 hours daily; Tesla use only",,,,,,,6,,Tesla,http://www.teslamotors.com/supercharger,05/05/2015,66808,2015-05-05 11:41:33+00,P,,,04/01/2015,,,,,TESLA,"16940 California 14
Mojave, CA 93501",35.0687118,-118.1741298,1400000US06029005900,35970
15572,0101000020E6100000C51D6FF2DB8F5DC01BA6118EB40D4140,ELEC,MARSH PARK,2944 Gleneden St,"MARSH PARK SNGL; Adjacent to Pavilion and Restroom Buildings
MARSH PARK DUAL; Adjacent to Park Pavilion and Restroom Buildings",,888-758-4389,E,,Public,24 hours daily,,,,,,3,,,ChargePoint Network,http://www.mychargepoint.net/,10/09/2015,65501,2015-10-09 07:46:12+00,,,,,,,,,J1772,"2944 Gleneden St
Los Angeles, CA 90039",34.1070726,-118.2477995,1400000US06037187200,35987
9323,0101000020E61000002BA62D092B1F5DC08AD46AFE4EF94040,ELEC,Two Bunch Palms Resort & Spa - Tesla,67425 Two Bunch Palms Trail,,,760-329-8791  877-798-3752,E,,Public,"24 hours daily; for Tesla use only; for guest use only; see front desk for access",,,,,,2,,,Tesla,http://www.teslamotors.com/supercharger,,70424,2015-10-09 20:45:17+00,P,,,08/01/2015,,,,,TESLA,"67425 Two Bunch Palms Trail
Desert Hot Springs, CA 92240",33.9477232,-116.4870017,1400000US06065044516,36001
8140,0101000020E6100000DFA815A6EF4C5DC07008556AF6904040,ELEC,High Tech High,1420 W. San Marcos Blvd,,,888-998-2546,E,,Private,MON: 24 hours | TUE: 24 hours | WED: 24 hours | THU: 24 hours | FRI: 24 hours | SAT: 24 hours | SUN: 24 hours,,,,,,3,,,Blink Network,http://www.blinknetwork.com/,10/09/2015,51520,2015-10-09 07:11:01+00,,,,,,,,,J1772,"1420 W. San Marcos Blvd
San Marcos, CA 92078",33.13252,-117.202127,1400000US06073020029,36034
18108,0101000020E610000064CDC82077CB5DC07AFB73D190194140,ELEC,City of Oxnard - Downtown Parking ,324 S B St,,,805-385-7871,E,,Public,Garage business hours,,,,,,1,,,,,10/06/2015,70057,2015-10-06 22:11:52+00,LG,,,04/11/2013,,,,,J1772,"324 S B St
Oxnard, CA 93030",34.199732,-119.179146,1400000US06111008700,36061
2203,0101000020E6100000A94E07B29EF25EC00874266DAAD64340,ELEC,Westport - Union Landing State Beach,Westport Union Landing SB,,,,P,09/01/2016 12:00:00 AM,PLANNED - not yet accessible (Public),,,,,,,2,,,,,10/06/2015,70022,2015-10-06 21:57:57+00,SG,,,,,,,,J1772,"Westport Union Landing SB
Westport, CA 95488",39.677076,-123.790936,1400000US06045010200,36089
11735,0101000020E61000002B8716D94ECA5DC083482B63E8174140,ELEC,SERVICEBLDG1,1400 Vanguard Dr,1400 VANGUARD,,888-758-4389,E,,Public,24 hours daily,,,,,,2,,,ChargePoint Network,http://www.mychargepoint.net/,10/09/2015,69854,2015-10-09 07:40:44+00,,,,,,,,,J1772,"1400 Vanguard Dr
Oxnard, CA 93033",34.1867794,-119.1610625,1400000US06111009100,36214
17719,0101000020E61000006C921FF12BCB5DC0F9F36DC152194140,ELEC,City of Oxnard - Transit Center Parking,255 E Fifth St,,,805-385-7871,E,,Public,24 hours daily,,,,,,2,,,,,10/06/2015,70056,2015-10-06 21:33:34+00,LG,,,04/11/2013,,,,,J1772,"255 E Fifth St
Oxnard, CA 93030",34.197838,-119.174557,1400000US06111009100,36214
7382,0101000020E6100000DC291DACFF565DC0EB025E66D8FC4040,ELEC,McDonald's Riverside,2242 University Avenue,,,888-998-2546,E,,Public,MON: 24 hours | TUE: 24 hours | WED: 24 hours | THU: 24 hours | FRI: 24 hours | SAT: 24 hours | SUN: 24 hours,,,,,,1,,,Blink Network,http://www.blinknetwork.com/,10/09/2015,51230,2015-10-09 07:09:36+00,,,,,,,,,J1772,"2242 University Avenue
Riverside, CA 92507",33.975354,-117.359355,1400000US06065030502,36218
7078,0101000020E610000091ED7C3F35825DC06FF59CF4BE094140,ELEC,El Monte Metrolink,10925 Railroad St,,,800-371-5465,E,,Public,24 hours daily,,,,,,2,,,,,05/05/2015,49117,2015-05-05 11:55:05+00,P,,,08/17/2012,,,,,J1772,"10925 Railroad St
El Monte, CA 91731",34.07614,-118.0345,1400000US06037432700,36228
10880,0101000020E61000006939D0436D895DC00F0D8B51D7124140,ELEC,City of Pasadena - Holly Street Garage,150 E Holly St,,,626-744-7665,E,,Public,"Garage business hours; pay lot",,,,,,8,,3 SP Inductive,,,05/05/2015,6505,2015-05-05 11:59:21+00,LG,,,08/30/1997,,,,,J1772,"150 E Holly St
Pasadena, CA 91103",34.147196,-118.147294,1400000US06037461902,36250
10581,0101000020E61000008C1EAE8B11895DC0C43AFA04F5124140,ELEC,City of Pasadena - Plaza Las Fuentes,135 N Los Robles Ave,,,626-744-7665,E,,Public,"24 hours daily; pay lot",,,,,,2,,1 SP Inductive,,,05/05/2015,50154,2015-05-05 11:59:22+00,LG,,,11/27/2012,,,,,J1772,"135 N Los Robles Ave
Pasadena, CA 91101",34.1481024,-118.1416959,1400000US06037461902,36250
16668,0101000020E610000072231BFE89895DC0B265F9BA0C134140,ELEC,City of Pasadena - Marriott Garage,171 N Raymond Ave,,,626-577-8963  626-744-7655,E,,Public,"24 hours daily; pay lot",,,,,,3,,,,,05/05/2015,53677,2015-05-05 11:57:38+00,LG,,,07/01/2013,,,,,J1772,"171 N Raymond Ave
Pasadena, CA 91103",34.148826,-118.1490474,1400000US06037461902,36250
19710,0101000020E6100000B56E83DA6F905DC01762F54718FE4040,ELEC,Extra Space Storage,6033 S Central Ave,,,323-521-1849,E,,Public,24 hours daily,,,,,,1,,,,,07/08/2015,64774,2015-07-08 15:02:30+00,T,,,09/01/2014,,,,,J1772,"6033 S Central Ave
Los Angeles, CA 90001",33.985116,-118.256827,1400000US06037239202,36302
20427,0101000020E610000035400EEF5E7E5DC0DC604D0A98E84040,ELEC,EVSP WALGREENS,2560 W Ball Rd,"STORE 10629; The station is left of the store's entrance",,888-758-4389,E,,Public,24 hours daily,,,,,,1,,,ChargePoint Network,http://www.mychargepoint.net/,10/09/2015,44408,2015-10-09 07:43:05+00,,,,,,,,,J1772,"2560 W Ball Rd
Anaheim, CA 92804",33.8171399,-117.9745443,1400000US06059087806,36452
18552,0101000020E6100000AC1C5A643B6F5EC03D9B559FAB454340,ELEC,Davis Amtrak Station,840 2nd St,2nd & H St,,530-757-5685,E,,Public,24 hours daily,,,,,,2,,1 SP Inductive,,,06/02/2015,33556,2015-06-02 18:34:26+00,P,,,12/01/2008,,,,,J1772,"840 2nd St
Davis, CA 95616",38.5443,-121.738,1400000US06113010602,36613
14263,0101000020E6100000C6F4296CAB4C5DC05943F34AA3604040,ELEC,Old Town San Diego State Historic Park,4002 Wallace St,,,619-220-5422,P,12/31/2015 12:00:00 AM,PLANNED - not yet accessible (Public),Park business hours,,,,,,1,,,,,05/05/2015,63467,2015-05-05 11:52:13+00,P,,,,,,,,J1772,"4002 Wallace St
San Diego, CA 92110",32.7549833,-117.1979628,1400000US06073006500,36686
4939,0101000020E6100000827CBF87014D5DC0A04E1EBBB0604040,ELEC,Urban Corps San Diego County,3127 Jefferson Street,,,888-998-2546,E,,Public,"MON: 8:00am-5:00pm | TUE: 8:00am-5:00pm | WED: 8:00am-5:00pm, 8:00am-5:02pm | THU: 8:00am-5:00pm | FRI: 8:00am-5:00pm",,,,,,2,,,Blink Network,http://www.blinknetwork.com/,10/09/2015,46471,2015-10-09 07:12:46+00,,,,,,,,,J1772,"3127 Jefferson Street
San Diego, CA 92110",32.7553934,-117.2032184,1400000US06073006500,36686
4712,0101000020E61000005F402FDCB9905EC02E02637D03E94240,ELEC,Nissan of Oakland,2735 Broadway,,,510-588-2200,E,,Public - Call ahead,Dealership business hours,,,,,,1,1,,,,07/08/2015,46741,2015-07-08 14:52:32+00,P,,,01/31/2012,,,,,J1772 CHADEMO,"2735 Broadway
Oakland, CA 94611",37.820419,-122.261344,1400000US06001401300,36788
128,0101000020E61000005F402FDCB9905EC02E02637D03E94240,ELEC,Nissan of Oakland,2735 Broadway,,,510-588-2200,E,,Private,,,,,,,1,1,,,,07/08/2015,60337,2015-07-08 14:52:32+00,P,,,01/31/2012,,,,,J1772 CHADEMO,"2735 Broadway
Oakland, CA 94611",37.820419,-122.261344,1400000US06001401300,36788
9837,0101000020E61000009DD66D50FB905EC0915F3FC406E94240,ELEC,ALTABATESSUMMIT,435 Hawthorne Ave,"LEVEL 3-SOUTH; In parking garage on south side of 3rd floor
LEVEL B1-NORTH; In parking garage on north side of 1st Basement level
LEVEL L1-SOUTH; In parking garage on south side of 1st floor
LEVEL B2-NORTH; In parking garage on north side of 2nd Basement level
LEVEL 2-SOUTH; In parking garage on south side of 2nd floor
LEVEL L1-NORTH; In parking garage on north side of 1st floor
LEVEL 3-NORTH; In parking garage on north side of 3rd floor
LEVEL 4-NORTH; In parking garage on north side of 4th floor
LEVEL 2-NORTH; In parking garage on north side of 2nd floor
LEVEL B2-SOUTH; In parking garage on south side of 2nd Basement level
LEVEL 4-SOUTH; In parking garage on south side of 4th floor
LEVEL B1-SOUTH; In parking garage on south side of 1st Basement level",,888-758-4389,E,,Public,24 hours daily,,,,,,12,,,ChargePoint Network,http://www.mychargepoint.net/,10/09/2015,48971,2015-10-09 08:06:51+00,,,,,,,,,J1772,"435 Hawthorne Ave
Oakland, CA 94609",37.820519,-122.265339,1400000US06001401300,36788
1493,0101000020E61000005F402FDCB9905EC02E02637D03E94240,ELEC,Nissan of Oakland,2820 Broadway,,,,E,,Private,,,,,,,1,,,,,07/08/2015,46742,2015-07-08 15:18:58+00,P,,,02/14/2014,,,,,J1772,"2820 Broadway
Oakland, CA 94612",37.820419,-122.261344,1400000US06001401300,36788
20698,0101000020E6100000756671B504915EC06F4CAA1155E94240,ELEC,"Walgreens - Oakland, CA #3170",3400 Telegraph Ave,,,800-663-5633,E,,Public - Card key at all times,"MO: Not Specified; TU: Not Specified; WE: Not Specified; TH: Not Specified; FR: Not Specified; SA: Not Specified; SU: Not Specified",,,,,,1,,,SemaCharge Network,http://www.semacharge.com/,10/09/2015,43481,2015-10-09 07:36:23+00,,,,,,,,,J1772,"3400 Telegraph Ave
Oakland, CA 94609",37.8229086,-122.2659124,1400000US06001401300,36788
5500,0101000020E610000041BCAE5FB0825EC0E3DF675C38FA4240,ELEC,McDonald's,1691 Monument Blvd,,,888-998-2546,E,,Public,MON: 24 hours | TUE: 24 hours | WED: 24 hours | THU: 24 hours | FRI: 24 hours | SAT: 24 hours | SUN: 24 hours,,,,,,2,,,Blink Network,http://www.blinknetwork.com/,10/09/2015,67772,2015-10-09 07:10:54+00,,,,,,,,,J1772,"1691 Monument Blvd
Concord, CA 94520",37.954845,-122.042015,1400000US06013336202,36908
17232,0101000020E61000007B87DBA1E19A5EC097C1BDD7B5E24240,ELEC,CCSF-SFMTA,1660 Mission St,"1660 MISSION; In outdoor garage area between Mission and Otis",,888-758-4389,E,,Public,24 hours daily,,,,,1,1,,,ChargePoint Network,http://www.mychargepoint.net/,10/09/2015,50059,2015-10-09 08:16:47+00,,,,,,,,,NEMA520 J1772,"1660 Mission St
San Francisco, CA 94103",37.7711744,-122.4200215,1400000US06075020100,36951
4867,0101000020E610000039B9DFA128425DC01825E82FF4624040,ELEC,Bob Stall Chevrolet,7601 Alvarado Road,,,888-998-2546,E,,Public,MON: 24 hours | TUE: 24 hours | WED: 24 hours | THU: 24 hours | FRI: 24 hours | SAT: 24 hours | SUN: 24 hours,,,,,,4,,,Blink Network,http://www.blinknetwork.com/,10/09/2015,51777,2015-10-09 07:12:39+00,,,,,,,,,J1772,"7601 Alvarado Road
La Mesa, CA 91941",32.773077,-117.03373,1400000US06073014806,36991
15676,0101000020E6100000EEB1F4A10B205DC05ED0E748D3E54040,ELEC,Parker Palm Springs - Tesla,4200 E Palm Canyon Dr,,,760-770-5000  877-798-3752,E,,Public,"24 hours daily; for Tesla use only; for guest use only; see valet for access",,,,,,2,,,Tesla,http://www.teslamotors.com/supercharger,,70351,2015-10-08 18:38:48+00,P,,,06/01/2015,,,,,TESLA,"4200 E Palm Canyon Dr
Palm Springs, CA 92264",33.7955104,-116.50071,1400000US06065941000,37000
15231,0101000020E610000069835D5E4A205DC0931337B8BEE54040,ELEC,BMW PALM SPRING,3737 E Palm Canyon Dr,"STATION 01; Located on east side of building left of the service drive.",,888-758-4389,E,,Public,24 hours daily,,,,,,2,,,ChargePoint Network,http://www.mychargepoint.net/,10/09/2015,60420,2015-10-09 08:21:49+00,,,,,,,,,J1772,"3737 E Palm Canyon Dr
Palm Springs, CA 92264",33.7948828,-116.5045391,1400000US06065941000,37000
13967,0101000020E6100000A51309A69A8D5DC06687F8872D054140,ELEC,"Carl's Jr - 2320 E 4th St., Los Angeles",2320 E. 4th Street,,,888-998-2546,E,,Public,MON: 24 hours | TUE: 24 hours | WED: 24 hours | THU: 24 hours | FRI: 24 hours | SAT: 24 hours | SUN: 24 hours,,,,,,3,,,Blink Network,http://www.blinknetwork.com/,10/09/2015,61804,2015-10-09 07:11:34+00,,,,,,,,,J1772,"2320 E. 4th Street
Los Angeles, CA 90043",34.040452,-118.212564,1400000US06037204600,37113
15389,0101000020E6100000631B02910FEE5DC0954B3ED1D0614240,ELEC,Best Western Plus,1551 N Peach Ave,,,559-251-5200,E,,Public,"24 hours daily; complimentary for hotel guests",,,,,,2,,,,,05/05/2015,61814,2015-05-05 11:57:52+00,P,,,04/10/2014,,,,,J1772,"1551 N Peach Ave
Fresno, CA 93727",36.7641851,-119.7197001,1400000US06019002906,37117
10162,0101000020E6100000A6400BAE5E905DC0648B492476074140,ELEC,LADWP - Boylston,1141 W 2nd St,At Beaudry Ave,,,E,,Private - Government only,,,,,,,4,,,,,03/04/2015,33177,2015-03-04 14:23:00+00,LG,,,10/15/1999,,,,,J1772,"1141 W 2nd St
Los Angeles, CA 90026",34.0582929,-118.2557788,1400000US06037208000,37165
3346,0101000020E6100000D7BE805E38905DC0A6F4A7E8A3074140,ELEC,Canvas LA,138 N Beaudry Avenue,,,800-663-5633,E,,Public - Card key at all times,"MO: Not Specified; TU: Not Specified; WE: Not Specified; TH: Not Specified; FR: Not Specified; SA: Not Specified; SU: Not Specified",,,,,,2,,,SemaCharge Network,http://www.semacharge.com/,10/09/2015,66825,2015-10-09 07:37:05+00,,,,,,,,,J1772,"138 N Beaudry Avenue
Los Angeles, CA 90012",34.0596896,-118.2534405,1400000US06037208000,37165
8923,0101000020E61000003D2F70D4E58D5DC0F4F285DA800A4140,ELEC,LADWP - Lincoln Heights District,3101 Artesian St,Between W Ave 26 and W Ave 33,,,E,,Private - Government only,,,,,,,20,,,,,03/04/2015,33179,2015-03-04 15:19:36+00,LG,,,10/15/1999,,,,,J1772,"3101 Artesian St
Los Angeles, CA 90031",34.0820573,-118.2171527,1400000US06037199000,37281
20685,0101000020E610000009771D609C885EC041672D605D024340,ELEC,MARTINEZ CA,680 Court St,MAIN & COURT ST,,888-758-4389,E,,Public,24 hours daily,,,,,1,1,,,ChargePoint Network,http://www.mychargepoint.net/,10/09/2015,36347,2015-10-09 07:52:50+00,,,,,,,,,NEMA520 J1772,"680 Court St
Martinez, CA 94553",38.0184746,-122.1345444,1400000US06013316000,37321
21480,0101000020E6100000727B93F0CE885EC0F992D79475024340,ELEC,MARTINEZ CA,407 Estudillo St,"MTZ AMTRAK #1; -",,888-758-4389,E,,Public,24 hours daily,,,,,,2,,,ChargePoint Network,http://www.mychargepoint.net/,10/09/2015,40401,2015-10-09 07:52:50+00,,,,,,,,,J1772,"407 Estudillo St
Martinez, CA 94553",38.0192133,-122.1376306,1400000US06013316000,37321
13865,0101000020E6100000462575029A545DC0C2137AFD49424140,ELEC,Valley Hi Nissan,15722 Valley Park Ln,,,760-241-1700,E,,Public - Call ahead,Dealership business hours,,,,,,1,,,,,07/08/2015,39956,2015-07-08 14:27:23+00,P,,,03/15/2011,,,,,J1772,"15722 Valley Park Ln
Victorville, CA 92394",34.517883,-117.3219,1400000US06071009904,37419
11291,0101000020E6100000462575029A545DC0C2137AFD49424140,ELEC,Valley Hi Nissan,15722 Valley Park Ln,,,760-241-1700,E,,Private,,,,,,,1,,,,,07/08/2015,48068,2015-07-08 14:27:23+00,P,,,03/15/2011,,,,,J1772,"15722 Valley Park Ln
Victorville, CA 92394",34.517883,-117.3219,1400000US06071009904,37419
20678,0101000020E6100000F7E461A1D6545DC0D95BCAF962414140,ELEC,Mojave Desert Air Quality Management District,14306 Park Ave,,,760-245-1661,E,,Public,"24 hours daily; leave cell phone number visible on dashboard in case of emergency",,,,,,1,,,,,05/05/2015,49149,2015-05-05 11:43:56+00,P,,,02/01/2012,,,,,J1772,"14306 Park Ave
Victorville, CA 92392",34.510833,-117.3256,1400000US06071009904,37419
2020,0101000020E6100000CA0C65F297545DC0B537F8C264424140,ELEC,Valley Hi Honda,15710 Valley Park Ln,,,760-962-9600,E,,Public - Call ahead,Dealership business hours,,,,,,2,,,,,07/08/2015,60202,2015-07-08 14:20:59+00,P,,,12/31/2014,,,,,J1772,"15710 Valley Park Ln
Victorville, CA 92394",34.5187,-117.3217741,1400000US06071009904,37419
22167,0101000020E61000004626E0D7482A5EC0EC8A19E1EDA34140,ELEC,Union Bank,995 Higuera St,,,805-541-6100,E,,Public,24 hours daily,,,,,,,,1 LP Inductive  1 Avcon Conductive 520C,,,07/08/2015,21712,2015-07-08 14:54:29+00,P,,,08/15/2002,,,,,,"995 Higuera St
San Luis Obispo, CA 93401",35.280697,-120.660696,1400000US06079011101,37463
1670,0101000020E6100000355EBA490C2A5EC0D5CA845FEAA34140,ELEC,"Marcum, Copp, Barbieri DDS",1129 Pacific St,"From Pacific St, turn right into the lot.  Charger is in the back.",,805-541-8731,E,,Public,"24 hours daily; pay lot",,,,,,1,,,,,05/05/2015,48836,2015-05-05 11:51:18+00,P,,,07/01/2012,,,,,J1772,"1129 Pacific St
San Luis Obispo, CA 93401",35.28059,-120.657,1400000US06079011101,37463
1486,0101000020E6100000EBE2361AC06F5EC0C1E09A3BFA454340,ELEC,City of Davis - City Hall,23 Russell Blvd,,,530-757-5602,E,,Public,"24 hours daily; 2 hour maximum",,,,,,2,,,,,06/02/2015,49329,2015-06-02 18:17:04+00,LG,,,08/29/2012,,,,,J1772,"23 Russell Blvd
Davis, CA 95616",38.546699,-121.7461,1400000US06113010701,37578
470,0101000020E61000007A7E07F5636F5EC0AAE7EE84A8464340,ELEC,City of Davis - Parking Lot,826 H St,Located in the Amtrak parking lot,,530-757-5610,E,,Public,24 hours daily,,,,,,1,,,,,06/02/2015,64504,2015-06-02 17:43:36+00,LG,,,12/01/2013,,,,,J1772,"826 H St
Davis, CA 95616",38.5520178,-121.7404759,1400000US06113010701,37578
12804,0101000020E61000003A92CB7F486F5EC0D2C6116BF1454340,ELEC,4th and G Plaza Public Parking Garage,4th St & G St,Entrance on 4th St,,530-753-7730,E,,Public,24 hours daily,,,,,3,1,1,1 SP Inductive,,,05/05/2015,33555,2015-05-05 11:57:43+00,P,,,12/01/2008,,,,,NEMA520 J1772 TESLA,"4th St &amp; G St
Davis, CA 95616",38.54643,-121.7388,1400000US06113010701,37578
4073,0101000020E61000003BBE62B25D6F5EC033C8B83D9C454340,ELEC,City of Davis - Parking Lot,207 F St,Located between 2nd and 3rd streets.,,530-757-5610,E,,Public,24 hours daily,,,,,,1,,1 SP Inductive,,,06/02/2015,53372,2015-06-02 18:10:11+00,LG,,,03/06/2013,,,,,J1772,"207 F St
Davis, CA 95616",38.5438306,-121.7400938,1400000US06113010701,37578
6419,0101000020E6100000AE47E17A14885DC0D7BFEB3367F54040,ELEC,Kaiser Permanente - Downey,9449 East Imperial Highway,,,888-998-2546,E,,Public,MON: 24 hours | TUE: 24 hours | WED: 24 hours | THU: 24 hours | FRI: 24 hours | SAT: 24 hours | SUN: 24 hours,,,,,,4,,,Blink Network,http://www.blinknetwork.com/,10/09/2015,50935,2015-10-09 07:11:03+00,,,,,,,,,J1772,"9449 East Imperial Highway
Downey, CA 90242",33.917212,-118.12625,1400000US06037551101,37686
22427,0101000020E61000001EFEF565C4225DC05581FF52ABEB4040,ELEC,DESERT REGIONAL,486 E Mel Ave,"EL MIRADOR 01; Located on the southeast corner of Lot G",,888-758-4389,E,,Public,24 hours daily,,,,,1,1,,,ChargePoint Network,http://www.mychargepoint.net/,10/09/2015,63323,2015-10-09 07:54:25+00,,,,,,,,,NEMA520 J1772,"486 E Mel Ave
Palm Springs, CA 92262",33.8411659,-116.5432372,1400000US06065044602,37784
11375,0101000020E6100000E7AD15C8C7225DC08B0A8B40ABEB4040,ELEC,DESERT REGIONAL,398 E Mel Ave,"EL MIRADOR 02; Located on the southeast corner of Lot G, One Row West of Station # 1",,888-758-4389,E,,Public,24 hours daily,,,,,1,1,,,ChargePoint Network,http://www.mychargepoint.net/,10/09/2015,63322,2015-10-09 07:54:25+00,,,,,,,,,NEMA520 J1772,"398 E Mel Ave
Palm Springs, CA 92262",33.8411637,-116.5434437,1400000US06065044602,37784
5466,0101000020E61000001BF67B629D225DC060CAC0012DEB4040,ELEC,City of Palm Springs - Wellness Park,Tachevah & Via Miraleste,,,760-323-8214,E,,Public,24 hours daily,,,,,,1,,,,,10/06/2015,52612,2015-10-06 22:01:08+00,LG,,,09/01/2013,,,,,J1772,"Tachevah &amp; Via Miraleste
Palm Springs, CA 92262",33.837311,-116.540856,1400000US06065044602,37784
6081,0101000020E6100000B05582C5E1225DC0C4060B2769EA4040,ELEC,Colony Palms Hotel - Tesla,572 N Indian Canyon Dr,,,760-969-1800  877-798-3752,E,,Public,"24 hours daily; for Tesla use only; for guest use only; see front desk for access",,,,,,2,,,Tesla,http://www.teslamotors.com/supercharger,09/02/2015,68954,2015-09-02 02:45:46+00,P,,,04/01/2015,,,,,TESLA,"572 N Indian Canyon Dr
Palm Springs, CA 92262",33.831334,-116.54503,1400000US06065044602,37784
13736,0101000020E6100000E5B8533A587F5DC003999D45EFDA4040,ELEC,Surf City Nissan,17331 Beach Blvd,,,714-500-6000,E,,Private,,,,,,,1,,,,,07/08/2015,48195,2015-07-08 14:27:02+00,P,,,03/15/2011,,,,,J1772,"17331 Beach Blvd
Huntington Beach, CA 92647",33.710427,-117.98976,1400000US06059099402,37784
4002,0101000020E6100000E54526E0D7215DC009DE904605EC4040,ELEC,City of Palm Springs - Desert AIDS Project,1695 N Sunrise Way,,,760-323-8214,E,,Public,24 hours daily,,,,,,4,,,,,10/06/2015,52603,2015-10-06 22:01:02+00,LG,,,08/07/2013,,,,,J1772,"1695 N Sunrise Way
Palm Springs, CA 92262",33.843911,-116.528801,1400000US06065044602,37784
13663,0101000020E6100000E5B8533A587F5DC003999D45EFDA4040,ELEC,Surf City Nissan,17331 Beach Blvd,,,714-500-6000,E,,Public - Call ahead,Dealership business hours,,,,,,1,,,,,07/08/2015,39903,2015-07-08 14:27:02+00,P,,,03/15/2011,,,,,J1772,"17331 Beach Blvd
Huntington Beach, CA 92647",33.710427,-117.98976,1400000US06059099402,37784
1307,0101000020E61000007C2AA73D25455DC0718DCF64FF624040,ELEC,San Diego State University - Parking Structure 5,5500 Campanile,,,888-998-2546,E,,Private,MON: 24 hours | TUE: 24 hours | WED: 24 hours | THU: 24 hours | FRI: 24 hours | SAT: 24 hours | SUN: 24 hours,,,,,,5,,,Blink Network,http://www.blinknetwork.com/,10/09/2015,48834,2015-10-09 07:12:52+00,,,,,,,,,J1772,"5500 Campanile
San Diego, CA 92182",32.773419,-117.080398,1400000US06073002801,37788
16387,0101000020E61000003411363CBD445DC0F9A1D28899634040,ELEC,San Diego State University - Parking Structure 8,5500 Campanile,,,888-998-2546,E,,Public,MON: 24 hours | TUE: 24 hours | WED: 24 hours | THU: 24 hours | FRI: 24 hours | SAT: 24 hours | SUN: 24 hours,,,,,,2,,,Blink Network,http://www.blinknetwork.com/,10/09/2015,44976,2015-10-09 07:12:51+00,,,,,,,,,J1772,"5500 Campanile
San Diego, CA 92182",32.778123,-117.07405,1400000US06073002801,37788
21167,0101000020E610000031B2648EE5445DC0C5AD8218E8624040,ELEC,San Diego State University,5500 Campanile,,,888-998-2546,E,,Public,MON: 24 hours | TUE: 24 hours | WED: 24 hours | THU: 24 hours | FRI: 24 hours | SAT: 24 hours | SUN: 24 hours,,,,,,1,,,Blink Network,http://www.blinknetwork.com/,10/09/2015,49143,2015-10-09 07:14:02+00,,,,,,,,,J1772,"5500 Campanile
San Diego, CA 92182",32.772708,-117.076511,1400000US06073002801,37788
21634,0101000020E6100000BAF94674CF445DC034D593F947634040,ELEC,San Diego State University - Parking Structure 4,5500 Campanile,"L2 Units located on Level 1

L2 Units located on Level 1
",,888-998-2546,E,,Public,MON: 24 hours | TUE: 24 hours | WED: 24 hours | THU: 24 hours | FRI: 24 hours | SAT: 24 hours | SUN: 24 hours,,,,,,2,,,Blink Network,http://www.blinknetwork.com/,10/09/2015,48833,2015-10-09 07:12:52+00,,,,,,,,,J1772,"5500 Campanile
San Diego, CA 92182",32.775634,-117.075162,1400000US06073002801,37788
21317,0101000020E61000001C2444F982515DC0AA656B7D91084140,ELEC,550 HOSPITALITY,550 E Hospitality Ln,"550HOSPITALITY1; -
550HOSPITALITY2; -",,888-758-4389,E,,Public,24 hours daily,,,,,,4,,,ChargePoint Network,http://www.mychargepoint.net/,10/09/2015,66670,2015-10-09 07:45:44+00,,,,,,,,,J1772,"550 E Hospitality Ln
San Bernardino, CA 92408",34.06694,-117.273619,1400000US06071007200,37796
13558,0101000020E6100000C6A70018CF515DC06092CA1473084140,ELEC,7 Eleven,1935 S. Waterman Ave,,,888-998-2546,E,,Public,MON: 24 hours | TUE: 24 hours | WED: 24 hours | THU: 24 hours | FRI: 24 hours | SAT: 24 hours | SUN: 24 hours,,,,,,,2,,Blink Network,http://www.blinknetwork.com/,10/09/2015,65933,2015-10-09 07:12:58+00,,,,,,,,,CHADEMO,"1935 S. Waterman Ave
San Bernardino, CA 92408",34.066012,-117.278265,1400000US06071007200,37796
622,0101000020E61000001B4641F0F8425EC0DCB75A272E9E4340,ELEC,SIERRA COLLEGE,250 Sierra College Drive,"GRASS VALLEY 1
GRASS VALLEY 2",,888-758-4389,E,,Public,24 hours daily,,,,,,4,,,ChargePoint Network,http://www.mychargepoint.net/,10/09/2015,61490,2015-10-09 08:20:58+00,,,,,,,,,J1772,"250 Sierra College Drive
Grass Valley, CA 95945",39.2357835,-121.046444,1400000US06057000501,37888
6613,0101000020E61000008BB67416873E5DC0EA3823EFC1654040,ELEC,Mossy Nissan - El Cajon,1170 W Main St,,,619-588-0500,E,,Public - Call ahead,Dealership business hours,,,,,,1,,,,,07/08/2015,39886,2015-07-08 14:25:05+00,P,,,03/15/2011,,,,,J1772,"1170 W Main St
El Cajon, CA 92020",32.7949809,-116.9769951,1400000US06073016202,37923
21671,0101000020E61000000729780AB93D5DC030F5F3A622674040,ELEC,Macy's #71-552 - Parkway - El Cajon CA,291 Fletcher Pkwy.,"Located in the East lot entrance near 
Best Buy

Located in the East lot entrance near 
Best Buy
",,888-998-2546,E,,Public,MON: 24 hours | TUE: 24 hours | WED: 24 hours | THU: 24 hours | FRI: 24 hours | SAT: 24 hours | SUN: 24 hours,,,,,,2,,,Blink Network,http://www.blinknetwork.com/,10/09/2015,47606,2015-10-09 07:08:37+00,,,,,,,,,J1772,"291 Fletcher Pkwy.
El Cajon, CA 92020",32.805745,-116.964419,1400000US06073016202,37923
6949,0101000020E6100000DF32A7CB623E5DC05130630AD6664040,ELEC,Toyota of El Cajon,965 Arnele Ave,,,888-998-2546,E,,Public,MON: 24 hours | TUE: 24 hours | WED: 24 hours | THU: 24 hours | FRI: 24 hours | SAT: 24 hours | SUN: 24 hours,,,,,,1,,,Blink Network,http://www.blinknetwork.com/,10/09/2015,52086,2015-10-09 07:09:40+00,,,,,,,,,J1772,"965 Arnele Ave
El Cajon, CA 92020",32.803407,-116.97478,1400000US06073016202,37923
14904,0101000020E610000003EFE4D3633E5DC03DEFC682C2664040,ELEC,Toyota of El Cajon,965 Arnele Ave,,,619-440-0270,E,,Public - Call ahead,Dealership business hours,,,,,,2,,,,,10/06/2015,69977,2015-10-06 21:56:58+00,P,,,07/01/2015,,,,,J1772,"965 Arnele Ave
El Cajon, CA 92805",32.802811,-116.974843,1400000US06073016202,37923
12770,0101000020E61000008BB67416873E5DC0EA3823EFC1654040,ELEC,Mossy Nissan - El Cajon,1170 W Main St,,,619-588-0500,E,,Private,,,,,,,1,,,,,07/08/2015,47607,2015-07-08 14:25:05+00,P,,,03/15/2011,,,,,J1772,"1170 W Main St
El Cajon, CA 92020",32.7949809,-116.9769951,1400000US06073016202,37923
22209,0101000020E6100000145F48E240525EC09E3935E1A85F4340,ELEC,ROSEVILLE,405 Vernon Street,"CIVIC CENTER; Lower level of multi story parking garage near handicap parking ",,888-758-4389,E,,Public,24 hours daily,,,,,1,1,,,ChargePoint Network,http://www.mychargepoint.net/,10/09/2015,60941,2015-10-09 08:08:03+00,,,,,,,,,NEMA520 J1772,"405 Vernon Street
Roseville, CA 95678",38.7473413,-121.2852102,1400000US06061020901,37938
16310,0101000020E6100000A1A014ADDC0D5DC0D15966118ADB4040,ELEC,CNTYOFRIVERSIDE,83010 CA-111,82995 HWY 111,,888-758-4389,E,,Public,24 hours daily,,,,,,2,,,ChargePoint Network,http://www.mychargepoint.net/,10/09/2015,65338,2015-10-09 08:28:12+00,,,,,,,,,J1772,"83010 CA-111
Indio, CA 92201",33.715151,-116.216594,1400000US06065049500,38054
9330,0101000020E610000006C314400C795DC04FE2F75F7C094140,ELEC,West Covina/205 N Citrus St West Covina,205 N Citrus St West Covina,,,877-455-3833,E,,Public - Card key at all times,"24 hours daily; EVgo network subscription and key fob required",,,,,,,1,,eVgo Network,https://www.evgonetwork.com/,10/09/2015,69544,2015-10-09 08:54:33+00,,,,,,,,,CHADEMO,"205 N Citrus St West Covina
West Covina, CA 91791",34.07410812,-117.8913727,1400000US06037406200,38180
5916,0101000020E610000098EB23A6FA785DC0DFAEF25F7B094140,ELEC,West Covina Nissan,205 N Citrus St,,,626-732-1000,E,,Private,,,,,,,1,,,,,07/08/2015,48071,2015-07-08 14:27:20+00,P,,,03/15/2011,,,,,J1772,"205 N Citrus St
West Covina, CA 91791",34.0740776,-117.8902984,1400000US06037406200,38180
20182,0101000020E610000069119BD9F8795DC048FC8A355C094140,ELEC,Penske Mercedes-Benz of West Covina,1829 E Garvey Ave N,,,,E,,Private,,,,,,1,,,,,,08/04/2015,60232,2015-08-04 13:08:34+00,P,,,01/01/2014,,,,,NEMA520,"1829 E Garvey Ave N
West Covina, CA 91791",34.0731265,-117.9058136,1400000US06037406200,38180
6872,0101000020E610000098EB23A6FA785DC0DFAEF25F7B094140,ELEC,West Covina Nissan,205 N Citrus St,,,626-732-1000,E,,Public - Call ahead,Dealership business hours,,,,,,1,,,,,07/08/2015,39959,2015-07-08 14:27:20+00,P,,,03/15/2011,,,,,J1772,"205 N Citrus St
West Covina, CA 91791",34.0740776,-117.8902984,1400000US06037406200,38180
5145,0101000020E6100000DB5F877BF6755EC0EF4D78AE94E14340,ELEC,COURTESY BMW,2520 Cohasset Rd,STATION 01,,888-758-4389,E,,Public,24 hours daily,,,,,,2,,,ChargePoint Network,http://www.mychargepoint.net/,10/09/2015,61420,2015-10-09 08:21:17+00,,,,,,,,,J1772,"2520 Cohasset Rd
Chico, CA 95973",39.7623499,-121.8431691,1400000US06007000104,38203
22218,0101000020E6100000986E1283C09A5EC08FAA2688BAE34240,ELEC,San Francisco City Hall,1 Dr Carlton B Goodlet Pl,,,,E,,Private,Zipcar use only,,,,,1,1,,,,,06/02/2015,50060,2015-06-02 18:10:52+00,LG,,,08/15/2009,,,,,NEMA520 J1772,"1 Dr Carlton B Goodlet Pl
San Francisco, CA 94102",37.77913,-122.418,1400000US06075012402,38333
10705,0101000020E61000000585E6DFD39A5EC053AD2AA0F5E34240,ELEC,CCSF-SFMTA,525 Golden Gate Ave,"SFPUC HEADQTRS1; Parking Curbside-Parking Meter Time Limit & Rates Apply",,888-758-4389,E,,Public,24 hours daily,,,,,1,1,,,ChargePoint Network,http://www.mychargepoint.net/,10/09/2015,48172,2015-10-09 08:14:40+00,,,,,,,,,NEMA520 J1772,"525 Golden Gate Ave
San Francisco, CA 94102",37.7809334,-122.4191818,1400000US06075012402,38333
4100,0101000020E610000060AB048BC39A5EC08F17D2E121E44240,ELEC,Wilson Sonsini Goodrich & Rosati,650 Page Mill Rd,,,650-493-9300,E,,Public,"24 hours daily; see security to access",,,,,,2,,,,,05/05/2015,50949,2015-05-05 11:54:50+00,P,,,02/15/2013,,,,,J1772,"650 Page Mill Rd
Palo Alto, CA 94304",37.782284,-122.418185,1400000US06075012402,38333
15224,0101000020E6100000E03D5123BE9A5EC0AB425E6ADFE34240,ELEC,CCSF-SFMTA,355 McAllister St,"CIVIC CENTER 3; Public Parking Level 1 & 2, Parking Rates Apply
CIVIC CENTER 5
CIVIC CENTER 2; Public Parking Level 1 & 2, Parking Rates Apply
CIVIC CENTER; Public Parking Level 1 & 2, Parking Rates Apply
CIVIC CENTER 6; Public Parking Level 1 & 2, Parking Rates Apply ",,888-758-4389,E,,Public,24 hours daily,,,,,4,5,,,ChargePoint Network,http://www.mychargepoint.net/,10/09/2015,41338,2015-10-09 08:05:54+00,,,,,,,,,NEMA520 J1772,"355 McAllister St
San Francisco, CA 94102",37.7802556,-122.4178551,1400000US06075012402,38333
6821,0101000020E6100000986E1283C09A5EC08FAA2688BAE34240,ELEC,San Francisco City Hall,1 Dr Carlton B Goodlet Pl,,,,E,,Private,City vehicle use only,,,,,1,1,,,,,06/02/2015,35149,2015-06-02 18:10:52+00,LG,,,08/15/2009,,,,,NEMA520 J1772,"1 Dr Carlton B Goodlet Pl
San Francisco, CA 94102",37.77913,-122.418,1400000US06075012402,38333
5152,0101000020E6100000F8DEDFA0BD9A5EC0F7E7A221E3E34240,ELEC,Civic Center Garage,355 McAllister St,Chargers located on Level 1 and Level 2,,415-863-1537,E,,Public,"24 hours daily; pay lot",,,,,,,,1 SP Inductive,,,05/05/2015,21366,2015-05-05 11:55:14+00,LG,,,01/31/2002,,,,,,"355 McAllister St
San Francisco, CA 94102",37.780369,-122.417824,1400000US06075012402,38333
7799,0101000020E6100000244CACE7FF8F5DC0053175FCBC054140,ELEC,ESSEX,610 S Main St,"PACELECLOFT 02; 7th st.
PACELECLOFT 01; 7th st.",,888-758-4389,E,,Public,24 hours daily,,,,,,3,,,ChargePoint Network,http://www.mychargepoint.net/,10/09/2015,68839,2015-10-09 07:42:24+00,,,,,,,,,J1772,"610 S Main St
LA, CA 90014",34.0448299,-118.2499942,1400000US06037207302,38438
11150,0101000020E6100000C7269E58CC8F5DC0CC7D721420064140,ELEC,CITY OF LA,101-115 E 4th St,"BSL #1; 9 a.m. - 4:00 p.m. 7 days a week",,888-758-4389,E,,Public,24 hours daily,,,,,,1,,,ChargePoint Network,http://www.mychargepoint.net/,10/09/2015,62879,2015-10-09 07:50:30+00,,,,,,,,,J1772,"101-115 E 4th St
Los Angeles, CA 90013",34.047854,-118.2468473,1400000US06037207302,38438
3710,0101000020E610000086747808E34E5EC0362383DC45F44240,ELEC,San Joaquin County Office of Education,2707 Transworld Dr,,,209-468-4800,E,,Public - Call ahead,"8am-5pm M-F; see front desk for access",,,,,,2,,,,,08/04/2015,68395,2015-08-04 13:09:08+00,SG,,,04/01/2015,,,,,J1772,"2707 Transworld Dr
Stockton, CA 95206",37.908382,-121.232607,1400000US06077003803,38455
6255,0101000020E6100000921E2B9DB44E5EC021FAFF82EEF34240,ELEC,San Joaquin County Office of Education,2901 Arch Airport Rd,,,209-468-4800,E,,Public - Call ahead,"8am-5pm M-F; see front desk for access",,,,,,1,,,,,08/04/2015,68396,2015-08-04 13:09:07+00,SG,,,04/01/2015,,,,,J1772,"2901 Arch Airport Rd
Stockton, CA 95206",37.9057163,-121.2297738,1400000US06077003803,38455
13650,0101000020E6100000DAB6DE2527515EC0944440CFB0F24240,ELEC,BMW FACILITIES,1101 Runway Dr,"STOCKTON 01; -Hours the public can access the EV charger.   Mon-Fri 7:00 AM- 7:00 PM   Closed on weekends and holidays.",,888-758-4389,E,,Public,24 hours daily,,,,,,2,,,ChargePoint Network,http://www.mychargepoint.net/,10/09/2015,63221,2015-10-09 08:22:03+00,,,,,,,,,J1772,"1101 Runway Dr
Stockton, CA 95206",37.8960208,-121.2680144,1400000US06077003803,38455
11244,0101000020E61000004CDF6B088E535EC0840CE4D9E5214340,ELEC,City of Galt,495 Industrial Dr,,,209-366-7260,E,,Public,7:30am-5:30pm M-F,,,,,,2,,,,,10/06/2015,69989,2015-10-06 21:33:30+00,LG,,,07/01/2015,,,,,J1772,"495 Industrial Dr
Galt, CA 95632",38.264827,-121.305544,1400000US06067009503,38487
11328,0101000020E610000027C11BD2A8925DC03FC8B260E20B4140,ELEC,Hollywood Hotel,1160 N. Vermont Ave.,,,888-998-2546,E,,Public,MON: 24 hours | TUE: 24 hours | WED: 24 hours | THU: 24 hours | FRI: 24 hours | SAT: 24 hours | SUN: 24 hours,,,,,,3,,,Blink Network,http://www.blinknetwork.com/,10/09/2015,60059,2015-10-09 07:09:03+00,,,,,,,,,J1772,"1160 N. Vermont Ave.
Hollywood, CA 90029",34.092846,-118.291554,1400000US06037191301,38750
122,0101000020E6100000917EFB3A70F25DC0CCD3B9A294664240,ELEC,San Joaquin Valley Air Pollution Control District,1990 E Gettysburg Ave,,,559-230-6000,E,,Private,Employee use only,,,,,,2,,,,,05/05/2015,49119,2015-05-05 11:51:28+00,P,,,07/17/2012,,,,,J1772,"1990 E Gettysburg Ave
Fresno, CA 93726",36.801411,-119.7881,1400000US06019005000,38780
5099,0101000020E6100000FC6EBA6587525DC06AFAEC80EB3C4140,ELEC,Southern California Edison - Victorville Service Center,12353 Hesperia Rd,,,,E,,Private,,,,,,,,,1 SP Inductive,,,04/03/2015,32854,2015-04-03 17:07:45+00,T,,,01/15/2008,,,,,,"12353 Hesperia Rd
Victorville, CA 92392",34.475937,-117.289514,1400000US06071010026,38788
16390,0101000020E6100000B9AB5791D1785EC04ED367075CAB4240,ELEC,SAN JOSE,70 S 4th St,"4TH & ST JOHNS2
4TH & ST JOHNS3
4TH & ST JOHNS; In Parking structure between St Johns and Santa Clara",,888-758-4389,E,,Public,24 hours daily,,,,,,3,,,ChargePoint Network,http://www.mychargepoint.net/,10/09/2015,44982,2015-10-09 07:51:15+00,,,,,,,,,J1772,"70 S 4th St
San Jose, CA 95112",37.338746,-121.887791,1400000US06085501000,38866
14194,0101000020E6100000405DEEDDB0785EC0DE51088959AB4240,ELEC,SAN JOSE,225 E Santa Clara St,"5TH& SNTA CLARA; -
5TH& SNTACLARA2; -
5TH& SNTACLARA3; -",,888-758-4389,E,,Public,24 hours daily,,,,,,3,,,ChargePoint Network,http://www.mychargepoint.net/,10/09/2015,46480,2015-10-09 07:51:14+00,,,,,,,,,J1772,"225 E Santa Clara St
San Jose, CA 95112",37.3386699,-121.8857951,1400000US06085501000,38866
15125,0101000020E6100000DBCF7355EA785EC03C9E3B6645AB4240,ELEC,SAN JOSE,95 N 3rd St,"3RD STREET #1
3RD STREET #2
3RD STREET #3
3RD STREET #4
3RD STREET #7
3RD STREET #5
3RD STREET #6",,888-758-4389,E,,Public,24 hours daily,,,,,3,7,,,ChargePoint Network,http://www.mychargepoint.net/,10/09/2015,50746,2015-10-09 07:51:14+00,,,,,,,,,J1772 NEMA520,"95 N 3rd St
San Jose, CA 95113",37.3380554,-121.8893026,1400000US06085501000,38866
20226,0101000020E6100000881EE7ECD3785EC000755EBE50AB4240,ELEC,SAN JOSE,48-72 N 4th St,"4TH & ST JOHNS4
4TH & ST JOHNS5",,888-758-4389,E,,Public,24 hours daily,,,,,2,2,,,ChargePoint Network,http://www.mychargepoint.net/,10/09/2015,55963,2015-10-09 07:51:27+00,,,,,,,,,NEMA520 J1772,"48-72 N 4th St
San Jose, CA 95112",37.3384016,-121.8879349,1400000US06085501000,38866
14066,0101000020E61000005EBA490C029B5EC0FE43FAEDEBE44240,ELEC,Nissan of San Francisco,1395 Van Ness Ave,,,855-252-3791,E,,Private,,,,,,,1,,,,,07/08/2015,50970,2015-07-08 14:25:38+00,P,,,03/01/2012,,,,,J1772,"1395 Van Ness Ave
San Francisco, CA 94109",37.78845,-122.422,1400000US06075012000,38930
14031,0101000020E61000005EBA490C029B5EC0FE43FAEDEBE44240,ELEC,Nissan of San Francisco,1395 Van Ness Ave,,,855-252-3791,E,,Public,Dealership business hours,,,,,,1,,,,,07/08/2015,50969,2015-07-08 14:25:38+00,P,,,03/01/2012,,,,,J1772,"1395 Van Ness Ave
San Francisco, CA 94109",37.78845,-122.422,1400000US06075012000,38930
9231,0101000020E610000069780EC0E19A5EC07EDC2340F2E44240,ELEC,CCSF-SFMTA,1399 Bush St,"POLK   BUSH; Public Parking Level 1",,888-758-4389,E,,Public,24 hours daily,,,,,1,1,,,ChargePoint Network,http://www.mychargepoint.net/,10/09/2015,41341,2015-10-09 08:09:14+00,,,,,,,,,NEMA520 J1772,"1399 Bush St
San Francisco, CA 94109",37.7886429,-122.4200287,1400000US06075012000,38930
16326,0101000020E6100000F42E83D668705EC04804FC7D73744240,ELEC,Watsonville,330 Main Street,,,888-998-2546,E,,Public,MON: 24 hours | TUE: 24 hours | WED: 24 hours | THU: 24 hours | FRI: 24 hours | SAT: 24 hours | SUN: 24 hours,,,,,,1,,,Blink Network,http://www.blinknetwork.com/,10/09/2015,48842,2015-10-09 07:12:38+00,,,,,,,,,J1772,"330 Main Street
Watsonville, CA 95076",36.90977454,-121.7563988,1400000US06087110300,38953
14304,0101000020E61000007FCB52A1F06C5DC0819C8B1AA7CD4040,ELEC,SOFI APARTMENTS,24555 Los Alisos Blvd,"STATION 01; In front of the Leasing Office",,888-758-4389,E,,Public,24 hours daily,,,,,,2,,,ChargePoint Network,http://www.mychargepoint.net/,10/09/2015,67997,2015-10-09 07:44:50+00,,,,,,,,,J1772,"24555 Los Alisos Blvd
Laguna Hills, CA 92653",33.6066621,-117.7021869,1400000US06059062647,39123
5014,0101000020E61000007BAF100C56905EC0F644D7851F0F4340,ELEC,Vallejo Nissan,3287 Sonoma Blvd,,,707-643-8291,E,,Public - Call ahead,Dealership business hours,,,,,,1,,,,,07/08/2015,39955,2015-07-08 14:27:18+00,P,,,03/15/2011,,,,,J1772,"3287 Sonoma Blvd
Vallejo, CA 94590",38.1181495,-122.2552519,1400000US06095251701,39250
2852,0101000020E61000007BAF100C56905EC0F644D7851F0F4340,ELEC,Vallejo Nissan,3287 Sonoma Blvd,,,707-643-8291,E,,Private,,,,,,,1,,,,,07/08/2015,48066,2015-07-08 14:27:18+00,P,,,03/15/2011,,,,,J1772,"3287 Sonoma Blvd
Vallejo, CA 94590",38.1181495,-122.2552519,1400000US06095251701,39250
850,0101000020E610000040E0DCBA76535DC0145F48E240064140,ELEC,City of Colton - Fiesta Village Family Fun Park,1405 E Washington St,,,844-560-7121,E,,Public,24 hours daily,,,,,,2,,,Greenlots,http://greenlots.com/,10/06/2015,63069,2015-10-06 22:10:41+00,LG,,,05/01/2015,,,,,J1772,"1405 E Washington St
Colton, CA 92324",34.0488551,-117.3041217,1400000US06071007109,39332
7525,0101000020E61000009CA73AE466675DC0FACF3F660CF14040,ELEC,Corona Nissan,2575 Wardlow Rd,,,951-735-3360,E,,Private,,,,,,,1,,,,,07/08/2015,47601,2015-07-08 14:24:21+00,P,,,03/15/2011,,,,,J1772,"2575 Wardlow Rd
Corona, CA 92882",33.8831909,-117.615655,1400000US06065041500,39342
18740,0101000020E610000036A671B98B665DC0D31D7A41FAF04040,ELEC,American Electric Supply,1872 W Pomona Rd,,,,E,,Private,,,,,,,1,,,,,03/04/2015,46716,2015-03-04 01:20:56+00,T,,,02/15/2012,,,,,J1772,"1872 W Pomona Rd
Corona, CA 92880",33.8826372,-117.6022781,1400000US06065041500,39342
11189,0101000020E61000009CA73AE466675DC0FACF3F660CF14040,ELEC,Corona Nissan,2575 Wardlow Rd,,,951-735-3360,E,,Public - Call ahead,Dealership business hours,,,,,,1,1,,,,07/08/2015,39881,2015-07-08 14:24:21+00,P,,,03/15/2011,,,,,J1772 CHADEMO,"2575 Wardlow Rd
Corona, CA 92882",33.8831909,-117.615655,1400000US06065041500,39342
15221,0101000020E6100000EE13F6A397675DC0B2A1F6B6F4F04040,ELEC,CARDINALE WAY,2603 Wardlow Rd,VW_422597_A,,888-758-4389,E,,Public,24 hours daily,,,,,,2,,,ChargePoint Network,http://www.mychargepoint.net/,10/09/2015,69856,2015-10-09 08:27:03+00,,,,,,,,,J1772,"2603 Wardlow Rd
Corona, CA 92882",33.8824681,-117.6186304,1400000US06065041500,39342
5902,0101000020E6100000B64714FF1C8E5EC0F7E978CC40174440,ELEC,Best Western - Tesla,203 Antelope Blvd,,,530-527-8882  877-798-3752,E,,Public,"24 hours daily; for Tesla use only; for guest use only",,,,,,2,,,Tesla,http://www.teslamotors.com/supercharger,09/02/2015,68911,2015-09-02 02:43:11+00,P,,,03/01/2015,,,,,TESLA,"203 Antelope Blvd
Red Bluff, CA 96080",40.181665,-122.2205198,1400000US06103000600,39366
7170,0101000020E6100000E9DC4834DC495DC0A62E7480BBDE4040,ELEC,Southern California Edison - San Jacinto Service Center,26100 Menifee Rd,,,,E,,Private,,,,,,,,,4 SP Inductive,,,04/03/2015,32853,2015-04-03 17:10:35+00,T,,,01/15/2008,,,,,,"26100 Menifee Rd
Romoland, CA 92585",33.7400971,-117.1540652,1400000US06065042728,39388
19376,0101000020E61000003FF1AD59F8415DC0BDE13E726B5F4040,ELEC,Mossy Honda of Lemon Grove,3615 Lemon Grove Ave,,,619-461-2600,E,,Public - Call ahead,Dealership business hours,,,,,,1,,,,,05/05/2015,53909,2015-05-05 11:56:47+00,P,,,11/15/2013,,,,,J1772,"3615 Lemon Grove Ave
Lemon Grove, CA 91945",32.7454665,-117.0307831,1400000US06073014400,39421
879,0101000020E6100000F7764B72C0635EC00D33D9E4957F4240,ELEC,Gilroy Nissan-Hyundai,400 Stutz Way,,,408-842-1777,E,,Public - Call ahead,Dealership business hours,,,,,,2,,,,,07/08/2015,39897,2015-07-08 14:26:48+00,P,,,03/15/2011,,,,,J1772,"400 Stutz Way
Gilroy, CA 95020",36.9967619,-121.558621,1400000US06085512603,39432
1070,0101000020E6100000F7764B72C0635EC00D33D9E4957F4240,ELEC,Gilroy Nissan-Hyundai,400 Stutz Way,,,408-842-1777,E,,Private,,,,,,,1,,,,,07/08/2015,48187,2015-07-08 14:26:48+00,P,,,03/15/2011,,,,,J1772,"400 Stutz Way
Gilroy, CA 95020",36.9967619,-121.558621,1400000US06085512603,39432
15651,0101000020E6100000855FEAE74D7C5EC0EBABAB02B5024340,ELEC,McDonald's #16318 - Bailey Rd - Bay Point CA,220 Bailey Road,,,888-998-2546,E,,Public,MON: 24 hours | TUE: 24 hours | WED: 24 hours | THU: 24 hours | FRI: 24 hours | SAT: 24 hours | SUN: 24 hours,,,,,,3,,,Blink Network,http://www.blinknetwork.com/,10/09/2015,67779,2015-10-09 07:11:48+00,,,,,,,,,J1772,"220 Bailey Road
Bay Point, CA 94565",38.021149,-121.942255,1400000US06013314104,39536
1494,0101000020E61000000A59277854945EC07B4FE5B4A7A74440,ELEC,Best Western Plus Treehouse - Tesla,111 Morgan Way,I-5 Exit 738,,877-798-3752,E,,Public,"24 hours daily; for Tesla use only",,,,,,,4,,Tesla,http://www.teslamotors.com/supercharger,05/05/2015,53379,2015-05-05 11:41:53+00,P,,,10/31/2013,,,,,TESLA,"111 Morgan Way
Mount Shasta, CA 96067",41.3098055,-122.3176556,1400000US06093001000,39552
9949,0101000020E610000089AC7F21F5C95DC0B240608A171C4140,ELEC,SERVICEBLDG1,1911 Williams Dr,BEHAVHEALTHBLDG,,888-758-4389,E,,Public,24 hours daily,,,,,,2,,,ChargePoint Network,http://www.mychargepoint.net/,10/09/2015,69606,2015-10-09 07:40:45+00,,,,,,,,,J1772,"1911 Williams Dr
Oxnard, CA 93036",34.2194684,-119.1555866,1400000US06111004902,39594
14255,0101000020E61000009E3F6D5427C85DC0BBA4202EEF194140,ELEC,VWGOA,201 Del Norte Blvd,"STATION 2; -
STATION 1; -",,888-758-4389,E,,Public,24 hours daily,,,,,,2,,,ChargePoint Network,http://www.mychargepoint.net/,10/09/2015,49132,2015-10-09 07:50:42+00,,,,,,,,,J1772,"201 Del Norte Blvd
Oxnard, CA 93030",34.2026117,-119.1274005,1400000US06111004902,39594
22301,0101000020E6100000A9B17389D9ED5EC057C0F34185904340,ELEC,Greenwood State Beach,5980-6140 Shoreline Hwy,Located along the Mendocino County coast about 15 miles north of Point Arena on Highway 1,,707-937-5804,P,09/01/2016 12:00:00 AM,PLANNED - not yet accessible (Public),,,,,,,2,,,,,10/06/2015,69978,2015-10-06 22:02:50+00,SG,,,,,,,,J1772,"5980-6140 Shoreline Hwy
Elk, CA 95432",39.1290667,-123.7164024,1400000US06045011001,39667
17257,0101000020E61000001226D6F37FF25EC07422669BC0A24340,ELEC,Little River Inn - Tesla,7751 California 1,,,707-937-5942  877-798-3752,E,,Public,"24 hours daily; for Tesla use only; for guest use only; see front desk for access",,,,,,2,,,Tesla,http://www.teslamotors.com/supercharger,,70276,2015-10-07 21:15:47+00,P,,,06/01/2015,,,,,TESLA,"7751 California 1
Little River, CA 95456",39.2715029,-123.7890596,1400000US06045011001,39667
16689,0101000020E61000004255F1EB2CF25EC088372163A4A14340,ELEC,Dennen's Victorian Farmhouse - Tesla,7001 California 1,,,707-937-0697  877-798-3752,E,,Public,"24 hours daily; for Tesla use only; for guest use only; see front desk for access",,,,,,1,,,Tesla,http://www.teslamotors.com/supercharger,09/02/2015,68960,2015-09-02 02:44:44+00,P,,,05/01/2015,,,,,TESLA,"7001 California 1
Little River, CA 95456",39.2628292,-123.7839918,1400000US06045011001,39667
6698,0101000020E6100000A77C6363B9ED5EC079F06EC042904340,ELEC,Elk Cove Inn and Spa - Tesla,6300 California 1,,,707-877-3321  877-798-3752,E,,Public - Call ahead,"24 hours daily; for Tesla use only; for guest use only",,,,,,1,,,Tesla,http://www.teslamotors.com/supercharger,09/02/2015,68963,2015-09-02 02:45:10+00,P,,,03/01/2015,,,,,TESLA,"6300 California 1
Elk, CA 95432",39.1270371,-123.7144402,1400000US06045011001,39667
8960,0101000020E6100000DF15C1FF56995DC0501C40BFEF174140,ELEC,Milan Capital Management,6400 Laurel Cyn,,,888-998-2546,E,,Public,MON: 24 hours | TUE: 24 hours | WED: 24 hours | THU: 24 hours | FRI: 24 hours | SAT: 24 hours | SUN: 24 hours,,,,,,1,,,Blink Network,http://www.blinknetwork.com/,10/09/2015,63508,2015-10-09 07:09:56+00,,,,,,,,,J1772,"6400 Laurel Cyn
North Hollywood, CA 91602",34.187004,-118.395935,1400000US06037123901,39750
15119,0101000020E6100000AC81F79FC6425DC07FAD0100B6454040,ELEC,"Las Americas, CA/4211 Camino De La Plaza",4211 Camino De La Plaza,,,877-455-3833,E,,Public - Card key at all times,"24 hours daily; EVgo network subscription and key fob required",,,,,,1,2,,eVgo Network,https://www.evgonetwork.com/,10/09/2015,69353,2015-10-09 08:50:40+00,,,,,,,,,CHADEMO J1772,"4211 Camino De La Plaza
San Diego, CA 92173",32.5446167,-117.0433731,1400000US06073010009,39775
10898,0101000020E6100000F036CA5587DF5EC045679945288D4340,ELEC,Greenwood Ridge Vineyards,5501 Highway 128,,,707-895-2002  877-798-3752,E,,Public,"Vineyard business hours; for guest use only; see front desk for access",,,,,,2,1,,Tesla,http://www.teslamotors.com/supercharger,09/02/2015,63730,2015-09-02 02:34:07+00,P,,,10/10/2014,,,,,J1772 CHADEMO TESLA,"5501 Highway 128
Philo, CA 95466",39.1027915,-123.4926352,1400000US06045011200,39909
6894,0101000020E6100000D85B6F40F0E05EC0AF152301598F4340,ELEC,EV CHARGING STA,3151 CA-128,"HANDLEY CELLARS; -",,888-758-4389,E,,Public,24 hours daily,,,,,,2,,,ChargePoint Network,http://www.mychargepoint.net/,10/09/2015,58226,2015-10-09 08:20:00+00,,,,,,,,,J1772,"3151 CA-128
Philo, CA 95466",39.1199037,-123.5146638,1400000US06045011200,39909
6536,0101000020E61000003E5B07077BDC5EC07C26FBE769884340,ELEC,Hendy Woods State Park,18599 Philo Greenwood Rd,,,707-895-3141,P,09/01/2016 12:00:00 AM,PLANNED - not yet accessible (Public),,,,,,,2,,,,,10/06/2015,70021,2015-10-06 21:33:02+00,SG,,,,,,,,J1772,"18599 Philo Greenwood Rd
Philo, CA 95466",39.065732,-123.445009,1400000US06045011200,39909
16378,0101000020E6100000F0092307B69C5DC0A8C5E061DA1A4140,ELEC,Van Nuys Amtrak/Metrolink Station,7724 Van Nuys Blvd,,,800-371-5465,E,,Public,24 hours daily,,,,,,3,,,,,05/05/2015,7245,2015-05-05 11:51:13+00,P,,,06/30/1998,,,,,J1772,"7724 Van Nuys Blvd
Van Nuys, CA 91405",34.2097895,-118.4486101,1400000US06037127102,39968
5103,0101000020E61000001B78FF69B48F5DC01F49490F43F64040,ELEC,Los Angeles County - Martin Luther King Hospital,1670 E 120th St,"Located at loading dock, first driveway East of Compton Ave",,323-267-2023,E,,Public,"24 hours daily; keypad activated, instructions on EVSE",,,,,,2,,,,,06/02/2015,63737,2015-06-02 18:19:47+00,LG,,,10/01/2014,,,,,J1772,"1670 E 120th St
Los Angeles, CA 90059",33.9239215,-118.2453866,1400000US06037540700,39971
9377,0101000020E61000004EECA17DAC8C5EC03FE3C28190F64340,ELEC,Rabobank - Tesla,950 Highway 99 W,I-5 Exit 631,,877-798-3752,E,,Public,"24 hours daily; for Tesla use only",,,,,,,6,,Tesla,http://www.teslamotors.com/supercharger,05/05/2015,53370,2015-05-05 11:41:27+00,P,,,10/31/2013,,,,,TESLA,"950 Highway 99 W
Corning, CA 96021",39.926285,-122.198028,1400000US06103001100,40000
5665,0101000020E6100000AC037BA7DD905EC064B0E2546BE84240,ELEC,OAKLAND VW,2710 Broadway,VW_426084_A,,888-758-4389,E,,Public,24 hours daily,,,,,,2,,,ChargePoint Network,http://www.mychargepoint.net/,10/09/2015,65063,2015-10-09 08:26:47+00,,,,,,,,,J1772,"2710 Broadway
Oakland, CA 94612",37.8157755,-122.2635287,1400000US06001403501,40000
19099,0101000020E6100000144CEB25FC905EC073405C8308E84240,ELEC,CARCHARGING,2353 Webster St,"YMCA GARAGE-ACE; Station in the YMCA garage,First level on west wall. ",,888-758-4389,E,,Public,24 hours daily,,,,,,1,,,ChargePoint Network,http://www.mychargepoint.net/,10/09/2015,44419,2015-10-09 07:55:24+00,,,,,,,,,J1772,"2353 Webster St
Oakland, CA 94612",37.8127598,-122.2653899,1400000US06001403501,40000
20159,0101000020E61000009170106308915DC01AA3755435124140,ELEC,ICIS,540 W Colorado St,"546 W COLORADO1; Located in retail parking",,888-758-4389,E,,Public,24 hours daily,,,,,,2,,,ChargePoint Network,http://www.mychargepoint.net/,10/09/2015,52520,2015-10-09 07:54:55+00,,,,,,,,,J1772,"540 W Colorado St
Glendale, CA 91204",34.1422525,-118.2661369,1400000US06037302302,40051
1391,0101000020E61000008C74F51906915DC0A3B492B135124140,ELEC,ICIS,540 Colorado Blvd,"546 W COLORADO2; -",,888-758-4389,E,,Public,24 hours daily,,,,,,2,,,ChargePoint Network,http://www.mychargepoint.net/,10/09/2015,55917,2015-10-09 07:54:55+00,,,,,,,,,J1772,"540 Colorado Blvd
Glendale, CA 91204",34.1422636,-118.2659974,1400000US06037302302,40051
17195,0101000020E6100000AAD6C22CB4CC5EC0DFE00B93A9924340,ELEC,Super 8 Ukiah,693 S Orchard Ave,"Highway 101, Gobbi Street exit",,707-468-8181  877-798-3752,E,,Public - Call ahead,"24 hours daily; free for hotel guests. Guests may request use of the EVSE when making hotel reservations",Cash A D M V,,,,,3,,,Tesla,http://www.teslamotors.com/supercharger,03/04/2015,39314,2015-10-08 21:29:07+00,P,,,05/15/2011,,,,,J1772 TESLA,"693 S Orchard Ave
Ukiah, CA 95482",39.1458,-123.198497,1400000US06045011500,40144
18454,0101000020E61000008CC866FD9C925DC0BFA0E0BDFE074140,ELEC,Wilshire Vermont Parking Garage - Tesla,3183 Wilshire Blvd,,,213-384-5800  877-798-3752,E,,Public,"24 hours daily; for Tesla use only",,,,,,2,,,Tesla,http://www.teslamotors.com/supercharger,,70431,2015-10-09 20:46:42+00,P,,,06/01/2015,,,,,TESLA,"3183 Wilshire Blvd
Los Angeles, CA 90010",34.0624616,-118.2908319,1400000US06037211120,40180
5075,0101000020E61000008CC866FD9C925DC0BFA0E0BDFE074140,ELEC,WILSHIREVERMONT,3183 Wilshire Blvd,"WILSHIRE STAT 1; Located in first floor garage",,888-758-4389,E,,Public,24 hours daily,,,,,,2,,,ChargePoint Network,http://www.mychargepoint.net/,10/09/2015,68252,2015-10-09 07:42:41+00,,,,,,,,,J1772,"3183 Wilshire Blvd
Los Angeles, CA 90005",34.0624616,-118.2908319,1400000US06037211120,40180
17194,0101000020E6100000D395198057905DC0D3C1FA3F87114140,ELEC,Glendale Nissan,727 South Brand Boulevard,,,877-455-3833,E,,Public - Card key at all times,"24 hours daily; EVgo network subscription and key fob required",,,,,,,1,,eVgo Network,https://www.evgonetwork.com/,10/09/2015,69569,2015-10-09 08:54:56+00,,,,,,,,,CHADEMO,"727 South Brand Boulevard
Glendale, CA 91204",34.13694,-118.2553406,1400000US06037302401,40295
3053,0101000020E610000097975709F1905DC04E5E09490B114140,ELEC,GLENDALE IWM,548 W Chevy Chase Dr,"PUBLIC WORKS; INTEGRATED WASTE MANAGEMENT YARD.  Access Gate can be opened by calling 818-548-3916.  Max Use is 4 hrs.  Available 7:30 am-4:30 pm M-F.  For safety, remain in vehicle or in lobby.",,888-758-4389,E,,Public,24 hours daily,,,,,,2,,,ChargePoint Network,http://www.mychargepoint.net/,10/09/2015,61775,2015-10-09 07:51:45+00,,,,,,,,,J1772,"548 W Chevy Chase Dr
Glendale, CA 91204",34.1331569,-118.2647117,1400000US06037302401,40295
8547,0101000020E61000007B8269BD84905DC02437D43950104140,ELEC,CAMDEN,3900 San Fernando Rd,"GLENDALE P1; Located on P1 parking floor",,888-758-4389,E,,Public,24 hours daily,,,,,,1,,,ChargePoint Network,http://www.mychargepoint.net/,10/09/2015,66437,2015-10-09 08:26:43+00,,,,,,,,,J1772,"3900 San Fernando Rd
Glendale, CA 91204",34.1274483,-118.2581018,1400000US06037302401,40295
14421,0101000020E6100000F832518454905DC08AEF1F668A114140,ELEC,Glendale Nissan,727 S Brand Blvd,,,818-240-6000,E,,Private,,,,,,,1,,,,,07/08/2015,48188,2015-07-08 14:24:42+00,P,,,03/15/2011,,,,,J1772,"727 S Brand Blvd
Glendale, CA 91204",34.1370361,-118.2551585,1400000US06037302401,40295
5357,0101000020E6100000F832518454905DC08AEF1F668A114140,ELEC,Glendale Nissan,727 S Brand Blvd,,,818-240-6000,E,,Public - Call ahead,Dealership business hours,,,,,,1,,,,,07/08/2015,39898,2015-07-08 14:24:42+00,P,,,03/15/2011,,,,,J1772,"727 S Brand Blvd
Glendale, CA 91204",34.1370361,-118.2551585,1400000US06037302401,40295
9171,0101000020E610000036CEA623805B5EC0AC3C81B0534C4340,ELEC,Kaiser Office Building,1650 Response Rd,,,,E,,Private,Employee use only,,,,,,,,1 SP Inductive  8 Conductive 120V/240V NEMA 14-50,,,05/05/2015,21675,2015-05-05 11:54:35+00,P,,,06/30/2002,,,,,,"1650 Response Rd
Sacramento, CA 95815",38.596304,-121.429696,1400000US06067005402,40349
11635,0101000020E6100000FF3EE3C201795EC0285998CF03AA4240,ELEC,SAN JOSE,329-381 S Almaden Blvd,"WOZ LOT; Located in Woz Lot",,888-758-4389,E,,Public,24 hours daily,,,,,1,1,,,ChargePoint Network,http://www.mychargepoint.net/,10/09/2015,65640,2015-10-09 07:51:32+00,,,,,,,,,NEMA520 J1772,"329-381 S Almaden Blvd
San Jose, CA 95110",37.3282413,-121.8907325,1400000US06085501700,40350
4097,0101000020E61000000223D4B1EF785EC0BC2AAB4434AA4240,ELEC,SAN JOSE,150 W San Carlos St,"CONVENTION CNT1; Ground Floor, Main Garage, North Wall, Section S11
CONVENTION CNT2; Ground Floor, Main Garage, North Wall, Section S11",,888-758-4389,E,,Public,24 hours daily,,,,,2,2,,,ChargePoint Network,http://www.mychargepoint.net/,10/09/2015,55952,2015-10-09 07:51:12+00,,,,,,,,,NEMA520 J1772,"150 W San Carlos St
San Jose, CA 95113",37.3297201,-121.8896298,1400000US06085501700,40350
22324,0101000020E61000004ACC58D9E3785EC075FB5179E0A94240,ELEC,SAN JOSE,488 S Almaden Blvd,"SJ-002; Parking level P5 Adjacent to the ADA Stalls
SJ-001; Parking Level P5 Opposite ADA Stalls",,888-758-4389,E,,Public,24 hours daily,,,,,,4,,,ChargePoint Network,http://www.mychargepoint.net/,10/09/2015,60708,2015-10-09 07:52:48+00,,,,,,,,,J1772,"488 S Almaden Blvd
San Jose, CA 95113",37.3271629,-121.8889068,1400000US06085501700,40350
4929,0101000020E6100000DA1B7C61322B5DC03354C554FA8D4040,ELEC,MJ - Santa Ysabel,"30250 Julian Rd, Highway 78 & 79",,,888-998-2546,E,,Public,MON: 24 hours | TUE: 24 hours | WED: 24 hours | THU: 24 hours | FRI: 24 hours | SAT: 24 hours | SUN: 24 hours,,,,,,3,2,,Blink Network,http://www.blinknetwork.com/,10/09/2015,69118,2015-10-09 07:08:49+00,,,,,,,,,CHADEMO J1772,"30250 Julian Rd, Highway 78 &amp; 79
Santa Ysabel, CA 92070",33.109202,-116.67495,1400000US06073020903,40405
13408,0101000020E6100000541454F9C3205DC060FCD9345BE94040,ELEC,City of Palm Springs - Coachella Valley Economic Partnership,3111 E Tahquitz,Rabobank Building,,760-323-8214,E,,Public,24 hours daily,,,,,,2,,,,,10/06/2015,52527,2015-10-06 22:11:14+00,LG,,,03/07/2013,,,,,J1772,"3111 E Tahquitz
Palm Springs, CA 92264",33.8230959,-116.5119613,1400000US06065044701,40407
327,0101000020E6100000D16C68145C215DC09B030473F4E84040,ELEC,City of Palm Springs - Camelot Theatre,2300 E Baristo Rd,,,760-323-8214,E,,Public,24 hours daily,,,,,,2,,,,,10/06/2015,52525,2015-10-06 21:54:57+00,LG,,,08/07/2013,,,,,J1772,"2300 E Baristo Rd
Palm Springs, CA 92262",33.81996,-116.5212451,1400000US06065044701,40407
16254,0101000020E6100000845A1D4AFE205DC09E23F25D4AEA4040,ELEC,City of Palm Springs - Accelerator Park,2901 E Alejo,,,760-323-8214,E,,Public,24 hours daily,,,,,,1,,,,,10/06/2015,52524,2015-10-06 21:54:54+00,LG,,,03/07/2013,,,,,J1772,"2901 E Alejo
Palm Springs, CA 92264",33.8303945,-116.5155206,1400000US06065044701,40407
13487,0101000020E61000004278B471C4205DC04F07B29E5AE94040,ELEC,Coachella Valley Economic Partnership - Rabobank,3111 E Tahquitz,,,760-340-1575,E,,Public,24 hours daily,,,,,,2,,,,,10/06/2015,70058,2015-10-06 21:39:39+00,LG,,,03/11/2013,,,,,J1772,"3111 E Tahquitz
Palm Springs, CA 92263",33.823078,-116.51199,1400000US06065044701,40407
1288,0101000020E6100000EBF6A3F2C0205DC017C8A29F5FE94040,ELEC,City of Palm Springs - International Airport,3100 E Tahquitz Canyon Way,,,760-323-8214,E,,Public,"24 hours daily; pay lot",,,,,,6,,,,,10/06/2015,52606,2015-10-06 22:01:03+00,LG,,,03/11/2013,,,,,J1772,"3100 E Tahquitz Canyon Way
Palm Springs, CA 92262",33.8232307,-116.5117766,1400000US06065044701,40407
16570,0101000020E61000000367DFCBB3205DC0EC562A0362E94040,ELEC,City of Palm Springs - City Hall,3200 E Tahquitz Canyon Way,,,760-323-8214,E,,Public,24 hours daily,,,,,,2,,,,,10/06/2015,52526,2015-10-06 22:01:13+00,LG,,,03/11/2013,,,,,J1772,"3200 E Tahquitz Canyon Way
Palm Springs, CA 92264",33.8233036,-116.5109739,1400000US06065044701,40407
18978,0101000020E61000005307793D98215DC0FD3383F8C0E84040,ELEC,City of Palm Springs - Pavilion,401 S Pavilion Way,,,760-323-8214,E,,Public,24 hours daily,,,,,,1,,,,,10/06/2015,52609,2015-10-06 21:43:09+00,LG,,,09/01/2013,,,,,J1772,"401 S Pavilion Way
Palm Springs, CA 92262",33.818389,-116.524917,1400000US06065044701,40407
20392,0101000020E6100000645DDC4603215DC0F9F719170EEA4040,ELEC,City of Palm Springs - Fleet Maintenance Yard,425 Civic Dr,,,760-323-8214,E,,Public,24 hours daily,,,,,,1,,,,,10/06/2015,52605,2015-10-06 22:11:12+00,LG,,,03/11/2013,,,,,J1772,"425 Civic Dr
Palm Springs, CA 92262",33.828555,-116.515825,1400000US06065044701,40407
9576,0101000020E61000006DB477A114CA5DC03DB25EB12B1D4140,ELEC,Delivering Customer Happiness - Honda of Oxnard,1450 Auto Center Dr,,,805-973-1000,E,,Public,Dealership business hours,,,,,,2,,,,,05/05/2015,52351,2015-05-05 11:54:27+00,P,,,03/18/2013,,,,,J1772,"1450 Auto Center Dr
Oxnard, CA 93030",34.2278959,-119.1575092,1400000US06111005002,40461
15949,0101000020E6100000E2033BFE8BC95DC006F4C29D0B1D4140,ELEC,Team Nissan,1801 Auto Center Dr,,,805-485-8787,E,,Public - Call ahead,Dealership business hours,,,,,,1,,,,,07/08/2015,39918,2015-07-08 14:27:04+00,P,,,03/15/2011,,,,,J1772,"1801 Auto Center Dr
Oxnard, CA 93036",34.226917,-119.1491695,1400000US06111005002,40461
11339,0101000020E6100000E2033BFE8BC95DC006F4C29D0B1D4140,ELEC,Team Nissan,1801 Auto Center Dr,,,805-485-8787,E,,Private,,,,,,,1,,,,,07/08/2015,48157,2015-07-08 14:27:04+00,P,,,03/15/2011,,,,,J1772,"1801 Auto Center Dr
Oxnard, CA 93036",34.226917,-119.1491695,1400000US06111005002,40461
12667,0101000020E610000033970AE09CC95DC01D760040251D4140,ELEC,Team Nissan/1801 Auto Center Drive,1801 Auto Center Drive,,,877-455-3833,E,,Public - Card key at all times,"24 hours daily; EVgo network subscription and key fob required",,,,,,,1,,eVgo Network,https://www.evgonetwork.com/,10/09/2015,69453,2015-10-09 08:52:50+00,,,,,,,,,CHADEMO,"1801 Auto Center Drive
Oxnard, CA 93036",34.22769928,-119.1501999,1400000US06111005002,40461
3009,0101000020E6100000343C07E030745EC0E4D9E55B1F024340,ELEC,CITY HALL 1,200 H St,"CITY HALL 1; Southwest corner of City Hall Building ",,888-758-4389,E,,Public,24 hours daily,,,,,,2,,,ChargePoint Network,http://www.mychargepoint.net/,10/09/2015,66790,2015-10-09 07:45:46+00,,,,,,,,,J1772,"200 H St
Antioch, CA 94509",38.016582,-121.8154831,1400000US06013305000,40521
19276,0101000020E61000002A7288B839755EC0B8E864A9F5004340,ELEC,Antioch Nissan,1831 Auto Center Dr,,,925-755-2600,E,,Public - Call ahead,Dealership business hours,,,,,,1,,,,,07/08/2015,39870,2015-07-08 15:03:25+00,P,,,03/15/2011,,,,,J1772,"1831 Auto Center Dr
Antioch, CA 94509",38.007497,-121.831648,1400000US06013305000,40521
10523,0101000020E61000002A7288B839755EC0B8E864A9F5004340,ELEC,Antioch Nissan,1831 Auto Center Dr,,,925-755-2600,E,,Private,,,,,,,1,,,,,07/08/2015,47590,2015-07-08 15:03:25+00,P,,,03/15/2011,,,,,J1772,"1831 Auto Center Dr
Antioch, CA 94509",38.007497,-121.831648,1400000US06013305000,40521
9222,0101000020E6100000F7E80DF791485EC0C2A0F1E956BD4240,ELEC,Thompson Chevrolet Olds Buick,701 2nd St,,,,E,,Private,Service center use only,,,,,,1,,,,,08/04/2015,68401,2015-08-04 13:09:15+00,P,,,04/01/2015,,,,,J1772,"701 2nd St
Patterson, CA 95363",37.4792149,-121.133909,1400000US06099003201,40795
16662,0101000020E610000025068195432B5EC0616C21C841A14140,ELEC,San Luis Obispo Promenade - Bed Bath & Beyond,319 Madonna Rd,,,805-545-7556  805-542-9004,E,,Public,24 hours daily,,,,,,4,,,,,05/05/2015,35561,2015-05-05 11:55:13+00,P,,,04/15/2000,,,,,J1772,"319 Madonna Rd
San Luis Obispo, CA 93401",35.25982,-120.676,1400000US06079011200,40917
6812,0101000020E610000022BB1CC0EC335DC01451FADF9DF64040,ELEC,Desert Hills Premium Outlets,13425 Millard Pass,,,877-455-3833,E,,Public - Card key at all times,"24 hours daily; EVgo network subscription and key fob required",,,,,,1,2,,eVgo Network,https://www.evgonetwork.com/,10/09/2015,69356,2015-10-09 08:50:44+00,,,,,,,,,CHADEMO J1772,"13425 Millard Pass
Cabazon, CA 92230",33.92669296,-116.8113251,1400000US06065043813,41012
5155,0101000020E610000067D311C04D335DC018C606A00BF64040,ELEC,Morongo Casino,49500 Seminole Dr,,,877-455-3833,E,,Public - Card key at all times,"24 hours daily; EVgo network subscription and key fob required",,,,,,2,,,eVgo Network,https://www.evgonetwork.com/,10/09/2015,69279,2015-10-09 08:48:44+00,,,,,,,,,J1772,"49500 Seminole Dr
Cabazon, CA 92230",33.92222977,-116.8016205,1400000US06065043813,41012
21701,0101000020E6100000738236397C345DC0EB1ED95C35F74040,ELEC,Desert Hills Premium Outlets - Tesla,48400 Seminole Dr,,,877-798-3752,E,,Public,"24 hours daily; for Tesla use only",,,,,,,10,,Tesla,http://www.teslamotors.com/supercharger,02/03/2015,65082,2015-02-03 18:12:37+00,P,,,01/01/2015,,,,,TESLA,"48400 Seminole Dr
Cabazon, CA 92230",33.931316,-116.820082,1400000US06065043813,41012
22400,0101000020E610000067D311C04D335DC018C606A00BF64040,ELEC,Morongo Casino,49500 Seminole Dr.,,,877-455-3833,E,,Public - Card key at all times,"24 hours daily; EVgo network subscription and key fob required",,,,,,,2,,eVgo Network,https://www.evgonetwork.com/,10/09/2015,69465,2015-10-09 08:53:03+00,,,,,,,,,CHADEMO,"49500 Seminole Dr.
Cabazon, CA 92230",33.92222977,-116.8016205,1400000US06065043813,41012
16872,0101000020E6100000A88DEA74A0605EC0CEBA90589C4A4340,ELEC,DGS MAIN,707 3rd St,"ZIG STATION 1
ZIG STATION 2
DGS ZIG",,888-758-4389,E,,Public,24 hours daily,,,,,,3,,,ChargePoint Network,http://www.mychargepoint.net/,10/09/2015,46518,2015-10-09 07:40:51+00,,,,,,,,,J1772,"707 3rd St
West Sacramento, CA 95605",38.5828963,-121.5097935,1400000US06113010101,41034
5807,0101000020E6100000E6913F1878455DC01D1F2DCE18524040,ELEC,City of Chula Vista - Civic Center North,276 Fourth Avenue,,,888-998-2546,E,,Public,MON: 24 hours | TUE: 24 hours | WED: 24 hours | THU: 24 hours | FRI: 24 hours | SAT: 24 hours | SUN: 24 hours,,,,,,7,,,Blink Network,http://www.blinknetwork.com/,10/09/2015,51772,2015-10-09 07:09:07+00,,,,,,,,,J1772,"276 Fourth Avenue
Chula Vista, CA 91910",32.641382,-117.085455,1400000US06073012402,41067
18320,0101000020E61000002D0CEC8CCA935DC05B22BCE24E174140,ELEC,BWP EV CHARGE,240 E Orange Grove Ave,"240 EAST O.G.#1
240 EAST O.G.#2",,888-758-4389,E,,Public,24 hours daily,,,,,2,2,,,ChargePoint Network,http://www.mychargepoint.net/,10/09/2015,42319,2015-10-09 07:43:52+00,,,,,,,,,NEMA520 J1772,"240 E Orange Grove Ave
Burbank, CA 91502",34.1820949,-118.3092377,1400000US06037310702,41106
13263,0101000020E61000000092448ADC935DC050D0DCF934174140,ELEC,BWP EV CHARGE,133 E Orange Grove Ave,"133 EAST O.G.#2; -
133 EAST O.G.#1; -",,888-758-4389,E,,Public,24 hours daily,,,,,2,2,,,ChargePoint Network,http://www.mychargepoint.net/,10/09/2015,42320,2015-10-09 07:43:51+00,,,,,,,,,NEMA520 J1772,"133 E Orange Grove Ave
Burbank, CA 91502",34.1813042,-118.3103357,1400000US06037310702,41106
21062,0101000020E61000001DCC26C0B0935DC00A48FB1F60174140,ELEC,BWP EV CHARGE,301 E Olive Ave,301 E OLIVE AVE,,888-758-4389,E,,Public,24 hours daily,,,,,1,1,,,ChargePoint Network,http://www.mychargepoint.net/,10/09/2015,42318,2015-10-09 07:43:52+00,,,,,,,,,NEMA520 J1772,"301 E Olive Ave
Burbank, CA 91502",34.182621,-118.307663,1400000US06037310702,41106
19395,0101000020E610000068FFA8F2E2935DC0666A12BC21174140,ELEC,BWP EV CHARGE,120 E Orange Grove Ave,"120 EAST O.G.#1; -
120 EAST O.G.#2; -",,888-758-4389,E,,Public,24 hours daily,,,,,2,2,,,ChargePoint Network,http://www.mychargepoint.net/,10/09/2015,42321,2015-10-09 07:43:52+00,,,,,,,,,NEMA520 J1772,"120 E Orange Grove Ave
Burbank, CA 91502",34.180717,-118.3107268,1400000US06037310702,41106
2063,0101000020E6100000C6A354C213795DC07C9E3F6D54FF4040,ELEC,Best Western - Tesla,18880 Gale Ave,,,626-810-1818  877-798-3752,E,,Public,"24 hours daily; for Tesla use only; for guest use only",,,,,,2,,,Tesla,http://www.teslamotors.com/supercharger,09/02/2015,68913,2015-09-02 02:43:17+00,P,,,05/01/2015,,,,,TESLA,"18880 Gale Ave
Rowland Heights, CA 91748",33.994764,-117.891831,1400000US06037408211,41121
9106,0101000020E6100000F19D98F5627B5DC0717495EEAEFF4040,ELEC,Puente Hills Nissan,17320 E Gale Ave,,,626-626-2600,E,,Public - Call ahead,Dealership business hours,,,,,,1,,,,,07/08/2015,39877,2015-07-08 14:26:19+00,P,,,03/15/2011,,,,,J1772,"17320 E Gale Ave
City of Industry, CA 91748",33.997526,-117.927915,1400000US06037408211,41121
16956,0101000020E6100000F19D98F5627B5DC0717495EEAEFF4040,ELEC,Puente Hills Nissan,17320 E Gale Ave,,,626-626-2600,E,,Private,,,,,,,1,,,,,07/08/2015,47597,2015-07-08 14:26:19+00,P,,,03/15/2011,,,,,J1772,"17320 E Gale Ave
City of Industry, CA 91748",33.997526,-117.927915,1400000US06037408211,41121
12967,0101000020E6100000AE4676A5657B5DC0FD304278B4FF4040,ELEC,BROWN AUTO GRP,17320 E Gale Ave,"QUICK CHARGER2; Located on the front right side of building by service drive",,888-758-4389,E,,Public,24 hours daily,,,,,,,1,,ChargePoint Network,http://www.mychargepoint.net/,10/09/2015,61282,2015-10-09 08:24:44+00,,,,,,,,,CHADEMO,"17320 E Gale Ave
City of Industry, CA 91748",33.997695,-117.928079,1400000US06037408211,41121
5252,0101000020E610000053B29C84D2945DC0B1242F21D50C4140,ELEC,1600 VINE,1619-1637 Argyle Ave,"1STLEVEL ST1; First level parking garage",,888-758-4389,E,,Public,24 hours daily,,,,,,2,,,ChargePoint Network,http://www.mychargepoint.net/,10/09/2015,68830,2015-10-09 08:31:58+00,,,,,,,,,J1772,"1619-1637 Argyle Ave
LA, CA 90028",34.1002542,-118.325349,1400000US06037191000,41148
10604,0101000020E6100000206118B0E4945DC0DAACFA5C6D0D4140,ELEC,Extra Space Storage,1860 Vine St,,,323-464-1194,E,,Public,24 hours daily,,,,,,1,,,,,07/08/2015,64778,2015-07-08 15:02:27+00,T,,,09/01/2014,,,,,J1772,"1860 Vine St
Los Angeles, CA 90028",34.1049,-118.326458,1400000US06037191000,41148
19066,0101000020E6100000174850FC98945DC008B53A94FC0C4140,ELEC,Toyota of Hollywood,6000 Hollywood Blvd,At N Gower St,,,E,,Private,Customer use only,,,,,,1,,,,,07/08/2015,38380,2015-07-08 15:02:40+00,P,,,11/15/2010,,,,,J1772,"6000 Hollywood Blvd
Hollywood, CA 90028",34.1014581,-118.3218375,1400000US06037191000,41148
20279,0101000020E6100000A7BFA8EEDB945DC09F4F2ED7EC0C4140,ELEC,W Hollywood Hotel - Tesla,6250 Hollywood Blvd,,,323-798-1330  877-798-3752,E,,Public,"24 hours daily; for Tesla use only; for guest use only; see valet for access",,,,,,4,,,Tesla,http://www.teslamotors.com/supercharger,,70427,2015-10-09 20:45:51+00,P,,,08/01/2015,,,,,TESLA,"6250 Hollywood Blvd
Los Angeles, CA 90028",34.1009778,-118.3259236,1400000US06037191000,41148
3862,0101000020E610000088388C38D3945DC00A140C42D40C4140,ELEC,1600 VINE,1600 Vine St,"VINE 5TH FL ST4; EV Charging restricted to 1600 Vine residents only",,888-758-4389,E,,Public,24 hours daily,,,,,,2,,,ChargePoint Network,http://www.mychargepoint.net/,10/09/2015,67989,2015-10-09 07:45:24+00,,,,,,,,,J1772,"1600 Vine St
Los Angeles, CA 90028",34.1002276,-118.3253919,1400000US06037191000,41148
7043,0101000020E6100000656EBE11DD4E5DC06440F67AF76F4040,ELEC,San Diego  Veterans Affairs Medical Center,3350 La Jolla Village Dr,,,,E,,Private,VA fleet use only,,,,,,1,,,,,08/04/2015,52468,2015-08-04 12:34:30+00,FG,19,Department of Veterans Affairs,06/30/2013,,,,,,"3350 La Jolla Village Dr
San Diego, CA 92161",32.87474,-117.232243,1400000US06073008305,41250
14420,0101000020E6100000C174B57034505DC097E71C97CCF34040,ELEC,DOTACA,14941 Riverside Dr,"STATION2
STATION1
STATION3",,888-758-4389,E,,Public,24 hours daily,,,,,,4,,,ChargePoint Network,http://www.mychargepoint.net/,10/09/2015,65359,2015-10-09 08:23:24+00,,,,,,,,,J1772,"14941 Riverside Dr
March Air Reserve Base, CA 92518",33.9046811,-117.2532007,1400000US06065046700,41250
21946,0101000020E61000009369D9FF254E5DC05BFA0240B6704040,ELEC,UCSD- Parking Lot: P703,9500 Gilman Dr,,,877-455-3833,E,,Public - Card key at all times,"24 hours daily; EVgo network subscription and key fob required",,,,,,,1,,eVgo Network,https://www.evgonetwork.com/,10/09/2015,69506,2015-10-09 08:53:42+00,,,,,,,,,,"9500 Gilman Dr
La Jolla, CA 92093",32.88056183,-117.2210693,1400000US06073008305,41250
20949,0101000020E610000007B5DFDA894F5DC0613255302A714040,ELEC,UCSD - Pangea Parking Structure,9500 Gilman Drive,,,888-998-2546,E,,Public,MON: 24 hours | TUE: 24 hours | WED: 24 hours | THU: 24 hours | FRI: 24 hours | SAT: 24 hours | SUN: 24 hours,,,,,,3,,,Blink Network,http://www.blinknetwork.com/,10/09/2015,51056,2015-10-09 07:12:45+00,,,,,,,,,J1772,"9500 Gilman Drive
La Jolla, CA 92037",32.8841,-117.242789,1400000US06073008305,41250
2310,0101000020E6100000217365506D4E5DC00C5BB39597704040,ELEC,UCSD - Thornton East Campus Parking,9300 Campus Point Dr,"EV chargers are located on 1st floor of 
the new parking structures across the 
street from the hospital. One station 
is on the East side and the other is on 
the west side.

EV chargers are located on 1st floor of 
the new parking structures across the 
street from the hospital. One station 
is on the East side and the other is on 
the west side.
",,888-998-2546,E,,Private,MON: 24 hours | TUE: 24 hours | WED: 24 hours | THU: 24 hours | FRI: 24 hours | SAT: 24 hours | SUN: 24 hours,,,,,,2,,,Blink Network,http://www.blinknetwork.com/,10/09/2015,55232,2015-10-09 07:12:45+00,,,,,,,,,J1772,"9300 Campus Point Dr
La Jolla, CA 92037",32.879626,-117.225422,1400000US06073008305,41250
11376,0101000020E6100000F819170E84525DC01F11532289F44040,ELEC,Western Municipal Water District,14205 Meridian Pkwy,Located at East Alessandro Ave and Cactus Ave,,951-571-7100,E,,Public,"7am-4:30pm daily; pay lot",,,,,,2,,,,,06/02/2015,52899,2015-06-02 18:10:00+00,LG,,,07/01/2013,,,,,J1772,"14205 Meridian Pkwy
Riverside, CA 92518",33.910435,-117.28931,1400000US06065046700,41250
10296,0101000020E61000007A50508A564F5DC06C7A50508A704040,ELEC,UCSD - Faculty Club,9500 Gilman Drive,,,888-998-2546,E,,Private,MON: 24 hours | TUE: 24 hours | WED: 24 hours | THU: 24 hours | FRI: 24 hours | SAT: 24 hours | SUN: 24 hours,,,,,,1,,,Blink Network,http://www.blinknetwork.com/,10/09/2015,52347,2015-10-09 07:12:00+00,,,,,,,,,J1772,"9500 Gilman Drive
La Jolla, CA 92037",32.879221,-117.239657,1400000US06073008305,41250
19762,0101000020E610000090BDDEFDF14E5DC0CE6F986890704040,ELEC,UCSD - Structural & Materials Engineering Building,9500 Gilman Drive,,,888-998-2546,E,,Public,MON: 24 hours | TUE: 24 hours | WED: 24 hours | THU: 24 hours | FRI: 24 hours | SAT: 24 hours | SUN: 24 hours,,,,,,2,,,Blink Network,http://www.blinknetwork.com/,10/09/2015,50150,2015-10-09 07:12:45+00,,,,,,,,,J1772,"9500 Gilman Drive
La Jolla, CA 92037",32.879407,-117.23352,1400000US06073008305,41250
9632,0101000020E610000020521DBC404F5DC004E21A4410704040,ELEC,University of California San Diego - GE,9500 Gilman Dr,,,,E,,Private,Employee use only,,,,,,2,,,,,03/04/2015,43475,2015-03-04 14:12:44+00,SG,,,01/15/2012,,,,,J1772,"9500 Gilman Dr
La Jolla, CA 92093",32.8754964,-117.2383261,1400000US06073008305,41250
8051,0101000020E61000009369D9FF254E5DC05BFA0240B6704040,ELEC,UCSD- Parking Lot: P703,9500 Gilman Dr,,,877-455-3833,E,,Public - Card key at all times,"24 hours daily; EVgo network subscription and key fob required",,,,,,,1,,eVgo Network,https://www.evgonetwork.com/,10/09/2015,69507,2015-10-09 08:53:43+00,,,,,,,,,,"9500 Gilman Dr
La Jolla, CA 92093",32.88056183,-117.2210693,1400000US06073008305,41250
17811,0101000020E61000005B785E2A364F5DC062F6B2EDB46F4040,ELEC,UCSD - Hopkins Parking,9500 Gilman Drive,,,888-998-2546,E,,Public,MON: 24 hours | TUE: 24 hours | WED: 24 hours | THU: 24 hours | FRI: 24 hours | SAT: 24 hours | SUN: 24 hours,,,,,,4,,,Blink Network,http://www.blinknetwork.com/,10/09/2015,62124,2015-10-09 07:13:50+00,,,,,,,,,J1772,"9500 Gilman Drive
La Jolla, CA 92037",32.872709,-117.237681,1400000US06073008305,41250
3234,0101000020E61000006B44D5543B235DC0826A285A5EE94040,ELEC,The Willows Historic Palm Springs Inn - Tesla,412 W Tahquitz Canyon Way,,,760-320-0771  877-798-3752,E,,Public,"24 hours daily; for Tesla use only; for guest use only; see front desk for access",,,,,,1,,,Tesla,http://www.teslamotors.com/supercharger,,70421,2015-10-09 20:44:41+00,P,,,08/01/2015,,,,,TESLA,"412 W Tahquitz Canyon Way
Palm Springs, CA 92262",33.8231919,-116.5504963,1400000US06065044606,41269
16227,0101000020E610000048B2FD1AFF225DC0A2D8655309E94040,ELEC,City of Palm Springs - Village Green,233 S Palm Canyon Dr,,,760-323-8214,E,,Public,24 hours daily,,,,,,2,,,,,10/06/2015,52610,2015-10-06 22:01:05+00,LG,,,08/06/2013,,,,,J1772,"233 S Palm Canyon Dr
Palm Springs, CA 92262",33.8205971,-116.5468204,1400000US06065044606,41269
12001,0101000020E6100000664B5645B8235DC0ACE63922DFED4040,ELEC,City of Palm Springs - Visitors Center,Indian Canyon & Tram Rd,,,760-323-8214,E,,Public,24 hours daily,,,,,,2,,,,,10/06/2015,52611,2015-10-06 22:01:06+00,LG,,,08/14/2013,,,,,J1772,"Indian Canyon &amp; Tram Rd
Palm Springs, CA 92262",33.858372,-116.558122,1400000US06065044606,41269
10216,0101000020E6100000501C40BFEF225DC00AF2B391EBE84040,ELEC,City of Palm Springs - Downtown Parking Structure,Indian Canyon Dr & Baristo Rd,,,760-323-8214,E,,Public,24 hours daily,,,,,,2,,,,,10/06/2015,52604,2015-10-06 22:11:09+00,LG,,,03/11/2013,,,,,J1772,"Indian Canyon Dr &amp; Baristo Rd
Palm Springs, CA 92264",33.819689,-116.545883,1400000US06065044606,41269
22448,0101000020E6100000E606431D56935DC0AD31E884D0ED4040,ELEC,Carl's Jr - 1360 W. 190th,1360 W. 190th St.,,,888-998-2546,E,,Public,MON: 24 hours | TUE: 24 hours | WED: 24 hours | THU: 24 hours | FRI: 24 hours | SAT: 24 hours | SUN: 24 hours,,,,,,3,,,Blink Network,http://www.blinknetwork.com/,10/09/2015,52099,2015-10-09 07:12:59+00,,,,,,,,,J1772,"1360 W. 190th St.
Torrance, CA 90501",33.857926,-118.302131,1400000US06037292000,41298
6260,0101000020E61000008A5CCBBFF1715EC0F14607A0A8754240,ELEC,Nob Hill Foods - Watsonville,1912 Main Street,,,877-455-3833,E,,Public - Card key at all times,"24 hours daily; EVgo network subscription and key fob required",,,,,,,1,,eVgo Network,https://www.evgonetwork.com/,10/09/2015,69331,2015-10-09 08:50:08+00,,,,,,,,,,"1912 Main Street
Watsonville, CA 95076",36.91920853,-121.7803802,1400000US06087110501,41385
16654,0101000020E610000099D4D00660405EC0C05E61C1FD864240,ELEC,Los Banos KOA,28485 Gonzaga Rd,,,800-562-3992,E,,Public,8am-5pm daily,,,,,10,,,,,,05/05/2015,60871,2015-05-05 11:54:36+00,P,,,12/15/2014,,,,,NEMA520,"28485 Gonzaga Rd
Gustine, CA 95322",37.054619,-121.005861,1400000US06047002100,41455
11205,0101000020E61000005A46EA3D958C5DC061A6ED5F59ED4040,ELEC,Long Beach - W Market St Parking,Long Beach Blvd & W Market St,"Surface parking lot at NE corner of 
Long Beach Blvd & W Market St.

Surface parking lot at NE corner of 
Long Beach Blvd & W Market St.

Surface parking lot at NE corner of 
Long Beach Blvd & W Market St.

Surface parking lot at NE corner of 
Long Beach Blvd & W Market St.
",,888-998-2546,E,,Private,MON: 24 hours | TUE: 24 hours | WED: 24 hours | THU: 24 hours | FRI: 24 hours | SAT: 24 hours | SUN: 24 hours,,,,,,4,,,Blink Network,http://www.blinknetwork.com/,10/09/2015,61511,2015-10-09 07:09:45+00,,,,,,,,,J1772,"Long Beach Blvd &amp; W Market St
Long Beach, CA 90805",33.85429,-118.196609,1400000US06037570304,41544
13905,0101000020E610000080A43E7F909C5DC0C8C22165D5904140,ELEC,CITY HALL,128 Rte 58,STATION 01,,888-758-4389,E,,Public,24 hours daily,,,,,,2,,,ChargePoint Network,http://www.mychargepoint.net/,10/09/2015,67187,2015-10-09 07:41:34+00,,,,,,,,,J1772,"128 Rte 58
Tehachapi, CA 93561",35.1315123,-118.4463194,1400000US06029006100,41553
20959,0101000020E61000005AB1097A39605EC071169BFB50494340,ELEC,SNG-18,500 R St,"2NDSTALLMAIN; 1st level - north side
500R STATION 03; 1st level, north side
500R STATION 04; 1st level north side
500R STATION 01; 1st level - north side 1st charger",,888-758-4389,E,,Public,24 hours daily,,,,,,7,,,ChargePoint Network,http://www.mychargepoint.net/,10/09/2015,63199,2015-10-09 07:40:36+00,,,,,,,,,J1772,"500 R St
Sacramento, CA 95811",38.5727839,-121.5035081,1400000US06067002100,41583
2086,0101000020E6100000D1741B79C5765DC0E8908AB5AED24040,ELEC,IRVINE CO OFC,111 Innovation Dr,"111 INNOVATN 02; Stations are between 111 Innovation and 121 Innovation in the upper lot near the stairs.
111 INNOVATN 03; Stations are between 111 Innovation and 121 Innvovation in the upper lot near the stairs.
111 INNOVATN 01; Station is at the back of the 111 Innovation Building.",,888-758-4389,E,,Public,24 hours daily,,,,,,5,,,ChargePoint Network,http://www.mychargepoint.net/,10/09/2015,63770,2015-10-09 07:44:30+00,,,,,,,,,J1772,"111 Innovation Dr
Irvine, CA 92617",33.6459567,-117.8558028,1400000US06059062614,41763
15704,0101000020E610000039DED38B90755DC0C350E2CEE0D24040,ELEC,UC IRVINE,Social Sciences Parking Structure Third Floor,"SSPS 3RD FLR 01; Social Sciences Parking Structure, 3d Floor.",,888-758-4389,E,,Public,24 hours daily,,,,,,1,,,ChargePoint Network,http://www.mychargepoint.net/,10/09/2015,65948,2015-10-09 07:46:03+00,,,,,,,,,J1772,"Social Sciences Parking Structure Third Floor
Irvine, CA 92617",33.6474856,-117.8369474,1400000US06059062614,41763
11079,0101000020E6100000034AF9FF27765DC01E04D31F50D34040,ELEC,UC IRVINE,4002 Mesa Rd Mesa Parking Structure,"MPS 1ST FLR 03; Mesa Parking Structure, first floor at NE corner. Permit required.
MPS 1ST FLR 01; Mesa Parking Structure, first floor at NE corner. Permit required.
MPS 1ST FLR 02; Mesa Parking Structure, first floor at NE corner. Permit required.",,888-758-4389,E,,Public,24 hours daily,,,,,3,3,,,ChargePoint Network,http://www.mychargepoint.net/,10/09/2015,43205,2015-10-09 07:46:01+00,,,,,,,,,NEMA520 J1772,"4002 Mesa Rd Mesa Parking Structure
Irvine, CA 92617",33.6508827,-117.8461914,1400000US06059062614,41763
11734,0101000020E61000001E0714A0DC755DC0F859C05F27D34040,ELEC,UC IRVINE,4242 Campus Dr Student Center Parking Structure,"SCPS 1ST FLR 03; Student Center Parking Structure, first floor at SW corner. Permit required.
SCPS 1ST FLR 02; Student Center Parking Structure, first floor at SW corner. Permit required.
SCPS 1ST FLR 01; Student Center Parking Structure, first floor at SE corner. Permit required.",,888-758-4389,E,,Public,24 hours daily,,,,,3,3,,,ChargePoint Network,http://www.mychargepoint.net/,10/09/2015,43204,2015-10-09 07:46:00+00,,,,,,,,,NEMA520 J1772,"4242 Campus Dr Student Center Parking Structure
Irvine, CA 92612",33.6496391,-117.8415909,1400000US06059062614,41763
19747,0101000020E610000026C632FD92755DC09AFC602A47D24040,ELEC,SCE-UCI,651 E Peltason Dr,"STATION 9; Located in a parking garage with fee based access
STATION 20;  Located in a parking garage with fee based access
STATION 10; Station is located in a pay to park garage. Charging is free until July 1, 2015 as a part of the Irvine Smart Grid Demonstration Project
STATION 3; Station is located in a pay to park garage. Charging is free until July 1, 2015 as a part of the Irvine Smart Grid Demonstration Project
STATION 17; Station is located in a pay to park garage. Charging is free until July 1, 2015 as a part of the Irvine Smart Grid Demonstration Project
STATION 2; Station is located in a pay to park garage. Charging is free until July 1, 2015 as a part of the Irvine Smart Grid Demonstration Project
STATION 4; Station is located in a pay to park garage. Charging is free until July 1, 2015 as a part of the Irvine Smart Grid Demonstration Project
STATION 11; Station is located in a pay to park garage. Charging is free until July 1, 2015 as a part of the Irvine Smart Grid Demonstration Project
STATION 13;  Station is located in a pay to park garage. Charging is free until July 1, 2015 as a part of the Irvine Smart Grid Demonstration Project
STATION 15; Station is located in a pay to park garage. Charging is free until July 1, 2015 as a part of the Irvine Smart Grid Demonstration Project
STATION 16; Station is located in a pay to park garage. Charging is free until July 1, 2015 as a part of the Irvine Smart Grid Demonstration Project
STATION 18; Station is located in a pay to park garage. Charging is free until July 1, 2015 as a part of the Irvine Smart Grid Demonstration Project
STATION 5; Station is located in a pay to park garage. Charging is free until July 1, 2015 as a part of the Irvine Smart Grid Demonstration Project
STATION 1; Station is located in a pay to park garage. Charging is free until July 1, 2015 as a part of the Irvine Smart Grid Demonstration Project
STATION 7; Station is located in a pay to park garage. Charging is free until July 1, 2015 as a part of the Irvine Smart Grid Demonstration Project
STATION 19; Station is located in a pay to park garage. Charging is free until July 1, 2015 as a part of the Irvine Smart Grid Demonstration Project
STATION 6; Station is located in a pay to park garage. Charging is free until July 1, 2015 as a part of the Irvine Smart Grid Demonstration Project
STATION 12; Station is located in a pay to park garage. Charging is free until July 1, 2015 as a part of the Irvine Smart Grid Demonstration Project
STATION 8; Station is located in a pay to park garage. Charging is free until July 1, 2015 as a part of the Irvine Smart Grid Demonstration Project
STATION 14; Station is located in a pay to park garage. Charging is free until July 1, 2015 as a part of the Irvine Smart Grid Demonstration Project",,888-758-4389,E,,Public,24 hours daily,,,,,,20,,,ChargePoint Network,http://www.mychargepoint.net/,10/09/2015,64872,2015-10-09 08:28:13+00,,,,,,,,,J1772,"651 E Peltason Dr
Irvine, CA 92617",33.6427968,-117.8370965,1400000US06059062614,41763
6371,0101000020E610000019DBB5CE09765DC00785F70B2CD24040,ELEC,UC IRVINE,415 E Peltason Dr,"LOT 16 MSTB 1-2; Stations are in Lot 16 near the E. Peltason  Dr. entrance, also near the MSTB bldg.
LOT 16 MSTB 3-4; Stations are in Lot 16 near the E. Peltason Dr entrance, also near the MSTB bldg.
LOT 16 MSTB 5-6; Stations are in Lot 16 near the E. Peltason Dr entrance, also near the MSTB bldg.",,888-758-4389,E,,Public,24 hours daily,,,,,,6,,,ChargePoint Network,http://www.mychargepoint.net/,10/09/2015,66593,2015-10-09 07:47:12+00,,,,,,,,,J1772,"415 E Peltason Dr
Irvine, CA 92617",33.6419692,-117.8443486,1400000US06059062614,41763
7117,0101000020E6100000EC43280090755DC028E84020E1D24040,ELEC,UC IRVINE,Social Science Parking Structure University of California,"SSPS 3RD FLR 02; Social Science Parking Structure, third floor. Permit required.",,888-758-4389,E,,Public,24 hours daily,,,,,,1,,,ChargePoint Network,http://www.mychargepoint.net/,10/09/2015,43203,2015-10-09 07:46:01+00,,,,,,,,,J1772,"Social Science Parking Structure University of California
Irvine, CA 92617",33.6474953,-117.8369141,1400000US06059062614,41763
12638,0101000020E6100000D1E80E6267755DC05B3FFD67CDD24040,ELEC,UC IRVINE,6452 Adobe Cir S,"LOT 1C 01; Station is in Lot 1C, this is the outdoor lot serving the Public Services Bld.",,888-758-4389,E,,Public,24 hours daily,,,,,,2,,,ChargePoint Network,http://www.mychargepoint.net/,10/09/2015,65072,2015-10-09 07:46:04+00,,,,,,,,,J1772,"6452 Adobe Cir S
Irvine, CA 92617",33.6468935,-117.834435,1400000US06059062614,41763
10127,0101000020E61000009CD54C08E7765DC0A482D4377AD24040,ELEC,IRVINE CO OFC,130 Theory,"130 THEORY 02; Stations are in front of the 130 Theory building.
130 THEORY 01; Stations are in front of the 130 Theory building",,888-758-4389,E,,Public,24 hours daily,,,,,,3,,,ChargePoint Network,http://www.mychargepoint.net/,10/09/2015,64158,2015-10-09 07:44:30+00,,,,,,,,,J1772,"130 Theory
Irvine, CA 92617",33.6443548,-117.8578511,1400000US06059062614,41763
11493,0101000020E6100000B41CE8A1B6545DC0DA1B7C6132174140,ELEC,California State University - San Bernadino,5500 University Pkwy,Located at the East parking structure.,,909-537-5912,E,,Public,24 hours daily,,,,,,3,,,,,08/04/2015,51945,2015-08-04 12:39:52+00,P,,,05/13/2013,,,,,J1772,"5500 University Pkwy
San Bernardino, CA 92407",34.181225,-117.323647,1400000US06071004510,41776
12531,0101000020E61000008EACFC3298545DC0D28437B57D174140,ELEC,CSUSB LOT C,5500 University Parkway,"CSUSB STAT 2; Parking Lot C North end Sierra Drive
CSUSB STAT 1; Parking Lot C, North end Sierra Drive",,888-758-4389,E,,Public,24 hours daily,,,,,,4,,,ChargePoint Network,http://www.mychargepoint.net/,10/09/2015,68946,2015-10-09 08:29:22+00,,,,,,,,,J1772,"5500 University Parkway
San Bernardino, CA 92407",34.1835238,-117.3217895,1400000US06071004510,41776
14254,0101000020E61000006CD509C35B595EC031CD74AF93424340,ELEC,MAINTENANCE-1,8300 Demetre Ave,"MAINTENANCE-1; Station Provided for Depot Park Tenants and their employees only Please. / East of intersection of Midway St and Demetre Ave",,888-758-4389,E,,Public,24 hours daily,,,,,,2,,,ChargePoint Network,http://www.mychargepoint.net/,10/09/2015,63783,2015-10-09 08:25:58+00,,,,,,,,,J1772,"8300 Demetre Ave
Sacramento, CA 95828",38.520132,-121.3962257,1400000US06067009201,41793
4042,0101000020E61000003FF0E7CA56595DC0B09701C2E2F84040,ELEC,NOTRE DAME,7085 Brockton Ave,"VISITOR PARKING; High School Visitor Parking Only, Monday through Friday",,888-758-4389,E,,Public,24 hours daily,,,,,,2,,,ChargePoint Network,http://www.mychargepoint.net/,10/09/2015,69743,2015-10-09 07:41:46+00,,,,,,,,,J1772,"7085 Brockton Ave
Riverside, CA 92506",33.9444201,-117.3959224,1400000US06065031401,41795
8510,0101000020E6100000569DD5027B965DC0852348A5D80B4140,ELEC,City of West Hollywood - Plummer Park,7377 Santa Monica Blvd,,,888-998-2546,E,,Public,MON: 24 hours | TUE: 24 hours | WED: 24 hours | THU: 24 hours | FRI: 24 hours | SAT: 24 hours | SUN: 24 hours,,,,,,2,,,Blink Network,http://www.blinknetwork.com/,10/09/2015,33547,2015-10-09 07:13:14+00,,,,,,,,,J1772,"7377 Santa Monica Blvd
West Hollywood, CA 90069",34.092549,-118.351258,1400000US06037700101,41821
21467,0101000020E610000031E24C5D43C25DC0E3AF24D4670A4240,ELEC,Merle Stone Chevrolet Cadillac,800 W Henderson,,,,E,,Private,Service center use only,,,,,,1,,,,,08/04/2015,68405,2015-08-04 13:09:00+00,P,,,04/01/2015,,,,,J1772,"800 W Henderson
Porterville, CA 93257",36.0812936,-119.0353616,1400000US06107003700,41837
15954,0101000020E6100000E027B3E66CED5EC0B48B0EED08754340,ELEC,Coast Guard House Historic Inn & Cottages,695 Arena Cove,,,707-882-2442,E,,Public - Call ahead,"24 hours daily; call ahead to make appointment",,,,,,1,,,,,07/08/2015,63371,2015-07-08 14:20:10+00,P,,,06/01/2014,,,,,J1772,"695 Arena Cove
Point Arena, CA 95468",38.9143349,-123.7097718,1400000US06045011102,41859
7710,0101000020E610000051700C5CF9EB5EC0CA8D7D24807D4340,ELEC,Manchester State Park,44500 Kinney Rd,,,707-882-2463,P,09/01/2016 12:00:00 AM,PLANNED - not yet accessible (Public),,,,,,,2,,,,,10/06/2015,70014,2015-10-06 22:10:36+00,SG,,,,,,,,J1772,"44500 Kinney Rd
Manchester, CA 95459",38.9804731,-123.6870947,1400000US06045011102,41859
13412,0101000020E6100000E9BF626850315EC01168FA360EB74240,ELEC,Ray Main Sales,13219 4th St,,,209-681-2772,E,,Public - Call ahead,"24 hours daily; call ahead",,,,,,,1,,,,08/04/2015,68397,2015-08-04 13:09:04+00,P,,,04/01/2015,,,,,CHADEMO,"13219 4th St
Hickman, CA 95323",37.4301213,-120.7705327,1400000US06047000201,41875
7911,0101000020E6100000BA4E232D955B5DC06BF294D574094140,ELEC,Kaiser Permanente - Fontana,9961 Sierra Ave.,,,888-998-2546,E,,Public,MON: 24 hours | TUE: 24 hours | WED: 24 hours | THU: 24 hours | FRI: 24 hours | SAT: 24 hours | SUN: 24 hours,,,,,,4,,,Blink Network,http://www.blinknetwork.com/,10/09/2015,6429,2015-10-09 07:09:07+00,,,,,,,,,J1772,"9961 Sierra Ave.
Fontana, CA 92335",34.073878,-117.43098,1400000US06071003302,41884
9985,0101000020E6100000A79AB40474B85DC091894AD9D8684140,ELEC,Holiday Inn Express & Suites Frazier Park Hotel,612 Wainright Ct,,,661-248-1600,P,10/01/2016 12:00:00 AM,PLANNED - not yet accessible (Public),,,,,,,,1,,,,10/06/2015,69995,2015-10-06 21:33:11+00,P,,,,,,,,CHADEMO,"612 Wainright Ct
Lebec, CA 93243",34.8191177,-118.8820812,1400000US06029003306,41887
4356,0101000020E61000003A121E238FBC5DC01245ED235C7E4140,ELEC,Petro Shopping Center - Tesla,5602 Dennis McCarthy Dr,I-5 Exit 219B,,877-798-3752,E,,Public,"24 hours daily; for Tesla use only",,,,,,,6,,Tesla,http://www.teslamotors.com/supercharger,05/05/2015,52639,2015-05-05 11:42:31+00,P,,,06/01/2013,,,,,TESLA,"5602 Dennis McCarthy Dr
Lebec, CA 93243",34.9871869,-118.9462364,1400000US06029003306,41887
22401,0101000020E6100000824C7CFFB0855EC0F0B84D5D9ED34240,ELEC,EVSP WALGREENS,164 W Jackson St,STORE 4659,,888-758-4389,E,,Public,24 hours daily,,,,,,1,,,ChargePoint Network,http://www.mychargepoint.net/,10/09/2015,69182,2015-10-09 07:43:15+00,,,,,,,,,J1772,"164 W Jackson St
Hayward, CA 94544",37.6532704,-122.0889281,1400000US06001436602,41914
16759,0101000020E610000030664B5645735EC07F15E0BBCDDB4340,ELEC,NRG eVgo - Butte College Chico,2320 Forest Ave,,,877-455-3833,E,,Public - Card key at all times,"24 hours daily; eVgo network subscription and key fob required",,,,,,1,1,,eVgo Network,https://www.evgonetwork.com/,07/08/2015,64559,2015-07-08 15:12:09+00,P,,,09/11/2014,,,,,J1772 CHADEMO,"2320 Forest Ave
Chico, CA 95928",39.717216,-121.801107,1400000US06007000903,42031
2848,0101000020E6100000707A17EFC78F5DC04703780B240E4140,ELEC,Extra Space Storage,2904 Casitas Ave,,,323-661-8122,E,,Public,24 hours daily,,,,,,1,,,,,07/08/2015,64776,2015-07-08 15:02:33+00,T,,,09/01/2014,,,,,J1772,"2904 Casitas Ave
Los Angeles, CA 90039",34.110475,-118.246578,1400000US06037187102,42115
18537,0101000020E6100000E20165532E4B5EC030325C78B9BB4240,ELEC,BESTWESTERNPLUS,2959 Speno Dr,"VILLADELLAGO6
VILLADELLAGO3
VILLADELLAGO2
VILLADELLAGO5
VILLADELLAGOINN
VILLADELLAGO4; -",,888-758-4389,E,,Public,24 hours daily,,,,,6,6,,,ChargePoint Network,http://www.mychargepoint.net/,10/09/2015,42267,2015-10-09 08:02:40+00,,,,,,,,,NEMA520 J1772,"2959 Speno Dr
Patterson, CA 95363",37.4665976,-121.1747025,1400000US06099003300,42156
14773,0101000020E61000002AA913D044605EC0BA313D61893D4340,ELEC,EVSP WALGREENS,1420 Meadowview Rd,"STORE 13597 (2)
STORE 13597",,888-758-4389,E,,Public,24 hours daily,,,,,,2,,,ChargePoint Network,http://www.mychargepoint.net/,10/09/2015,43485,2015-10-09 07:43:12+00,,,,,,,,,J1772,"1420 Meadowview Rd
Sacramento, CA 95832",38.480755,-121.5042,1400000US06067004300,42166
11921,0101000020E6100000AAF3A8F8BF545EC092CCEA1D6EF74240,ELEC,Electric Vehicles International,1627 Army Ct,,,209-939-0405,E,,Private,Employee use only,,,,,2,,,,,,08/04/2015,68394,2015-08-04 13:08:53+00,P,,,04/01/2015,,,,,NEMA520,"1627 Army Ct
Stockton, CA 95206",37.933048,-121.324217,1400000US06077000801,42188
4215,0101000020E6100000D1048A58C4195DC096ECD808C4E94040,ELEC,Light Source,30690 Hill St,,,,E,,Private,,,,,,,1,,,,,03/04/2015,46513,2015-03-04 14:12:30+00,P,,,02/15/2012,,,,,J1772,"30690 Hill St
Thousand Palms, CA 92276",33.826295,-116.402609,1400000US06065044505,42213
16817,0101000020E61000003221E692AA4B5DC0B0ABC95356634040,ELEC,USD-Manchester,1720 Via Las Cumbres,,,888-998-2546,E,,Private,MON: 24 hours | TUE: 24 hours | WED: 24 hours | THU: 24 hours | FRI: 24 hours | SAT: 24 hours | SUN: 24 hours,,,,,,8,,,Blink Network,http://www.blinknetwork.com/,10/09/2015,50967,2015-10-09 07:10:47+00,,,,,,,,,J1772,"1720 Via Las Cumbres
San Diego, CA 92110",32.776072,-117.182286,1400000US06073009000,42214
2631,0101000020E61000007C6308008E4B5DC0E4A25A4414634040,ELEC,USD-Acala Vista,1520 Via Las Cumbres,,,888-998-2546,E,,Private,MON: 24 hours | TUE: 24 hours | WED: 24 hours | THU: 24 hours | FRI: 24 hours | SAT: 24 hours | SUN: 24 hours,,,,,,6,,,Blink Network,http://www.blinknetwork.com/,10/09/2015,50965,2015-10-09 07:10:48+00,,,,,,,,,J1772,"1520 Via Las Cumbres
San Diego, CA 92110",32.774056,-117.180542,1400000US06073009000,42214
13431,0101000020E610000098B55E1D91905DC070D1C952EB134140,ELEC,GLENDALE PLAZA,655 Central Ave,"EV BAY 3&4; -",,888-758-4389,E,,Public,24 hours daily,,,,,,2,,,ChargePoint Network,http://www.mychargepoint.net/,10/09/2015,64941,2015-10-09 07:54:49+00,,,,,,,,,J1772,"655 Central Ave
Glendale, CA 91203",34.155619,-118.2588571,1400000US06037301801,42258
19484,0101000020E6100000A4D6451B91905DC0A0CB2FDEEA134140,ELEC,GLENDALE PLAZA,655 N. Central Ave,"GLENDALE PLZ 01; Parking Fees Apply: Station is on Level 3, follow signs",,888-758-4389,E,,Public,24 hours daily,,,,,,2,,,ChargePoint Network,http://www.mychargepoint.net/,10/09/2015,55814,2015-10-09 07:54:49+00,,,,,,,,,J1772,"655 N. Central Ave
Glendale, CA 91203",34.1556051,-118.2588566,1400000US06037301801,42258
536,0101000020E6100000E55D9AC7068C5DC05FCE6C57E8F94040,ELEC,AZALEA,4635 Firestone Blvd,"AZALEA1; -
AZALEA2",,888-758-4389,E,,Public,24 hours daily,,,,,,4,,,ChargePoint Network,http://www.mychargepoint.net/,10/09/2015,63217,2015-10-09 08:18:21+00,,,,,,,,,J1772,"4635 Firestone Blvd
South Gate, CA 90280",33.952403,-118.1879138,1400000US06037536000,42375
6335,0101000020E6100000C1351C3BCD4C5DC0112FF42D18074140,ELEC,Southern California Edison - Redlands Service Center,287 Tennessee St,,,,E,,Private,,,,,,,,,3 SP Inductive,,,04/03/2015,32849,2015-04-03 17:01:55+00,T,,,01/15/2008,,,,,,"287 Tennessee St
Redlands, CA 92373",34.0554254,-117.2000263,1400000US06071008100,42521
2705,0101000020E6100000364B13002D455DC0477EF59FD24D4040,ELEC,Broadway Plaza - Chula Vista,1166 Broadway,,,877-455-3833,E,,Public - Card key at all times,"24 hours daily; EVgo network subscription and key fob required",,,,,,1,2,,eVgo Network,https://www.evgonetwork.com/,10/09/2015,69375,2015-10-09 08:51:09+00,,,,,,,,,CHADEMO J1772,"1166 Broadway
Chula Vista, CA 91911",32.60799026,-117.0808716,1400000US06073013103,42663
17622,0101000020E61000006CA862748A3C5DC0434D3E8743F74040,ELEC,San Gorgonio Hospital,600 N Highland Springs Ave,,,951-845-2836,E,,Public,24 hours daily,,,,,,4,,,,,05/05/2015,66638,2015-05-05 11:57:07+00,P,,,04/01/2014,,,,,J1772,"600 N Highland Springs Ave
Banning, CA 92220",33.9317483,-116.9459506,1400000US06065044103,42783
3977,0101000020E6100000EC5DCD4B8F3C5DC0C501F4FBFEF64040,ELEC,"Walgreens - Banning, CA #5182",60 N. Highland Springs Drive,,,800-663-5633,E,,Public - Card key at all times,"MO: 12:00am-12:00am; TU: 12:00am-12:00am; WE: 12:00am-12:00am; TH: 12:00am-12:00am; FR: 12:00am-12:00am; SA: 12:00am-12:00am; SU: 12:00am-12:00am",,,,,,1,,,SemaCharge Network,http://www.semacharge.com/,10/09/2015,49322,2015-10-09 07:36:50+00,,,,,,,,,J1772,"60 N. Highland Springs Drive
Banning, CA 92220",33.9296565,-116.9462461,1400000US06065044103,42783
20047,0101000020E6100000D6C56D3400355EC090D8EE1EA0C74340,ELEC,Riverside Inn - Tesla,206 Commercial St,,,530-289-1000  877-798-3752,E,,Public,"24 hours daily; for Tesla use only; for guest use only; see front desk for access",,,,,,1,,,Tesla,http://www.teslamotors.com/supercharger,,70364,2015-10-08 18:40:27+00,P,,,06/01/2015,,,,,TESLA,"206 Commercial St
Downieville, CA 95936",39.559574,-120.8281375,1400000US06091010000,42833
10750,0101000020E61000007619FED30D7D5DC00DE4D9E55B0B4140,ELEC,Los Angeles Department of Public Works - Baldwin Park Construction Permit Office,14747 E Ramona Blvd,,,,T,,TEMPORARILY UNAVAILABLE (Private - Government only),,,,,,,,,2 Conductive 240V,,,06/02/2015,21612,2015-06-02 18:04:29+00,LG,,,,,,,,,"14747 E Ramona Blvd
Baldwin Park, CA 91706",34.088742,-117.953969,1400000US06037405102,42926
11015,0101000020E6100000153B1A87FA905EC01903EB387EE64240,ELEC,ALAMEDA,165 13th St,"ALCOPARK 2- 005; Charging stations located on second floor, next to elevators. Garage open M-F 7 AM - 7 PM
ALCOPARK 8 -005; Charging stations located on 8th floor, next to elevators. Garage open M-F 7 AM - 7 PM
ALCOPARK 8 -003; Charging stations located on 8th floor, next to elevators. Garage open M-F 7 AM - 7 PM
ALCOPARK 2-003; Charging stations located on second floor, next to elevators. Garage open M-F 7 AM - 7 PM
ALCOPARK 8 -004; Charging stations located on 8th floor, next to elevators. Garage open M-F 7 AM - 7 PM
ALCOPARK 8- 002; Charging stations located on 8th floor, next to elevators. Garage open M-F 7 AM - 7 PM
ALCOPARK 2- 002; Charging stations located on second floor, next to elevators. Garage open M-F 7 AM - 7 PM    
ALCOPARK 2- 004; Charging stations located on second floor, next to elevators. Garage open M-F 7 AM - 7 PM
ALCOPARK 8- 001; Charging stations located on 8th floor, next to elevators. Garage open M-F 7 AM - 7 PM
ALCOPARK 2- 001; Charging stations located on second floor, next to elevators. Garage open M-F 7 AM - 7 PM ",,888-758-4389,E,,Public,24 hours daily,,,,,10,10,,,ChargePoint Network,http://www.mychargepoint.net/,10/09/2015,51222,2015-10-09 07:46:28+00,,,,,,,,,NEMA520 J1772,"165 13th St
Oakland, CA 94612",37.800727,-122.265291,1400000US06001403400,42982
12245,0101000020E61000007E6FD39FFD905EC0B450D77F42E74240,ELEC,CARCHARGING,1901 Harrison St,"ACE PARKING #12; Drive down the access ramp, charging station will be on left",,888-758-4389,E,,Public,24 hours daily,,,,,1,1,,,ChargePoint Network,http://www.mychargepoint.net/,10/09/2015,47351,2015-10-09 07:55:36+00,,,,,,,,,NEMA520 J1772,"1901 Harrison St
Oakland, CA 94612",37.8067169,-122.26548,1400000US06001403400,42982
9117,0101000020E6100000D1B8269309965EC09811836511F84240,ELEC,RICHMOND,2540 Barrett Ave,"ART CENTER 03; Located in Art Center parking lot
ART CENTER 01; Located in Art Center parking lot
ART CENTER 02; Located in Art Center Parking lot",,888-758-4389,E,,Public,24 hours daily,,,,,3,3,,,ChargePoint Network,http://www.mychargepoint.net/,10/09/2015,50738,2015-10-09 07:48:49+00,,,,,,,,,NEMA520 J1772,"2540 Barrett Ave
Richmond, CA 94804",37.9380309,-122.3443344,1400000US06013374000,43015
3065,0101000020E6100000E6E5B0FB8E1D5EC05B5D4E0988114340,ELEC,Dunbar House 1880 - Tesla,271 Jones St,,,209-728-2897  877-798-3752,E,,Public,"24 hours daily; for Tesla use only; for guest use only; see front desk for access",,,,,,1,,,Tesla,http://www.teslamotors.com/supercharger,09/02/2015,68961,2015-09-02 02:45:30+00,P,,,06/01/2015,,,,,TESLA,"271 Jones St
Murphys, CA 95247",38.136964,-120.461852,1400000US06009000122,43072
2250,0101000020E61000000603194BA21F5EC0D00CE2033B124340,ELEC,Courtwood Inn - Tesla,2081 Ponderosa Way,,,209-728-8686  877-798-3752,E,,Public,"24 hours daily; for Tesla use only; for guest use only; see front desk for access",,,,,,1,,,Tesla,http://www.teslamotors.com/supercharger,09/02/2015,68956,2015-09-02 02:44:42+00,P,,,06/01/2015,,,,,TESLA,"2081 Ponderosa Way
Murphy's, CA 95247",38.142426,-120.4942806,1400000US06009000122,43072
4797,0101000020E61000007765170CAE455DC0E690798956504040,ELEC,"Walgreens - Chula Vista, CA #6255",621 I Street,,,800-663-5633,E,,Public - Card key at all times,"MO: Not Specified; TU: Not Specified; WE: Not Specified; TH: Not Specified; FR: Not Specified; SA: Not Specified; SU: Not Specified",,,,,,1,,,SemaCharge Network,http://www.semacharge.com/,10/09/2015,43812,2015-10-09 07:36:34+00,,,,,,,,,J1772,"621 I Street
Chula Vista, CA 92220",32.6276409,-117.088748,1400000US06073012600,43125
17242,0101000020E61000009013268C66C75EC0B74604E3E07A4340,ELEC,Terra Savia Winery,14160 Mountain House Rd,,,707-744-1114  877-798-3752,E,,Public,9am-5pm daily,,,,,,3,,,Tesla,http://www.teslamotors.com/supercharger,06/02/2015,67344,2015-10-09 18:36:40+00,P,,,05/01/2015,,,,,TESLA J1772,"14160 Mountain House Rd
Hopland, CA 95449",38.959988,-123.115634,1400000US06045011800,43125
15110,0101000020E61000002E01F8A754C75EC0E09C11A5BD7B4340,ELEC,Solar Living Institute,13771 S Highway 101,,,707-472-2403  877-798-3752,E,,Public,"10am-6pm daily; see front desk for access",,,,,2,2,,2 Other Conductive,Tesla,http://www.teslamotors.com/supercharger,02/03/2015,37264,2015-10-08 16:23:10+00,P,,,04/15/1989,,,,,NEMA515 TESLA,"13771 S Highway 101
Hopland, CA 95449",38.966725,-123.114542,1400000US06045011800,43125
2335,0101000020E6100000ECCA1DEC837F5DC0B48295F9FDE44040,ELEC,EVSP WALGREENS,11900 Beach Blvd,"STORE 6446; The station is located right of the store's entrance",,888-758-4389,E,,Public,24 hours daily,,,,,,1,,,ChargePoint Network,http://www.mychargepoint.net/,10/09/2015,69103,2015-10-09 07:43:05+00,,,,,,,,,J1772,"11900 Beach Blvd
Stanton, CA 90680",33.7890007,-117.9924269,1400000US06059087902,43144
7592,0101000020E6100000AFB0E07EC07A5DC039D55A9885D24040,ELEC,MONOGRAM RES,421 Bernard St,"BLUE SOL; The station is located in the parking garage",,888-758-4389,E,,Public,24 hours daily,,,,,,2,,,ChargePoint Network,http://www.mychargepoint.net/,10/09/2015,69916,2015-10-09 08:27:58+00,,,,,,,,,J1772,"421 Bernard St
Costa Mesa, CA 92627",33.644702,-117.917999,1400000US06059063702,43384
17448,0101000020E61000008E7AE3FFE99E5EC0FB0DC97F37DC4240,ELEC,PARKMERCED,350 Arballo Dr,"350 ARBALLO; -",,888-758-4389,E,,Public,24 hours daily,,,,,,1,,,ChargePoint Network,http://www.mychargepoint.net/,10/09/2015,56267,2015-10-09 07:56:31+00,,,,,,,,,J1772,"350 Arballo Dr
San Francisco, CA 94132",37.7204437,-122.4830322,1400000US06075033204,43412
7096,0101000020E6100000F901FEDFC79E5EC019D7AEBFDBDB4240,ELEC,PARKMERCED,750 Gonzalez Dr,750 GONZALES,,888-758-4389,E,,Public,24 hours daily,,,,,,1,,,ChargePoint Network,http://www.mychargepoint.net/,10/09/2015,56272,2015-10-09 07:56:33+00,,,,,,,,,J1772,"750 Gonzalez Dr
San Francisco, CA 94132",37.7176437,-122.4809494,1400000US06075033204,43412
14350,0101000020E61000003E46D49FD89E5EC0C111EEDF06DC4240,ELEC,PARKMERCED,405 Serrano Dr,"405 SERRANO; -",,888-758-4389,E,,Public,24 hours daily,,,,,,1,,,ChargePoint Network,http://www.mychargepoint.net/,10/09/2015,56269,2015-10-09 07:56:32+00,,,,,,,,,J1772,"405 Serrano Dr
San Francisco, CA 94132",37.7189598,-122.4819717,1400000US06075033204,43412
21583,0101000020E6100000575EF23FF99E5EC00791B17F43DC4240,ELEC,PARKMERCED,310 Arballo Dr,"310 ARBALLO; -",,888-758-4389,E,,Public,24 hours daily,,,,,,1,,,ChargePoint Network,http://www.mychargepoint.net/,10/09/2015,56273,2015-10-09 07:56:33+00,,,,,,,,,J1772,"310 Arballo Dr
San Francisco, CA 94132",37.7208099,-122.483963,1400000US06075033204,43412
7319,0101000020E6100000C600E4DFC29E5EC04F22C2BF08DC4240,ELEC,PARKMERCED,355 Serrano Dr,355 SERRANO,,888-758-4389,E,,Public,24 hours daily,,,,,,1,,,ChargePoint Network,http://www.mychargepoint.net/,10/09/2015,56265,2015-10-09 07:56:31+00,,,,,,,,,J1772,"355 Serrano Dr
San Francisco, CA 94132",37.719017,-122.4806442,1400000US06075033204,43412
15056,0101000020E61000007356FABFD99E5EC0BEC7F4DFDEDB4240,ELEC,PARKMERCED,810 Gonzalez Dr,810 GONZALES,,888-758-4389,E,,Public,24 hours daily,,,,,,1,,,ChargePoint Network,http://www.mychargepoint.net/,10/09/2015,56270,2015-10-09 07:56:32+00,,,,,,,,,J1772,"810 Gonzalez Dr
San Francisco, CA 94132",37.7177391,-122.4820404,1400000US06075033204,43412
9241,0101000020E6100000C32CB4731AAF5EC0E5E48FB3FA3A4340,ELEC,SCHULZ MUSEUM,2301 Hardies Ln,"CUSTOMERS ONLY; Located in the Schulz Museum Parking Lot",,888-758-4389,E,,Public,24 hours daily,,,,,,2,,,ChargePoint Network,http://www.mychargepoint.net/,10/09/2015,63006,2015-10-09 07:50:21+00,,,,,,,,,J1772,"2301 Hardies Ln
Santa Rosa, CA 95403",38.4607758,-122.7359895,1400000US06097152802,43498
16324,0101000020E6100000D26F5F07CE865EC031D120054FD54240,ELEC,McDonald's #18516 - W. A Street - Hayward CA,355 West A. Street,,,888-998-2546,E,,Public,MON: 24 hours | TUE: 24 hours | WED: 24 hours | THU: 24 hours | FRI: 24 hours | SAT: 24 hours | SUN: 24 hours,,,,,,2,,,Blink Network,http://www.blinknetwork.com/,10/09/2015,67771,2015-10-09 07:09:36+00,,,,,,,,,J1772,"355 West A. Street
Hayward, CA 94541",37.666474,-122.106325,1400000US06001436200,43516
8952,0101000020E6100000A728F27FA2875EC00680096073D54240,ELEC,Hayward F&E,19691 Hesperian Blvd,,,877-455-3833,E,,Public - Card key at all times,"24 hours daily; EVgo network subscription and key fob required",,,,,,1,2,,eVgo Network,https://www.evgonetwork.com/,10/09/2015,69387,2015-10-09 08:51:25+00,,,,,,,,,CHADEMO J1772,"19691 Hesperian Blvd
hayward, CA 94541",37.66758347,-122.1192932,1400000US06001436200,43516
14000,0101000020E6100000A8C64B3789415DC00E10CCD1E3614040,ELEC,La Mesa Springs - Vons Grocery,8011 University Ave,,,619-464-1011,E,,Public,24 hours daily,,,,,,4,,,,,07/08/2015,49121,2015-07-08 14:59:07+00,P,,,07/18/2012,,,,,J1772,"8011 University Ave
La Mesa, CA 91942",32.764765,-117.024,1400000US06073014601,43523
19355,0101000020E6100000732A19002A595EC0E1660A00024D4340,ELEC,Kaiser Morse,2025 Morse Ave,,,877-455-3833,E,,Public - Card key at all times,"24 hours daily; EVgo network subscription and key fob required",,,,,,11,,,eVgo Network,https://www.evgonetwork.com/,10/09/2015,69264,2015-10-09 08:48:26+00,,,,,,,,,J1772,"2025 Morse Ave
Sacramento, CA 95825",38.60162354,-121.3931885,1400000US06067005601,43525
3420,0101000020E6100000732A19002A595EC0E1660A00024D4340,ELEC,Kaiser Morse,2025 Morse Ave,,,877-455-3833,E,,Public - Card key at all times,"24 hours daily; EVgo network subscription and key fob required",,,,,,1,,,eVgo Network,https://www.evgonetwork.com/,10/09/2015,69267,2015-10-09 08:48:30+00,,,,,,,,,J1772,"2025 Morse Ave
Sacramento, CA 95825",38.60162354,-121.3931885,1400000US06067005601,43525
10540,0101000020E610000098288C7791595EC021A92AD9564C4340,ELEC,NIELLO VOLKSWAG,2625 Alta Arden Expy,"VW_426027_A; -",,888-758-4389,E,,Public,24 hours daily,,,,,,2,,,ChargePoint Network,http://www.mychargepoint.net/,10/09/2015,64451,2015-10-09 08:27:31+00,,,,,,,,,J1772,"2625 Alta Arden Expy
Sacramento, CA 95825",38.5964004,-121.3995036,1400000US06067005601,43525
8411,0101000020E6100000732A19002A595EC0E1660A00024D4340,ELEC,Kaiser Morse,2025 Morse Ave,,,877-455-3833,E,,Public - Card key at all times,"24 hours daily; EVgo network subscription and key fob required",,,,,,5,,,eVgo Network,https://www.evgonetwork.com/,10/09/2015,69263,2015-10-09 08:48:23+00,,,,,,,,,J1772,"2025 Morse Ave
Sacramento, CS 95825",38.60162354,-121.3931885,1400000US06067005601,43525
5504,0101000020E61000006ABC749318845DC0624A24D1CB084140,ELEC,California Air Resources Board,9530 Telstar Ave,,,626-575-6800,E,,Public,24 hours daily,,,,,,4,,,,,05/05/2015,1583,2015-05-05 11:43:50+00,SG,,,10/15/1996,,,,,J1772,"9530 Telstar Ave
El Monte, CA 91731",34.06872,-118.064,1400000US06037433101,43563
822,0101000020E61000004F0BB9AD88885DC0AC53E57B46FD4040,ELEC,Caltrans District 7,7301 E Slawson Ave,,,,P,11/01/2015 12:00:00 AM,PLANNED - not yet accessible (Private),,,,,,,2,,,,,10/06/2015,70008,2015-10-06 22:10:29+00,SG,,,,,,,,J1772,"7301 E Slawson Ave
Commerce, CA 90040",33.9787135,-118.1333422,1400000US06037532304,43571
16274,0101000020E6100000A8AB3B16DBAC5EC05D33F9669B374340,ELEC,COUNTY SONOMA,1351 Maple Avenue,"SR VETS BLDG #2; Available for Public Use with 4-hour Time Limit - Service provided by County of Sonoma
SR VETS BLDG #1; Available for Public Use with 4-hour Time Limit - Service provided by County of Sonoma",,888-758-4389,E,,Public,24 hours daily,,,,,2,2,,,ChargePoint Network,http://www.mychargepoint.net/,10/09/2015,51068,2015-10-09 08:14:31+00,,,,,,,,,NEMA520 J1772,"1351 Maple Avenue
Santa Rosa, CA 95404",38.43443,-122.700872,1400000US06097151900,43646
15636,0101000020E6100000B4893842AB875DC0B05EA0FF79F74040,ELEC,Penske Toyota Scion of Downey,9136 Firestone Blvd,,,,E,,Private,,,,,,2,,,,,,08/04/2015,60235,2015-08-04 13:12:39+00,P,,,01/01/2014,,,,,NEMA520,"9136 Firestone Blvd
Downey, CA 90241",33.9334106,-118.1198278,1400000US06037551102,43674
4836,0101000020E61000004B9352D0ED875DC0EBC5504EB4F74040,ELEC,Carl's Jr - 9002 Firestone,9002 Firestone,,,888-998-2546,E,,Public,MON: 24 hours | TUE: 24 hours | WED: 24 hours | THU: 24 hours | FRI: 24 hours | SAT: 24 hours | SUN: 24 hours,,,,,,2,,,Blink Network,http://www.blinknetwork.com/,10/09/2015,51505,2015-10-09 07:12:44+00,,,,,,,,,J1772,"9002 Firestone
Downey, CA 90241",33.93519,-118.12389,1400000US06037551102,43674
9733,0101000020E6100000A4BACA24B4D25DC023DDCF29C8234140,ELEC,CITY OF VENTURA,555 Santa Clara St,"DOWNTOWN PS 2; Zero Emissions
DOWNTOWN PS 3; Zero Emissions
DOWNTOWN PS 4; Zero Emissions
DOWNTOWN PS 1; Zero Emissions",,888-758-4389,E,,Public,24 hours daily,,,,,4,4,,,ChargePoint Network,http://www.mychargepoint.net/,10/09/2015,43506,2015-10-09 07:47:07+00,,,,,,,,,NEMA520 J1772,"555 Santa Clara St
Ventura, CA 93001",34.279546,-119.2922451,1400000US06111002400,43690
4677,0101000020E61000004CA59F7076D35DC090696D1ADB234140,ELEC,Patagonia,259 W. Santa Clara St.,,,888-998-2546,E,,Public,MON: 24 hours | TUE: 24 hours | WED: 24 hours | THU: 24 hours | FRI: 24 hours | SAT: 24 hours | SUN: 24 hours,,,,,,1,,,Blink Network,http://www.blinknetwork.com/,10/09/2015,47648,2015-10-09 07:11:05+00,,,,,,,,,J1772,"259 W. Santa Clara St.
Ventura, CA 93001",34.280124,-119.304104,1400000US06111002400,43690
18567,0101000020E61000008CF7E3F6CBD25DC00795B88E71234140,ELEC,CITY OF VENTURA,460 E Harbor Blvd,"BEACHFRONT PS#4; Zero Emissions
BEACHFRONT PS#3; Zero Emissions
BEACHFRONT PS#2
BEACHFRONT PS#1",,888-758-4389,E,,Public,24 hours daily,,,,,4,4,,,ChargePoint Network,http://www.mychargepoint.net/,10/09/2015,43504,2015-10-09 07:47:07+00,,,,,,,,,NEMA520 J1772,"460 E Harbor Blvd
Ventura, CA 93001",34.276903,-119.293699,1400000US06111002400,43690
11627,0101000020E6100000FFEA71DF6AB65DC0BFD4CF9B8A164140,ELEC,Thousand Oaks Civic Arts Plaza (City Hall),2100 Thousand Oaks Boulevard,,,888-998-2546,E,,Public,MON: 24 hours | TUE: 24 hours | WED: 24 hours | THU: 24 hours | FRI: 24 hours | SAT: 24 hours | SUN: 24 hours,,,,,,3,,,Blink Network,http://www.blinknetwork.com/,10/09/2015,64181,2015-10-09 07:12:02+00,,,,,,,,,J1772,"2100 Thousand Oaks Boulevard
Thousand Oaks, CA 91362",34.176105,-118.850273,1400000US06111007100,43730
631,0101000020E6100000425C397B67445DC01497E315884E4040,ELEC,"Walgreens - Chula Vista, CA #2623",1111 Third Ave,,,800-663-5633,E,,Public - Card key at all times,"MO: Not Specified; TU: Not Specified; WE: Not Specified; TH: Not Specified; FR: Not Specified; SA: Not Specified; SU: Not Specified",,,,,,1,,,SemaCharge Network,http://www.semacharge.com/,10/09/2015,43811,2015-10-09 07:36:33+00,,,,,,,,,J1772,"1111 Third Ave
Chula Vista, CA 91911",32.613528,-117.068816,1400000US06073013102,43802
13848,0101000020E61000003E85121C4D565EC0B65BDC9090544340,ELEC,EVSP WALGREENS,4920-4984 Madison Ave,STORE 6807,,888-758-4389,E,,Public,24 hours daily,,,,,,1,,,ChargePoint Network,http://www.mychargepoint.net/,10/09/2015,69180,2015-10-09 07:43:02+00,,,,,,,,,J1772,"4920-4984 Madison Ave
Sacramento, CA 95841",38.6606618,-121.3484564,1400000US06067007503,43821
12681,0101000020E61000004C1762F5474E5DC04339D1AE42084140,ELEC,Walmart #1693,2050 W Redlands Blvd,,,888-998-2546,E,,Public,MON: 24 hours | TUE: 24 hours | WED: 24 hours | THU: 24 hours | FRI: 24 hours | SAT: 24 hours | SUN: 24 hours,,,,,,2,,,Blink Network,http://www.blinknetwork.com/,10/09/2015,6433,2015-10-09 07:13:39+00,,,,,,,,,J1772,"2050 W Redlands Blvd
Redlands, CA 92373",34.064535,-117.223142,1400000US06071007800,43833
17944,0101000020E6100000A2D45E44DB4C5DC0E8DA17D00B084140,ELEC,Redlands Ford,1221 W Colton Ave,1121 W Colton Ave,,,E,,Private,Service center use only,,,,,,1,,,,,07/08/2015,63740,2015-07-08 14:55:30+00,P,,,08/01/2014,,,,,J1772,"1221 W Colton Ave
Redlands, CA 92374",34.0628605,-117.200883,1400000US06071007800,43833
12386,0101000020E610000001D24895724D5DC0DBC01DA853084140,ELEC,Metro Nissan of Redlands,1665 Industrial Park Ave,,,909-793-3377,E,,Private,,,,,,,1,,,,,07/08/2015,48162,2015-07-08 14:25:01+00,P,,,03/15/2011,,,,,J1772,"1665 Industrial Park Ave
Redlands, CA 92374",34.065053,-117.2101186,1400000US06071007800,43833
13013,0101000020E610000001D24895724D5DC0DBC01DA853084140,ELEC,Metro Nissan of Redlands,1665 Industrial Park Ave,,,909-793-3377,E,,Public - Call ahead,Dealership business hours,,,,,,1,1,,,,07/08/2015,39913,2015-07-08 14:25:01+00,P,,,03/15/2011,,,,,J1772 CHADEMO,"1665 Industrial Park Ave
Redlands, CA 92374",34.065053,-117.2101186,1400000US06071007800,43833
20456,0101000020E6100000DC65BFEE74975EC0892991442F494440,ELEC,Crown Nissan,300 E Cypress Ave,,,530-223-2177,E,,Private,,,,,,,1,,,,,07/08/2015,48161,2015-07-08 14:24:23+00,P,,,03/15/2011,,,,,J1772,"300 E Cypress Ave
Redding, CA 96002",40.571755,-122.366512,1400000US06089010300,44007
7873,0101000020E6100000F607CA6DFB965EC0606D31E47D494440,ELEC,Best Western - Tesla,2300 Hilltop Dr,,,530-221-6100  877-798-3752,E,,Public,"24 hours daily; for Tesla use only; for guest use only",,,,,,2,,,Tesla,http://www.teslamotors.com/supercharger,09/02/2015,68915,2015-09-02 02:43:18+00,P,,,03/01/2015,,,,,TESLA,"2300 Hilltop Dr
Redding, CA 96002",40.5741544,-122.359096,1400000US06089010300,44007
10043,0101000020E61000000975ECFB4B975EC0DCDCF35723494440,ELEC,Redding Kia,418 E Cypress Ave,,,530-226-0418,E,,Public - Call ahead,Dealership business hours,,,,,,1,,,,,10/06/2015,69734,2015-10-06 22:05:28+00,P,,,08/01/2015,,,,,J1772,"418 E Cypress Ave
Redding, CA 96002",40.5713911,-122.3640127,1400000US06089010300,44007
15962,0101000020E61000002CF9331713AD5EC07EA19119B92C4340,ELEC,ROHNERT PARK #1,495 City Center Drive,"RP1; Located in the NE corner of the City Center Plaza Parking Lot. There are two access points. 1-Enter on Lynne Conde Way to Parking Lot or, 2- Enter off City Center Dr to Parking Lot",,888-758-4389,E,,Public,24 hours daily,,,,,1,1,,,ChargePoint Network,http://www.mychargepoint.net/,10/09/2015,66710,2015-10-09 07:56:19+00,,,,,,,,,NEMA520 J1772,"495 City Center Drive
Rohnert Park, CA 94928",38.3493988,-122.7042902,1400000US06097151305,44007
22429,0101000020E6100000DC65BFEE74975EC0892991442F494440,ELEC,Crown Nissan,300 E Cypress Ave,,,530-223-2177,E,,Public - Call ahead,Dealership business hours,,,,,,1,,,,,07/08/2015,39922,2015-07-08 14:24:23+00,P,,,03/15/2011,,,,,J1772,"300 E Cypress Ave
Redding, CA 96002",40.571755,-122.366512,1400000US06089010300,44007
10799,0101000020E6100000B1B849560F545EC073C174B5705A4340,ELEC,STONES,6508 Antelope Rd,"EV 2; -
EV 1; -",,888-758-4389,E,,Public,24 hours daily,,,,,2,2,,,ChargePoint Network,http://www.mychargepoint.net/,10/09/2015,68176,2015-10-09 08:07:29+00,,,,,,,,,NEMA520 J1772,"6508 Antelope Rd
Citrus Heights, CA 95621",38.7065646,-121.3134361,1400000US06067008129,44042
16225,0101000020E6100000CC2D0840B7805DC0BF9704A0B8DF4040,ELEC,Westminster Mall,1025 Westminster Mall,,,877-455-3833,E,,Public - Card key at all times,"24 hours daily; EVgo network subscription and key fob required",,,,,,,2,,eVgo Network,https://www.evgonetwork.com/,10/09/2015,69371,2015-10-09 08:51:05+00,,,,,,,,,CHADEMO,"1025 Westminster Mall
Westminster, CA 92683",33.74782181,-118.0111847,1400000US06059099601,44568
11462,0101000020E6100000617138F32B805DC001D1DDBFC3DF4040,ELEC,Southern California Edison - Fenwick Office,14799 1/2 Chestnut St,,,,E,,Private,,,,,,,3,,3 SP Inductive,,,04/03/2015,48614,2015-04-03 17:10:37+00,T,,,09/30/2011,,,,,J1772,"14799 1/2 Chestnut St
Westminster, CA 92683",33.7481613,-118.0026825,1400000US06059099601,44568
3312,0101000020E6100000BA7DFBDFB6805DC0CC2D0840B7DF4040,ELEC,Westminster Mall,1025 Westminster Mall,,,877-455-3833,E,,Public - Card key at all times,"24 hours daily; EVgo network subscription and key fob required",,,,,,1,,,eVgo Network,https://www.evgonetwork.com/,10/09/2015,69530,2015-10-09 08:54:10+00,,,,,,,,,J1772,"1025 Westminster Mall
Westminster, CA 92683",33.74777985,-118.0111618,1400000US06059099601,44568
15312,0101000020E610000053019C830C805DC0A66BDC5152DF4040,ELEC,Southern California Edison - Orange Coast Service Center,7333 Bolsa Ave,,,,E,,Private,,,,,,,2,,1 LP Inductive  11 SP Inductive,,,04/03/2015,27315,2015-04-03 17:10:37+00,T,,,07/15/2005,,,,,J1772,"7333 Bolsa Ave
Westminster, CA 92683",33.7446997,-118.0007638,1400000US06059099601,44568
7917,0101000020E61000002AF16F86D1915EC0A6D7C11C980D4340,ELEC,LENNAR M.I.,690 Walnut Avenue,"MARE ISLAND 01; -",,888-758-4389,E,,Public,24 hours daily,,,,,,2,,,ChargePoint Network,http://www.mychargepoint.net/,10/09/2015,63357,2015-10-09 07:49:39+00,,,,,,,,,J1772,"690 Walnut Avenue
Vallejo, CA 94592",38.1062046,-122.2784134,1400000US06095250801,44661
17990,0101000020E61000001C4B0E8E48915EC0DBA09BA2C80C4340,ELEC,LENNAR M.I.,1080 Nimitz Ave,"BLDG 117 #2; Northwest corner
BLDG 117 #1; Northwest corner",,888-758-4389,E,,Public,24 hours daily,,,,,,4,,,ChargePoint Network,http://www.mychargepoint.net/,10/09/2015,63212,2015-10-09 07:49:38+00,,,,,,,,,J1772,"1080 Nimitz Ave
Vallejo, CA 94592",38.0998729,-122.2700534,1400000US06095250801,44661
17642,0101000020E61000003ECF9F36AA8E5EC095568D6F39BE4240,ELEC,CITY OF REDWOOD,850 Middlefield Rd,"DOWNTOWNCINEMA2; Jefferson underground garage, First floor
DOWNTOWNCINEMA1; Jefferson Underground Garage, First floor",,888-758-4389,E,,Public,24 hours daily,,,,,2,2,,,ChargePoint Network,http://www.mychargepoint.net/,10/09/2015,56801,2015-10-09 07:45:54+00,,,,,,,,,NEMA520 J1772,"850 Middlefield Rd
Redwood City, CA 94063",37.4861278,-122.229139,1400000US06081610202,44722
11610,0101000020E6100000A12E52288B8E5EC06C932F0D68BE4240,ELEC,CITY OF REDWOOD,750 Marshall St,"MARSHALLGARAGE1; Located at the rear Broadway St. entrance
MARSHALLGARAGE2; CT-2102 Pole Mount Unit at the rear Broadway St. entrance
L3 MARSHALL ST; -",,888-758-4389,E,,Public,24 hours daily,,,,,2,2,1,,ChargePoint Network,http://www.mychargepoint.net/,10/09/2015,39232,2015-10-09 07:48:24+00,,,,,,,,,NEMA520 J1772 CHADEMO,"750 Marshall St
Redwood City, CA 94063",37.4875504,-122.2272435,1400000US06081610202,44722
6446,0101000020E6100000A3433B02938E5EC0500B1467FBBD4240,ELEC,CITY OF REDWOOD,1044 Middlefield Rd,"MAIN LIBRARY; Located in parking lot behind Library",,888-758-4389,E,,Public,24 hours daily,,,,,1,1,,,ChargePoint Network,http://www.mychargepoint.net/,10/09/2015,41335,2015-10-09 07:45:56+00,,,,,,,,,NEMA520 J1772,"1044 Middlefield Rd
Redwood City, CA 94063",37.4842347,-122.2277227,1400000US06081610202,44722
12533,0101000020E6100000A25D85941F925EC01F0EB7E809274340,ELEC,River Terrace Inn,1600 Soscol Ave,,,707-320-9000  877-798-3752,E,,Public,"24 hours daily; see front desk for access",,,,,,3,,,Tesla,http://www.teslamotors.com/supercharger,,70363,2015-10-08 18:31:12+00,P,,,08/01/2015,,,,,TESLA J1772,"1600 Soscol Ave
Napa, CA 94559",38.3049899,-122.2831775,1400000US06055200503,44744
22467,0101000020E610000012AE36B5A2935DC0FCDA9F30CDF14040,ELEC,Gardena Nissan,1670 W Redondo Beach Blvd,,,310-532-1600,E,,Private,,,,,,,1,,,,,07/08/2015,48186,2015-07-08 14:24:40+00,P,,,03/15/2011,,,,,J1772,"1670 W Redondo Beach Blvd
Gardena, CA 90247",33.8890744,-118.3068059,1400000US06037603006,44783
15540,0101000020E610000012AE36B5A2935DC0FCDA9F30CDF14040,ELEC,Gardena Nissan,1670 W Redondo Beach Blvd,,,310-532-1600,E,,Public - Call ahead,Dealership business hours,,,,,,1,,,,,07/08/2015,39896,2015-07-08 14:24:40+00,P,,,03/15/2011,,,,,J1772,"1670 W Redondo Beach Blvd
Gardena, CA 90247",33.8890744,-118.3068059,1400000US06037603006,44783
15727,0101000020E6100000325C78B9636A5EC095CB9074175C4240,ELEC,My Nissan,222 Auto Center Cir,,,831-444-8888,E,,Public - Call ahead,Dealership business hours,,,,,,1,,,,,07/08/2015,39930,2015-07-08 14:25:14+00,P,,,03/15/2011,,,,,J1772,"222 Auto Center Cir
Salinas, CA 93907",36.7194658,-121.6623367,1400000US06053010504,44808
7023,0101000020E6100000BB270F0BB56A5EC00B98C0ADBB594240,ELEC,Rabobank - Salinas,1285 N Davis Rd,,,831-784-7700,E,,Public,24 hours daily,,,,,,1,,,,,05/05/2015,35470,2015-05-05 11:51:20+00,P,,,12/15/2009,,,,,J1772,"1285 N Davis Rd
Salinas, CA 93907",36.70104,-121.6673,1400000US06053010504,44808
10098,0101000020E6100000752CA51D6D6A5EC0A99B30067B5B4240,ELEC,Salinas Valley Ford,1100 Auto Center Cir,,,831-444-4444,E,,Public,Dealership business hours,,,,,,4,,,,,05/05/2015,63808,2015-05-05 11:52:21+00,P,,,01/01/2013,,,,,J1772,"1100 Auto Center Cir
Salinas, CA 93907",36.7146919,-121.6629099,1400000US06053010504,44808
3997,0101000020E6100000325C78B9636A5EC095CB9074175C4240,ELEC,My Nissan,222 Auto Center Cir,,,831-444-8888,E,,Private,,,,,,,1,,,,,07/08/2015,48167,2015-07-08 14:25:14+00,P,,,03/15/2011,,,,,J1772,"222 Auto Center Cir
Salinas, CA 93907",36.7194658,-121.6623367,1400000US06053010504,44808
17073,0101000020E6100000F1A0342F626A5EC07EA257A8DA5B4240,ELEC,Salinas Toyota,700 Auto Center Cir,,,,E,,Private,Service center use only,,,,,,1,,,,,07/08/2015,60445,2015-07-08 15:22:32+00,P,,,01/01/2014,,,,,,"700 Auto Center Cir
Salinas, CA 93907",36.7176104,-121.6622427,1400000US06053010504,44808
10049,0101000020E61000002E73BA2C26F35EC03F83972A62A84340,ELEC,Sea Rock Inn - Tesla,11101 Lansing St,,,707-937-0926  877-798-3752,E,,Public,"24 hours daily; for Tesla use only; for guest use only; see front desk for access",,,,,,2,,,Tesla,http://www.teslamotors.com/supercharger,,70383,2015-10-09 20:27:28+00,P,,,07/01/2015,,,,,TESLA,"11101 Lansing St
Mendocino, CA 95460",39.3154958,-123.799205,1400000US06045011002,44883
5538,0101000020E61000005DAC037B27F35EC0CAFACDC474A84340,ELEC,Agate Cove Inn - Tesla,11201 Lansing St,,,707-937-0551  877-798-3752,E,,Public,"24 hours daily; for Tesla use only; for guest use only; see front desk for access",,,,,,1,,,Tesla,http://www.teslamotors.com/supercharger,09/02/2015,68896,2015-09-02 02:42:47+00,P,,,04/01/2015,,,,,TESLA,"11201 Lansing St
Mendocino, CA 95460",39.3160635,-123.7992847,1400000US06045011002,44883
16354,0101000020E6100000C2120F289BF25EC0E8BF07AF5DA64340,ELEC,Stanford Inn by the Sea,44850 Comptche Ukiah Rd,,,707-937-5615  877-798-3752,E,,Public - Call ahead,"9:30am-10pm daily; for guest use only",,,,,,3,,,Tesla,http://www.teslamotors.com/supercharger,05/05/2015,51710,2015-10-09 19:28:52+00,P,,,04/01/2013,,,,,J1772 TESLA,"44850 Comptche Ukiah Rd
Mendocino, CA 95460",39.299734,-123.79072,1400000US06045011002,44883
21300,0101000020E61000008FE3874A23F45EC0BC033C69E1AC4340,ELEC,Point Cabrillo Light Station State Historic Park,13800 Cabrillo Dr,,,707-937-6122,P,09/01/2016 12:00:00 AM,PLANNED - not yet accessible (Public),,,,,,,2,,,,,10/06/2015,70016,2015-10-06 22:10:38+00,SG,,,,,,,,J1772,"13800 Cabrillo Dr
Mendocino, CA 95460",39.350629,-123.814654,1400000US06045011002,44883
22111,0101000020E6100000008E3D7B2EF15EC0C824236761A34340,ELEC,Van Damme State Park,8001 N Highway 1,,,707-937-0851,P,09/01/2016 12:00:00 AM,PLANNED - not yet accessible (Public),,,,,,,2,,,,,10/06/2015,69996,2015-10-06 21:57:01+00,SG,,,,,,,,J1772,"8001 N Highway 1
Little River, CA 95456",39.27641,-123.768462,1400000US06045011002,44883
8874,0101000020E61000008C4CC0AF91875DC040A0336953FF4040,ELEC,Million Dollar Baby,841 Washington Blvd,"Chargers are available 8:30AM - 3:00 PM 
Monday - Friday excluding holidays.

Chargers are available 8:30AM - 3:00 PM 
Monday - Friday excluding holidays.

Chargers are available 8:30AM - 3:00 PM 
Monday - Friday excluding holidays.
",,888-998-2546,E,,Public,MON: 24 hours | TUE: 24 hours | WED: 24 hours | THU: 24 hours | FRI: 24 hours | SAT: 24 hours | SUN: 24 hours,,,,,,3,,,Blink Network,http://www.blinknetwork.com/,10/09/2015,50945,2015-10-09 07:11:58+00,,,,,,,,,J1772,"841 Washington Blvd
Montebello, CA 90640",33.994733,-118.118267,1400000US06037532200,44902
5818,0101000020E6100000807AD8B04BEA5DC0D537D5FFDEA94240,ELEC,Chateau du Sureau - Tesla,48688 Victoria Ln,,,559-683-6860  877-798-3752,E,,Public - Call ahead,"24 hours daily; for Tesla use only; for guest use only",,,,,,2,,,Tesla,http://www.teslamotors.com/supercharger,,70318,2015-10-08 18:31:54+00,P,,,03/01/2015,,,,,TESLA,"48688 Victoria Ln
Oakhurst, CA 93644",37.3271179,-119.6608698,1400000US06039000108,44939
12907,0101000020E6100000DA8D3EE603195DC051CC30A479DC4040,ELEC,"Walgreens - Palm Desert, CA #4756",44840 Monterey Ave,,,800-663-5633,E,,Public - Card key at all times,"MO: 12:00am-12:00am; TU: 12:00am-12:00am; WE: 12:00am-12:00am; TH: 12:00am-12:00am; FR: 12:00am-12:00am; SA: 12:00am-12:00am; SU: 12:00am-12:00am",,,,,,1,,,SemaCharge Network,http://www.semacharge.com/,10/09/2015,53530,2015-10-09 07:36:50+00,,,,,,,,,J1772,"44840 Monterey Ave
Palm Desert, CA 92260",33.7224622,-116.390863,1400000US06065045108,45023
21542,0101000020E6100000B2ACEA9BEA165DC0802A6EDC62DC4040,ELEC,Indian Wells Resort Hotel,76-661 Highway 111,,,800-248-3220,E,,Public,24 hours daily,,,,,,1,,,,,05/05/2015,53905,2015-05-05 11:52:37+00,P,,,03/26/2013,,,,,J1772,"76-661 Highway 111
Indian Wells, CA 92210",33.721767,-116.3580694,1400000US06065045108,45023
10284,0101000020E61000008FDE701FB9AD5EC046B1DCD26A364340,ELEC,Nissan of Santa Rosa,1275 Santa Rosa Ave.,"Hours: - 8 AM - 7 PM Monday-Saturday - 
10 AM - 6 PM Sunday -  - 10 AM - 6 PM 
on Holidays - Closed Thanksgiving and 
Christmas
",,888-998-2546,E,,Public,MON: 8:00am-7:00pm | TUE: 8:00am-7:00pm | WED: 8:00am-7:00pm | THU: 8:00am-7:00pm | FRI: 8:00am-7:00pm | SAT: 8:00am-7:00pm | SUN: 10:00am-6:00pm,,,,,,,2,,Blink Network,http://www.blinknetwork.com/,10/09/2015,49147,2015-10-09 07:12:33+00,,,,,,,,,CHADEMO,"1275 Santa Rosa Ave.
Santa Rosa, CA 95404",38.425135,-122.714424,1400000US06097151402,45123
8856,0101000020E61000004A9A3FA6B5AD5EC010255AF278364340,ELEC,Nissan of Santa Rosa,1275 Santa Rosa Ave,,,707-545-7050,E,,Public - Call ahead,Dealership business hours,,,,,,1,,,,,07/08/2015,39943,2015-07-08 14:25:40+00,P,,,03/15/2011,,,,,J1772,"1275 Santa Rosa Ave
Santa Rosa, CA 95404",38.425566,-122.714212,1400000US06097151402,45123
13661,0101000020E610000067374426AAAD5EC0032FE9DE79364340,ELEC,Kia of Santa Rosa,1255 Santa Rosa Ave,,,855-900-7584,E,,Public,24 hours daily,,,,,,,2,,Greenlots,http://greenlots.com/,08/04/2015,68311,2015-08-04 12:55:34+00,P,,,11/01/2014,,,,,CHADEMO J1772COMBO,"1255 Santa Rosa Ave
Santa Rosa, CA 95404",38.4255942,-122.7135101,1400000US06097151402,45123
16077,0101000020E6100000782A3B585AAC5EC0B7BF69B05F324340,ELEC,The Gables Wine Country Inn - Tesla,4257 Petaluma Hill Rd,,,707-585-7777  877-798-3752,E,,Public,"24 hours daily; for Tesla use only; for guest use only; see front desk for access",,,,,,2,,,Tesla,http://www.teslamotors.com/supercharger,,70407,2015-10-09 20:38:56+00,P,,,06/01/2015,,,,,TESLA,"4257 Petaluma Hill Rd
Santa Rosa, CA 95404",38.3935452,-122.6930142,1400000US06097151402,45123
16643,0101000020E61000004A9A3FA6B5AD5EC010255AF278364340,ELEC,Nissan of Santa Rosa,1275 Santa Rosa Ave,,,707-545-7050,E,,Private,,,,,,,1,,,,,07/08/2015,60338,2015-07-08 14:25:40+00,P,,,03/15/2011,,,,,J1772,"1275 Santa Rosa Ave
Santa Rosa, CA 95404",38.425566,-122.714212,1400000US06097151402,45123
19772,0101000020E6100000E6632DF4F7785DC0E28FA2CEDCE44040,ELEC,UC UCIMC,101 The City Dr. S,"SOUTH OF B52 02; Stations are South of Bldg 52
SOUTH OF B52 01; Staions are South of Bldg 52
SOUTH OF B52 03; Stations are South of Bldg 52",,888-758-4389,E,,Public,24 hours daily,,,,,,6,,,ChargePoint Network,http://www.mychargepoint.net/,10/09/2015,46745,2015-10-09 07:48:22+00,,,,,,,,,J1772,"101 The City Dr. S
Orange, CA 92868",33.7879885,-117.8901339,1400000US06059076102,45125
18596,0101000020E6100000DE44E33F13795DC03E9CFA1FE4E34040,ELEC,Outlets of Orange,20 City Blvd W,,,877-455-3833,E,,Public - Card key at all times,"24 hours daily; EVgo network subscription and key fob required",,,,,,1,,,eVgo Network,https://www.evgonetwork.com/,10/09/2015,70123,2015-10-09 08:54:19+00,,,,,,,,,J1772,"20 City Blvd W
Orange, CA 92868",33.78039932,-117.8917999,1400000US06059076102,45125
6310,0101000020E6100000DE44E33F13795DC03E9CFA1FE4E34040,ELEC,Outlets of Orange,20 City Blvd W,,,877-455-3833,E,,Public - Card key at all times,"24 hours daily; EVgo network subscription and key fob required",,,,,,,2,,eVgo Network,https://www.evgonetwork.com/,10/09/2015,69351,2015-10-09 08:50:37+00,,,,,,,,,CHADEMO,"20 City Blvd W
Orange, CA 92868",33.78039932,-117.8917999,1400000US06059076102,45125
16327,0101000020E610000024ED461FF3105FC0D48041D2A7494440,ELEC,Victorian Inn and VI Restaurant,400 Ocean Ave,,,707-786-4949  877-798-3752,E,,Public - Call ahead,"11:30am-8:30pm daily; free for hotel and restaurant guests",,,,,,2,,,Tesla,http://www.teslamotors.com/supercharger,05/05/2015,63181,2015-10-08 16:31:28+00,P,,,09/01/2014,,,,,J1772 TESLA,"400 Ocean Ave
Ferndale, CA 95536",40.575434,-124.264839,1400000US06023011200,45136
1615,0101000020E6100000945D7A4501115FC0737511F0B5494440,ELEC,Redwood Suites - Tesla,332 Ocean Ave,,,707-786-5000  877-798-3752,E,,Public - Call ahead,"24 hours daily; for Tesla use only; available by reservation only",,,,,,1,,,Tesla,http://www.teslamotors.com/supercharger,,70357,2015-10-08 18:39:38+00,P,,,07/01/2015,,,,,TESLA,"332 Ocean Ave
Ferndale, CA 95536",40.5758648,-124.2657026,1400000US06023011200,45136
1124,0101000020E6100000602F5E3D38705EC0AFB321FFCC564340,ELEC,Trillium CNG - Yolo County Transportation District,350 Industrial Way,"On Interstate Highway 5N (from Fremont), merge onto E Main Street, toward CA-113 S / Woodland, then turn right on Industrial Way.",,800-920-1166  530-661-0816,E,,Public,24 hours daily,,,,,,2,,,,,07/08/2015,62045,2015-07-08 15:11:01+00,P,,,04/01/2014,,,,,J1772,"350 Industrial Way
Woodland, CA 95776",38.678131,-121.7534326,1400000US06113010800,45159
3435,0101000020E6100000BD5296218E715EC0BBB88D06F0564340,ELEC,City of Woodland - Public Parking,501 Court St,NE corner of Court and College Streets,,530-661-2060,E,,Public,24 hours daily,,,,,,1,,,,,10/06/2015,69945,2015-10-06 21:39:31+00,LG,,,02/10/2015,,,,,J1772,"501 Court St
Woodland, CA 95695",38.6792,-121.7743,1400000US06113010800,45159
20107,0101000020E6100000A167B3EA73715EC03B70CE88D2564340,ELEC,City of Woodland - Public Parking,617 Dead Cat Alley,Located at First St and Dead Cat Alley,,530-661-2060,E,,Public,"24 hours daily; 2 hour parking limit",,,,,,2,,,,,10/06/2015,69944,2015-10-06 22:09:28+00,LG,,,02/10/2015,,,,,J1772,"617 Dead Cat Alley
Woodland, CA 95695",38.6783,-121.7727,1400000US06113010800,45159
7741,0101000020E610000057B1F84D61845EC05B3FFD67CD1F4340,ELEC,Fairfield Transportation Center,2000 Cadenasso Dr,,,707-449-5424,E,,Public,24 hours daily,,,,,,,,2 Tesla Conductive,,,06/02/2015,35146,2015-06-02 18:13:52+00,P,,,06/15/2004,,,,,,"2000 Cadenasso Dr
Fairfield, CA 94533",38.248456,-122.068439,1400000US06095252402,45317
2955,0101000020E61000008ADEF30D16855EC0A5DEAEF25F1F4340,ELEC,Momentum Nissan,2545 Auto Mall Pkwy,,,707-402-3200,E,,Private,,,,,,,1,,,,,07/08/2015,46725,2015-07-08 14:25:03+00,P,,,01/31/2012,,,,,J1772,"2545 Auto Mall Pkwy
Fairfield, CA 94533",38.2451156,-122.0794711,1400000US06095252402,45317
21538,0101000020E610000079F0C97935855EC0A5B9BA08F81E4340,ELEC,MOMENTUM OF FLD,2855 Auto Mall Pkwy,VW_426065_A,,888-758-4389,E,,Public,24 hours daily,,,,,,2,,,ChargePoint Network,http://www.mychargepoint.net/,10/09/2015,65002,2015-10-09 08:26:30+00,,,,,,,,,J1772,"2855 Auto Mall Pkwy
Fairfield, CA 94533",38.2419444,-122.0813889,1400000US06095252402,45317
18806,0101000020E61000008ADEF30D16855EC0A5DEAEF25F1F4340,ELEC,Momentum Nissan,2545 Auto Mall Pkwy,,,707-402-3200,E,,Public - Call ahead,Dealership business hours,,,,,,1,,,,,07/08/2015,46724,2015-07-08 14:25:03+00,P,,,01/31/2012,,,,,J1772,"2545 Auto Mall Pkwy
Fairfield, CA 94533",38.2451156,-122.0794711,1400000US06095252402,45317
16278,0101000020E61000008FE4F21FD2435DC008BBF63F9FFF4040,ELEC,Fresh & Easy - Calimesa,1126 Calimesa Blvd.,,,877-455-3833,E,,Public - Card key at all times,"24 hours daily; EVgo network subscription and key fob required",,,,,,,2,,eVgo Network,https://www.evgonetwork.com/,10/09/2015,69398,2015-10-09 08:51:42+00,,,,,,,,,CHADEMO,"1126 Calimesa Blvd.
Calimesa, CA 92320",33.99704742,-117.0597,1400000US06065043802,45399
21964,0101000020E61000008FE4F21FD2435DC008BBF63F9FFF4040,ELEC,Fresh & Easy - Calimesa,1126 Calimesa Blvd.,,,877-455-3833,E,,Public - Card key at all times,"24 hours daily; EVgo network subscription and key fob required",,,,,,1,,,eVgo Network,https://www.evgonetwork.com/,10/09/2015,69287,2015-10-09 08:48:54+00,,,,,,,,,J1772,"1126 Calimesa Blvd.
Calimesa, CA 92320",33.99704742,-117.0597,1400000US06065043802,45399
18921,0101000020E610000031348DDC09735EC037C87FDCD9574240,ELEC,"Walgreens - Marina, CA #4997",226 Reservation Rd,,,800-663-5633,E,,Public - Card key at all times,"MO: Not Specified; TU: Not Specified; WE: Not Specified; TH: Not Specified; FR: Not Specified; SA: Not Specified; SU: Not Specified",,,,,,1,,,SemaCharge Network,http://www.semacharge.com/,10/09/2015,44415,2015-10-09 07:36:35+00,,,,,,,,,J1772,"226 Reservation Rd
Marina, CA 93933",36.6863361,-121.7974769,1400000US06053014202,45405
14695,0101000020E61000001DAB949EE98F5DC0C16F438CD7124140,ELEC,Glendale Civic Center,120 N Isabel St,,,818-548-3900,P,12/31/2015 12:00:00 AM,PLANNED - not yet accessible (Public),24 hours daily,,,,,,,1,,,,10/06/2015,69990,2015-10-06 21:56:53+00,LG,,,,,,,,CHADEMO,"120 N Isabel St
Glendale, CA 91206",34.147203,-118.248634,1400000US06037302002,45423
14672,0101000020E61000003E5DDDB1D88F5DC045BC75FEED124140,ELEC,Glendale Water and Power,141 N Glendale Ave,,,,E,,Private,,,,,,,1,,,,,10/06/2015,45319,2015-10-06 22:03:36+00,LG,,,01/15/2012,,,,,J1772,"141 N Glendale Ave
Glendale, CA 91206",34.147888,-118.247601,1400000US06037302002,45423
3404,0101000020E61000009A081B9E5E555EC0410FB56D184F4340,ELEC,Carmichael Library,5605 Marconi Ave,At La Vista,,916-264-2700  916-264-2920,E,,Public,24 hours daily,,,,,,1,,1 SP Inductive,,,06/02/2015,25610,2015-06-02 18:10:16+00,P,,,07/15/2004,,,,,J1772,"5605 Marconi Ave
Carmichael, CA 95608",38.617933,-121.3339,1400000US06067007701,45464
12548,0101000020E6100000DCD7817346885DC0973B33C170F84040,ELEC,City of Downey,11111 Brookshire Ave,Southwest parking lot,,562-904-7246,E,,Public,24 hours daily,,,,,,2,,,,,08/04/2015,49116,2015-08-04 13:08:23+00,LG,,,08/17/2012,,,,,J1772,"11111 Brookshire Ave
Downey, CA 90241",33.940941,-118.1293,1400000US06037550901,45566
13128,0101000020E610000006C314408CAD5EC0C80FF0FF3E384340,ELEC,CITYOFSANTAROSA,117 D St,GARAGE 9 #3,,888-758-4389,E,,Public,24 hours daily,,,,,1,1,,,ChargePoint Network,http://www.mychargepoint.net/,10/09/2015,56433,2015-10-09 07:58:04+00,,,,,,,,,NEMA520 J1772,"117 D St
Santa Rosa, CA 95404",38.4394226,-122.7116852,1400000US06097152000,45585
13849,0101000020E6100000FE5A0300ECAD5EC07788FB9F2E384340,ELEC,Santa Rosa Plaza,1071 Santa Rosa Plaza,,,877-455-3833,E,,Public - Card key at all times,"24 hours daily; EVgo network subscription and key fob required",,,,,,,1,,eVgo Network,https://www.evgonetwork.com/,10/09/2015,69401,2015-10-09 08:51:46+00,,,,,,,,,,"1071 Santa Rosa Plaza
Santa Rosa, CA 95401",38.43892288,-122.7175293,1400000US06097152000,45585
18951,0101000020E6100000FE5A0300ECAD5EC07788FB9F2E384340,ELEC,Santa Rosa Plaza,1071 Santa Rosa Plaza,,,877-455-3833,E,,Public - Card key at all times,"24 hours daily; EVgo network subscription and key fob required",,,,,,1,,,eVgo Network,https://www.evgonetwork.com/,10/09/2015,69247,2015-10-09 08:48:01+00,,,,,,,,,J1772,"1071 Santa Rosa Plaza
Santa Rosa, CA 95401",38.43892288,-122.7175293,1400000US06097152000,45585
1754,0101000020E6100000FFA2BA6FEBAD5EC0092B5FE16E384340,ELEC,Santa Rosa Plaza,1071 Santa Rosa Plaza,,,800-663-5633,E,,Public - Card key at all times,"MO: Not Specified; TU: Not Specified; WE: Not Specified; TH: Not Specified; FR: Not Specified; SA: Not Specified; SU: Not Specified",,,,,,1,,,SemaCharge Network,http://www.semacharge.com/,10/09/2015,43219,2015-10-09 07:36:16+00,,,,,,,,,J1772,"1071 Santa Rosa Plaza
Santa Rosa, CA 95401",38.4408838,-122.7174949,1400000US06097152000,45585
16206,0101000020E6100000D2C6116BF1AD5EC03B376DC669384340,ELEC,Santa Rosa Plaza,1071 Santa Rosa Plaza,,,888-998-2546,E,,Public,MON: 24 hours | TUE: 24 hours | WED: 24 hours | THU: 24 hours | FRI: 24 hours | SAT: 24 hours | SUN: 24 hours,,,,,,1,,,Blink Network,http://www.blinknetwork.com/,10/09/2015,67035,2015-10-09 07:08:59+00,,,,,,,,,J1772,"1071 Santa Rosa Plaza
Santa Rosa, CA 95401",38.440728,-122.71786,1400000US06097152000,45585
147,0101000020E6100000CEC5DFF684AD5EC021B715B13E384340,ELEC,CITYOFSANTAROSA,97 D St,"GARAGE 9 #2
GARAGE 9 #1",,888-758-4389,E,,Public,24 hours daily,,,,,2,2,,,ChargePoint Network,http://www.mychargepoint.net/,10/09/2015,48143,2015-10-09 07:58:03+00,,,,,,,,,NEMA520 J1772,"97 D St
Santa Rosa, CA 95404",38.4394132,-122.7112405,1400000US06097152000,45585
16719,0101000020E6100000A03138EFA4AD5EC02FEC7AB317384340,ELEC,CITYOFSANTAROSA,555 First Street,"GARAGE 12 #2
GARAGE 12 #1",,888-758-4389,E,,Public,24 hours daily,,,,,2,2,,,ChargePoint Network,http://www.mychargepoint.net/,10/09/2015,48142,2015-10-09 07:58:04+00,,,,,,,,,NEMA520 J1772,"555 First Street
Santa Rosa, CA 95401",38.4382233,-122.7131918,1400000US06097152000,45585
8597,0101000020E6100000F82DDF9FF7AD5EC0E88F1FE0FF374340,ELEC,CITYOFSANTAROSA,201 3rd St,"PARKING LOT 101; Parking Lot is under the 101 Freeway",,888-758-4389,E,,Public,24 hours daily,,,,,1,1,,,ChargePoint Network,http://www.mychargepoint.net/,10/09/2015,48144,2015-10-09 07:58:05+00,,,,,,,,,NEMA520 J1772,"201 3rd St
Santa Rosa, CA 95401",38.4374962,-122.7182388,1400000US06097152000,45585
652,0101000020E6100000938B31B08EAD5EC013D6C6D809384340,ELEC,CITYOFSANTAROSA,100 Santa Rosa Ave,"CITY HALL #2
CITY HALL #1",,888-758-4389,E,,Public,24 hours daily,,,,,2,2,,,ChargePoint Network,http://www.mychargepoint.net/,10/09/2015,1546,2015-10-09 07:58:04+00,,,,,,,,,NEMA520 J1772,"100 Santa Rosa Ave
Santa Rosa, CA 95404",38.4378005,-122.711834,1400000US06097152000,45585
7813,0101000020E610000032AEB8382A935DC04982700514F24040,ELEC,EVSP WALGREENS,1344 W Redondo Beach Blvd,"STORE 7175; The station is located left of the store's entrance",,888-758-4389,E,,Public,24 hours daily,,,,,,1,,,ChargePoint Network,http://www.mychargepoint.net/,10/09/2015,43817,2015-10-09 07:43:04+00,,,,,,,,,J1772,"1344 W Redondo Beach Blvd
Gardena, CA 90247",33.891236,-118.299452,1400000US06037603004,45611
1948,0101000020E6100000CD1FD3DA34505DC08350DEC7D1B04040,ELEC,Fallbrook Branch Library,124 S Mission Rd,,,760-731-4650,P,05/01/2016 12:00:00 AM,PLANNED - not yet accessible (Public),24 hours daily,,,,,,35,,,,,10/06/2015,69984,2015-10-06 21:33:10+00,LG,,,,,,,,J1772,"124 S Mission Rd
Fallbrook, CA 92028",33.381402,-117.253226,1400000US06073018904,45625
10270,0101000020E61000000A25389AC8AE5EC020402BD5AA3A4340,ELEC,Coddingtown Mall,733 Coddingtown Mall,,,800-663-5633,E,,Public - Card key at all times,"MO: Not Specified; TU: Not Specified; WE: Not Specified; TH: Not Specified; FR: Not Specified; SA: Not Specified; SU: Not Specified",,,,,,2,,,SemaCharge Network,http://www.semacharge.com/,10/09/2015,43827,2015-10-09 07:36:23+00,,,,,,,,,J1772,"733 Coddingtown Mall
Santa Rosa, CA 95401",38.4583384,-122.7309938,1400000US06097153001,45662
5886,0101000020E6100000FEF73B6FBEAE5EC07EF2C17CC33A4340,ELEC,Coddingtown Mall,733 Coddingtown Mall,,,888-998-2546,E,,Public,MON: 24 hours | TUE: 24 hours | WED: 24 hours | THU: 24 hours | FRI: 24 hours | SAT: 24 hours | SUN: 24 hours,,,,,,2,,,Blink Network,http://www.blinknetwork.com/,10/09/2015,67012,2015-10-09 07:09:00+00,,,,,,,,,J1772,"733 Coddingtown Mall
Santa Rosa, CA 95401",38.4590908,-122.7303732,1400000US06097153001,45662
12271,0101000020E610000089B7CEBFDDAE5EC0E096FA3FA83A4340,ELEC,Whole Foods - Santa Rosa,733 Coddingtown Center,,,877-455-3833,E,,Public - Card key at all times,"24 hours daily; EVgo network subscription and key fob required",,,,,,1,2,,eVgo Network,https://www.evgonetwork.com/,10/09/2015,69380,2015-10-09 08:51:17+00,,,,,,,,,CHADEMO J1772,"733 Coddingtown Center
Santa Rosa, CA 95401",38.45825958,-122.7322845,1400000US06097153001,45662
17650,0101000020E6100000FB1AEEC8FDAE5EC0CDC5843D923A4340,ELEC,CTPLAZA #1,1420 Guerneville Rd,"CTPLAZA #1; The station is located near the entrance",,888-758-4389,E,,Public,24 hours daily,,,,,,2,,,ChargePoint Network,http://www.mychargepoint.net/,10/09/2015,69708,2015-10-09 08:28:12+00,,,,,,,,,J1772,"1420 Guerneville Rd
Santa Rosa, CA 95403",38.4575879,-122.7342398,1400000US06097153001,45662
15589,0101000020E61000004E637B2DE8445DC076887FD8D2504040,ELEC,CPEX,590 3rd Ave,"ASSESSOR'S OFF; Located at Assessor's Center",,888-758-4389,E,,Public,24 hours daily,,,,,,2,,,ChargePoint Network,http://www.mychargepoint.net/,10/09/2015,70110,2015-10-09 08:32:02+00,,,,,,,,,J1772,"590 3rd Ave
Chula Vista, CA 91910",32.6314345,-117.076671,1400000US06073013000,45673
16870,0101000020E61000009FDC007D6C6A5DC039758AFAC9BF4040,ELEC,Union Bank - Tesla,31971 Camino Capistrano,I-5 at CA-74 Exit,,877-798-3752,E,,Public,"24 hours daily; for Tesla use only",,,,,,,7,,Tesla,http://www.teslamotors.com/supercharger,05/05/2015,61674,2015-05-05 11:48:41+00,P,,,05/01/2014,,,,,TESLA,"31971 Camino Capistrano
San Juan Capistrano, CA 92675",33.4983514,-117.6628716,1400000US06059042312,45821
19483,0101000020E61000009F3BC1FEEB515EC00EF62686E4104340,ELEC,Hutchins Street Square Community Center,125 S Hutchins St,,,209-333-6815,E,,Public,24 hours daily,,,,,,1,,,,,05/05/2015,51920,2015-05-05 11:51:40+00,LG,,,03/19/2013,,,,,J1772,"125 S Hutchins St
Lodi, CA 95240",38.131974,-121.280029,1400000US06077004204,45842
7380,0101000020E61000002B685A6265515EC069C537143E114340,ELEC,Lodi Downtown Parking Structure,50 N Sacramento St,,,209-333-6815,E,,Public,24 hours daily,,,,,,1,,,,,05/05/2015,51922,2015-05-05 11:51:42+00,LG,,,03/19/2013,,,,,J1772,"50 N Sacramento St
Lodi, CA 95240",38.134707,-121.271813,1400000US06077004204,45842
14872,0101000020E6100000DEC9A7C7B6515EC014ECBFCE4D114340,ELEC,City of Lodi - Finance Department,310 W Elm St,,,209-333-6815,E,,Public,24 hours daily,,,,,,1,,,,,05/05/2015,51919,2015-05-05 11:57:33+00,LG,,,03/19/2013,,,,,J1772,"310 W Elm St
Lodi, CA 95240",38.135187,-121.276781,1400000US06077004204,45842
18805,0101000020E610000059969E9F98515EC0C1148A1986114340,ELEC,Lodi Public Library,201 W Locust St,,,209-333-6815,E,,Public,24 hours daily,,,,,,1,,,,,05/05/2015,51923,2015-05-05 11:42:18+00,LG,,,03/19/2013,,,,,J1772,"201 W Locust St
Lodi, CA 95240",38.1369049,-121.2749404,1400000US06077004204,45842
8831,0101000020E61000000745F30016095FC089CE328B50644440,ELEC,St. Joseph Hospital - Parking Lot,2700 Dolbeer St,,,707-445-8121,P,05/01/2016 12:00:00 AM,PLANNED - not yet accessible (Public),,,,,,,1,,,,,10/06/2015,69982,2015-10-06 21:56:57+00,LG,,,,,,,,J1772,"2700 Dolbeer St
Eureka, CA 95501",40.783708,-124.141968,1400000US06023000600,45861
12191,0101000020E61000008033E7CFEDF65DC031A53F451FF04240,ELEC,Evergreen Lodge,33160 Evergreen Rd,,,209-379-2606  877-798-3752,E,,Public,"24 hours daily; for guest use only; see front desk for access",,,,,,2,,,Tesla,http://www.teslamotors.com/supercharger,09/02/2015,68966,2015-09-02 02:45:34+00,P,,,06/01/2015,,,,,TESLA J1772,"33160 Evergreen Rd
Groveland, CA 95321",37.8759543,-119.8582649,1400000US06109004200,45905
13301,0101000020E6100000F5A0A014AD0E5EC0FDB0EFD46DEB4240,ELEC,Groveland Hotel - Tesla,18767 Main St,,,209-962-4000  877-798-3752,E,,Public,"24 hours daily; free for hotel guests or $5 charge for non-guests; see front desk for access ",,,,,,1,,,Tesla,http://www.teslamotors.com/supercharger,02/03/2015,65460,2015-10-09 19:09:27+00,P,,,08/01/2014,,,,,TESLA,"18767 Main St
Groveland, CA 95321",37.8392893,-120.229314,1400000US06109004200,45905
20970,0101000020E6100000051A6CEA3C7C5EC0412D060FD3304340,ELEC,Nissan of Vacaville,671 Orange Dr,,,707-455-4500,E,,Public - Call ahead,Dealership business hours,,,,,,1,,,,,07/08/2015,39953,2015-07-08 14:25:42+00,P,,,03/15/2011,,,,,J1772,"671 Orange Dr
Vacaville, CA 95687",38.381441,-121.941218,1400000US06095252911,46042
1280,0101000020E61000004029FFFFA47C5EC05BA5AABF14304340,ELEC,KOHL'S,570 Orange Dr,"VACAVILLE; EV Charging for Kohl's Customers Only - 4 hour max",,888-758-4389,E,,Public,24 hours daily,,,,,1,1,,,ChargePoint Network,http://www.mychargepoint.net/,10/09/2015,42278,2015-10-09 08:07:58+00,,,,,,,,,NEMA520 J1772,"570 Orange Dr
Vacaville, CA 95687",38.3756332,-121.9475708,1400000US06095252911,46042
11272,0101000020E61000000ACA236E047C5EC03670AC3022314340,ELEC,VACAVILLE VW,580 Orange Dr,VW_426114_A,,888-758-4389,E,,Public,24 hours daily,,,,,,2,,,ChargePoint Network,http://www.mychargepoint.net/,10/09/2015,66937,2015-10-09 08:26:27+00,,,,,,,,,J1772,"580 Orange Dr
Vacaville, CA 95687",38.3838559,-121.9377704,1400000US06095252911,46042
8553,0101000020E6100000179F02603C7D5EC07DC908A0FF2E4340,ELEC,Vacaville Premium Outlets,301 Nut Tree Road,,,877-455-3833,E,,Public - Card key at all times,"24 hours daily; EVgo network subscription and key fob required",,,,,,1,2,,eVgo Network,https://www.evgonetwork.com/,10/09/2015,69342,2015-10-09 08:50:23+00,,,,,,,,,J1772 CHADEMO,"301 Nut Tree Road
Vacaville, CA 95687",38.36717606,-121.95681,1400000US06095252911,46042
15150,0101000020E6100000B271B32E247D5EC000A94D9CDC2E4340,ELEC,Vacaville Premium Outlets - Tesla,321 Nut Tree Rd,I-80 Exit 56,,877-798-3752,E,,Public,"24 hours daily; for Tesla use only",,,,,,,8,,Tesla,http://www.teslamotors.com/supercharger,05/05/2015,53926,2015-05-05 11:41:52+00,P,,,12/15/2013,,,,,TESLA,"321 Nut Tree Rd
Vacaville, CA 95687",38.3661075,-121.9553334,1400000US06095252911,46042
16035,0101000020E6100000051A6CEA3C7C5EC0412D060FD3304340,ELEC,Nissan of Vacaville,671 Orange Dr,,,707-455-4500,E,,Private,,,,,,,1,,,,,07/08/2015,48064,2015-07-08 14:25:42+00,P,,,03/15/2011,,,,,J1772,"671 Orange Dr
Vacaville, CA 95687",38.381441,-121.941218,1400000US06095252911,46042
10416,0101000020E61000005FDED2203B7D5EC08EBE9360BB2E4340,ELEC,Vacaville Premium Outlets,321 Nut Tree Road,,,888-998-2546,E,,Public,MON: 24 hours | TUE: 24 hours | WED: 24 hours | THU: 24 hours | FRI: 24 hours | SAT: 24 hours | SUN: 24 hours,,,,,,2,,,Blink Network,http://www.blinknetwork.com/,10/09/2015,66857,2015-10-09 07:10:51+00,,,,,,,,,J1772,"321 Nut Tree Road
Vacaville, CA 95687",38.3650933,-121.9567339,1400000US06095252911,46042
7539,0101000020E61000002503401537585DC02C67EF8CB6984040,ELEC,NCTD-Oceanside Transit Center,235 South Tremont Street,,,888-998-2546,E,,Public,MON: 24 hours | TUE: 24 hours | WED: 24 hours | THU: 24 hours | FRI: 24 hours | SAT: 24 hours | SUN: 24 hours,,,,,,7,,,Blink Network,http://www.blinknetwork.com/,10/09/2015,47628,2015-10-09 07:13:12+00,,,,,,,,,J1772,"235 South Tremont Street
Oceanside, CA 92054",33.193071,-117.378362,1400000US06073018400,46094
4694,0101000020E6100000747918FFE3345EC0306BBD3A225D4340,ELEC,El Dorado County Government Center,330 Fair Ln,Located at building B,,530-621-7501,E,,Public,24 hours daily,,,,,,10,,,,,07/08/2015,68153,2015-07-08 14:58:52+00,LG,,,04/01/2015,,,,,J1772,"330 Fair Ln
Placerville, CA 95667",38.7276071,-120.8264158,1400000US06017031000,46140
16050,0101000020E61000002D9F9BECD5EA5DC0FE76233D56AB4240,ELEC,Veterans Affairs Outpatient Clinic,40597 Westlake Dr,,,559-683-5300,E,,Public,24 hours daily,,,,,,1,,,,,08/04/2015,68408,2015-08-04 13:09:16+00,FG,19,Department of Veterans Affairs,04/01/2015,,,,,J1772,"40597 Westlake Dr
Oakhurst, CA 93644",37.3385693,-119.6693069,1400000US06039000103,46140
3436,0101000020E6100000C6F594415AE95DC0BD0402F802AB4240,ELEC,Best Western Plus Yosemite Gateway Inn,40530 Highway 41,,,559-642-6038,E,,Public - Call ahead,"24 hours daily; for guest use only",,,,,,1,,,,,08/04/2015,68388,2015-08-04 13:08:47+00,P,,,04/01/2015,,,,,J1772,"40530 Highway 41
Oakhurst, CA 93644",37.3360281,-119.6461338,1400000US06039000103,46140
177,0101000020E6100000A245B6F3FD345EC053E8BCC62E5D4340,ELEC,El Dorado County Government Center,2850 Fairlane Ct,Building C parking lot,,530-621-5300,E,,Public,24 hours daily,,,,,,2,,,,,07/08/2015,25522,2015-07-08 15:22:56+00,P,,,05/15/2004,,,,,J1772,"2850 Fairlane Ct
Placerville, CA 95667",38.72799,-120.828,1400000US06017031000,46140
14341,0101000020E6100000EE0E84BFBA495EC08A9125732C154340,ELEC,The Inn at Locke House - Tesla,19960 Elliott Rd,,,209-727-5715  877-798-3752,E,,Public,"24 hours daily; for Tesla use only; for guest use only; see front desk for access",,,,,,1,,,Tesla,http://www.teslamotors.com/supercharger,,70409,2015-10-09 20:39:40+00,P,,,08/01/2015,,,,,TESLA,"19960 Elliott Rd
Lockeford, CA 95237",38.165419,-121.1520232,1400000US06077004701,46148
6261,0101000020E610000004F6E2D583505DC05D42F45ABF984040,ELEC,VISTA,435 La Tortuga Dr,"02
03
01
VISTA - 04",,888-758-4389,E,,Public,24 hours daily,,,,,,4,,,ChargePoint Network,http://www.mychargepoint.net/,10/09/2015,66692,2015-10-09 08:24:55+00,,,,,,,,,J1772,"435 La Tortuga Dr
Vista, CA 92081",33.1933397,-117.2580466,1400000US06073019701,46154
15012,0101000020E610000092A7F63386515DC0448A01124D984040,ELEC,MOSSY BMW,1715 Hacienda Dr,STATION 01,,888-758-4389,E,,Public,24 hours daily,,,,,,2,,,ChargePoint Network,http://www.mychargepoint.net/,10/09/2015,62477,2015-10-09 07:50:46+00,,,,,,,,,J1772,"1715 Hacienda Dr
Vista, CA 92081",33.189852,-117.2738161,1400000US06073019701,46154
19605,0101000020E6100000AA0B1DE0EE9E5EC005B0F99F99D94240,ELEC,Westlake Shopping Center - Daly City,247 Lake Merced Blvd-EV,,,877-455-3833,E,,Public - Card key at all times,"24 hours daily; EVgo network subscription and key fob required",,,,,,1,2,,eVgo Network,https://www.evgonetwork.com/,10/09/2015,69600,2015-10-09 08:55:28+00,,,,,,,,,J1772 CHADEMO,"247 Lake Merced Blvd-EV
Daly City, CA 94015",37.70000076,-122.4833298,1400000US06081600800,46206
13466,0101000020E6100000C7116BF1297A5DC0FC3905F9D9104140,ELEC,City of Azusa - San Gabriel & W. 6th,San Gabriel & W. 6th,,,888-998-2546,E,,Public,MON: 24 hours | TUE: 24 hours | WED: 24 hours | THU: 24 hours | FRI: 24 hours | SAT: 24 hours | SUN: 24 hours,,,,,,,2,,Blink Network,http://www.blinknetwork.com/,10/09/2015,51502,2015-10-09 07:13:17+00,,,,,,,,,CHADEMO,"San Gabriel &amp; W. 6th
Azusa, CA 91702",34.131652,-117.90881,1400000US06037404301,46219
19731,0101000020E61000007A37161406A65DC074D99E0F85184140,ELEC,ESSEX,21201 Kittridge St,"REVEAL; -",,888-758-4389,E,,Public,24 hours daily,,,,,,2,,,ChargePoint Network,http://www.mychargepoint.net/,10/09/2015,63092,2015-10-09 07:42:24+00,,,,,,,,,J1772,"21201 Kittridge St
Los Angeles, CA 91303",34.1915607,-118.594121,1400000US06037134903,46250
11046,0101000020E6100000DE9046054E805DC0E15E99B7EA0C4140,ELEC,Clean Fuel Connection Inc,11800 Clarke St,,,888-890-4638,E,,Private,"Public charging available in emergency situations; call ahead for arrangements",,,,,,1,,1 SP Inductive,,,05/05/2015,21791,2015-05-05 11:55:22+00,P,,,09/15/2002,,,,,J1772,"11800 Clarke St
Arcadia, CA 91006",34.100913,-118.004762,1400000US06037432500,46383
21060,0101000020E6100000255AF2785A455EC0C9FF89366C734340,ELEC,City of Auburn - Train Station,11500 Blocker Dr,Train Station Parking Lot,,530-823-4211,E,,Public,24 hours daily,,,,,,1,,,,,05/05/2015,64700,2015-05-05 11:55:32+00,LG,,,12/01/2014,,,,,J1772,"11500 Blocker Dr
Auburn, CA 95603",38.9017399,-121.083647,1400000US06061020300,46448
18874,0101000020E6100000F41373B53A455EC0711871A6AE734340,ELEC,Placer County Personnel Office,145 Fulweiler Ave,,,530-745-7536,E,,Public,24 hours daily,,,,,,1,,1 SP Inductive,,,06/02/2015,51911,2015-06-02 17:48:19+00,LG,,,03/15/2013,,,,,J1772,"145 Fulweiler Ave
Auburn, CA 95603",38.9037674,-121.0817083,1400000US06061020300,46448
9813,0101000020E610000006C8862469455EC013EA8E6A7D734340,ELEC,Creekside Business Park,11641 Blocker Dr,,,530-745-9801,E,,Public,24 hours daily,,,,,,5,,,,,05/05/2015,53366,2015-05-05 11:49:33+00,P,,,03/28/2013,,,,,J1772,"11641 Blocker Dr
Auburn, CA 95603",38.9022649,-121.0845424,1400000US06061020300,46448
7195,0101000020E6100000997E8978EB7D5DC08E9257E718E24040,ELEC,Orange County Nissan of Garden Grove,9222 Trask Ave,,,714-537-0900,E,,Private,,,,,,,1,,,,,07/08/2015,48185,2015-07-08 14:25:55+00,P,,,03/15/2011,,,,,J1772,"9222 Trask Ave
Garden Grove, CA 92844",33.766385,-117.967497,1400000US06059088901,46495
3912,0101000020E6100000997E8978EB7D5DC08E9257E718E24040,ELEC,Orange County Nissan of Garden Grove,9222 Trask Ave,,,714-537-0900,E,,Public - Call ahead,Dealership business hours,,,,,,1,,,,,07/08/2015,39895,2015-07-08 14:25:55+00,P,,,03/15/2011,,,,,J1772,"9222 Trask Ave
Garden Grove, CA 92844",33.766385,-117.967497,1400000US06059088901,46495
8098,0101000020E6100000D061BEBC008A5DC07B6B60AB04014140,ELEC,"Carl's Jr - 5501 Telegraph, City of Commerce",5501 Telegraph,,,888-998-2546,E,,Public,MON: 24 hours | TUE: 24 hours | WED: 24 hours | THU: 24 hours | FRI: 24 hours | SAT: 24 hours | SUN: 24 hours,,,,,,4,,,Blink Network,http://www.blinknetwork.com/,10/09/2015,61805,2015-10-09 07:11:35+00,,,,,,,,,J1772,"5501 Telegraph
City of Commerce, CA 90040",34.007955,-118.156295,1400000US06037532303,46596
13222,0101000020E610000029E8F692C6895DC07E8B4E965A014140,ELEC,Los Angeles County - Health Services,5555 Ferguson Dr,Located in rear parking lot ,,323-267-2023,E,,Public,"24 hours daily; keypad activated, instructions on EVSE",,,,,,4,,,,,06/02/2015,63735,2015-06-02 18:19:43+00,LG,,,10/01/2014,,,,,J1772,"5555 Ferguson Dr
Commerce, CA 90022",34.010577,-118.152745,1400000US06037532303,46596
8752,0101000020E6100000DD240681954A5DC08577B988EF664040,ELEC,Mesa College,7250 Mesa College Drive,,,888-998-2546,E,,Public,MON: 6:00am-11:00pm | TUE: 6:00am-11:00pm | WED: 6:00am-11:00pm | THU: 6:00am-11:00pm | FRI: 6:00am-5:00pm,,,,,,5,,,Blink Network,http://www.blinknetwork.com/,10/09/2015,44974,2015-10-09 07:13:30+00,,,,,,,,,J1772,"7250 Mesa College Drive
San Diego, CA 92111",32.804185,-117.165375,1400000US06073008510,46638
2875,0101000020E6100000A44808A0E27D5EC070F408A05E2D4340,ELEC,Sequoia River Oaks,1000 Allison Drive,,,877-455-3833,E,,Public - Card key at all times,"24 hours daily; EVgo network subscription and key fob required",,,,,,1,,,eVgo Network,https://www.evgonetwork.com/,10/09/2015,69225,2015-10-09 08:47:32+00,,,,,,,,,J1772,"1000 Allison Drive
Vacaville, CA 94596",38.35445023,-121.9669571,1400000US06095253105,46651
14257,0101000020E6100000AF25E4839E7D5EC01ABFF04A922D4340,ELEC,Vacaville Cultural Center,1000 Ulatis Dr,,,707-449-5424,E,,Public,24 hours daily,,,,,,1,,1 SP Inductive,,,06/02/2015,25511,2015-06-02 18:10:46+00,LG,,,06/15/2004,,,,,J1772,"1000 Ulatis Dr
Vacaville, CA 95687",38.356027,-121.9628,1400000US06095253105,46651
2439,0101000020E6100000FCE4284014E25CC01B4B581B63614040,ELEC,Imperial Valley Mall - Tesla,3551 S Dogwood Rd,,,877-798-3752,E,,Public,"24 hours daily; for Tesla use only",,,,,,,8,,Tesla,http://www.teslamotors.com/supercharger,02/03/2015,65084,2015-02-03 18:12:43+00,P,,,01/01/2015,,,,,TESLA,"3551 S Dogwood Rd
El Centro, CA 92243",32.760837,-115.532486,1400000US06025011300,46682
9648,0101000020E61000002700B507907E5DC0C52C6AE67F114140,ELEC,Nissan of Duarte,1434 Buena Vista St,,,626-305-3000,E,,Private,,,,,,,1,,,,,07/08/2015,47605,2015-07-08 14:26:08+00,P,,,03/15/2011,,,,,J1772,"1434 Buena Vista St
Duarte, CA 91010",34.1367157,-117.9775409,1400000US06037430101,46687
13442,0101000020E61000002700B507907E5DC0C52C6AE67F114140,ELEC,Nissan of Duarte,1434 Buena Vista St,,,626-305-3000,E,,Public - Call ahead,Dealership business hours,,,,,,1,,,,,07/08/2015,39885,2015-07-08 14:26:08+00,P,,,03/15/2011,,,,,J1772,"1434 Buena Vista St
Duarte, CA 91010",34.1367157,-117.9775409,1400000US06037430101,46687
17832,0101000020E61000009F5A7D7555C25DC05952EE3EC7A74140,ELEC,Nissan of Bakersfield,2800 Pacheco Rd,,,661-835-8600,E,,Public - Call ahead,Dealership business hours,,,,,,1,1,,,,07/08/2015,39871,2015-07-08 14:25:20+00,P,,,03/15/2011,,,,,J1772 CHADEMO,"2800 Pacheco Rd
Bakersfield, CA 93313",35.310768,-119.036466,1400000US06029003112,46773
11666,0101000020E61000009F5A7D7555C25DC05952EE3EC7A74140,ELEC,Nissan of Bakersfield,2800 Pacheco Rd,,,661-835-8600,E,,Private,,,,,,,1,,,,,07/08/2015,47591,2015-07-08 14:25:20+00,P,,,03/15/2011,,,,,J1772,"2800 Pacheco Rd
Bakersfield, CA 93313",35.310768,-119.036466,1400000US06029003112,46773
2973,0101000020E6100000F9707FE48C8E5EC07610E09975BF4240,ELEC,Boardwalk Nissan,1 Bair Island Rd,,,650-364-0100,E,,Public - Call ahead,Dealership business hours,,,,,,1,,,,,07/08/2015,39923,2015-07-08 14:24:01+00,P,,,03/15/2011,,,,,J1772,"1 Bair Island Rd
Redwood City, CA 94063",37.4957764,-122.2273494,1400000US06081610302,46776
17024,0101000020E61000003B1BF2CF0C8E5EC0179B560A81C04240,ELEC,Seaport Plaza,100-200 Cardinal Way,,,888-998-2546,E,,Public,MON: 24 hours | TUE: 24 hours | WED: 24 hours | THU: 24 hours | FRI: 24 hours | SAT: 24 hours | SUN: 24 hours,,,,,,1,,,Blink Network,http://www.blinknetwork.com/,10/09/2015,65366,2015-10-09 07:10:39+00,,,,,,,,,J1772,"100-200 Cardinal Way
Redwood City, CA 94063",37.503938,-122.219532,1400000US06081610302,46776
5424,0101000020E6100000E0089CB6908E5EC0DBFD2AC077BF4240,ELEC,BOARDWALK VW,1 Bair Island Rd,VW_426074,,888-758-4389,E,,Public,24 hours daily,,,,,,2,,,ChargePoint Network,http://www.mychargepoint.net/,10/09/2015,61156,2015-10-09 08:27:07+00,,,,,,,,,J1772,"1 Bair Island Rd
Redwood City, CA 94063",37.495842,-122.2275826,1400000US06081610302,46776
21194,0101000020E6100000AA9ECC3F7A8E5EC08FCCFAFF7EBF4240,ELEC,Boardwalk Nissan,1 Bair Island Road,,,877-455-3833,E,,Public - Card key at all times,"24 hours daily; EVgo network subscription and key fob required",,,,,,,1,,eVgo Network,https://www.evgonetwork.com/,10/09/2015,69597,2015-10-09 08:55:23+00,,,,,,,,,CHADEMO,"1 Bair Island Road
Redwood City, CA 94063",37.49606323,-122.2262115,1400000US06081610302,46776
17725,0101000020E6100000A01A2FDD248E5EC0D788601C5CC04240,ELEC,CardioDx - Britannia Seaport Centre,600 Saginaw Drive,,,888-998-2546,E,,Public,MON: 24 hours | TUE: 24 hours | WED: 24 hours | THU: 24 hours | FRI: 24 hours | SAT: 24 hours | SUN: 24 hours,,,,,,4,,,Blink Network,http://www.blinknetwork.com/,10/09/2015,65396,2015-10-09 07:10:36+00,,,,,,,,,J1772,"600 Saginaw Drive
Redwood City, CA 94063",37.502811,-122.221,1400000US06081610302,46776
17117,0101000020E6100000F9707FE48C8E5EC07610E09975BF4240,ELEC,Boardwalk Nissan,1 Bair Island Rd,,,650-364-0100,E,,Private,,,,,,,1,,,,,07/08/2015,48163,2015-07-08 14:24:01+00,P,,,03/15/2011,,,,,J1772,"1 Bair Island Rd
Redwood City, CA 94063",37.4957764,-122.2273494,1400000US06081610302,46776
14456,0101000020E61000001E705D31238E5EC032B08EE387C04240,ELEC,Seaport Plaza - Relypsa Fleet,100 Cardinal Way,"Free workplace chargers for Relypsa 
EE's only

Free workplace chargers for Relypsa 
EE's only
",,888-998-2546,E,,Private,MON: 24 hours | TUE: 24 hours | WED: 24 hours | THU: 24 hours | FRI: 24 hours | SAT: 24 hours | SUN: 24 hours,,,,,,2,,,Blink Network,http://www.blinknetwork.com/,10/09/2015,70118,2015-10-09 07:14:01+00,,,,,,,,,J1772,"100 Cardinal Way
Redwood City, CA 94063",37.504147,-122.220898,1400000US06081610302,46776
10263,0101000020E6100000225D22CD0E8D5EC02949F0E95EC14240,ELEC,Informatica,2100 Seaport Blvd,,,,E,,Private,Employee use only,,,,,,6,,,,,05/05/2015,51938,2015-05-05 11:55:33+00,P,,,05/15/2013,,,,,J1772,"2100 Seaport Blvd
San Bruno, CA 94063",37.51070904,-122.2040284,1400000US06081610302,46776
19122,0101000020E61000005E3013A0017C5DC025DA02004FEB4040,ELEC,Anaheim Plaza,440 North Euclid Street,,,877-455-3833,E,,Public - Card key at all times,"24 hours daily; EVgo network subscription and key fob required",,,,,,,2,,eVgo Network,https://www.evgonetwork.com/,10/09/2015,69323,2015-10-09 08:49:55+00,,,,,,,,,CHADEMO,"440 North Euclid Street
Anaheim, CA 92801",33.83834839,-117.9375992,1400000US06059087200,46786
18069,0101000020E6100000AD855968E77A5DC0323CF6B358EA4040,ELEC,Anaheim Police Department,425 S. Harbor Blvd.,,,888-998-2546,E,,Private,MON: 24 hours | TUE: 24 hours | WED: 24 hours | THU: 24 hours | FRI: 24 hours | SAT: 24 hours | SUN: 24 hours,,,,,,2,,,Blink Network,http://www.blinknetwork.com/,10/09/2015,51202,2015-10-09 07:09:40+00,,,,,,,,,J1772,"425 S. Harbor Blvd.
Anaheim, CA 92805",33.830832,-117.920374,1400000US06059087200,46786
20594,0101000020E61000000C056C0723735EC0D2FE0758AB004340,ELEC,"Walgreens - Oakland, CA #11706",301 E 18th Street,,,800-663-5633,E,,Public - Card key at all times,"MO: 12:00am-12:00am; TU: 12:00am-12:00am; WE: 12:00am-12:00am; TH: 12:00am-12:00am; FR: 12:00am-12:00am; SA: 12:00am-12:00am; SU: 12:00am-12:00am",,,,,,1,,,SemaCharge Network,http://www.semacharge.com/,10/09/2015,43210,2015-10-09 07:36:20+00,,,,,,,,,J1772,"301 E 18th Street
Oakland, CA 94606",38.005229,-121.799013,1400000US06013306003,46904
3054,0101000020E6100000868F882991975DC0064A0A2C80FB4040,ELEC,Affordable Stage,647 Augusta St.,"Code: 1790
",,888-998-2546,E,,Public,MON: 24 hours | TUE: 24 hours | WED: 24 hours | THU: 24 hours | FRI: 24 hours | SAT: 24 hours | SUN: 24 hours,,,,,,1,,,Blink Network,http://www.blinknetwork.com/,10/09/2015,47613,2015-10-09 07:13:48+00,,,,,,,,,J1772,"647 Augusta St.
Inglewood, CA 90302",33.964849,-118.368235,1400000US06037601302,46960
1378,0101000020E61000003CE6F2D5C47B5DC06C9E7EABD0FF4040,ELEC,PUENTE HILLS VW,17110 E Gale Ave,VW_422104_A,,888-758-4389,E,,Public,24 hours daily,,,,,,2,,,ChargePoint Network,http://www.mychargepoint.net/,10/09/2015,64945,2015-10-09 07:45:59+00,,,,,,,,,J1772,"17110 E Gale Ave
City of Industry, CA 91745",33.9985556,-117.9338889,1400000US06037408202,46979
2107,0101000020E61000000B28D4D3478D5EC072F8A41309BE4240,ELEC,Silver Spring Networks,585 Broadway Street,"Available 7AM to 6PM M-F only for free 
public charging.

Available 7AM to 6PM M-F only for free 
public charging.

Available 7AM to 6PM M-F only for free 
public charging.

Available 7AM to 6PM M-F only for free 
public charging.

Available 7AM to 6PM M-F only for free 
public charging.
",,888-998-2546,E,,Public,MON: 24 hours | TUE: 24 hours | WED: 24 hours | THU: 24 hours | FRI: 24 hours | SAT: 24 hours | SUN: 24 hours,,,,,,4,2,,Blink Network,http://www.blinknetwork.com/,10/09/2015,49988,2015-10-09 07:10:40+00,,,,,,,,,CHADEMO J1772,"585 Broadway Street
Redwood City, CA 94063",37.484652,-122.207509,1400000US06081610201,46994
712,0101000020E61000002298593AD58D5EC0CA671E6569BE4240,ELEC,CITY OF REDWOOD,1400 Broadway,"PUBLIC WORKS; IN BACK OF PARKING LOT",,888-758-4389,E,,Public,24 hours daily,,,,,,2,,,ChargePoint Network,http://www.mychargepoint.net/,10/09/2015,67180,2015-10-09 07:45:58+00,,,,,,,,,J1772,"1400 Broadway
Redwood City, CA 94063",37.4875914,-122.2161394,1400000US06081610201,46994
8611,0101000020E61000008F56105E16695EC0F6ACB54137D34340,ELEC,Butte College - Lot 1C,3536 Butte Campus Dr,,,530-895-2351,E,,Public,24 hours daily,,,,,2,,,,,,10/06/2015,70019,2015-10-06 22:10:15+00,P,,,12/05/2014,,,,,NEMA520,"3536 Butte Campus Dr
Oroville, CA 95965",39.6501238,-121.6419902,1400000US06007002200,47014
15958,0101000020E61000008F56105E16695EC0F6ACB54137D34340,ELEC,Butte College - Lot 3B,3536 Butte Campus Dr,,,530-895-2351,E,,Public,24 hours daily,,,,,2,,,,,,10/06/2015,70020,2015-10-06 22:10:23+00,P,,,12/05/2014,,,,,NEMA520,"3536 Butte Campus Dr
Oroville, CA 95965",39.6501238,-121.6419902,1400000US06007002200,47014
19852,0101000020E6100000DE4724C09F785DC082B8FE9FBBD94040,ELEC,Bristol Plaza - Santa Ana,"3329 South Bristol, Unit A",,,877-455-3833,E,,Public - Card key at all times,"24 hours daily; EVgo network subscription and key fob required",,,,,,1,1,,eVgo Network,https://www.evgonetwork.com/,10/09/2015,69394,2015-10-09 08:51:37+00,,,,,,,,,J1772,"3329 South Bristol, Unit A
Santa Ana, CA 92704",33.70103836,-117.8847504,1400000US06059074006,47030
16498,0101000020E610000098F49C99858E5DC001EEC38BCFF64040,ELEC,Los Angeles County Sheriff - Century Station,11705 S Alameda ,,,323-267-2023,E,,Public,"Garage business hours; pay lot; keypad activated, instructions on EVSE",,,,,,2,,,,,06/02/2015,63059,2015-06-02 18:01:35+00,LG,,,08/01/2014,,,,,J1772,"11705 S Alameda
Lynwood, CA 90059",33.9282088,-118.2269043,1400000US06037540501,47035
2611,0101000020E61000001FD61BB5C2D25DC0E109BDFE24244140,ELEC,CITY OF VENTURA,501 Poli St,"CITY HALL #2; Zero Emissions
CITY HALL; Zero Emissions",,888-758-4389,E,,Public,24 hours daily,,,,,2,2,,,ChargePoint Network,http://www.mychargepoint.net/,10/09/2015,43505,2015-10-09 07:47:07+00,,,,,,,,,NEMA520 J1772,"501 Poli St
Ventura, CA 93001",34.282379,-119.293134,1400000US06111002102,47065
15569,0101000020E610000071E7C2482FFE5DC08C0FB3976D774340,ELEC,El Dorado County Government Center,1360 Johnson Blvd,,,530-573-3155,E,,Public,24 hours daily,,,,,,4,,,,,07/08/2015,68152,2015-07-08 14:23:25+00,LG,,,04/01/2015,,,,,J1772,"1360 Johnson Blvd
South Lake Tahoe, CA 96150",38.933032,-119.971636,1400000US06017030200,47083
12941,0101000020E6100000FE65F7E4615D5DC00DE02D90A0F44040,ELEC,Galleria at Tyler,1299 Galleria at Tyler,,,951-351-3110,E,,Public,Mall business hours,,,,,,6,,,,,05/05/2015,6425,2015-05-05 11:54:19+00,P,,,08/30/1997,,,,,J1772,"1299 Galleria at Tyler
Riverside, CA 92503",33.91115,-117.4591,1400000US06065031601,47135
12103,0101000020E61000001B834E081D5D5EC03E117AEC1D464340,ELEC,EVSP WALGREENS,2900 Stockton Blvd,STORE 5374,,888-758-4389,E,,Public,24 hours daily,,,,,,1,,,ChargePoint Network,http://www.mychargepoint.net/,10/09/2015,43822,2015-10-09 07:43:12+00,,,,,,,,,J1772,"2900 Stockton Blvd
Sacramento, CA 95817",38.5477882,-121.454897,1400000US06067001800,47217
18676,0101000020E61000008639419B1C565EC0E57E87A240534340,ELEC,American River College Automotive Technology Building,4700 College Oak Dr,,,916-484-8354,E,,Public,"Garage business hours; parking permit required",,,,,,1,,,,,10/06/2015,70070,2015-10-06 21:57:16+00,P,,,07/13/2012,,,,,J1772,"4700 College Oak Dr
Sacramento, CA 95841",38.65041,-121.345496,1400000US06067007504,47250
4127,0101000020E61000002B8DF3925A235DC01F300F99F2EE4040,ELEC,City of Palm Springs - James O Jessie Desert Highland Unity Center,480 Tramview Rd,,,760-323-8214,E,,Public,24 hours daily,,,,,,2,,,,,10/06/2015,52607,2015-10-06 22:01:09+00,LG,,,09/01/2013,,,,,J1772,"480 Tramview Rd
Palm Springs, CA 92262",33.8667785,-116.5524032,1400000US06065044605,47431
1677,0101000020E610000009FB761211C75DC01C615111A70F4140,ELEC,Naval Base - Ventura Point Mugu,NA,Bldg 63,,,E,,Private,Solar-powered,,,,,,,,,,,01/06/2015,48711,2015-01-06 17:49:24+00,FG,14,Department of Navy,08/01/2012,,,,,,"NA
Point Mugu, CA 93042",34.122286,-119.110417,1400000US06111004600,47609
2039,0101000020E61000009E7532DD10965EC0D618198975FB4240,ELEC,EVSP WALGREENS,14280 San Pablo Ave,"STORE 13796; The station is located left of the store's entrance",,888-758-4389,E,,Public,24 hours daily,,,,,,1,,,ChargePoint Network,http://www.mychargepoint.net/,10/09/2015,42276,2015-10-09 07:43:13+00,,,,,,,,,J1772,"14280 San Pablo Ave
San Pablo, CA 94806",37.9645244,-122.3447793,1400000US06013367200,47667
19173,0101000020E61000007C9DD497A58C5EC01FBB0B9414DE4240,ELEC,Bank of America,333 Hegenberger Road,,,888-998-2546,E,,Private,MON: 24 hours | TUE: 24 hours | WED: 24 hours | THU: 24 hours | FRI: 24 hours | SAT: 24 hours | SUN: 24 hours,,,,,,2,,,Blink Network,http://www.blinknetwork.com/,10/09/2015,65646,2015-10-09 07:10:33+00,,,,,,,,,J1772,"333 Hegenberger Road
Oakland, CA 94621",37.735003,-122.197607,1400000US06001409000,47717
6627,0101000020E610000086F766E5A88D5EC0BF750F1A0BDB4240,ELEC,OAK INT AIRPORT,1 Airport Drive,"PREMIER 2; Premier Parking Lot
PREMIER 4; Premier Parking Lot
PREMIER 5; Premier Parking Lot
PREMIER 6; Premier Parking Lot
PREMIER 1; Premier Parking Lot
PREMIER 7; Premier Parking Lot
PREMIER 3; Premier Parking Lot 
PREMIER ADA; Premier Parking Lot / ADA",,888-758-4389,E,,Public,24 hours daily,,,,,8,8,,,ChargePoint Network,http://www.mychargepoint.net/,10/09/2015,38926,2015-10-09 08:05:30+00,,,,,,,,,NEMA520 J1772,"1 Airport Drive
Oakland, CA 94621",37.7112763,-122.2134336,1400000US06001409000,47717
22289,0101000020E6100000F6C07DD3AA8D5EC05EB7ADD282DB4240,ELEC,OAK INT AIRPORT,Alan Shepard Way,"EMPL LOT 214-1; For Employees with Permit Access Only. Located between Airport Dr and John Glenn Dr.",,888-758-4389,E,,Public,24 hours daily,,,,,1,1,,,ChargePoint Network,http://www.mychargepoint.net/,10/09/2015,66713,2015-10-09 08:18:23+00,,,,,,,,,NEMA520 J1772,"Alan Shepard Way
Oakland, CA 94621",37.7149299,-122.2135514,1400000US06001409000,47717
11048,0101000020E61000009A6A1CA0EA8C5EC0BCF957A027DD4240,ELEC,CARCHARGING,1 Hegenberger Rd,"ACE PARKING #17; EVSE located to the left of the large Hilton sign.",,888-758-4389,E,,Public,24 hours daily,,,,,,1,,,ChargePoint Network,http://www.mychargepoint.net/,10/09/2015,51930,2015-10-09 07:55:39+00,,,,,,,,,J1772,"1 Hegenberger Rd
Oakland, CA 94621",37.7277718,-122.2018204,1400000US06001409000,47717
12867,0101000020E61000007D3F355EBA8D5EC0166A4DF38EDB4240,ELEC,Oakland Airport - Economy Lot,1 Airport Dr,"Enter Economy Parking Lot; turn to left. Stations located near corner of John Glenn and Alan Shepard",,510-563-3300,E,,Public,"24 hours daily; pay lot",,,,,,2,,1 SP Inductive,,,06/02/2015,50736,2015-06-02 18:10:13+00,P,,,12/20/2012,,,,,J1772,"1 Airport Dr
Oakland, CA 94621",37.7153,-122.2145,1400000US06001409000,47717
2267,0101000020E610000036AB3E575B8D5EC07A36AB3E57DB4240,ELEC,Oakland Airport - Daily B Lot,1 Airport Dr,"Enter Economy Parking Lot; turn to left. Stations located near corner of John Glenn and Alan Shepard",,510-563-3300,E,,Public,"24 hours daily; pay lot",,,,,,2,,,,,06/02/2015,33695,2015-06-02 18:10:58+00,P,,,12/31/2008,,,,,J1772,"1 Airport Dr
Oakland, CA 94621",37.7136,-122.2087,1400000US06001409000,47717
20595,0101000020E610000038F17AD5EF495DC0846F50B120C24040,ELEC,TEMECULA NISSAN,41895 Motor Car Pkwy,"QUICK CHARGER1; Located by the flag pole near the patio",,888-758-4389,E,,Public,24 hours daily,,,,,,,1,,ChargePoint Network,http://www.mychargepoint.net/,10/09/2015,61068,2015-10-09 07:52:28+00,,,,,,,,,CHADEMO,"41895 Motor Car Pkwy
Temecula, CA 92591",33.5166227,-117.1552633,1400000US06065043216,47746
10916,0101000020E61000003CD05499F3495DC0B0E600C11CC24040,ELEC,Quality Nissan - Temecula,41895 Motor Car Pkwy,,,951-676-6601,E,,Private,,,,,,,1,,,,,07/08/2015,60340,2015-07-08 14:26:23+00,P,,,03/15/2011,,,,,J1772,"41895 Motor Car Pkwy
Temecula, CA 92591",33.5165025,-117.1554931,1400000US06065043216,47746
20355,0101000020E61000003CD05499F3495DC0B0E600C11CC24040,ELEC,Quality Nissan - Temecula,41895 Motor Car Pkwy,,,951-676-6601,E,,Public - Call ahead,Dealership business hours,,,,,,1,,,,,07/08/2015,39949,2015-07-08 14:26:23+00,P,,,03/15/2011,,,,,J1772,"41895 Motor Car Pkwy
Temecula, CA 92591",33.5165025,-117.1554931,1400000US06065043216,47746
12895,0101000020E6100000D1949D7ED0495DC09AC7ABBD99C14040,ELEC,Rancho Ford,26895 Ynez Rd,,,,E,,Private,Service center use only,,,,,,1,,,,,07/08/2015,53922,2015-07-08 15:00:08+00,P,,,11/01/2013,,,,,J1772,"26895 Ynez Rd
Temecula, CA 92591",33.5125043,-117.1533505,1400000US06065043216,47746
957,0101000020E6100000C4F41840D38E5EC0B917FB3FC5BD4240,ELEC,Whole Foods - Redwood City,1250 Jefferson Ave,,,877-455-3833,E,,Public - Card key at all times,"24 hours daily; EVgo network subscription and key fob required",,,,,,1,2,,eVgo Network,https://www.evgonetwork.com/,10/09/2015,69393,2015-10-09 08:51:36+00,,,,,,,,,CHADEMO J1772,"1250 Jefferson Ave
Redwood City, CA 94062",37.48258209,-122.2316437,1400000US06081610203,47800
19188,0101000020E61000003A6DD795E09E5EC0D41BFF4F0F284340,ELEC,The Fairmont Sonoma Mission Inn & Spa - Tesla,100 Boyes Blvd,,,707-938-9000  877-798-3752,E,,Public,"24 hours daily; for Tesla use only; for guest use only; see valet for access",,,,,,2,,,Tesla,http://www.teslamotors.com/supercharger,,70406,2015-10-09 20:38:28+00,P,,,08/01/2015,,,,,TESLA,"100 Boyes Blvd
Sonoma, CA 95476",38.3129673,-122.4824576,1400000US06097150305,47835
7056,0101000020E6100000B19EFFC302695EC00EAB2E96D8564240,ELEC,Salinas Super 8,131 Kern ST,"These stations are available for the use of the general public
These stations are available for the use of the general public",,800-663-5633,E,,Public - Card key at all times,"MO: 12:00am-12:00am; TU: 12:00am-12:00am; WE: 12:00am-12:00am; TH: 12:00am-12:00am; FR: 12:00am-12:00am; SA: 12:00am-12:00am; SU: 12:00am-12:00am",,,,,,2,,,SemaCharge Network,http://www.semacharge.com/,10/09/2015,69912,2015-10-09 07:37:30+00,,,,,,,,,J1772,"131 Kern ST
Salinas, CA 93905",36.6784847,-121.6407938,1400000US06053000502,48050
21256,0101000020E6100000ED212B091A2C5EC0DE4C96A47CD24140,ELEC,The Oaks Hotel,3000 Riverside Avenue,"null
null
null
null",,800-663-5633,E,,Public - Card key at all times,"MO: Not Specified; TU: Not Specified; WE: Not Specified; TH: Not Specified; FR: Not Specified; SA: Not Specified; SU: Not Specified",,,,,,4,,,SemaCharge Network,http://www.semacharge.com/,10/09/2015,53532,2015-10-09 07:36:53+00,,,,,,,,,J1772,"3000 Riverside Avenue
Paso Robles, CA 93446",35.6444288,-120.6890891,1400000US06079010102,48138
7736,0101000020E610000020B41EBE4C2C5EC085B4C6A013D04140,ELEC,Paso Robles Inn,1103 Spring St,,,800-676-1713  877-798-3752,E,,Public,"24 hours daily; for guest use only",,,,,,2,,,Tesla,http://www.teslamotors.com/supercharger,,70352,2015-10-08 18:28:49+00,P,,,07/01/2015,,,,,TESLA J1772,"1103 Spring St
Paso Robles, CA 93446",35.625599,-120.692184,1400000US06079010102,48138
16750,0101000020E6100000E4DE5740FC2B5EC04D2ABFB10CD24140,ELEC,Best Western Plus Black Oak,1135 24th St,,,805-238-4740 ,E,,Public,"24 hours daily; guest use only",,,,,,2,,,,,05/05/2015,62976,2015-05-05 11:50:33+00,P,,,07/01/2014,,,,,J1772,"1135 24th St
Paso Robles, CA 93446",35.6410124,-120.6872712,1400000US06079010102,48138
14823,0101000020E61000008A0629780A2C5EC02920ED7F80CF4140,ELEC,PASO ROBLES,624 Pine St,"STATION 1; -
STATION 2; -",,888-758-4389,E,,Public,24 hours daily,,,,,,4,,,ChargePoint Network,http://www.mychargepoint.net/,10/09/2015,69720,2015-10-09 07:41:47+00,,,,,,,,,J1772,"624 Pine St
Paso Robles, CA 93446",35.621109,-120.688139,1400000US06079010102,48138
10075,0101000020E6100000FF5E65C80C2C5EC0DB6B41EF8DD24140,ELEC,The Oaks Hotel - Tesla,3000 Riverside Ave,,,805-237-8700  877-798-3752,E,,Public,"24 hours daily; for Tesla use only; for guest use only; see front desk for access",,,,,,3,,,Tesla,http://www.teslamotors.com/supercharger,,70412,2015-10-09 20:41:06+00,P,,,08/01/2015,,,,,TESLA,"3000 Riverside Ave
Paso Robles, CA 93446",35.6449565,-120.6882802,1400000US06079010102,48138
20025,0101000020E6100000A539686531995DC03387495DD7154140,ELEC,ESSEX,12005 Albers St,AVERY APTS,,888-758-4389,E,,Public,24 hours daily,,,,,,2,,,ChargePoint Network,http://www.mychargepoint.net/,10/09/2015,60532,2015-10-09 07:42:18+00,,,,,,,,,J1772,"12005 Albers St
Los Angeles, CA 91607",34.1706349,-118.3936399,1400000US06037125100,48154
17846,0101000020E61000005C8C26BCA98A5DC04F79CFDC9EF94040,ELEC,Central Ford,5645 Firestone Blvd,,,562-927-7888,E,,Public,Dealership business hours,,,,,,2,,,,,05/05/2015,63653,2015-05-05 11:52:24+00,P,,,12/01/2013,,,,,J1772,"5645 Firestone Blvd
South Gate, CA 90280",33.9501606,-118.1666098,1400000US06037536102,48348
6604,0101000020E61000005173A895F8C85DC01BDC31D010264240,ELEC,Monarch Ford,132 N D St,,,,E,,Private,Service center use only,,,,,,2,,,,,08/04/2015,68404,2015-08-04 13:09:03+00,P,,,04/01/2015,,,,,J1772,"132 N D St
Exeter, CA 93221",36.2973881,-119.1401724,1400000US06107001501,48354
13479,0101000020E61000007D5237618C805DC03074362E2DE14040,ELEC,LADWP - Haynes Power Plant,6801 Westminster Ave,,,,E,,Private - Government only,,,,,,,,,1 SP Inductive,,,03/04/2015,1531,2015-03-04 14:25:03+00,LG,,,10/15/1999,,,,,,"6801 Westminster Ave
Long Beach, CA 90803",33.7591913,-118.0085681,1400000US06059099903,48359
20046,0101000020E6100000200A664CC1535EC0E4F6CB272B604340,ELEC,EVSP WALGREENS,3999 Foothills Blvd,"STORE 5501 #2
STORE 5501 #1",,888-758-4389,E,,Public,24 hours daily,,,,,,2,,,ChargePoint Network,http://www.mychargepoint.net/,10/09/2015,69803,2015-10-09 07:43:13+00,,,,,,,,,J1772,"3999 Foothills Blvd
Roseville, CA 95747",38.751317,-121.308673,1400000US06061020908,48361
269,0101000020E61000005C01857AFA735EC056664AEB6F414440,ELEC,Mt. Lassedn Park & Shingletown Campground - Tesla,7749 KOA Rd,,,530-474-3024  877-798-3752,E,,Public,"24 hours daily; for Tesla use only; see front desk for access",,,,,,2,,,Tesla,http://www.teslamotors.com/supercharger,,70339,2015-10-08 18:36:01+00,P,,,08/01/2015,,,,,TESLA,"7749 KOA Rd
Shingletown, CA 96088",40.511228,-121.812163,1400000US06089012603,48431
7427,0101000020E6100000652E15C0394D5EC0C6ECFA3FE6664340,ELEC,Rocklin Commons,5190 Commons Dr.,,,877-455-3833,E,,Public - Card key at all times,"24 hours daily; EVgo network subscription and key fob required",,,,,,2,,,eVgo Network,https://www.evgonetwork.com/,10/09/2015,69358,2015-10-09 08:50:46+00,,,,,,,,,J1772,"5190 Commons Dr.
Rocklin, CA 95677",38.80390167,-121.2066498,1400000US06061021103,48438
5714,0101000020E610000076824765549D5DC056CDBDD1D8034140,ELEC,LANTANA,3301 Exposition Blvd,SOUTH STATION 1,,888-758-4389,E,,Public,24 hours daily,,,,,,2,,,ChargePoint Network,http://www.mychargepoint.net/,10/09/2015,51958,2015-10-09 07:54:47+00,,,,,,,,,J1772,"3301 Exposition Blvd
Santa Monica, CA 90404",34.0300543,-118.4582761,1400000US06037701801,48438
11203,0101000020E61000002ECA6C90499E5DC0B6F3FDD478034140,ELEC,Ralphs Store #292 - Santa Monica,1644 Cloverfield Ave,"Chargers are for customers ONLY. Usage 
set for 2hr limits. Violators will be 
towed.

Chargers are for customers ONLY. Usage 
set for 2hr limits. Violators will be 
towed.
",,888-998-2546,E,,Public,MON: 24 hours | TUE: 24 hours | WED: 24 hours | THU: 24 hours | FRI: 24 hours | SAT: 24 hours | SUN: 24 hours,,,,,,2,,,Blink Network,http://www.blinknetwork.com/,10/09/2015,63684,2015-10-09 07:09:05+00,,,,,,,,,J1772,"1644 Cloverfield Ave
Santa Monica, CA 90404",34.027125,-118.47324,1400000US06037701801,48438
19732,0101000020E6100000089E31827C4D5EC095151E8F74664340,ELEC,Tesla Service Center,4361 Granite Dr,,,877-798-37582,E,,Public,"24 hours daily; for Tesla use only",,,,,,,8,,Tesla,http://www.teslamotors.com/supercharger,06/02/2015,67202,2015-06-02 18:18:20+00,P,,,03/01/2015,,,,,TESLA,"4361 Granite Dr
Rocklin, CA 95677",38.8004321,-121.2107244,1400000US06061021103,48438
12664,0101000020E6100000732D5A80369E5DC0505436ACA9034140,ELEC,WATER GARDEN,2450 Colorado Ave,"P3 STATION 01; Stations are on P3 of the parking structure, follow signs.",,888-758-4389,E,,Public,24 hours daily,,,,,,2,,,ChargePoint Network,http://www.mychargepoint.net/,10/09/2015,69761,2015-10-09 07:56:09+00,,,,,,,,,J1772,"2450 Colorado Ave
Santa Monica, CA 90404",34.0286155,-118.4720765,1400000US06037701801,48438
13810,0101000020E61000002FF7C951009E5DC04DC752DAD1024140,ELEC,City of Santa Monica - Virginia Avenue Park,2200 Virginia Ave,Accessible from Virginia and Pico Ave,,310-458-8516,E,,Public,6am-11pm daily,,,,,,2,,1 SP Inductive  1 Avcon Inductive,,,02/03/2015,33679,2015-02-03 18:14:05+00,LG,,,01/01/2013,,,,,J1772,"2200 Virginia Ave
Santa Monica, CA 90404",34.0220292,-118.4687695,1400000US06037701801,48438
21570,0101000020E6100000A8740BB8429E5DC0E89FE06245034140,ELEC,Southern California Edison - Santa Monica Service Center,1721 22nd St,,,,E,,Private,,,,,,,4,,1 LP Inductive  11 SP Inductive,,,04/03/2015,27320,2015-04-03 17:10:31+00,T,,,07/15/2005,,,,,J1772,"1721 22nd St
Santa Monica, CA 90404",34.025555,-118.4728222,1400000US06037701801,48438
17666,0101000020E61000009698C2DE1F9E5DC0A1DC11A9C4034140,ELEC,WATER GARDEN,1620 26th St.,"P2 STATION 02; Stations are on P2 of the Parking Garage, follow signs.
P1 STATION 02; Stations are on P1 of the Parking Garage, follow signs.
P1 STATION 01; Stations are on P1 of the Parking Garage, follow signs.
P2 STATION 01; Stations are on P2 of the Parking Garage, follow signs.
P3 STATION 02; Stations are on P3 of the parking garage.",,888-758-4389,E,,Public,24 hours daily,,,,,,10,,,ChargePoint Network,http://www.mychargepoint.net/,10/09/2015,46508,2015-10-09 07:56:07+00,,,,,,,,,J1772,"1620 26th St.
Santa Monica, CA 90404",34.0294391,-118.4706952,1400000US06037701801,48438
15413,0101000020E61000004D98D5E022095FC06B85443580874440,ELEC,Trinidad Bay Bed & Breakfast - Tesla,560 Edwards St,,,707-677-0840  877-798-3752,E,,Public,"24 hours daily; for Tesla use only; for guest use only; see front desk for access",,,,,,1,,,Tesla,http://www.teslamotors.com/supercharger,,70422,2015-10-09 20:44:54+00,P,,,06/01/2015,,,,,TESLA,"560 Edwards St
Trinidad, CA 95570",41.0586001,-124.1427538,1400000US06023010200,48490
5643,0101000020E6100000633CEF6B49125DC0A829B80EC4E04040,ELEC,COACHELLAVALLEY,79050 Varner Rd,VW_422514_A,,888-758-4389,E,,Public,24 hours daily,,,,,,2,,,ChargePoint Network,http://www.mychargepoint.net/,10/09/2015,65562,2015-10-09 08:27:01+00,,,,,,,,,J1772,"79050 Varner Rd
Indio, CA 92203",33.7559832,-116.2857313,1400000US06065049400,48512
19894,0101000020E6100000535A7F4B00685DC005F9D9C875054140,ELEC,Southern California Edison - Ontario Service Center,1351 E Francis St,,,,E,,Private,,,,,,,,,2 LP Inductive  12 SP Inductive,,,04/03/2015,27314,2015-04-03 17:10:27+00,T,,,07/15/2005,,,,,,"1351 E Francis St
Ontario, CA 91761",34.042657,-117.625018,1400000US06071001803,48523
2627,0101000020E610000041FADCBF68675DC002A2BB7F87054140,ELEC,PHILIPS,1700 S Baker Ave,"ORAL HEALTH; East parking lot, next to employee entrance",,888-758-4389,E,,Public,24 hours daily,,,,,1,1,,,ChargePoint Network,http://www.mychargepoint.net/,10/09/2015,48995,2015-10-09 08:16:54+00,,,,,,,,,NEMA520 J1772,"1700 S Baker Ave
Ontario, CA 91761",34.0431976,-117.6157684,1400000US06071001803,48523
3250,0101000020E61000009964E42CEC785DC0E6A1A5E14A0A4140,ELEC,BOZZANI MOTORS,528 S Citrus Ave,VW_422142_A,,888-758-4389,E,,Public,24 hours daily,,,,,,2,,,ChargePoint Network,http://www.mychargepoint.net/,10/09/2015,63205,2015-10-09 08:24:54+00,,,,,,,,,J1772,"528 S Citrus Ave
Covina, CA 91723",34.0804102,-117.889415,1400000US06037406102,48558
20505,0101000020E61000004305E2D0B6785EC0FD97B55E1DAB4240,ELEC,SAN JOSE,44 S 4th St,"4TH & SF 6
4TH & SF 5
4TH & SF 4
4TH & SF 7",,888-758-4389,E,,Public,24 hours daily,,,,,,4,,,ChargePoint Network,http://www.mychargepoint.net/,10/09/2015,28844,2015-10-09 07:51:17+00,,,,,,,,,J1772,"44 S 4th St
San Jose, CA 95112",37.3368338,-121.8861582,1400000US06085500901,48616
8623,0101000020E6100000EF2E617EB8785EC0F719BC5411AB4240,ELEC,SAN JOSE,88 S 4th St,"4TH SF 2
4TH SF 1; -",,888-758-4389,E,,Public,24 hours daily,,,,,2,2,,,ChargePoint Network,http://www.mychargepoint.net/,10/09/2015,64217,2015-10-09 07:51:26+00,,,,,,,,,NEMA520 J1772,"88 S 4th St
San Jose, CA 95112",37.3364664,-121.8862606,1400000US06085500901,48616
12870,0101000020E61000003E48AA4AB6785EC0C280CA9D3EAB4240,ELEC,SAN JOSE,200 E Santa Clara St,"CITY HALL 2; Enter City Hall garage from 6th street. Chargers located on west side of garage near elevators for rotunda
CITY HALL 1; Enter City Hall garage from 6th street. Chargers located on west side of garage near elevators for rotunda",,888-758-4389,E,,Public,24 hours daily,,,,,2,2,,,ChargePoint Network,http://www.mychargepoint.net/,10/09/2015,33718,2015-10-09 07:51:30+00,,,,,,,,,NEMA520 J1772,"200 E Santa Clara St
San Jose, CA 95113",37.3378484,-121.8861262,1400000US06085500901,48616
16795,0101000020E61000003E48AA4AB6785EC0C280CA9D3EAB4240,ELEC,SAN JOSE,200 E Santa Clara St,"CITY HALL 5; Enter City Hall garage from 6th street. Chargers located on west side of garage near elevators for rotunda
CITY HALL 3; Enter City Hall garage from 6th street. Chargers located on west side of garage near elevators for rotunda
CITY HALL 4; Enter City Hall garage from 6th street. Chargers located on west side of garage near elevators for rotunda
CITY HALL 8; Enter City Hall garage from 6th street. Chargers located on west side of garage near elevators for rotunda
CITY HALL 7; Enter City Hall garage from 6th street. Chargers located on west side of garage near elevators for rotunda
CITY HALL 6; Enter City Hall garage from 6th street. Chargers located on west side of garage near elevators for rotunda
CITY HALL 9; Enter City Hall garage from 6th street. Chargers located on west side of garage near elevators for rotunda",,888-758-4389,E,,Public,24 hours daily,,,,,4,7,,,ChargePoint Network,http://www.mychargepoint.net/,10/09/2015,50747,2015-10-09 07:51:16+00,,,,,,,,,J1772 NEMA520,"200 E Santa Clara St
San Jose, CA 95112",37.3378484,-121.8861262,1400000US06085500901,48616
4940,0101000020E61000003C0E2840B9785EC07073CF5F8DAA4240,ELEC,SAN JOSE,288 S 2nd St,2ND& SAN CARLS3,,888-758-4389,E,,Public,24 hours daily,,,,,,1,,,ChargePoint Network,http://www.mychargepoint.net/,10/09/2015,55960,2015-10-09 07:51:20+00,,,,,,,,,J1772,"288 S 2nd St
San Jose, CA 95113",37.3324394,-121.8863068,1400000US06085500901,48616
16993,0101000020E6100000762E313BB0785EC0676A6D7594AA4240,ELEC,SAN JOSE,280 S 2nd St,"2ND& SAN CARLS4
2ND& SAN CARLS2
2ND& SAN CARLOS; -
2ND & SAN CRLS5
2ND & SAN CRLS6",,888-758-4389,E,,Public,24 hours daily,,,,,2,5,,,ChargePoint Network,http://www.mychargepoint.net/,10/09/2015,46479,2015-10-09 07:51:19+00,,,,,,,,,J1772 NEMA520,"280 S 2nd St
San Jose, CA 95113",37.3326556,-121.8857563,1400000US06085500901,48616
19373,0101000020E6100000370D9B12DA8A5DC003F2800DE3E74040,ELEC,Hooman Nissan - Long Beach,1800 E Spring St,,,800-973-3689,E,,Public - Call ahead,Dealership business hours,,,,,,1,1,,,,07/08/2015,46510,2015-07-08 14:52:25+00,P,,,01/31/2012,,,,,J1772 CHADEMO,"1800 E Spring St
Signal Hill, CA 90755",33.8116166,-118.1695601,1400000US06037573402,48776
9783,0101000020E6100000D955ED3FD78A5DC094FEFBDFD3E74040,ELEC,1800 E Spring St,1800 E Spring St,,,877-455-3833,E,,Public - Card key at all times,"24 hours daily; EVgo network subscription and key fob required",,,,,,,1,,eVgo Network,https://www.evgonetwork.com/,10/09/2015,69541,2015-10-09 08:54:30+00,,,,,,,,,CHADEMO,"1800 E Spring St
Long Beach, CA 90755",33.81115341,-118.1693878,1400000US06037573402,48776
1951,0101000020E6100000370D9B12DA8A5DC003F2800DE3E74040,ELEC,Hooman Nissan - Long Beach,1800 E Spring St,,,800-973-3689,E,,Private,,,,,,,1,,,,,07/08/2015,46511,2015-07-08 14:52:25+00,P,,,01/31/2012,,,,,J1772,"1800 E Spring St
Signal Hill, CA 90755",33.8116166,-118.1695601,1400000US06037573402,48776
6343,0101000020E6100000B241CB5FC68A5DC004F30480B2E64040,ELEC,Fresh & Easy - Signal Hill,2475 Cherry Ave,,,877-455-3833,E,,Public - Card key at all times,"24 hours daily; EVgo network subscription and key fob required",,,,,,1,,,eVgo Network,https://www.evgonetwork.com/,10/09/2015,69255,2015-10-09 08:48:13+00,,,,,,,,,J1772,"2475 Cherry Ave
Signal Hill, CA 90755",33.80232239,-118.1683578,1400000US06037573402,48776
1961,0101000020E6100000B241CB5FC68A5DC004F30480B2E64040,ELEC,Fresh & Easy - Signal Hill,2475 Cherry Ave,,,877-455-3833,E,,Public - Card key at all times,"24 hours daily; EVgo network subscription and key fob required",,,,,,,2,,eVgo Network,https://www.evgonetwork.com/,10/09/2015,69411,2015-10-09 08:52:01+00,,,,,,,,,CHADEMO,"2475 Cherry Ave
Signal Hill, CA 90755",33.80232239,-118.1683578,1400000US06037573402,48776
4602,0101000020E610000034D93F4F03665DC0BB421F2C630F4140,ELEC,City of Rancho Cucamonga - Archibald Library,7368 Archibald Ave,,,909-477-2700,E,,Public,24 hours daily,,,,,,1,,,,,05/05/2015,46972,2015-05-05 11:53:24+00,LG,,,01/31/2012,,,,,J1772,"7368 Archibald Ave
Rancho Cucamonga, CA 91730",34.120214,-117.593952,1400000US06071002027,48850
20476,0101000020E6100000C2BD326FD5525EC0BA4BE2AC88024340,ELEC,"Walgreens - Stockton, CA #10482",7850 West Ln,,,800-663-5633,E,,Public - Card key at all times,"MO: Not Specified; TU: Not Specified; WE: Not Specified; TH: Not Specified; FR: Not Specified; SA: Not Specified; SU: Not Specified",,,,,,1,,,SemaCharge Network,http://www.semacharge.com/,10/09/2015,43828,2015-10-09 07:36:34+00,,,,,,,,,J1772,"7850 West Ln
Stockton, CA 95210",38.019796,-121.294277,1400000US06077003410,48932
6670,0101000020E6100000B76686E8EB1B5EC0779DB23FF5754140,ELEC,Pine Tree Plaza,2125 S Broadway,Located on the south side of building B.,,805-969-7500,E,,Public,"24 hours daily; call number listed on charger for access",,,,,,1,,,,,05/05/2015,51957,2015-05-05 11:42:26+00,P,,,03/20/2013,,,,,J1772,"2125 S Broadway
Santa Maria, CA 93454",34.9215469,-120.4362737,1400000US06083002402,48942
14077,0101000020E6100000419AB1683A355EC07769C361695A4340,ELEC,"Walgreens - Placerville, CA #11823",4220 Missouri Flat Rd,,,800-663-5633,E,,Public - Card key at all times,"MO: Not Specified; TU: Not Specified; WE: Not Specified; TH: Not Specified; FR: Not Specified; SA: Not Specified; SU: Not Specified",,,,,,1,,,SemaCharge Network,http://www.semacharge.com/,10/09/2015,43820,2015-10-09 07:36:35+00,,,,,,,,,J1772,"4220 Missouri Flat Rd
Placerville, CA 95667",38.706341,-120.83169,1400000US06017031502,49021
5171,0101000020E6100000508F6D1970F25EC06A696E85B0BE4340,ELEC,MacKerricher State Park,24100 MacKerricher Park Rd,,,707-937-5804,P,05/01/2016 12:00:00 AM,PLANNED - not yet accessible (Public),24 hours daily,,,,,2,2,,,,,10/06/2015,69985,2015-10-06 22:02:54+00,SG,,,,,,,,NEMA520 J1772,"24100 MacKerricher Park Rd
Fort Bragg, CA 95437",39.489762,-123.788092,1400000US06045010300,49096
960,0101000020E6100000B6F3FDD478565DC069B2DA5779094140,ELEC,City of Colton - Arrowhead Regional Medical Center,400 N Pepper Ave,,,844-560-7121,E,,Public,24 hours daily,,,,,,2,,,Greenlots,http://greenlots.com/,08/04/2015,63070,2015-08-04 12:51:34+00,LG,,,05/01/2015,,,,,J1772,"400 N Pepper Ave
Colton, CA 92324",34.0740156,-117.351125,1400000US06071003612,49110
13632,0101000020E6100000EB8EC536A9B35EC0F8C1F9D4B1084340,ELEC,Pacific Coast SunTrail Hub,65 Third St,Located in the parking lot at 4th and B St,,855-900-7584,E,,Public - Card key at all times,"24 hours daily; Greenlots network card required",A D M V,,,,,1,2,,Greenlots,http://greenlots.com/,08/04/2015,60724,2015-08-04 12:23:38+00,P,,,01/15/2014,,,,,J1772 CHADEMO J1772COMBO,"65 Third St
Point Reyes Station, CA 94956",38.067927,-122.807203,1400000US06041133000,49375
13034,0101000020E61000001A16A3AEB5B95EC006F52D73BA164340,ELEC,Home,22188 Hwy 1,,,888-998-2546,E,,Public,MON: 24 hours | TUE: 24 hours | WED: 24 hours | THU: 24 hours | FRI: 24 hours | SAT: 24 hours | SUN: 24 hours,,,,,,1,,,Blink Network,http://www.blinknetwork.com/,10/09/2015,65484,2015-10-09 07:14:01+00,,,,,,,,,J1772,"22188 Hwy 1
Marshall, CA 94940",38.177565,-122.901714,1400000US06041133000,49375
9101,0101000020E61000004CC5C6BC8EC25DC0BEBED6A546B04140,ELEC,Jim Burke Ford,2001 Oak St,,,,E,,Private,"Service center use only; for Ford use only if chargers are not being used by service center",,,,,,1,,,,,05/05/2015,53895,2015-05-05 11:55:33+00,P,,,11/01/2013,,,,,J1772,"2001 Oak St
Bakersfield, CA 93301",35.377156,-119.039962,1400000US06029001700,49530
16954,0101000020E6100000098849B890515DC013848659C3F74040,ELEC,Ayres Hotel and Spa - Tesla,12631 Memorial Way,,,951-571-4141  877-798-3752,E,,Public,"24 hours daily; for Tesla use only; for guest use only",,,,,,2,,,Tesla,http://www.teslamotors.com/supercharger,09/02/2015,68901,2015-09-02 02:42:56+00,P,,,05/01/2015,,,,,TESLA,"12631 Memorial Way
Moreno Valley, CA 92553",33.9356491,-117.274458,1400000US06065042506,49559
3874,0101000020E610000085701640C2705EC071B43E4052624240,ELEC,IBEW LOCAL 234,10300 Merritt Street,"LOCAL 234; -",,888-758-4389,E,,Public,24 hours daily,,,,,1,1,,,ChargePoint Network,http://www.mychargepoint.net/,10/09/2015,48737,2015-10-09 08:14:45+00,,,,,,,,,NEMA520 J1772,"10300 Merritt Street
Castroville, CA 95012",36.7681351,-121.7618561,1400000US06053010400,49654
14481,0101000020E61000005144D0E2567D5DC08AA07B20C3E84040,ELEC,EVSP WALGREENS,946 S Brookhurst St,"STORE 6157; Walgreens @ 946 S Brookhurst St, Anaheim, CA 92804",,888-758-4389,E,,Public,24 hours daily,,,,,,1,,,ChargePoint Network,http://www.mychargepoint.net/,10/09/2015,68865,2015-10-09 07:43:03+00,,,,,,,,,J1772,"946 S Brookhurst St
Anaheim, CA 92804",33.8184548,-117.9584281,1400000US06059087701,49700
18485,0101000020E6100000DB9953138EB85EC002E5000BAA3E4340,ELEC,Farmhouse Inn,7871 River Rd,,,707-887-3300  877-798-3752,E,,Public,"24 hours daily; for guest use only",,,,,,3,,,Tesla,http://www.teslamotors.com/supercharger,09/02/2015,68970,2015-09-02 02:45:40+00,P,,,05/01/2015,,,,,TESLA J1772,"7871 River Rd
Forestville, CA 95436",38.4895643,-122.8836716,1400000US06097153705,49701
21305,0101000020E6100000B8713040477F5DC0CADFFFBF98DC4040,ELEC,Pavilions Place,16300 1/2  Beach Blvd,,,877-455-3833,E,,Public - Card key at all times,"24 hours daily; EVgo network subscription and key fob required",,,,,,,2,,eVgo Network,https://www.evgonetwork.com/,10/09/2015,69386,2015-10-09 08:51:23+00,,,,,,,,,CHADEMO,"16300 1/2 Beach Blvd
Westminster, CA 92683",33.72341156,-117.9887238,1400000US06059099241,49747
5544,0101000020E61000007B6F67BA321D5DC0C40204183BE24040,ELEC,The Ritz Carlton - Tesla,68900 Frank Sinatra Dr,,,760-321-8282  877-798-3752,E,,Public,"24 hours daily; for Tesla use only; for guest use only; see valet for access",,,,,,4,,,Tesla,http://www.teslamotors.com/supercharger,,70417,2015-10-09 20:42:46+00,P,,,07/01/2015,,,,,TESLA,"68900 Frank Sinatra Dr
Rancho Mirage, CA 92270",33.7674284,-116.4562212,1400000US06065045103,49760
17519,0101000020E6100000E4F38AA71E955DC0C05B2041F1F54040,ELEC,Hawthorne Municipal Airport - Tesla,1 Rocket Rd,I-105 Exit 5,,877-798-3752,E,,Public,"24 hours daily; for Tesla use only",,,,,,,12,,Tesla,http://www.teslamotors.com/supercharger,05/05/2015,52638,2015-05-05 11:42:30+00,P,,,06/01/2013,,,,,TESLA,"1 Rocket Rd
Hawthorne, CA 90250",33.921425,-118.329996,1400000US06037602509,49769
16090,0101000020E6100000E3361AC05B6E5DC02063EE5A420A4140,ELEC,CLAREMONT VOLKS,508-530 Auto Center Dr,VW_422143_A,,888-758-4389,E,,Public,24 hours daily,,,,,,2,,,ChargePoint Network,http://www.mychargepoint.net/,10/09/2015,63273,2015-10-09 08:25:12+00,,,,,,,,,J1772,"508-530 Auto Center Dr
Claremont, CA 91711",34.08015,-117.72435,1400000US06037402001,49770
2428,0101000020E61000004A7B832F4C2A5EC08BC3995FCDA34140,ELEC,Marsh Street Parking Structure,881 Marsh St,Located on the lower and upper levels,,805-781-7230,E,,Public,"24 hours daily; pay lot",,,,,,3,,,Tesla,http://www.teslamotors.com/supercharger,05/05/2015,41526,2015-05-05 11:55:54+00,LG,,,04/15/2000,,,,,J1772 TESLA,"881 Marsh St
San Luis Obispo, CA 93401",35.279705,-120.6609,1400000US06079011102,49775
21951,0101000020E61000005322895E46295EC0697407B133A14140,ELEC,San Luis Obispo County Air Pollution Control District,3433 Roberto Ct,,,805-781-5912,E,,Public,"8am-5pm M-F; see front desk for code",,,,,1,1,,,,,05/05/2015,21713,2015-05-05 11:43:55+00,LG,,,07/15/2002,,,,,NEMA520 J1772,"3433 Roberto Ct
San Luis Obispo, CA 93401",35.25939,-120.64492,1400000US06079011102,49775
8857,0101000020E6100000C72AA5677A955DC0910DA48B4D0B4140,ELEC,HOLLYWOOD 959,6600-6650 Romaine St,"LEVEL 5 - 02; Level 5
LEVEL 3 - 03; Level 3
LEVEL 6 - 03; Level 6
LEVEL 4 - 02; Level 4
LEVEL 1 - 02; Ground Level
LEVEL 4 - 03; Level 4
LEVEL 6 - 02; Level 6
LEVEL 1 - 03
LEVEL 5 - 03; Level 5
LEVEL 3 - 01; Level 3
LEVEL 4 - 01; Level 4
LEVEL 1 - 01
LEVEL 6 - 01; Level 6
LEVEL 5 - 01; Level 5
LEVEL 3 - 02; Level 3",,888-758-4389,E,,Public,24 hours daily,,,,,,30,,,ChargePoint Network,http://www.mychargepoint.net/,10/09/2015,68949,2015-10-09 07:42:29+00,,,,,,,,,J1772,"6600-6650 Romaine St
LA, CA 90038",34.088304,-118.335596,1400000US06037191901,49938
17210,0101000020E61000000282397A7C0D5EC0C117CB9992054340,ELEC,McCaffrey House Bed & Breakfast Inn,23251 Highway 108,,,888-586-0757  877-798-3752,E,,Public,"24 hours daily; for guest use only; see front desk for access",,,,,,2,,,Tesla,http://www.teslamotors.com/supercharger,,70330,2015-10-08 18:27:33+00,P,,,08/01/2015,,,,,TESLA J1772,"23251 Highway 108
Twain Harte, CA 92383",38.0435364,-120.2107225,1400000US06109003100,49986
13590,0101000020E61000004B28339449905DC04D8D8642BA134140,ELEC,550 North Brand Blvd.,550 N. Brand Blvd.,,,800-663-5633,E,,Public - Card key at all times,"MO: 12:00am-12:00am; TU: 12:00am-12:00am; WE: 12:00am-12:00am; TH: 12:00am-12:00am; FR: 12:00am-12:00am; SA: 12:00am-12:00am; SU: 12:00am-12:00am",,,,,,2,,,SemaCharge Network,http://www.semacharge.com/,10/09/2015,61061,2015-10-09 07:37:00+00,,,,,,,,,J1772,"550 N. Brand Blvd.
Glendale, CA 91203",34.1541217,-118.2544909,1400000US06037301900,50000
17322,0101000020E6100000C2853C829B795DC08F88CED7D1D44040,ELEC,Newport Mesa Church,2599 Newport Blvd,,,714-966-0454,E,,Public,24 hours daily,,,,,,2,,,,,07/08/2015,51912,2015-07-08 14:52:13+00,P,,,03/20/2013,,,,,J1772,"2599 Newport Blvd
Costa Mesa, CA 92626",33.6626539,-117.9001165,1400000US06059063906,50022
5360,0101000020E61000005364085BC7625DC048A066ED5B0D4140,ELEC,VSPA PARKING,8217 Rochester Ave,"VSPA PARKING; The station is located in the Courts Parking Lot",,888-758-4389,E,,Public,24 hours daily,,,,,,2,,,ChargePoint Network,http://www.mychargepoint.net/,10/09/2015,69744,2015-10-09 07:41:56+00,,,,,,,,,J1772,"8217 Rochester Ave
Rancho Cucamonga, CA 91730",34.1043679,-117.5434177,1400000US06071002207,50089
2592,0101000020E61000005ED5592DB02D5DC0658C0FB397A14140,ELEC,Jet Propulsion Lab Goldstone,Goldstone Rd,,,,E,,Private,NASA fleet use only,,,,,,1,,,,,01/06/2015,52466,2015-01-06 17:47:12+00,FG,22,National Aeronautics and Space Administration,06/30/2013,,,,,,"Goldstone Rd
Fort Irwin, CA 92310",35.262442,-116.713878,1400000US06071025000,50136
21935,0101000020E610000091DF9167CD2C5DC0AE2358665BA14140,ELEC,LRCGSAVEH010114,3401-3499 Meuse Argonne St,STATION2,,888-758-4389,E,,Public,24 hours daily,,,,,,1,,,ChargePoint Network,http://www.mychargepoint.net/,10/09/2015,63263,2015-10-09 08:24:08+00,,,,,,,,,J1772,"3401-3499 Meuse Argonne St
Fort Irwin, CA 92310",35.2606018,-116.7000369,1400000US06071025000,50136
5526,0101000020E610000079173955882B5DC025F1A8E7939F4140,ELEC,LRCGSAVEH010114,Depot Rd,"LOGISTICS; LOGISTICS personnel only",,888-758-4389,E,,Public,24 hours daily,,,,,,1,,,ChargePoint Network,http://www.mychargepoint.net/,10/09/2015,62901,2015-10-09 08:24:06+00,,,,,,,,,J1772,"Depot Rd
Fort Irwin, CA 92310",35.2467012,-116.6801961,1400000US06071025000,50136
4420,0101000020E6100000C4769C476A065FC08E8F16670C784440,ELEC,BMW OF HUMBOLDT,1795 Central Ave,STATION 01,,888-758-4389,E,,Public,24 hours daily,,,,,,2,,,ChargePoint Network,http://www.mychargepoint.net/,10/09/2015,61329,2015-10-09 08:22:07+00,,,,,,,,,J1772,"1795 Central Ave
McKinleyville, CA 95519",40.9378785,-124.1002368,1400000US06023010502,50241
18410,0101000020E61000004408D9C3A87B5DC0B758F6C9F60F4140,ELEC,SCE GATEWAY CTR,6090 N Irwindale Ave,"GC6090-03
GC6090-02
GC6090-01
GC6090-07
GC6090-05
GC6090-04
GC6090-06",,888-758-4389,E,,Public,24 hours daily,,,,,7,7,,,ChargePoint Network,http://www.mychargepoint.net/,10/09/2015,48721,2015-10-09 08:03:27+00,,,,,,,,,NEMA520 J1772,"6090 N Irwindale Ave
Irwindale, CA 91702",34.1247189,-117.9321756,1400000US06037404600,50341
4708,0101000020E6100000E695EB6D33805DC09F776341610E4140,ELEC,Los Angeles Department of Public Works - Longden Flood Maintenance Yard,160 E Longden Ave,,,,T,,TEMPORARILY UNAVAILABLE (Private - Government only),,,,,,,,,2 SP Inductive,,,06/02/2015,21616,2015-06-02 18:10:10+00,LG,,,,,,,,,"160 E Longden Ave
Irwindale, CA 91706",34.112343,-118.003139,1400000US06037404600,50341
15239,0101000020E610000006668522DD7B5DC08FA7E507AE0C4140,ELEC,Southern California Edison - Irwindale Business Center,4777 N Irwindale Ave,,,,E,,Private,Employee use only,,,,,7,7,,,Greenlots,http://greenlots.com/,07/16/2015,66307,2015-07-16 16:26:51+00,T,,,10/06/2014,,,,,NEMA520 J1772,"4777 N Irwindale Ave
Irwindale, CA 91706",34.099061,-117.935372,1400000US06037404600,50341
15425,0101000020E610000093AB58FCA67B5DC0D47FD6FCF80F4140,ELEC,Southern California Edison - Energy Education Center,6090 N Irwindale Ave,,,,E,,Private,Employee use only,,,,,8,8,,4 Paddle Inductive,,,04/03/2015,66308,2015-04-03 17:07:49+00,T,,,01/01/2012,,,,,NEMA520 J1772,"6090 N Irwindale Ave
Irwindale, CA 91702",34.124786,-117.932067,1400000US06037404600,50341
13232,0101000020E610000028CF6163037C5DC09BEDC0EF950F4140,ELEC,CHARGE STATION,15801 E 1st St,"STATION 2
STATION 1",,888-758-4389,E,,Public,24 hours daily,,,,,,4,,,ChargePoint Network,http://www.mychargepoint.net/,10/09/2015,67313,2015-10-09 08:30:58+00,,,,,,,,,J1772,"15801 E 1st St
Irwindale, CA 91706",34.1217632,-117.9377068,1400000US06037404600,50341
16534,0101000020E6100000CF2EDFFAB0255EC0E3FE23D3A18F4140,ELEC,Aloha Inn - Tesla,611 El Camino Real,,,805-489-9300  877-798-3752,E,,Public,"24 hours daily; for Tesla use only; for guest use only; see front desk for access",,,,,,1,,,Tesla,http://www.teslamotors.com/supercharger,09/02/2015,68897,2015-09-02 02:42:39+00,P,,,05/01/2015,,,,,TESLA,"611 El Camino Real
Arroyo Grande, CA 93420",35.122126,-120.588927,1400000US06079011901,50350
14660,0101000020E61000007DD5253ED2365EC0124BCADDE7C24240,ELEC,California State University - Stanislaus,Mariposa Dr,,,209-667-3114,E,,Public,"24 hours daily; parking permit required",,,,,,2,,,,,09/02/2015,68402,2015-09-02 21:08:15+00,P,,,04/01/2015,,,,,J1772,"Mariposa Dr
Turlock, CA 95382",37.522701,-120.8565822,1400000US06099003605,50375
1801,0101000020E6100000E7DF2EFB75965DC0580053060E084140,ELEC,Ralph's,5601 Wilshire Blvd,,,323-936-4954,E,,Public,24 hours daily,,,,,,,,2 LP Inductive,,,05/05/2015,7249,2015-05-05 11:44:44+00,T,,,06/15/1998,,,,,,"5601 Wilshire Blvd
Los Angeles, CA 90036",34.062928,-118.350951,1400000US06037215101,50442
11530,0101000020E61000009F2B007CA6965DC0E55D9AC706084140,ELEC,5757 WILSHIRE,5757 Wilshire Blvd,"EV STATION; -2nd floor of parking structure across from elevators
EV STATION 2; -2nd floor of parking structure across from elevators",,888-758-4389,E,,Public,24 hours daily,,,,,,4,,,ChargePoint Network,http://www.mychargepoint.net/,10/09/2015,65058,2015-10-09 07:47:52+00,,,,,,,,,J1772,"5757 Wilshire Blvd
LA, CA 90036",34.0627069,-118.3539114,1400000US06037215101,50442
7022,0101000020E61000001ACF5614E5965DC08FF172220B084140,ELEC,Los Angeles County Museum of Art,5905 Wilshire Blvd,Garage entrance on 6th St. Chargers located on first level.,,888-833-2148  323-857-6010,E,,Public,"Garage business hours; pay lot",,,,,,3,,,,,06/02/2015,46733,2015-06-02 18:04:42+00,P,,,04/10/2012,,,,,J1772,"5905 Wilshire Blvd
Los Angeles, CA 90036",34.0628398,-118.3577319,1400000US06037215101,50442
19035,0101000020E610000001AF850F5B7D5DC0FB8FF1CDDB0A4140,ELEC,Baldwin Park Metrolink - Lot 2,3825 Downing Ave,,,800-371-5465,E,,Public,24 hours daily,,,,,,10,,,,,03/04/2015,21792,2015-03-04 14:16:35+00,LG,,,01/01/2014,,,,,J1772,"3825 Downing Ave
Baldwin Park, CA 91706",34.0848329,-117.9586829,1400000US06037405201,50443
17459,0101000020E6100000E43D18C27BFF5EC044BFB67EFA704440,ELEC,RCEA EV NETWORK,111 Greenwood Rd,"BL CITY HALL; -",,888-758-4389,E,,Public,24 hours daily,,,,,,1,,,ChargePoint Network,http://www.mychargepoint.net/,10/09/2015,66690,2015-10-09 07:47:49+00,,,,,,,,,J1772,"111 Greenwood Rd
Blue Lake, CA 95525",40.8826445,-123.9919286,1400000US06023010300,50536
17919,0101000020E6100000B041BA33EEFF5EC0CD1FD3DA34714440,ELEC,RCEA EV NETWORK,777 Casino Way,"BL RANCHERIA 1; -
BL RANCHERIA 2",,888-758-4389,E,,Public,24 hours daily,,,,,,4,,,ChargePoint Network,http://www.mychargepoint.net/,10/09/2015,65028,2015-10-09 07:47:49+00,,,,,,,,,J1772,"777 Casino Way
Blue Lake, CA 95525",40.8844255,-123.9989137,1400000US06023010300,50536
7490,0101000020E61000000000000000405EC028A6034032D94240,ELEC,Fresh & Easy - Rose Pavilion,3903 Santa Rita Road,,,877-455-3833,E,,Public - Card key at all times,"24 hours daily; EVgo network subscription and key fob required",,,,,,1,2,,eVgo Network,https://www.evgonetwork.com/,10/09/2015,69389,2015-10-09 08:51:28+00,,,,,,,,,CHADEMO J1772,"3903 Santa Rita Road
Pleasanton, CA 94588",37.69684601,-121,1400000US06099000506,50543
10083,0101000020E61000003FC4060B27175DC07CD2890453E14040,ELEC,Club Intrawest,1 Willow Ridge,,,760-974-1200  877-798-3752,E,,Public,"24 hours daily; for guest use only; see front desk for access",,,,,,2,,,Tesla,http://www.teslamotors.com/supercharger,09/02/2015,68953,2015-09-02 02:45:44+00,P,,,03/01/2015,,,,,TESLA J1772,"1 Willow Ridge
Palm Desert, CA 92260",33.760346,-116.361758,1400000US06065044919,50553
11177,0101000020E6100000AECACF57DA6E5EC0E48233F8FB444340,ELEC,UC Davis Extension,1441 Research Park Dr,,,530-752-8277,E,,Public,24 hours daily,,,,,,2,,1 SP Inductive,,,07/08/2015,21673,2015-07-08 15:22:49+00,SG,,,06/01/2004,,,,,J1772,"1441 Research Park Dr
Davis, CA 95616",38.5389395,-121.7320766,1400000US06113010608,50564
13607,0101000020E61000008AB0E1E9956E5EC0AFB14B546F454340,ELEC,Yolo-Solano Air Quality Management District,1947 Galileo Ct,,,530-757-3650,E,,Public,24 hours daily,,,,,,1,,,,,05/05/2015,49330,2015-05-05 11:51:27+00,LG,,,06/15/2012,,,,,J1772,"1947 Galileo Ct
Davis, CA 95618",38.54246,-121.7279,1400000US06113010608,50564
13231,0101000020E6100000E9F92E00E86E5EC0ED3DA6FFF6444340,ELEC,UC DAVIS TAPS,1333 Research Park Dr,"LOT 80; Located in Lot 80, UC Davis Extension Facilities ",,888-758-4389,E,,Public,24 hours daily,,,,,1,1,,,ChargePoint Network,http://www.mychargepoint.net/,10/09/2015,43471,2015-10-09 08:12:47+00,,,,,,,,,NEMA520 J1772,"1333 Research Park Dr
Davis, CA 95618",38.5387878,-121.7329102,1400000US06113010608,50564
16379,0101000020E610000057A71485A7885DC048DC0830D10B4140,ELEC,NEW CENTURY BMW,18 N Olive Ave,"FAST CHARGER 01; DC Fast Charger",,888-758-4389,E,,Public,24 hours daily,,,,,,,1,,ChargePoint Network,http://www.mychargepoint.net/,10/09/2015,66521,2015-10-09 07:44:56+00,,,,,,,,,J1772COMBO,"18 N Olive Ave
Alhambra, CA 91801",34.0923214,-118.1352246,1400000US06037480303,50625
8963,0101000020E6100000FE8CC179A7885DC09BAF928FDD0B4140,ELEC,NEW CENTURY BMW,1139 West Main Street,"LEVEL 2 DUAL PT; Public ChargePoint Charging Station",,888-758-4389,E,,Public,24 hours daily,,,,,,2,,,ChargePoint Network,http://www.mychargepoint.net/,10/09/2015,66463,2015-10-09 07:44:55+00,,,,,,,,,J1772,"1139 West Main Street
Alhambra, CA 91801",34.092699,-118.1352219,1400000US06037480303,50625
5170,0101000020E6100000A4E59BC8A7885DC04A95CDC1D80B4140,ELEC,NEW CENTURY BMW,24 N Olive Ave,"LEVEL 2 DP 2; -",,888-758-4389,E,,Public,24 hours daily,,,,,,2,,,ChargePoint Network,http://www.mychargepoint.net/,10/09/2015,66522,2015-10-09 07:44:55+00,,,,,,,,,J1772,"24 N Olive Ave
Alhambra, CA 91801",34.0925524,-118.1352407,1400000US06037480303,50625
6568,0101000020E61000009031772D21535EC02575029A08574340,ELEC,Citrus Heights City Hall,6237 Fountain Square Dr,,,916-725-2448,T,,TEMPORARILY UNAVAILABLE (Public),24 hours daily,,,,,,3,,1 SP Inductive,,,10/06/2015,25519,2015-10-06 21:59:48+00,LG,,,,,,,,J1772,"6237 Fountain Square Dr
Citrus Heights, CA 95621",38.67995,-121.2989,1400000US06067008136,50694
949,0101000020E61000003CA583F57F355EC05AF2785A7EE24240,ELEC,Steve's Chevrolet Buick,1285 E F St,,,,E,,Private,Service center use only,,,,,,1,,,,,08/04/2015,68400,2015-08-04 13:09:12+00,P,,,04/01/2015,,,,,J1772,"1285 E F St
Oakdale, CA 95361",37.769481,-120.835935,1400000US06099000203,50719
12279,0101000020E61000006E4F90D8EE4A5DC0BDA8DDAF02C44040,ELEC,BMW OF MURRIETA,26825 Auto Mall Pkwy,"STATION 01
STATION 02",,888-758-4389,E,,Public,24 hours daily,,,,,,4,,,ChargePoint Network,http://www.mychargepoint.net/,10/09/2015,60605,2015-10-09 07:51:36+00,,,,,,,,,J1772,"26825 Auto Mall Pkwy
Murrieta, CA 92562",33.531332,-117.170828,1400000US06065051200,50739
9883,0101000020E61000007D3F355EBA495DC02497FF907EBF4040,ELEC,City of Temecula - 6th Street Lot,28462 Front St,Mercedes Street,,951-694-6411,E,,Public,24 hours daily,,,,,,2,,,,,05/05/2015,7236,2015-05-05 11:55:07+00,LG,,,12/31/2011,,,,,J1772,"28462 Front St
Temecula, CA 92590",33.49605,-117.152,1400000US06065051200,50739
21578,0101000020E6100000D34D621058495DC025CCB4FD2BBF4040,ELEC,City of Temecula - Old Town Parking Garage,28690 Mercedes St,4th Street,,951-694-6411,E,,Public,24 hours daily,,,,,,2,,,,,05/05/2015,50799,2015-05-05 11:55:05+00,LG,,,01/22/2013,,,,,J1772,"28690 Mercedes St
Temecula, CA 92590",33.49353,-117.146,1400000US06065051200,50739
5105,0101000020E6100000E39EF87BF34A5DC0A66F88A70DC44040,ELEC,MURRIETA VW,41300 Date St,VW_422128_A,,888-758-4389,E,,Public,24 hours daily,,,,,,2,,,ChargePoint Network,http://www.mychargepoint.net/,10/09/2015,66863,2015-10-09 08:26:48+00,,,,,,,,,J1772,"41300 Date St
Murrieta, CA 92562",33.5316667,-117.1711111,1400000US06065051200,50739
16905,0101000020E6100000A7CB6262F3275EC06EA6423C12514340,ELEC,Saluti Cellars Winery,7505 Grizzly Flat Rd,Located in the B&B carport,,530-626-0800,E,,Public,"11:30am-5:30pm Fri-Sun; call for appointment or after hours use",,,,,1,,,,,,07/08/2015,62463,2015-07-08 15:23:55+00,P,,,09/01/2014,,,,,NEMA1450,"7505 Grizzly Flat Rd
Somerset, CA 95684",38.633369,-120.62423,1400000US06017031402,50761
8126,0101000020E6100000B7F0BC54EC675EC0012B2C5D66534240,ELEC,MOCO AG COMM,1428 Abbott St,"1428 ABBOTT 01; Located at the Monterey County Agricultural Commissioner's Office",,888-758-4389,E,,Public,24 hours daily,,,,,,2,,,ChargePoint Network,http://www.mychargepoint.net/,10/09/2015,51943,2015-10-09 08:25:23+00,,,,,,,,,J1772,"1428 Abbott St
Salinas, CA 93901",36.6515614,-121.6237995,1400000US06053014500,50799
18379,0101000020E6100000874215481A6A5EC0A1B0D52F22544240,ELEC,TAMC,55 Plaza Cir,TAMC 1,,888-758-4389,E,,Public,24 hours daily,,,,,1,1,,,ChargePoint Network,http://www.mychargepoint.net/,10/09/2015,51944,2015-10-09 08:14:43+00,,,,,,,,,NEMA520 J1772,"55 Plaza Cir
Salinas, CA 93901",36.6572933,-121.6578541,1400000US06053014500,50799
21158,0101000020E61000009F50F4650E795EC03A121E238F024340,ELEC,CITYOFPITTSBURG,65 Civic Ave,"CIVIC CENTER 01; -
CIVIC CENTER 02; -",,888-758-4389,E,,Public,24 hours daily,,,,,2,2,,,ChargePoint Network,http://www.mychargepoint.net/,10/09/2015,38925,2015-10-09 08:03:04+00,,,,,,,,,NEMA520 J1772,"65 Civic Ave
Pittsburg, CA 94565",38.0199932,-121.8915038,1400000US06013311000,50856
9933,0101000020E61000002C0FD253E4375DC0946934B918854040,ELEC,Ramona Community Library,1275 Main St,,,760-788-5270,E,,Public,24 hours daily,,,,,,2,,,,,10/06/2015,70063,2015-10-06 22:02:59+00,LG,,,07/01/2015,,,,,J1772,"1275 Main St
Ramona, CA 92065",33.039817,-116.873311,1400000US06073020806,50872
17269,0101000020E61000004167D2A6EA375DC0AEF36F97FD844040,ELEC,Sun Valley Shopping Center,1306-1350 Main Street,,,888-998-2546,E,,Public,MON: 24 hours | TUE: 24 hours | WED: 24 hours | THU: 24 hours | FRI: 24 hours | SAT: 24 hours | SUN: 24 hours,,,,,,2,,,Blink Network,http://www.blinknetwork.com/,10/09/2015,60781,2015-10-09 07:13:47+00,,,,,,,,,J1772,"1306-1350 Main Street
Ramona, CA 92065",33.038989,-116.873697,1400000US06073020806,50872
22068,0101000020E61000002593533BC3215DC0C44142942FEC4040,ELEC,"Walgreens - Palm Springs, CA #1079",1700 E. Vista Chino,,,800-663-5633,E,,Public - Card key at all times,"MO: 12:00am-12:00am; TU: 12:00am-12:00am; WE: 12:00am-12:00am; TH: 12:00am-12:00am; FR: 12:00am-12:00am; SA: 12:00am-12:00am; SU: 12:00am-12:00am",,,,,,1,,,SemaCharge Network,http://www.semacharge.com/,10/09/2015,53531,2015-10-09 07:36:51+00,,,,,,,,,J1772,"1700 E. Vista Chino
Palm Springs, CA 92262",33.845202,-116.527541,1400000US06065044604,50905
13370,0101000020E61000004679E6E5B0335EC09B046F48A3304340,ELEC,Amador Transit,115 Valley View Way,SR-49 and Valley View Way,,209-267-2282,E,,Public,"24 hours daily; pay lot",,,,,,2,,,,,05/05/2015,46136,2015-05-05 11:55:08+00,LG,,,04/30/2012,,,,,J1772,"115 Valley View Way
Sutter Creek, CA 95685",38.379983,-120.807672,1400000US06005000303,50925
8370,0101000020E610000017BA12816A705DC0A3DF635529044140,ELEC,Allstar Kia,8 Rio Rancho Rd,,,855-900-7584,E,,Public,24 hours daily,,,,,,,2,,Greenlots,http://greenlots.com/,08/04/2015,68317,2015-08-04 12:55:43+00,P,,,11/01/2014,,,,,CHADEMO J1772COMBO,"8 Rio Rancho Rd
Pomona, CA 91766",34.0325114,-117.7565005,1400000US06037403000,50956
11403,0101000020E6100000DFDC5F3DEEF15DC0840D4FAF94674240,ELEC,Best Western - Tesla,480 E Shaw Ave,,,559-229-5811  877-798-3752,E,,Public,"24 hours daily; for Tesla use only; for guest use only",,,,,,1,,,Tesla,http://www.teslamotors.com/supercharger,09/02/2015,68914,2015-09-02 02:43:12+00,P,,,06/01/2015,,,,,TESLA,"480 E Shaw Ave
Fresno, CA 93710",36.809225,-119.780166,1400000US06019005410,51014
19136,0101000020E61000003957DE9F9CF15DC0C83A03C084674240,ELEC,Fashion Fair Mall - Fresno,727 E Shaw Ave,,,877-455-3833,E,,Public - Card key at all times,"24 hours daily; EVgo network subscription and key fob required",,,,,,1,2,,eVgo Network,https://www.evgonetwork.com/,10/09/2015,69403,2015-10-09 08:51:49+00,,,,,,,,,J1772 CHADEMO,"727 E Shaw Ave
fresno, CA 93710",36.80873871,-119.7751846,1400000US06019005410,51014
15332,0101000020E610000054A9D903AD975DC00DA661F888144140,ELEC,Crystalwerks,4940 Vineland Ave,,,888-998-2546,E,,Private,MON: 24 hours | TUE: 24 hours | WED: 24 hours | THU: 24 hours | FRI: 24 hours | SAT: 24 hours | SUN: 24 hours,,,,,,2,,,Blink Network,http://www.blinknetwork.com/,10/09/2015,50152,2015-10-09 07:11:41+00,,,,,,,,,J1772,"4940 Vineland Ave
North Hollywood, CA 91601",34.16043,-118.369935,1400000US06037125501,51037
3461,0101000020E61000000A719B5F83935DC08FF74FDC96E34040,ELEC,Marymount College at San Pedro,15401 USS New Jersey,,,310-377-5501,E,,Public,24 hours daily,,,,,,1,,,,,08/04/2015,51951,2015-08-04 12:50:04+00,P,,,03/04/2013,,,,,J1772,"15401 USS New Jersey
Los Angeles, CA 90732",33.7780414,-118.3048934,1400000US06037980015,51042
18932,0101000020E6100000404B57B08D775EC05A153CE015AE4240,ELEC,SAN JOSE,1608 Las Plumas Ave,"SJEIC1; Located on the northeast corner of the western lot. Parking lot closes at 6:15pm and closed all day on Sundays.
SJEIC3; Located on the northeast corner of the western lot, Parking lot closes at 6:15pm and closed all day on Sundays. 
SJEIC2; Located on the northeast corner of western lot. Parking lot closes at 6:15pm and closed all day on Sundays.",,888-758-4389,E,,Public,24 hours daily,,,,,,6,,,ChargePoint Network,http://www.mychargepoint.net/,10/09/2015,61841,2015-10-09 07:51:34+00,,,,,,,,,J1772,"1608 Las Plumas Ave
San Jose, CA 95133",37.3600426,-121.868023,1400000US06085503601,51050
18450,0101000020E6100000ADF9F197165F5EC0E259828C80424340,ELEC,City of Sacramento's Corporate Yard,5730 24th Street,,,916-808-4044,E,,Public,Employee and fleet use only,,,,,,4,,,,,10/06/2015,70071,2015-10-06 21:39:38+00,LG,,,05/15/2012,,,,,J1772,"5730 24th Street
Sacramento, CA 95822",38.519548,-121.485754,1400000US06067003800,51127
17165,0101000020E61000006BA807BB17925EC07F3E80FBF0254340,ELEC,NAPA RIVER INN,500 Main St,"CHARGER 1; Middle of parking lot, in front of Silos and Napa General Store. Napa River Inn & Historic Napa Mill
CHARGER 2; Middle of parking lot in front of Silos and Napa General Store. Napa River Inn & Historic Napa Mill. 4 stations available",,888-758-4389,E,,Public,24 hours daily,,,,,,4,,,ChargePoint Network,http://www.mychargepoint.net/,10/09/2015,53674,2015-10-09 07:53:04+00,,,,,,,,,J1772,"500 Main St
Napa, CA 94559",38.2964167,-122.2826984,1400000US06055200202,51176
15957,0101000020E61000005C0531D035925EC016078662E1254340,ELEC,5TH ST GARAGE,1100 5th St,"5TH ST GARAGE1; On first floor West side near entrance",,888-758-4389,E,,Public,24 hours daily,,,,,,2,,,ChargePoint Network,http://www.mychargepoint.net/,10/09/2015,67911,2015-10-09 08:31:48+00,,,,,,,,,J1772,"1100 5th St
Napa, CA 94590",38.2959407,-122.2845345,1400000US06055200202,51176
16513,0101000020E6100000889D29745E925EC0D6A8876874254340,ELEC,Inn on Randolph - Tesla,411 Randolph St,,,707-257-2886  877-798-3752,E,,Public - Call ahead,"24 hours daily; for Tesla use only; for guest use only",,,,,,1,,,Tesla,http://www.teslamotors.com/supercharger,09/02/2015,68992,2015-09-02 02:46:25+00,P,,,02/01/2015,,,,,TESLA,"411 Randolph St
Napa, CA 94559",38.292615,-122.287015,1400000US06055200202,51176
17705,0101000020E61000007D83E5BE8B925EC0FA70DA9DFF254340,ELEC,1539 FIRST PD,1501-1541 1st St,"CITY OF NAPA; City of Napa Municipal Parking Lot",,888-758-4389,E,,Public,24 hours daily,,,,,,2,,,ChargePoint Network,http://www.mychargepoint.net/,10/09/2015,61155,2015-10-09 08:20:57+00,,,,,,,,,J1772,"1501-1541 1st St
Napa, CA 94559",38.2968633,-122.2897794,1400000US06055200202,51176
5874,0101000020E61000006BA807BB17925EC07F3E80FBF0254340,ELEC,Napa River Inn - Tesla,500 Main St,,,707-251-8500  877-798-3752,E,,Public,"24 hours daily; for Tesla use only; for guest use only; see front desk for access",,,,,,2,,,Tesla,http://www.teslamotors.com/supercharger,,70340,2015-10-08 18:36:13+00,P,,,06/01/2015,,,,,TESLA,"500 Main St
Napa, CA 94559",38.2964167,-122.2826984,1400000US06055200202,51176
12553,0101000020E6100000C2B92B6027835EC0CD68F51FE3FD4240,ELEC,AutoCon Nissan of Concord - 1290 Concord Ave.,1290 Concord Ave.,,,877-455-3833,E,,Public - Card key at all times,"24 hours daily; EVgo network subscription and key fob required",,,,,,,1,,eVgo Network,https://www.evgonetwork.com/,10/09/2015,69546,2015-10-09 08:54:35+00,,,,,,,,,CHADEMO,"1290 Concord Ave.
Concord, CA 94520",37.9834938,-122.0492783,1400000US06013327000,51201
11701,0101000020E6100000991E5E213D835EC0ABD271906BFD4240,ELEC,Autocom Nissan of Concord,1290 Concord Ave,,,925-676-4400,E,,Public - Call ahead,Dealership business hours,,,,,,1,,,,,07/08/2015,39880,2015-07-08 15:03:23+00,P,,,03/15/2011,,,,,J1772,"1290 Concord Ave
Concord, CA 94520",37.9798451,-122.0506061,1400000US06013327000,51201
9590,0101000020E610000032E54350B5835EC08586B47C13FD4240,ELEC,Concord Kia,2199 Meridian Park Blvd,,,855-900-7584,E,,Public,24 hours daily,,,,,,,2,,Greenlots,http://greenlots.com/,08/04/2015,68315,2015-08-04 12:55:40+00,P,,,11/01/2014,,,,,CHADEMO J1772COMBO,"2199 Meridian Park Blvd
Concord, CA 94520",37.9771572,-122.0579415,1400000US06013327000,51201
10189,0101000020E610000039B874CC79835EC093E00D6954FC4240,ELEC,Concord Hilton,1970 Diamond Blvd.,"Room key required for parking access.

Room key required for parking access.

Room key required for parking access.

Room key required for parking access.

Room key required for parking access.

Room key required for parking access.

Room key required for parking access.
",,888-998-2546,E,,Private,MON: 24 hours | TUE: 24 hours | WED: 24 hours | THU: 24 hours | FRI: 24 hours | SAT: 24 hours | SUN: 24 hours,,,,,,6,2,,Blink Network,http://www.blinknetwork.com/,10/09/2015,50999,2015-10-09 07:10:12+00,,,,,,,,,CHADEMO J1772,"1970 Diamond Blvd.
Concord, CA 94520",37.971326,-122.054309,1400000US06013327000,51201
3629,0101000020E6100000991E5E213D835EC0ABD271906BFD4240,ELEC,Autocom Nissan of Concord,1290 Concord Ave,,,925-676-4400,E,,Private,,,,,,,1,1,,,,07/08/2015,47600,2015-07-08 15:03:23+00,P,,,03/15/2011,,,,,J1772 CHADEMO,"1290 Concord Ave
Concord, CA 94520",37.9798451,-122.0506061,1400000US06013327000,51201
7769,0101000020E61000002FDB4E5B237A5DC05A2A6F4738114140,ELEC,Azusa Light & Water Office Parking Lot,729 N. Azusa Avenue,,,888-998-2546,E,,Private,MON: 24 hours | TUE: 24 hours | WED: 24 hours | THU: 24 hours | FRI: 24 hours | SAT: 24 hours | SUN: 24 hours,,,,,,3,,,Blink Network,http://www.blinknetwork.com/,10/09/2015,50994,2015-10-09 07:10:51+00,,,,,,,,,J1772,"729 N. Azusa Avenue
Azusa, CA 91702",34.13453,-117.908408,1400000US06037400602,51207
1774,0101000020E610000024A6FA84A2555EC06F70D86C9B464340,ELEC,COUNTY EVSE,3800 Branch Center Rd,"BRANCH CENTER 1; Free Parking
BRANCH CENTER 2; Free Parking",,888-758-4389,E,,Public,24 hours daily,,,,,2,2,,,ChargePoint Network,http://www.mychargepoint.net/,10/09/2015,41325,2015-10-09 08:07:02+00,,,,,,,,,NEMA520 J1772,"3800 Branch Center Rd
Sacramento, CA 95827",38.5516182,-121.3380444,1400000US06067009103,51220
10381,0101000020E61000001F11532289325EC019390B7BDA5D4340,ELEC,Mosquito Road Park and Ride,Mosquito Rd & Clay St,,,530-642-5383,E,,Public,"Lot business hours; overnight parking prohibited",,,,,,2,,,,,07/08/2015,25507,2015-07-08 15:22:58+00,P,,,05/30/2004,,,,,J1772,"Mosquito Rd &amp; Clay St
Placerville, CA 95667",38.73323,-120.78962,1400000US06017031100,51222
4760,0101000020E610000069C4CC3E8F225DC0AC2C1BE780E64040,ELEC,Ace Hotel - Tesla,701 E Palm Canyon Dr,,,760-325-9900  877-798-3752,E,,Public,"24 hours daily; for Tesla use only; for guest use only; see valet for access",,,,,,2,,,Tesla,http://www.teslamotors.com/supercharger,09/02/2015,68895,2015-09-02 02:42:45+00,P,,,03/01/2015,,,,,TESLA,"701 E Palm Canyon Dr
Palm Springs, CA 92264",33.8008088,-116.539993,1400000US06065940800,51250
4159,0101000020E61000002D6002B7EE9E5DC07BDD2230D6274140,ELEC,Caltrans District 7 - Equipment Shop,13200 Golden State Rd,,,,P,11/01/2015 12:00:00 AM,PLANNED - not yet accessible (Private),,,,,,,4,,,,,10/06/2015,70007,2015-10-06 21:34:33+00,SG,,,,,,,,J1772,"13200 Golden State Rd
Los Angeles, CA 91342",34.311224,-118.48332,1400000US06037106604,51250
8656,0101000020E61000001DE5603601765EC014ED2AA4FC4E4240,ELEC,Tesla Service Center - Tesla,1901 Del Monte Blvd,,,831-264-6896  877-798-3752,E,,Public,"24 hours daily; for Tesla use only",,,,,,,6,,Tesla,http://www.teslamotors.com/supercharger,,70282,2015-10-07 21:17:50+00,P,,,06/01/2015,,,,,TESLA,"1901 Del Monte Blvd
Seaside, CA 93955",36.617085,-121.843824,1400000US06053014000,51282
12215,0101000020E6100000D1FF177467765EC022E2E654324E4240,ELEC,Cardinale Nissan,1661 Del Monte Blvd,,,831-393-0600,E,,Public - Call ahead,Dealership business hours,,,,,,1,,,,,07/08/2015,39944,2015-07-08 14:24:07+00,P,,,03/15/2011,,,,,J1772,"1661 Del Monte Blvd
Seaside, CA 93955",36.610911,-121.8500643,1400000US06053014000,51282
6297,0101000020E6100000864C439E6E765EC0FCB44071B64C4240,ELEC,"Walgreens - Seaside, CA #2867",1055 Fremont Blvd,,,800-663-5633,E,,Public - Card key at all times,"MO: Not Specified; TU: Not Specified; WE: Not Specified; TH: Not Specified; FR: Not Specified; SA: Not Specified; SU: Not Specified",,,,,,1,,,SemaCharge Network,http://www.semacharge.com/,10/09/2015,44422,2015-10-09 07:36:35+00,,,,,,,,,J1772,"1055 Fremont Blvd
Seaside, CA 93955",36.5993177,-121.8505016,1400000US06053014000,51282
13082,0101000020E6100000D1FF177467765EC022E2E654324E4240,ELEC,Cardinale Nissan,1661 Del Monte Blvd,,,831-393-0600,E,,Private,,,,,,,1,,,,,07/08/2015,48148,2015-07-08 14:24:07+00,P,,,03/15/2011,,,,,J1772,"1661 Del Monte Blvd
Seaside, CA 93955",36.610911,-121.8500643,1400000US06053014000,51282
19781,0101000020E610000033B1AF2B1C365EC02EB76A8DF7AE4140,ELEC,City of Morro Bay - Chamber of Commerce,695 Harbor St,Located at Harbor Street and Piney Way,,805-772-4467,E,,Public,"24 hours daily; MobileNOW! Phone application",,,,,,1,,,,,05/05/2015,51515,2015-05-05 11:53:06+00,LG,,,03/25/2013,,,,,J1772,"695 Harbor St
Morro Bay, CA 93442",35.3669297,-120.8454694,1400000US06079010603,51406
17827,0101000020E610000091ED7C3F35365EC05EBA490C02AF4140,ELEC,City of Morro Bay - Morro Bay Transit,535 Harbor St,Located at Harbor Street and Shasta Avenue,,805-722-6285,E,,Public,"24 hours daily; MobileNOW! Phone application",,,,,,1,,,,,05/05/2015,48728,2015-05-05 11:53:07+00,LG,,,06/19/2012,,,,,J1772,"535 Harbor St
Morro Bay, CA 93442",35.36725,-120.847,1400000US06079010603,51406
16219,0101000020E6100000D200DE0209855DC00CC9C9C4AD064140,ELEC,Southern California Edison - General Office 4,8631 Rush St,,,,E,,Private,Employee use only,,,,,14,14,,,Greenlots,http://greenlots.com/,04/03/2015,66306,2015-04-03 17:07:47+00,T,,,10/06/2014,,,,,NEMA520 J1772,"8631 Rush St
Rosemead, CA 91770",34.052178,-118.078675,1400000US06037482402,51481
1968,0101000020E61000009E8834E062855DC0C9610700D4064140,ELEC,Southern California Edison - Rosemead Service Center,2131 Walnut Grove Ave,,,,E,,Private,Employee use only,,,,,9,9,,,Greenlots,http://greenlots.com/,04/03/2015,21597,2015-04-03 17:10:39+00,T,,,01/01/2015,,,,,NEMA520 J1772,"2131 Walnut Grove Ave
Rosemead, CA 91770",34.05334473,-118.0841599,1400000US06037482402,51481
12097,0101000020E6100000935E8A613D855DC06B9093D3E8054140,ELEC,Southern California Edison - Rosemead Office Building 5,1515 Walnut Grove Ave,,,888-758-4389,E,,Private,Employee use only,,,,,12,12,,,Greenlots,http://greenlots.com/,04/03/2015,48611,2015-04-03 17:10:40+00,T,,,08/01/2011,,,,,NEMA520 J1772,"1515 Walnut Grove Ave
Rosemead, CA 91770",34.0461678,-118.0818714,1400000US06037482402,51481
7962,0101000020E6100000F54883DBDA445EC07C61325530184240,ELEC,Ciudad del Rey Motel & Trailer Park,50557 Wild Horse Rd,At US-101,,831-385-4828,E,,Public - Call ahead,Pay lot,,,,,,,,6 Conductive 120V/240V NEMA 14-50,,,05/05/2015,33563,2015-05-05 11:54:51+00,P,,,11/30/2008,,,,,,"50557 Wild Horse Rd
King City, CA 93930",36.188975,-121.075858,1400000US06053011303,51544
20049,0101000020E61000007613211A027A5DC02D8892DAD5EF4040,ELEC,EVSP WALGREENS,1250 E Chapman Ave,"STORE 1750; The station is located in the northeast corner, facing N Raymond Ave",,888-758-4389,E,,Public,24 hours daily,,,,,,1,,,ChargePoint Network,http://www.mychargepoint.net/,10/09/2015,68943,2015-10-09 07:43:05+00,,,,,,,,,J1772,"1250 E Chapman Ave
Fullerton, CA 92831",33.8737138,-117.9063783,1400000US06059011403,51600
16941,0101000020E6100000D539ABAA3C9A5EC0D4EC269DEDE44240,ELEC,BMW GROUP,520 Mason St,"520 MASON #2
520 MASON #6
520 MASON #7
520 MASON #4",,888-758-4389,E,,Public,24 hours daily,,,,,,4,,,ChargePoint Network,http://www.mychargepoint.net/,10/09/2015,48695,2015-10-09 08:16:18+00,,,,,,,,,J1772,"520 Mason St
San Francisco, CA 94102",37.7885014,-122.4099528,1400000US06075012100,51676
2819,0101000020E61000002693AEF4358B5DC023A4C920D2064140,ELEC,Los Angeles County Sheriff - Communications Center,1275 N Eastern Ave,,,,E,,Private,Permitted employee parking only,,,,,,4,,,,,06/02/2015,63055,2015-06-02 18:19:40+00,LG,,,08/01/2014,,,,,J1772,"1275 N Eastern Ave
Los Angeles, CA 90063",34.0532876,-118.1751682,1400000US06037530601,51750
21688,0101000020E610000006973380DC7B5DC014D3012059494140,ELEC,Antelope Valley Union School District - Littlerock High School,10833 E Ave R,,,,E,,Private,Employee use only,,,,,,2,,,,,01/06/2015,42255,2015-05-20 14:37:56+00,LG,,,11/15/2011,,,,,J1772,"10833 E Ave R
Littlerock, CA 93543",34.57303238,-117.9353333,1400000US06037910001,51768
4475,0101000020E610000083537A01519A5EC0259A9BCAFDD34240,ELEC,CITY OF SSF,329 Miller Ave,"CHARGER # 2; New Parking Garage downtown SSF
EV CHARGER #1; New South San Francisco
CHARGER # 3; New Parking Garage downtown
CHARGER #4; New Parking Garage downtown ",,888-758-4389,E,,Public,24 hours daily,,,,,4,4,,,ChargePoint Network,http://www.mychargepoint.net/,10/09/2015,38940,2015-10-09 08:03:06+00,,,,,,,,,NEMA520 J1772,"329 Miller Ave
South San Francisco, CA 94080",37.6561826,-122.4111942,1400000US06081602200,51832
13433,0101000020E6100000ED7E15E0BBB85DC00EBD07E04D174140,ELEC,The Oaks Mall,350 West Hillcrest Drive,,,877-455-3833,E,,Public - Card key at all times,"24 hours daily; EVgo network subscription and key fob required",,,,,,,2,,eVgo Network,https://www.evgonetwork.com/,10/09/2015,69355,2015-10-09 08:50:43+00,,,,,,,,,,"350 West Hillcrest Drive
Thousand Oaks, CA 91360",34.18206406,-118.886467,1400000US06111006900,51853
11937,0101000020E6100000122F4FE78AB85DC0E659492BBE174140,ELEC,Hillcrest Center,401 Hillcrest Drive,,,888-998-2546,E,,Public,MON: 24 hours | TUE: 24 hours | WED: 24 hours | THU: 24 hours | FRI: 24 hours | SAT: 24 hours | SUN: 24 hours,,,,,,4,,,Blink Network,http://www.blinknetwork.com/,10/09/2015,47645,2015-10-09 07:12:57+00,,,,,,,,,J1772,"401 Hillcrest Drive
Thousand Oaks, CA 91360",34.185491,-118.883478,1400000US06111006900,51853
13430,0101000020E61000005966B6D03AB85DC0F08B4B55DA164140,ELEC,Best Western,75 W Thousand Oaks Blvd,,,805-497-3701  877-798-3752,E,,Public,"24 hours daily; for guest use only",,,,,,3,,,Tesla,http://www.teslamotors.com/supercharger,09/02/2015,68919,2015-09-02 02:43:08+00,P,,,03/01/2015,,,,,TESLA J1772,"75 W Thousand Oaks Blvd
Thousand Oaks, CA 91360",34.178538,-118.8785898,1400000US06111006900,51853
20768,0101000020E61000000344C18C29B85DC0E719FB928D174140,ELEC,Janss Marketplace,275 N. Moorpark Rd.,"Located in Parking Structure on the 1st 
level by security.

Located in Parking Structure on the 1st 
level by security.
",,888-998-2546,E,,Public,MON: 24 hours | TUE: 24 hours | WED: 24 hours | THU: 24 hours | FRI: 24 hours | SAT: 24 hours | SUN: 24 hours,,,,,,2,,,Blink Network,http://www.blinknetwork.com/,10/09/2015,21640,2015-10-09 07:10:10+00,,,,,,,,,J1772,"275 N. Moorpark Rd.
Thousand Oaks, CA 91360",34.184008,-118.877536,1400000US06111006900,51853
19089,0101000020E610000032337DC0CD845EC01C6217A0C8D44240,ELEC,Hayward Nissan,24644 Mission Blvd,,,510-372-2800,E,,Public - Call ahead,Dealership business hours,,,,,,1,1,,,,07/08/2015,39901,2015-07-08 14:24:46+00,P,,,03/15/2011,,,,,J1772 CHADEMO,"24644 Mission Blvd
Hayward, CA 94544",37.6623726,-122.0750581,1400000US06001436500,51875
18845,0101000020E610000032337DC0CD845EC01C6217A0C8D44240,ELEC,Hayward Nissan,24644 Mission Blvd,,,510-372-2800,E,,Private,,,,,,,1,,,,,07/08/2015,48191,2015-07-08 14:24:46+00,P,,,03/15/2011,,,,,J1772,"24644 Mission Blvd
Hayward, CA 94544",37.6623726,-122.0750581,1400000US06001436500,51875
7446,0101000020E6100000E13DACDCB0845EC09232F32E28D44240,ELEC,TEAM VOLKSWAGEN,25115 Mission Blvd,VW_42031_A,,888-758-4389,E,,Public,24 hours daily,,,,,,2,,,ChargePoint Network,http://www.mychargepoint.net/,10/09/2015,69144,2015-10-09 08:25:32+00,,,,,,,,,J1772,"25115 Mission Blvd
Hayward, CA 94544",37.6574763,-122.0732948,1400000US06001436500,51875
5110,0101000020E6100000018A912573E15DC0EBC891CEC0324140,ELEC,CARPINTERIA,499 Linden Ave,"PARKING LOT 3
499 LINDEN",,888-758-4389,E,,Public,24 hours daily,,,,,,3,,,ChargePoint Network,http://www.mychargepoint.net/,10/09/2015,48962,2015-10-09 07:47:31+00,,,,,,,,,J1772,"499 Linden Ave
Carpinteria, CA 93013",34.396509,-119.522653,1400000US06083001604,51891
17750,0101000020E6100000630564543EE15DC07F25A13E13334140,ELEC,CARPINTERIA,929 Yucca Ln,"4945CARPINTERIA; Located behind pet supplies store",,888-758-4389,E,,Public,24 hours daily,,,,,,2,,,ChargePoint Network,http://www.mychargepoint.net/,10/09/2015,65531,2015-10-09 07:47:32+00,,,,,,,,,J1772,"929 Yucca Ln
Carpinteria, CA 93013",34.3990248,-119.5194293,1400000US06083001604,51891
1050,0101000020E6100000E7566364A49D5EC0F6F065A208404340,ELEC,Clif Family Winery,709 Main Street,,,888-998-2546,E,,Private,MON: 24 hours | TUE: 24 hours | WED: 24 hours | THU: 24 hours | FRI: 24 hours | SAT: 24 hours | SUN: 24 hours,,,,,,1,,,Blink Network,http://www.blinknetwork.com/,10/09/2015,61577,2015-10-09 07:13:51+00,,,,,,,,,J1772,"709 Main Street
St. Helena, CA 94574",38.5002635,-122.4631587,1400000US06055201601,51912
4654,0101000020E6100000D7789F99969D5EC0D9BDCBFBEE3F4340,ELEC,Velo Vino Clif Family Winery - Tesla,709 Main St,,,707-968-0625  877-798-3752,E,,Public,"24 hours daily; for Tesla use only; for guest use only; see front desk for access",,,,,,1,,,Tesla,http://www.teslamotors.com/supercharger,,70425,2015-10-09 20:45:28+00,P,,,06/01/2015,,,,,TESLA,"709 Main St
St. Helena, CA 94574",38.4994807,-122.4623169,1400000US06055201601,51912
11706,0101000020E61000001E00CC10A29D5EC030F5F3A622404340,ELEC,Long Meadow Ranch,738 Main St,,,707-963-4555  877-798-3752,E,,Public,"24 hours daily; for guest use only; see front desk for access",,,,,,3,,,Tesla,http://www.teslamotors.com/supercharger,,70278,2015-10-07 21:10:53+00,P,,,02/01/2015,,,,,TESLA J1772,"738 Main St
St. Helena, CA 94574",38.5010575,-122.4630167,1400000US06055201601,51912
11956,0101000020E6100000923B6C22339D5EC083A6255646414340,ELEC,NRG eVgo - Napa Valley Community College,1088 College Ave,,,,E,,Private,Student and employee use only,,,,,,1,,,eVgo Network,https://www.evgonetwork.com/,07/08/2015,67930,2015-07-08 15:15:05+00,P,,,04/01/2015,,,,,J1772,"1088 College Ave
St. Helena, CA 94574",38.509959,-122.456246,1400000US06055201601,51912
21016,0101000020E6100000E17CEA58258B5DC04639E2DA9A064140,ELEC,Internal Services Department Headquarters ,1102 N Eastern Ave,Located in lot 81,,323-267-2023,E,,Public,"6am-6pm M-Th; keypad activated, instructions on EVSE",,,,,,4,,,,,06/02/2015,63057,2015-06-02 18:01:27+00,LG,,,08/01/2014,,,,,J1772,"1102 N Eastern Ave
Los Angeles, CA 90063",34.0516008,-118.1741545,1400000US06037530602,51932
5198,0101000020E6100000DC48D922E98A5DC0EBF0C63835064140,ELEC,Internal Services Department Telecomm,1110 N Eastern Ave,,,323-267-2023,E,,Public,"6am-6pm M-F; keypad activated, instructions on EVSE",,,,,,4,,,,,06/02/2015,63058,2015-06-02 18:01:29+00,LG,,,08/01/2014,,,,,J1772,"1110 N Eastern Ave
Los Angeles, CA 90063",34.0484992,-118.1704795,1400000US06037530602,51932
10125,0101000020E6100000BD2484FD0D8B5DC0042967DE60064140,ELEC,Los Angeles County Sheriff - Fleet Shop,1104 N Eastern Ave,Northside wall of Shop,,323-267-2023,E,,Public,"8am-5pm M-F; keypad activated, instructions on EVSE",,,,,,2,,,,,06/02/2015,67303,2015-06-02 18:08:56+00,LG,,,08/01/2014,,,,,J1772,"1104 N Eastern Ave
Los Angeles, CA 90063",34.0498312,-118.1727289,1400000US06037530602,51932
17716,0101000020E6100000BD2484FD0D8B5DC0042967DE60064140,ELEC,Internal Services Shop,1104 N Eastern Ave,,,,E,,Private,Los Angeles County fleet use only,,,,,,4,,,,,06/02/2015,67300,2015-06-02 18:07:15+00,LG,,,08/01/2014,,,,,J1772,"1104 N Eastern Ave
Los Angeles, CA 90063",34.0498312,-118.1727289,1400000US06037530602,51932
657,0101000020E61000003E2883FE1D4A5DC0E2DB0594975B4040,ELEC,707 BROADWAY,707 Broadway,"B3-4; -
8-5; -
8-4; -
B3-1; -
4-3; -
B3-5; -
4-4; -
8-1; -
B3-6; -
B3-3; -
B3-2; -
8-3; -
8-2; -
4-1; www.707innovate.com",,888-758-4389,E,,Public,24 hours daily,,,,,,28,,,ChargePoint Network,http://www.mychargepoint.net/,10/09/2015,66763,2015-10-09 08:26:35+00,,,,,,,,,J1772,"707 Broadway
San Diego, CA 92101",32.7155633,-117.1580807,1400000US06073005300,51974
5789,0101000020E6100000E0FDA7D11A4A5DC01AA20A7F865B4040,ELEC,707 BROADWAY,935 7th Ave,"4-2; -",,888-758-4389,E,,Public,24 hours daily,,,,,,2,,,ChargePoint Network,http://www.mychargepoint.net/,10/09/2015,67312,2015-10-09 08:27:27+00,,,,,,,,,J1772,"935 7th Ave
San Diego, CA 92101",32.715042,-117.1578869,1400000US06073005300,51974
18653,0101000020E6100000EC6987BF264A5DC04E2844C0215C4040,ELEC,Ace Parking - Corporate Lot,645 Ash St.,,,888-998-2546,E,,Private,MON: 24 hours | TUE: 24 hours | WED: 24 hours | THU: 24 hours | FRI: 24 hours | SAT: 24 hours | SUN: 24 hours,,,,,,3,,,Blink Network,http://www.blinknetwork.com/,10/09/2015,49135,2015-10-09 07:12:42+00,,,,,,,,,J1772,"645 Ash St.
San Diego, CA 92101",32.71978,-117.158615,1400000US06073005300,51974
17844,0101000020E6100000630E828E564A5DC027DBC01DA85B4040,ELEC,US Grant Hotel,326 Broadway,,,619-232-3121  877-798-3752,E,,Private,"Hotel guest use only; see valet for access",,,,,,5,,,Tesla,http://www.teslamotors.com/supercharger,05/05/2015,46750,2015-10-09 19:48:17+00,P,,,04/01/2012,,,,,J1772 TESLA,"326 Broadway
San Diego, CA 92101",32.716068,-117.161533,1400000US06073005300,51974
8927,0101000020E6100000C37FBA81824A5DC078E68AF7885B4040,ELEC,IRVINE CO OFC,101 W Broadway,"101 W BROAD 02; Parking Rates Apply: Stations are on P2, follow signs.
101 W BROAD 01; Parking Rates Apply: Stations are on P2, please follow signs.",,888-758-4389,E,,Public,24 hours daily,,,,,,3,,,ChargePoint Network,http://www.mychargepoint.net/,10/09/2015,63166,2015-10-09 07:44:27+00,,,,,,,,,J1772,"101 W Broadway
San Diego, CA 92101",32.7151174,-117.1642155,1400000US06073005300,51974
8382,0101000020E6100000B3614D65514A5DC0FC8D76DCF05B4040,ELEC,Ace Parking Downtown Lot 1,1240 4th Ave,,,888-998-2546,E,,Public,MON: 24 hours | TUE: 24 hours | WED: 24 hours | THU: 24 hours | FRI: 24 hours | SAT: 24 hours | SUN: 24 hours,,,,,,2,,,Blink Network,http://www.blinknetwork.com/,10/09/2015,43486,2015-10-09 07:10:46+00,,,,,,,,,J1772,"1240 4th Ave
San Diego, CA 92107",32.718288,-117.161218,1400000US06073005300,51974
15765,0101000020E61000002381ABE1474A5DC04C5FBEABD45B4040,ELEC,IRVINE CO OFC,401 B Street,"WFP LVL P5 04; Enter Parking Structure, proceed to Level P5, follow signs, this station is in an ADA stall by the elevator
WFP LVL P5 03; Enter Parking Structure, proceed to Level P5, follow signs to the stations.
WFP LVL P5 02; Enter Parking Structure, follow signs to P5
WFP LVL P5 01; Enter Parking Structure, proceed to Level P5, follow signs.",,888-758-4389,E,,Public,24 hours daily,,,,,,4,,,ChargePoint Network,http://www.mychargepoint.net/,10/09/2015,50435,2015-10-09 07:43:59+00,,,,,,,,,J1772,"401 B Street
San Diego, CA 92101",32.7174277,-117.1606373,1400000US06073005300,51974
13730,0101000020E6100000F52D73BA2C4A5DC0948444DAC65B4040,ELEC,1111 6th Avenue,"1111 6th Avenue, Parking Basement",First Parking Tier Behind Building ,,800-663-5633,E,,Public,"MO: 12:00am-12:00am; TU: 12:00am-12:00am; WE: 12:00am-12:00am; TH: 12:00am-12:00am; FR: 12:00am-12:00am; SA: 12:00am-12:00am; SU: 12:00am-12:00am",,,,,,1,,,SemaCharge Network,http://www.semacharge.com/,10/09/2015,61656,2015-10-09 07:36:58+00,,,,,,,,,J1772,"1111 6th Avenue, Parking Basement
San Diego, CA 92101",32.717006,-117.15898,1400000US06073005300,51974
18330,0101000020E6100000F89B9A151B4A5DC0961EF23BF25B4040,ELEC,IRVINE CO OFC,750 B St,"SYMPHNY TWRS 03; Parking Rates Apply: Enter parking garage and proceed to P11, stations are near the elevator.
SYMPHNY TWRS 02; Parking Rates Apply: Enter parking garage and proceed to P11, stations are by the elevator.
SYMPHNY TWRS 01; Parking Rates Apply: Enter the parking garage and proceed to P11, stations are near the elevator.",,888-758-4389,E,,Public,24 hours daily,,,,,,5,,,ChargePoint Network,http://www.mychargepoint.net/,10/09/2015,62458,2015-10-09 07:44:23+00,,,,,,,,,J1772,"750 B St
San Diego, CA 92101",32.7183299,-117.1579031,1400000US06073005300,51974
17333,0101000020E6100000E839D8518B455EC05826570CB2794340,ELEC,Industrial Control Links,12840 Earhart Ave,,,530-888-1800,E,,Public,24 hours daily,,,,,,2,,,,,06/02/2015,51204,2015-06-02 18:02:17+00,P,,,02/01/2013,,,,,J1772,"12840 Earhart Ave
Auburn, CA 95602",38.9507461,-121.0866284,1400000US06061021802,51977
19473,0101000020E610000051B758F6C9945EC06CC94F4FC42B4340,ELEC,SENZA Hotel - Tesla,4066 Howard Ln,,,707-967-2626  877-798-3752,E,,Public,"24 hours daily; for Tesla use only; for guest use only; see front desk for access",,,,,,2,,,Tesla,http://www.teslamotors.com/supercharger,,70375,2015-10-09 20:25:10+00,P,,,08/01/2015,,,,,TESLA,"4066 Howard Ln
Napa, CA 94558",38.3419284,-122.3248268,1400000US06055201200,52031
18946,0101000020E61000007B05B353BD955EC0D7F26F3C442C4340,ELEC,O'Brien Estates - Tesla,1200 Orchard Ave,,,707-252-8463  877-798-3752,E,,Public - Call ahead,"24 hours daily; for Tesla use only; for guest use only",,,,,,2,,,Tesla,http://www.teslamotors.com/supercharger,,70342,2015-10-08 18:36:40+00,P,,,08/01/2015,,,,,TESLA,"1200 Orchard Ave
Napa, CA 94558",38.3458324,-122.3396806,1400000US06055201200,52031
5149,0101000020E61000004A33CCBF4CAE5EC054FC00207E3B4340,ELEC,Sonoma County,400-498 Fiscal Dr,,,,E,,Private,Fleet use only,,,,,1,1,,,ChargePoint Network,http://www.mychargepoint.net/,11/30/2013,35280,2015-01-09 14:04:00+00,LG,,,01/15/2011,,,,,NEMA520 J1772,"400-498 Fiscal Dr
Santa Rosa, CA 95403",38.46478653,-122.7234344,1400000US06097152100,52037
5043,0101000020E610000016832CB06CAE5EC0D048DFFF223B4340,ELEC,COUNTY SONOMA,2300 County Center Drive,"CC LA PLAZA #3; Available for Public Use with 4-hour Time Limit - Service provided by County of Sonoma
CC LA PLAZA #1; Available for Public Use with 4-hour Time Limit - Service provided by County of Sonoma
CC LA PLAZA #2; Available for Public Use with 4-hour Time Limit - Service provided by County of Sonoma",,888-758-4389,E,,Public,24 hours daily,,,,,3,3,,,ChargePoint Network,http://www.mychargepoint.net/,10/09/2015,36350,2015-10-09 08:02:03+00,,,,,,,,,NEMA520 J1772,"2300 County Center Drive
Santa Rosa, CA 95403",38.4620056,-122.7253838,1400000US06097152100,52037
19141,0101000020E61000007D34E6BF51AE5EC02697F71FB63B4340,ELEC,Sonoma County,2688 Ventura Ave,,,,E,,Private,,,,,,8,8,,,ChargePoint Network,http://www.mychargepoint.net/,11/30/2013,35150,2015-01-09 14:04:14+00,LG,,,08/15/2009,,,,,NEMA520 J1772,"2688 Ventura Ave
Santa Rosa, CA 95403",38.46649551,-122.7237396,1400000US06097152100,52037
10414,0101000020E610000038A9C36570AE5EC079FDEEC27B3B4340,ELEC,COUNTY SONOMA,575 Administration Dr,"CC ADMIN BOS #1; Available for Public Use with 4-hour Time Limit - Service provided by County of Sonoma
CC ADMIN BOS #2; -",,888-758-4389,E,,Public,24 hours daily,,,,,2,2,,,ChargePoint Network,http://www.mychargepoint.net/,10/09/2015,35151,2015-10-09 08:04:14+00,,,,,,,,,NEMA520 J1772,"575 Administration Dr
Santa Rosa, CA 95403",38.4647144,-122.7256102,1400000US06097152100,52037
7097,0101000020E6100000469CA96BC83F5EC0674E4D38AAE54240,ELEC,Modesto Toyota,4513 McHenry Ave,,,877-879-4034,E,,Public - Call ahead,Dealership business hours,,,,,,1,,,,,08/04/2015,68399,2015-08-04 13:09:01+00,P,,,04/01/2015,,,,,J1772,"4513 McHenry Ave
Modesto, CA 95354",37.7942572,-120.9966077,1400000US06077004901,52083
9357,0101000020E6100000F74E1608CC845DC0A699EE7552F94040,ELEC,Southern California Edison - Whittier Service Center,9901 Geary Ave,,,,E,,Private,,,,,,,,,1 LP Inductive  1 SP Inductive,,,04/03/2015,1558,2015-04-03 17:10:30+00,T,,,10/15/1996,,,,,,"9901 Geary Ave
Santa Fe Springs, CA 90670",33.947829,-118.0749531,1400000US06037502700,52106
14013,0101000020E61000008C0C175EEE7F5DC030229BF573EF4040,ELEC,Ken Grody Ford,6211 Beach Blvd,,,,E,,Private,Service center and customer use only,,,,,,8,,,,,05/05/2015,53896,2015-05-05 11:52:37+00,P,,,11/01/2013,,,,,J1772,"6211 Beach Blvd
Buena Park, CA 90621",33.8707263,-117.9989238,1400000US06059110603,52106
22049,0101000020E6100000CA7443AEAF7F5DC056B0D705CDEE4040,ELEC,Buena Park Nissan,6501 Auto Center Dr,,,714-739-0800,E,,Public - Call ahead,Dealership business hours,,,,,,1,1,,,,07/08/2015,39872,2015-07-08 14:24:03+00,P,,,03/15/2011,,,,,J1772 CHADEMO,"6501 Auto Center Dr
Buena Park, CA 90621",33.8656318,-117.9950977,1400000US06059110603,52106
15733,0101000020E6100000EE5C18E9457F5DC0EBE2361AC0EF4040,ELEC,Brico Electric,8272 Artesia Blvd,Suite A,,,E,,Private,,,,,,,6,,,,,03/04/2015,46708,2015-03-04 01:20:50+00,T,,,08/31/2011,,,,,J1772,"8272 Artesia Blvd
Buena Park, CA 90621",33.87305,-117.988642,1400000US06059110603,52106
19978,0101000020E6100000CA7443AEAF7F5DC056B0D705CDEE4040,ELEC,Buena Park Nissan,6501 Auto Center Dr,,,714-739-0800,E,,Private,,,,,,,1,,,,,07/08/2015,47592,2015-07-08 14:24:03+00,P,,,03/15/2011,,,,,J1772,"6501 Auto Center Dr
Buena Park, CA 90621",33.8656318,-117.9950977,1400000US06059110603,52106
5463,0101000020E6100000C75FFF1AB57F5DC0218FE046CAEE4040,ELEC,BROWN AUTO GRP,6501 Auto Center Dr,"QUICK CHARGER1; Located at the front left side of building by service drive",,888-758-4389,E,,Public,24 hours daily,,,,,,,1,,ChargePoint Network,http://www.mychargepoint.net/,10/09/2015,61280,2015-10-09 08:23:41+00,,,,,,,,,CHADEMO,"6501 Auto Center Dr
Buena Park, CA 90621",33.865548,-117.9954288,1400000US06059110603,52106
303,0101000020E61000001BD7BFEB33B35EC0E129E44A3D054340,ELEC,Point Reyes National Seashore - Bear Valley Visitor Center,1 Bear Valley Rd,The Bear Valley Visitor Center is located about 3/4 miles west of the Bear Valley Road and Highway 1 junction.,,415-464-5100 x2 x5,E,,Public,"6am-12am daily; overnight parking pass given to backcountry camping permit holders is required for 24 hour use",,,,,,3,,,,,10/06/2015,62978,2015-10-06 21:48:26+00,FG,16,Department of the Interior,08/06/2014,,,,,J1772,"1 Bear Valley Rd
Point Reyes Station, CA 94956",38.040933,-122.800044,1400000US06041132200,52125
21960,0101000020E61000005E7AA0BADEA25DC0CAF154D1691D4140,ELEC,Northridge Metrolink Station,8775 Wilbur Ave,,,800-371-5465,E,,Public,24 hours daily,,,,,,1,,,,,05/05/2015,21398,2015-05-05 11:51:11+00,P,,,01/31/2002,,,,,J1772,"8775 Wilbur Ave
Northridge, CA 91324",34.2297918,-118.5448443,1400000US06037115404,52143
9139,0101000020E61000000B54104D6A8C5EC0B0952B1785DB4240,ELEC,SAN LEANDRO,2506-3098 Davis St,"WTP 01; Wastewater Treatment Plant",,888-758-4389,E,,Public,24 hours daily,,,,,,2,,,ChargePoint Network,http://www.mychargepoint.net/,10/09/2015,66694,2015-10-09 07:45:23+00,,,,,,,,,J1772,"2506-3098 Davis St
San Leandro, CA 94577",37.7149991,-122.1939881,1400000US06001432400,52255
9010,0101000020E610000023B1EE69188C5EC0FF36D5A425DC4240,ELEC,Expresso Airport Parking,880 Doolittle Dr,,,800-820-8626,E,,Public,"Restricted to garage hours; pay lot",,,,,8,4,,,,,03/04/2015,65677,2015-03-04 14:22:42+00,P,,,11/08/2010,,,,,NEMA515 J1772,"880 Doolittle Dr
San Leandro, CA 94577",37.7198988,-122.1889901,1400000US06001432400,52255
4579,0101000020E610000023B1EE69188C5EC0FF36D5A425DC4240,ELEC,BMW GROUP,880 Doolittle Dr,"880DOOLITTLE #4
880DOOLITTLE #5
880 DOOLITTLE#1",,888-758-4389,E,,Public,24 hours daily,,,,,,3,,,ChargePoint Network,http://www.mychargepoint.net/,10/09/2015,49344,2015-10-09 08:16:16+00,,,,,,,,,J1772,"880 Doolittle Dr
San Leandro, CA 94577",37.7198988,-122.1889901,1400000US06001432400,52255
3619,0101000020E61000007D6B71D7DC895DC024986A662DF94040,ELEC,LA Fitness,7230 Firestone Blvd,Located on the west side of the building,,562-927-5688,E,,Public,24 hours daily,,,,,,3,,,,,03/04/2015,65657,2015-03-04 14:15:25+00,P,,,02/01/2013,,,,,J1772,"7230 Firestone Blvd
Downey, CA 90241",33.946698,-118.1541041,1400000US06037551401,52266
1989,0101000020E6100000A66C472781615EC0D6ABC8E8804A4340,ELEC,CITY HALL,1110 West Capitol Ave,"STATION #1; Behind City Hall - Near Building Entrance",,888-758-4389,E,,Public,24 hours daily,,,,,,2,,,ChargePoint Network,http://www.mychargepoint.net/,10/09/2015,53409,2015-10-09 08:20:37+00,,,,,,,,,J1772,"1110 West Capitol Ave
West Sacramento, CA 95691",38.582059,-121.5235079,1400000US06113010201,52287
9701,0101000020E610000061545227A0875DC08AB0E1E9950C4140,ELEC,Alhambra Nissan,726 E Main St,,,626-289-6161,E,,Public - Call ahead,Dealership business hours,,,,,,1,,,,,07/08/2015,39869,2015-07-08 14:41:25+00,P,,,03/15/2011,,,,,J1772,"726 E Main St
Alhambra, CA 91801",34.098325,-118.11915,1400000US06037481002,52306
1344,0101000020E610000061545227A0875DC08AB0E1E9950C4140,ELEC,Alhambra Nissan,726 E Main St,,,626-289-6161,E,,Private,,,,,,,1,,,,,07/08/2015,47589,2015-07-08 14:41:25+00,P,,,03/15/2011,,,,,J1772,"726 E Main St
Alhambra, CA 91801",34.098325,-118.11915,1400000US06037481002,52306
12608,0101000020E6100000B1259AF6834B5EC02FF2576DA3564340,ELEC,Folsom Historic District Parking Structure,905 Leidesdorff St,Located at the corner of Reading Street,,916-985-7452,E,,Public,"24 hours daily; 6 hour time limit",,,,,,2,,,,,03/04/2015,51211,2015-03-04 14:25:18+00,LG,,,02/28/2013,,,,,J1772,"905 Leidesdorff St
Folsom, CA 95630",38.6768624,-121.1799294,1400000US06067008404,52381
17962,0101000020E6100000F3075E88B05B5EC0A50B5641B1464340,ELEC,Sacramento Municipal Utility District,6151 S St,,,916-517-0363,E,,Public,24 hours daily,,,,,15,,2,,Greenlots,http://greenlots.com/,05/18/2015,60856,2015-05-18 20:40:32+00,T,,,03/24/2014,,,,,NEMA520 CHADEMO J1772COMBO,"6151 S St
Sacramento, CA 95817",38.5522844,-121.4326497,1400000US06067001700,52396
6620,0101000020E6100000F3075E88B05B5EC0A50B5641B1464340,ELEC,Sacramento Municipal Utility District,6151 S St,,,916-517-0363,E,,Private,,,,,,,4,,,,,05/18/2015,60857,2015-05-18 20:40:32+00,T,,,03/24/2014,,,,,J1772,"6151 S St
Sacramento, CA 95817",38.5522844,-121.4326497,1400000US06067001700,52396
14281,0101000020E6100000A1044713B95B5EC0F60B76C3B6464340,ELEC,Sacramento Municipal Utility District - Solar Parking Lot,6105 S St,,,916-452-3211,E,,Public,24 hours daily,,,,,,,2,,Greenlots,http://greenlots.com/,05/05/2015,66876,2015-05-05 11:58:23+00,T,,,01/01/2015,,,,,CHADEMO J1772COMBO,"6105 S St
Sacramento, CA 95817",38.5524525,-121.4331711,1400000US06067001700,52396
5066,0101000020E61000004B3558DD8F5B5EC04882154CA1464340,ELEC,Sacramento Municipal Utility District - Customer Service Center,6300 S St,,,916-452-3211,E,,Public,24 hours daily,,,,,,2,,,,,05/05/2015,66875,2015-05-05 11:58:22+00,T,,,01/01/2015,,,,,J1772,"6300 S St
Sacramento, CA 95817",38.5517974,-121.4306558,1400000US06067001700,52396
15782,0101000020E61000004B3558DD8F5B5EC04882154CA1464340,ELEC,Sacramento Municipal Utility District - Customer Service Center,6300 S St,,,916-452-3211,E,,Private,,,,,,,10,,1 SP Inductive,,,05/05/2015,7289,2015-05-05 11:58:22+00,T,,,12/31/2008,,,,,J1772,"6300 S St
Sacramento, CA 95817",38.5517974,-121.4306558,1400000US06067001700,52396
21304,0101000020E610000029ED0DBE305D5EC0A2EE0390DA464340,ELEC,University of California - Davis - Medical Center,4241 X St,Located in Parking Structure 3,,800-282-3284,E,,Public,24 hours daily,,,,,,10,,,,,07/08/2015,49134,2015-07-08 15:00:28+00,P,,,07/25/2012,,,,,J1772,"4241 X St
Sacramento, CA 95817",38.553545,-121.4561,1400000US06067001700,52396
15317,0101000020E610000040506EDB775B5EC012C53FC7A2464340,ELEC,Sacramento Municipal Utility District - Customer Service Center ,6301 S St,Customer Parking Lot,,916-452-3211,E,,Public,24 hours daily,,,,,,1,,1 SP Inductive,,,05/05/2015,33685,2015-05-05 11:55:29+00,T,,,12/31/2008,,,,,J1772,"6301 S St
Sacramento, CA 95817",38.5518426,-121.4291905,1400000US06067001700,52396
14020,0101000020E6100000A1044713B95B5EC0F60B76C3B6464340,ELEC,Sacramento Municipal Utility District - Solar Parking Lot,6105 S St,,,916-452-3211,E,,Private,Employee and fleet use only,,,,,15,4,,,,,05/05/2015,66877,2015-05-05 11:58:23+00,T,,,01/01/2015,,,,,NEMA520 J1772,"6105 S St
Sacramento, CA 95817",38.5524525,-121.4331711,1400000US06067001700,52396
2662,0101000020E610000054A703594F8A5EC069CAA9F81ADB4240,ELEC,San Leandro Ford,1111 Marina Blvd,,,510-352-2000,E,,Private,Service center use only,,,,,,1,,,,,06/02/2015,53918,2015-06-02 18:13:55+00,P,,,11/01/2013,,,,,J1772,"1111 Marina Blvd
San Leandro, CA 94577",37.7117606,-122.161093,1400000US06001433200,52460
19408,0101000020E61000002D228AC91B0F5EC0DC8310902F994340,ELEC,Squaw Valley Resort,1960 Squaw Valley Rd,,,800-403-0206  877-798-3752,E,,Public,"24 hours daily;for guest use only; see valet for access",,,,,,6,,,Tesla,http://www.teslamotors.com/supercharger,05/05/2015,52640,2015-10-08 17:45:55+00,P,,,08/01/2013,,,,,J1772 TESLA,"1960 Squaw Valley Rd
Olympic Valley, CA 96146",39.196764,-120.236071,1400000US06061022014,52500
15447,0101000020E61000009F477B7283855EC015BFCEF2E1D54240,ELEC,HAYWARD,777 B St,"CITY HALL 01; Located in basement level.  Available M-F 8AM-5PM, excl. Holidays",,888-758-4389,E,,Public,24 hours daily,,,,,1,1,,,ChargePoint Network,http://www.mychargepoint.net/,10/09/2015,51654,2015-10-09 07:50:46+00,,,,,,,,,NEMA520 J1772,"777 B St
Hayward, CA 94541",37.6709579,-122.0861479,1400000US06001435400,52702
17769,0101000020E61000003B79477C5D855EC02975C93846D64240,ELEC,City of Hayward - 805 B St,805 B Street,,,888-998-2546,E,,Public,MON: 24 hours | TUE: 24 hours | WED: 24 hours | THU: 24 hours | FRI: 24 hours | SAT: 24 hours | SUN: 24 hours,,,,,,10,2,,Blink Network,http://www.blinknetwork.com/,10/09/2015,49978,2015-10-09 07:13:41+00,,,,,,,,,CHADEMO J1772,"805 B Street
Hayward, CA 94541",37.674018,-122.0838309,1400000US06001435400,52702
15015,0101000020E6100000E8F692C6E8595EC0F50714FB156D4240,ELEC,SAN BENITO CO.,Winn Alley,DUAL PUBLIC,,888-758-4389,E,,Public,24 hours daily,,,,,,2,,,ChargePoint Network,http://www.mychargepoint.net/,10/09/2015,62229,2015-10-09 08:25:23+00,,,,,,,,,J1772,"Winn Alley
Hollister, CA 95023",36.8522333,-121.4048325,1400000US06069000400,52708
14918,0101000020E6100000300B92E3F3A45EC0D82B2CB81F4A4340,ELEC,Calistoga Spa Hot Springs - Tesla,1006 Washington St,,,707-942-6269  877-798-3752,E,,Public - Call ahead,"24 hours daily; for Tesla use only; for guest use only",,,,,,2,,,Tesla,http://www.teslamotors.com/supercharger,09/02/2015,68926,2015-09-02 02:43:46+00,P,,,06/01/2015,,,,,TESLA,"1006 Washington St
Calistoga, CA 94515",38.579093,-122.5773858,1400000US06055202000,52733
9286,0101000020E6100000D66949EC7FA45EC050A335ABE34A4340,ELEC,Solage Calistoga,755 Silverado Trail,,,707-226-0800  877-798-3752,E,,Public,"Resort guests and members only; see valet for access",,,,,,3,,,Tesla,http://www.teslamotors.com/supercharger,05/05/2015,42908,2015-10-08 20:07:32+00,P,,,01/01/2012,,,,,J1772 TESLA,"755 Silverado Trail
Calistoga, CA 94515",38.5850729,-122.5703078,1400000US06055202000,52733
16554,0101000020E610000000659D3B0BA55EC0F8623953324A4340,ELEC,Mount View Hotel & Spa - Tesla,1457 Lincoln Ave,,,707-942-6877  877-798-3752,E,,Public,"24 hours daily; for Tesla use only; for guest use only; see valet for access",,,,,,1,,,Tesla,http://www.teslamotors.com/supercharger,,70337,2015-10-08 18:35:34+00,P,,,06/01/2015,,,,,TESLA,"1457 Lincoln Ave
Calistoga, CA 94515",38.5796608,-122.5788106,1400000US06055202000,52733
18757,0101000020E6100000B29DEFA7C6635DC080608E1EBF0B4140,ELEC,City of Rancho Cucamonga - Metrolink Station,11208 Azuza Court,,,909-477-2700,E,,Public,Lot business hours,,,,,,2,,,,,05/05/2015,48979,2015-05-05 11:53:25+00,LG,,,01/31/2012,,,,,J1772,"11208 Azuza Court
Rancho Cucamonga, CA 91730",34.09177,-117.559,1400000US06071002110,52813
10803,0101000020E6100000BE9F1A2FDD645DC0E1404816300D4140,ELEC,City of Rancho Cucamonga - City Hall,10500 Civic Center Dr,Located in public parking lot for Rancho Cucamonga City Hall,,909-477-2700,E,,Public,24 hours daily,,,,,,2,,,,,05/05/2015,46973,2015-05-05 11:58:35+00,LG,,,01/31/2012,,,,,J1772,"10500 Civic Center Dr
Rancho Cucamonga, CA 91730",34.10303,-117.576,1400000US06071002110,52813
2800,0101000020E610000082E7DEC325635DC0EF5701BEDB0C4140,ELEC,City of Rancho Cucamonga - Animal Care & Adoption Center,11780 Arrow Rt,,,909-477-2700,E,,Public,24 hours daily,,,,,,1,,,,,05/05/2015,46974,2015-05-05 11:50:37+00,LG,,,01/31/2012,,,,,J1772,"11780 Arrow Rt
Rancho Cucamonga, CA 91730",34.100456,-117.54918,1400000US06071002110,52813
7964,0101000020E61000002049A4C835A05EC0FC0BF3D4D9DD4240,ELEC,CCSF - SFZOO,1 Zoo Road,"ZOO 2; Chargers in visitor parking lot just  south of accessible parking spaces adjacent to visitor entrance
ZOO 3; Chargers in visitor parking lot just  south of accessible parking spaces adjacent to visitor entrance
ZOO 4; Chargers in visitor parking lot just  south of accessible parking spaces adjacent to visitor entrance
ZOO 5; Chargers in visitor parking lot just  south of accessible parking spaces adjacent to visitor entrance",,888-758-4389,E,,Public,24 hours daily,,,,,,4,,,ChargePoint Network,http://www.mychargepoint.net/,10/09/2015,58034,2015-10-09 08:17:38+00,,,,,,,,,J1772,"1 Zoo Road
San Francisco, CA 94132",37.7332102,-122.5032827,1400000US06075060400,52833
22311,0101000020E61000009D233CEB64A05EC0678819D0C1DD4240,ELEC,CCSF - SFZOO,2856-2948 Great Hwy,"ZOO 1; Chargers in visitor parking lot just  south of accessible parking spaces adjacent to visitor entrance",,888-758-4389,E,,Public,24 hours daily,,,,,,1,,,ChargePoint Network,http://www.mychargepoint.net/,10/09/2015,58083,2015-10-09 08:18:00+00,,,,,,,,,J1772,"2856-2948 Great Hwy
San Francisco, CA 94132",37.7324772,-122.5061596,1400000US06075060400,52833
18083,0101000020E61000007CB19C2919605EC086AE44A0FA494340,ELEC,3 HOURS FREE,500 Capitol Mall,"EAST STATION; Main entrance, Level P-1
WEST STATION; Main entrance, Level P-1
STATION 1
STATION 2",,888-758-4389,E,,Public,24 hours daily,,,,,2,6,,,ChargePoint Network,http://www.mychargepoint.net/,10/09/2015,45268,2015-10-09 08:12:07+00,,,,,,,,,NEMA520 J1772,"500 Capitol Mall
Sacramento, CA 95814",38.577961,-121.5015358,1400000US06067000800,52841
9622,0101000020E6100000B7627FD93D605EC0384BC972124A4340,ELEC,Hines,300 Capitol Mall,,,916-498-9854,E,,Public,24 hours daily,,,,,4,4,,,,,06/02/2015,53383,2015-06-02 18:35:00+00,P,,,03/20/2013,,,,,J1772 NEMA1450,"300 Capitol Mall
Sacramento, CA 95814",38.578688,-121.503775,1400000US06067000800,52841
6790,0101000020E6100000EB353D2828605EC0BB0CFFE9064A4340,ELEC,Wells Fargo Center,400 Capital Mall,,,916-614-8850,E,,Public,"Garage business hours; pay lot",,,,,,5,,,,,05/05/2015,51236,2015-05-05 11:54:57+00,P,,,02/26/2013,,,,,J1772,"400 Capital Mall
Sacramento, CA 95814",38.578336,-121.502451,1400000US06067000800,52841
346,0101000020E6100000C1F979F8D7225DC07F2370DA42EC4040,ELEC,Riviera Palm Springs - Tesla,1600 N Indian Canyon Dr,,,866-588-8311  877-798-3752,E,,Public,"24 hours daily; for Tesla use only; for guest use only; see valet for access",,,,,,3,,,Tesla,http://www.teslamotors.com/supercharger,,70373,2015-10-09 20:24:35+00,P,,,03/01/2015,,,,,TESLA,"1600 N Indian Canyon Dr
Palm Springs, CA 92262",33.8457902,-116.5444318,1400000US06065941300,52885
18471,0101000020E6100000FEB7921D1B895EC0C2DD59BBEDBA4240,ELEC,Four Seasons Hotel Silicon Valley,2050 University Ave.,"Valet use only.
",,888-998-2546,E,,Private,MON: 24 hours | TUE: 24 hours | WED: 24 hours | THU: 24 hours | FRI: 24 hours | SAT: 24 hours | SUN: 24 hours,,,,,,1,,,Blink Network,http://www.blinknetwork.com/,10/09/2015,60819,2015-10-09 07:13:44+00,,,,,,,,,J1772,"2050 University Ave.
East Palo Alto, CA 94303",37.46038,-122.14228,1400000US06081612100,52948
5533,0101000020E61000007F01182ADA845DC00B783EA8300D4140,ELEC,Los Angeles County Sheriff - Temple City Station,8838 Las Tunas Dr,,,323-267-2023,E,,Public,"24 hours daily; keypad activated, instructions on EVSE",,,,,,2,,,,,06/02/2015,63064,2015-06-02 18:01:42+00,LG,,,08/01/2014,,,,,J1772,"8838 Las Tunas Dr
Temple City, CA 91780",34.1030474,-118.0758157,1400000US06037481201,53036
14557,0101000020E610000053D6CADF981E5DC0EDD5096031EC4040,ELEC,Plaza Rio Vista - Cathedral City,67800 Vista Chino,,,877-455-3833,E,,Public - Card key at all times,"24 hours daily; EVgo network subscription and key fob required",,,,,,1,1,,eVgo Network,https://www.evgonetwork.com/,10/09/2015,69415,2015-10-09 08:52:08+00,,,,,,,,,J1772,"67800 Vista Chino
Cathedral City, CA 92234",33.84525681,-116.4780807,1400000US06065044904,53075
1359,0101000020E6100000D08BC9D1D2045EC0F62C639EF0824240,ELEC,AMTRAK STATION,18814-18842 Rd 26,"STATION 1; Located at the Amtrak Station",,888-758-4389,E,,Public,24 hours daily,,,,,,2,,,ChargePoint Network,http://www.mychargepoint.net/,10/09/2015,65334,2015-10-09 07:48:59+00,,,,,,,,,J1772,"18814-18842 Rd 26
Madera, CA 93638",37.0229681,-120.0753674,1400000US06039000506,53149
21401,0101000020E610000053CDACA580485DC0EB3713D385624040,ELEC,2835 Camino Del Rio S.,2835 Camino Del Rio S.,First Parking Tier Behind Building ,,800-663-5633,E,,Public,"MO: 12:00am-12:00am; TU: 12:00am-12:00am; WE: 12:00am-12:00am; TH: 12:00am-12:00am; FR: 12:00am-12:00am; SA: 12:00am-12:00am; SU: 12:00am-12:00am",,,,,,1,,,SemaCharge Network,http://www.semacharge.com/,10/09/2015,61655,2015-10-09 07:37:05+00,,,,,,,,,J1772,"2835 Camino Del Rio S.
San Diego, CA 92108",32.769709,-117.132852,1400000US06073001100,53167
21505,0101000020E6100000BF9CD9AED04D5DC03ACAC16C02964040,ELEC,Walmart #2094 - Vista CA,1800 University Dr,"Northeast corner of parking lot, near 
handicap spots.

Northeast corner of parking lot, near 
handicap spots.
",,888-998-2546,E,,Public,MON: 24 hours | TUE: 24 hours | WED: 24 hours | THU: 24 hours | FRI: 24 hours | SAT: 24 hours | SUN: 24 hours,,,,,,2,,,Blink Network,http://www.blinknetwork.com/,10/09/2015,49150,2015-10-09 07:13:39+00,,,,,,,,,J1772,"1800 University Dr
Vista, CA 92083",33.171949,-117.215862,1400000US06073019902,53333
7894,0101000020E61000003A4030478F4D5DC079B0C56E9F954040,ELEC,"Walgreens - Vista, CA #9389",310 Sycamore Ave,,,800-663-5633,E,,Public - Card key at all times,"MO: Not Specified; TU: Not Specified; WE: Not Specified; TH: Not Specified; FR: Not Specified; SA: Not Specified; SU: Not Specified",,,,,,1,,,SemaCharge Network,http://www.semacharge.com/,10/09/2015,43832,2015-10-09 07:36:35+00,,,,,,,,,J1772,"310 Sycamore Ave
Vista, CA 92083",33.168928,-117.21187,1400000US06073019902,53333
13974,0101000020E6100000960A2AAA7E905DC0D2393FC571124140,ELEC,The Americana at Brand,"889 Americana Way, Suite 330",,,888-998-2546,E,,Public,MON: 24 hours | TUE: 24 hours | WED: 24 hours | THU: 24 hours | FRI: 24 hours | SAT: 24 hours | SUN: 24 hours,,,,,,6,,,Blink Network,http://www.blinknetwork.com/,10/09/2015,48354,2015-10-09 07:11:37+00,,,,,,,,,J1772,"889 Americana Way, Suite 330
Glendale, CA 91210",34.144097,-118.257731,1400000US06037302301,53404
4480,0101000020E610000086E464E2569C5DC0ED9C668176074140,ELEC,Oppenheimer Tower,10880 Wilshire Boulevard,,,888-998-2546,E,,Public,MON: 24 hours | TUE: 24 hours | WED: 24 hours | THU: 24 hours | FRI: 24 hours | SAT: 24 hours | SUN: 24 hours,,,,,,4,,,Blink Network,http://www.blinknetwork.com/,10/09/2015,67973,2015-10-09 07:13:18+00,,,,,,,,,J1772,"10880 Wilshire Boulevard
Los Angeles, CA 90024",34.058304,-118.442803,1400000US06037265510,53431
12106,0101000020E6100000D1764CDD959C5DC0E8D9ACFA5C074140,ELEC,10960 Wilshire,10960 Wilshire Boulevard,,,888-998-2546,E,,Public,MON: 24 hours | TUE: 24 hours | WED: 24 hours | THU: 24 hours | FRI: 24 hours | SAT: 24 hours | SUN: 24 hours,,,,,,4,,,Blink Network,http://www.blinknetwork.com/,10/09/2015,67972,2015-10-09 07:11:55+00,,,,,,,,,J1772,"10960 Wilshire Boulevard
Los Angeles, CA 90024",34.057525,-118.446647,1400000US06037265510,53431
6381,0101000020E6100000EAD0E979B7665DC0AFE87BB2070C4140,ELEC,City of Rancho Cucamonga - Public Works Service Center,8794 Lions St,,,909-477-2700,E,,Public,Lot business hours,,,,,,1,,,,,05/05/2015,51518,2015-05-05 11:58:40+00,LG,,,04/15/2013,,,,,J1772,"8794 Lions St
Rancho Cucamonga, CA 91730",34.0939849,-117.6049485,1400000US06071002105,53452
3972,0101000020E61000009FBD440603AE5EC06D5FF6A1C1374340,ELEC,Hyatt Vineyard Creek Hotel and Spa - Tesla,170 Railroad St,,,707-284-1234  877-798-3752,E,,Public,"24 hours daily; for Tesla use only; for guest use only; see front desk for access",,,,,,2,,,Tesla,http://www.teslamotors.com/supercharger,09/02/2015,68988,2015-09-02 02:46:21+00,P,,,03/01/2015,,,,,TESLA,"170 Railroad St
Santa Rosa, CA 95401",38.4355967,-122.7189346,1400000US06097153002,53533
3099,0101000020E6100000C2DA183BE18A5EC0B03C484F91BD4240,ELEC,Intuit - Menlo Park Campus,180 Jefferson Drive,,,888-998-2546,E,,Private,MON: 24 hours | TUE: 24 hours | WED: 24 hours | THU: 24 hours | FRI: 24 hours | SAT: 24 hours | SUN: 24 hours,,,,,,,2,,Blink Network,http://www.blinknetwork.com/,10/09/2015,49507,2015-10-09 07:12:53+00,,,,,,,,,CHADEMO,"180 Jefferson Drive
Menlo Park, CA 94025",37.480997,-122.169997,1400000US06081611700,53679
5929,0101000020E6100000D2FBC6D79E895EC0F1643733FABD4240,ELEC,Facebook - Building 12,1601 Willow Rd.,,,888-998-2546,E,,Public,MON: 24 hours | TUE: 24 hours | WED: 24 hours | THU: 24 hours | FRI: 24 hours | SAT: 24 hours | SUN: 24 hours,,,,,,,2,,Blink Network,http://www.blinknetwork.com/,10/09/2015,48965,2015-10-09 07:13:52+00,,,,,,,,,CHADEMO,"1601 Willow Rd.
Menlo Park, CA 94025",37.484198,-122.15032,1400000US06081611700,53679
7468,0101000020E6100000F836FDD98F895EC0FA7FD59123BE4240,ELEC,FACEBOOK,14 Hacker Way,MPK 14-8,,888-758-4389,E,,Public,24 hours daily,,,,,,2,,,ChargePoint Network,http://www.mychargepoint.net/,10/09/2015,63801,2015-10-09 08:24:11+00,,,,,,,,,J1772,"14 Hacker Way
Menlo Park, CA 94025",37.4854605,-122.149405,1400000US06081611700,53679
17161,0101000020E61000008FE5B8AE73895EC05BC4C1EFF0BD4240,ELEC,FACEBOOK,15 Hacker Way Building 15,"MPK 15-5; -",,888-758-4389,E,,Public,24 hours daily,,,,,,2,,,ChargePoint Network,http://www.mychargepoint.net/,10/09/2015,63726,2015-10-09 08:24:19+00,,,,,,,,,J1772,"15 Hacker Way Building 15
Menlo Park, CA 94025",37.4839153,-122.1476857,1400000US06081611700,53679
17415,0101000020E61000005E52109777895EC0C7BAB88D06BE4240,ELEC,FACEBOOK,1 Hacker Way Building 10,"MPK 10-2; Facebook Employees Only
MPK 10-1; Facebook Employees Only
MPK 10-4
MPK 10-5; -
MPK 10-6
MPK 10-3; -",,888-758-4389,E,,Public,24 hours daily,,,,,,12,,,ChargePoint Network,http://www.mychargepoint.net/,10/09/2015,63948,2015-10-09 08:26:14+00,,,,,,,,,J1772,"1 Hacker Way Building 10
Menlo Park, CA 94025",37.484575,-122.1479242,1400000US06081611700,53679
20607,0101000020E61000006EAE505A6E895EC05B1B745314BE4240,ELEC,FACEBOOK,17 Hacker Way,"MPK 17-8; Facebook Employees Only
MPK 17-9; Facebook Employees Only
MPK 17-6; Facebook Employees Only
MPK 17-3; Facebook Employees Only
MPK 17-4; Facebook Employees Only
MPK 17-7; Facebook Employees Only
MPK 17-5; Facebook Employees Only",,888-758-4389,E,,Public,24 hours daily,,,,,,14,,,ChargePoint Network,http://www.mychargepoint.net/,10/09/2015,69952,2015-10-09 08:19:01+00,,,,,,,,,J1772,"17 Hacker Way
Menlo Park, CA 94025",37.4849953,-122.1473604,1400000US06081611700,53679
11671,0101000020E61000005E52109777895EC0C7BAB88D06BE4240,ELEC,FACEBOOK,1 Hacker Way Building 14,"MPK 14-2; Facebook Employees Only
MPK 14-1; Facebook Employees Only
MPK 14-6
MPK 14-7; -
MPK 14-9
MPK 14-10
MPK 14-4
MPK 14-3
MPK 14-5",,888-758-4389,E,,Public,24 hours daily,,,,,,18,,,ChargePoint Network,http://www.mychargepoint.net/,10/09/2015,63800,2015-10-09 08:20:52+00,,,,,,,,,J1772,"1 Hacker Way Building 14
Menlo Park, CA 94025",37.484575,-122.1479242,1400000US06081611700,53679
13903,0101000020E6100000ECD742354A8B5EC0BD40A43A78BD4240,ELEC,LINC Lighting & Electrical,4500 Bohannon Dr,,,,E,,Private,,,,,,,2,,,,,03/04/2015,46737,2015-03-04 14:12:29+00,P,,,12/20/2011,,,,,J1772,"4500 Bohannon Dr
Menlo Park, CA 94025",37.4802316,-122.1764043,1400000US06081611700,53679
7201,0101000020E61000005E52109777895EC0C7BAB88D06BE4240,ELEC,FACEBOOK,1 Hacker Way Building 15,"MPK 15-8; -
MPK 15-6; -
MPK 15-9; -
MPK 15-4; -
MPK 15-3GW; -
MPK 15-10; -
MPK 15-7; -",,888-758-4389,E,,Public,24 hours daily,,,,,,14,,,ChargePoint Network,http://www.mychargepoint.net/,10/09/2015,63725,2015-10-09 08:24:10+00,,,,,,,,,J1772,"1 Hacker Way Building 15
Menlo Park, CA 94025",37.484575,-122.1479242,1400000US06081611700,53679
1746,0101000020E61000005E52109777895EC0C7BAB88D06BE4240,ELEC,FACEBOOK,1 Hacker Way Building 17,"MPK 17-11; Facebook Employees Only. Located on southwest side, Bldg 17
MPK 17-10; Facebook Employees Only
MPK 17-2; Facebook Employees Only",,888-758-4389,E,,Public,24 hours daily,,,,,1,5,,,ChargePoint Network,http://www.mychargepoint.net/,10/09/2015,69951,2015-10-09 08:12:37+00,,,,,,,,,NEMA520 J1772,"1 Hacker Way Building 17
Menlo Park, CA 94025",37.484575,-122.1479242,1400000US06081611700,53679
22255,0101000020E610000058B49487E0895EC026F7E05A92BD4240,ELEC,FACEBOOK,1 Facebook Way,"MPK 20-3; -
MPK 20-7; -
MPK 20-11
MPK 20-8; -
MPK 20-5; -
MPK 20-6; -
MPK 20-10
MPK 20-2; -
MPK 20-9
MPK 20-20
MPK 20-1; -
MPK 20-14
MPK 20-12
MPK 20-13
MPK 20-16
MPK 20-19
MPK 20-18
MPK 20-17
MPK 20-15
MPK 20-4; -",,888-758-4389,E,,Public,24 hours daily,,,,,,40,,,ChargePoint Network,http://www.mychargepoint.net/,10/09/2015,66659,2015-10-09 08:30:43+00,,,,,,,,,J1772,"1 Facebook Way
Menlo Park, CA 94025",37.4810289,-122.1543292,1400000US06081611700,53679
9299,0101000020E610000051949570328B5EC0E0C215AB61BD4240,ELEC,4700 BOHANNON,4700 Bohannon Dr,"4700 BOHANNON; Located outside of the front entrance of 4700 Bohannon",,888-758-4389,E,,Public,24 hours daily,,,,,,2,,,ChargePoint Network,http://www.mychargepoint.net/,10/09/2015,69013,2015-10-09 07:49:31+00,,,,,,,,,J1772,"4700 Bohannon Dr
Menlo Park, CA 94025",37.4795431,-122.1749536,1400000US06081611700,53679
9054,0101000020E6100000432CAC65FCF15DC0E4F0EE6D9F384140,ELEC,COUNTY OF SB,4572 Calle Real,"COUNTY_SB_APCD1; -
COUNTY_SB_APCD2; Free Parking 24/7 no restriction",,888-758-4389,E,,Public,24 hours daily,,,,,,4,,,ChargePoint Network,http://www.mychargepoint.net/,10/09/2015,63724,2015-10-09 08:13:21+00,,,,,,,,,J1772,"4572 Calle Real
Goleta, CA 93110",34.4423654,-119.7810301,1400000US06083000101,53781
3748,0101000020E61000004DD9E90775F25DC0B0389CF9D5384140,ELEC,Ramada Limited,4770 Calle Real,"Available only to Ramada Limited Guests

Available only to Ramada Limited Guests

Available only to Ramada Limited Guests
",,888-998-2546,E,,Public,MON: 24 hours | TUE: 24 hours | WED: 24 hours | THU: 24 hours | FRI: 24 hours | SAT: 24 hours | SUN: 24 hours,,,,,,3,,,Blink Network,http://www.blinknetwork.com/,10/09/2015,47640,2015-10-09 07:09:25+00,,,,,,,,,J1772,"4770 Calle Real
Santa Barbara, CA 93110",34.44403,-119.788393,1400000US06083000101,53781
837,0101000020E61000005948652F00F25DC0B25AAA1CA4384140,ELEC,COUNTY OF SB,4574-4588 Calle Real,"COUNTY_SB_APCD3; Free Parking 24/7 no restriction",,888-758-4389,E,,Public,24 hours daily,,,,,,2,,,ChargePoint Network,http://www.mychargepoint.net/,10/09/2015,70029,2015-10-09 08:32:32+00,,,,,,,,,J1772,"4574-4588 Calle Real
Goleta, CA 93110",34.4425083,-119.7812613,1400000US06083000101,53781
1845,0101000020E6100000E9F6ED7FDB885DC093BFFF7FB14B4140,ELEC,Antelope Valley Nissan/451 Auto Center Dr.,451 Auto Center Dr.,,,877-455-3833,E,,Public - Card key at all times,"24 hours daily; EVgo network subscription and key fob required",,,,,,,1,,eVgo Network,https://www.evgonetwork.com/,10/09/2015,69555,2015-10-09 08:54:44+00,,,,,,,,,CHADEMO,"451 Auto Center Dr.
Palmdale, CA 93551",34.59135437,-118.1383972,1400000US06037910201,53802
19424,0101000020E61000001213D4F0AD885DC08FEA2A93D04B4140,ELEC,ANTELOPE VALLEY,39050 Carriage Way,"VW_422585_A; -",,888-758-4389,E,,Public,24 hours daily,,,,,,2,,,ChargePoint Network,http://www.mychargepoint.net/,10/09/2015,64113,2015-10-09 07:48:30+00,,,,,,,,,J1772,"39050 Carriage Way
Palmdale, CA 93551",34.5923027,-118.1356165,1400000US06037910201,53802
22459,0101000020E6100000029EB470D9885DC0FBBF3456AC4B4140,ELEC,Antelope Valley Nissan,451 Auto Center Dr,"5th St West and Auto Center Dr; access EVSE via the service drive, located adjacent to the front door",,661-274-4700 x214,E,,Public - Call ahead,"24 hours daily; primarily for customer use",,,,,,2,,,,,07/08/2015,39919,2015-07-08 14:23:59+00,P,,,03/15/2011,,,,,J1772,"451 Auto Center Dr
Palmdale, CA 93551",34.5911968,-118.1382715,1400000US06037910201,53802
2938,0101000020E6100000029EB470D9885DC0FBBF3456AC4B4140,ELEC,Antelope Valley Nissan,451 Auto Center Dr,"5th St West and Auto Center Dr; access EVSE via the service drive, located adjacent to the front door",,661-274-4700 x214,E,,Private,Service center use only,,,,,,2,,,,,07/08/2015,48158,2015-07-08 14:23:59+00,P,,,03/15/2011,,,,,J1772,"451 Auto Center Dr
Palmdale, CA 93551",34.5911968,-118.1382715,1400000US06037910201,53802
18013,0101000020E6100000FF21FDF675905EC079060DFD13F04240,ELEC,University of California - Berkeley - Parking Structure H,Hearst Ave & La Loma Ave,,,510-643-7701,E,,Public,"Garage business hours; pay lot",,,,,1,2,,,,,09/25/2012,49253,2015-01-08 15:40:42+00,P,,,06/21/2012,,,,,NEMA520 J1772,"Hearst Ave &amp; La Loma Ave
Berkeley, CA 94709",37.87561,-122.2572,1400000US06001422500,54063
8430,0101000020E6100000F144B52DEF815EC0082C6FFDAA7C4240,ELEC,City of Santa Cruz,809 Center St,,,,E,,Private,,,,,,,1,,,,,06/02/2015,60866,2015-06-02 18:06:14+00,LG,,,02/01/2014,,,,,J1772,"809 Center St
Santa Cruz, CA 95060",36.9739682,-122.0302233,1400000US06087100700,54113
6103,0101000020E6100000598638D6C5815EC0268DD13AAA7C4240,ELEC,ECOLOGY ACTION,877 Cedar Street,"CEDAR STREET 02; Solar Powered!
CEDAR STREET 03; Solar Powered!
CEDAR STREET 01; Solar Powered!",,888-758-4389,E,,Public,24 hours daily,,,,,3,3,,,ChargePoint Network,http://www.mychargepoint.net/,10/09/2015,38934,2015-10-09 07:54:43+00,,,,,,,,,NEMA520 J1772,"877 Cedar Street
Santa Cruz, CA 95060",36.973945,-122.0277,1400000US06087100700,54113
13230,0101000020E61000009E2397A4D7815EC069BF5A5AB27C4240,ELEC,City of Santa Cruz,810 Center St,,,,E,,Private,,,,,,,4,,,,,06/02/2015,61429,2015-06-02 17:50:31+00,LG,,,02/01/2014,,,,,J1772,"810 Center St
Santa Cruz, CA 95060",36.9741929,-122.0287868,1400000US06087100700,54113
3025,0101000020E6100000B0123D3ABFA85EC05EEE38EA8D204340,ELEC,DEER CREEK,N McDowell Blvd,"STATION 3
STATION 2
STATION 6
STATION 8
STATION 5
STATION 4
STATION 1
STATION 9
STATION 7; -
STATION 10",,888-758-4389,E,,Public,24 hours daily,,,,,,10,,,ChargePoint Network,http://www.mychargepoint.net/,10/09/2015,61366,2015-10-09 07:47:14+00,,,,,,,,,J1772,"N McDowell Blvd
Petaluma, CA 94954",38.2543309,-122.6366716,1400000US06097150609,54167
3588,0101000020E61000005551BCCADA5E5DC0986E1283C0F24040,ELEC,Santa Ana Watershed Project Authority,11615 Sterling Ave,,,951-354-4220,E,,Public,"Business hours; see front desk for access",,,,,,2,,,,,10/06/2015,70066,2015-10-06 21:57:24+00,P,,,04/05/2013,,,,,J1772,"11615 Sterling Ave
Riverside, CA 92503",33.8965,-117.482104,1400000US06065041405,54208
17451,0101000020E6100000C976BE9F1A175DC00D1AFA27B8E04040,ELEC,JW Marriott Desert Springs Resort & Spa,74855 Country Club Dr,,,760-341-2211  877-798-3752,E,,Public,"24 hours daily; see valet for access",,,,,6,9,,,Tesla,http://www.teslamotors.com/supercharger,05/05/2015,48365,2015-10-07 21:51:17+00,P,,,12/31/2011,,,,,NEMA520 J1772 TESLA,"74855 Country Club Dr
Palm Desert, CA 92260",33.75562,-116.361,1400000US06065044930,54219
20486,0101000020E610000095A35B0AA37E5EC0908653E6E67D4240,ELEC,SANTA CRUZ CNTY,2400 Chanticleer Ave,"STATION 1; Located Near the Sheriff's Building",,888-758-4389,E,,Public,24 hours daily,,,,,1,1,,,ChargePoint Network,http://www.mychargepoint.net/,10/09/2015,51729,2015-10-09 08:16:26+00,,,,,,,,,NEMA520 J1772,"2400 Chanticleer Ave
Santa Cruz, CA 95062",36.983609,-121.9787012,1400000US06087121402,54259
19404,0101000020E61000002D7B12D89C795EC0E091C20655B14240,ELEC,AVAGO,1310 Ridder Park Dr,"CORPORATE HQ#4; For Employees Only.  South Parking Lot
CORPORATE HQ#3; For Employees Only. South Parking Lot ",,888-758-4389,E,,Public,24 hours daily,,,,,,4,,,ChargePoint Network,http://www.mychargepoint.net/,10/09/2015,55919,2015-10-09 07:45:51+00,,,,,,,,,J1772,"1310 Ridder Park Dr
San Jose, CA 95190",37.3854073,-121.900198,1400000US06085504318,54267
20619,0101000020E610000003ACFA0134795EC08000080E1EB04240,ELEC,Santa Clara Electrical,908 Bern Ct,At Old Oakland Rd,,408-453-1022,E,,Public,9am-5pm M-F,,,,,,1,,,,,05/05/2015,41583,2015-05-05 11:55:19+00,P,,,10/03/2011,,,,,J1772,"908 Bern Ct
San Jose, CA 95112",37.3759172,-121.8937993,1400000US06085504318,54267
11992,0101000020E61000002D7B12D89C795EC0E091C20655B14240,ELEC,AVAGO,1310 Ridder Park Dr,"CORPORATE HQ#2; For Employees Only. South Parking Lot adjacent to Santa Clara County Education Bldg
CORPORATE HQ#1; For Employees Only.  South Parking Lot adjacent to Santa Clara County Education Bldg",,888-758-4389,E,,Public,24 hours daily,,,,,1,3,,,ChargePoint Network,http://www.mychargepoint.net/,10/09/2015,50748,2015-10-09 07:45:51+00,,,,,,,,,J1772 NEMA520,"1310 Ridder Park Dr
San Jose, CA 95131",37.3854073,-121.900198,1400000US06085504318,54267
11805,0101000020E6100000912BF52C08845EC0EDD45C6E30D84240,ELEC,McDonald's #13562 - Grove Way - Castro Valley CA,2905 Grove Way,,,888-998-2546,E,,Public,MON: 24 hours | TUE: 24 hours | WED: 24 hours | THU: 24 hours | FRI: 24 hours | SAT: 24 hours | SUN: 24 hours,,,,,,3,,,Blink Network,http://www.blinknetwork.com/,10/09/2015,67784,2015-10-09 07:13:58+00,,,,,,,,,J1772,"2905 Grove Way
Castro Valley, CA 94546",37.688978,-122.062999,1400000US06001431100,54440
4195,0101000020E6100000B1F61CFD541D5DC0553431B841EA4040,ELEC,"Walgreens - Cathedral City, CA #9229",30015 Date Palm Dr,,,800-663-5633,E,,Public - Card key at all times,"MO: 12:00am-12:00am; TU: 12:00am-12:00am; WE: 12:00am-12:00am; TH: 12:00am-12:00am; FR: 12:00am-12:00am; SA: 12:00am-12:00am; SU: 12:00am-12:00am",,,,,,1,,,SemaCharge Network,http://www.semacharge.com/,10/09/2015,53520,2015-10-09 07:36:50+00,,,,,,,,,J1772,"30015 Date Palm Dr
Cathedral City, CA 92234",33.8301306,-116.4583123,1400000US06065044925,54453
16805,0101000020E6100000620DBCFF347C5DC01FF296AB1FE24040,ELEC,GARDEN GROVE,10800 Trask Ave,VW_422601_A,,888-758-4389,E,,Public,24 hours daily,,,,,,2,,,ChargePoint Network,http://www.mychargepoint.net/,10/09/2015,64045,2015-10-09 08:27:20+00,,,,,,,,,J1772,"10800 Trask Ave
Garden Grove, CA 92843",33.7665915,-117.9407348,1400000US06059088902,54545
8072,0101000020E61000008A8EE4F21F805DC03C8386FE09124140,ELEC,Lincoln City Cultural Center,181 W. Huntington Drive,EVSE-RS+,,888-833-2148,E,,Public,24 hours daily,,,,,,1,,,AeroVironment Network,http://evsolutions.avinc.com/services/subscriber_network/,10/09/2015,65904,2015-10-09 08:46:31+00,,,,,,,,,J1772,"181 W. Huntington Drive
Monrovia, CA 91016",34.14093,-118.00195,1400000US06037431100,54613
1324,0101000020E6100000CE8C7E349C7F5DC0679DF17D71114140,ELEC,Southern California Edison - Monrovia Service Center,1440 S California Ave,,,,E,,Private,,,,,,,,,4 SP Inductive,,,04/03/2015,27311,2015-04-03 16:57:05+00,T,,,07/15/2005,,,,,,"1440 S California Ave
Monrovia, CA 91016",34.136276,-117.993909,1400000US06037431100,54613
2779,0101000020E6100000091B9E5E297F5DC0D97745F0BF114140,ELEC,Sierra Chrysler Dodge Jeep Ram,1305 S Mountain Ave,,,888-805-2075,E,,Public - Call ahead,Dealership business hours,,,,,,3,,,,,05/05/2015,49127,2015-05-05 11:55:44+00,P,,,06/15/2012,,,,,J1772,"1305 S Mountain Ave
Monrovia, CA 91016",34.13867,-117.9869,1400000US06037431100,54613
1190,0101000020E6100000784485EAE60F5EC0C362D4B5F68F4240,ELEC,Steve Chevrolet of Chowchilla,1 Auto Park Pl,,,559-715-4626,E,,Private,Service center use only,,,,,,1,,,,,08/04/2015,68386,2015-08-04 13:09:11+00,P,,,04/01/2015,,,,,J1772,"1 Auto Park Pl
Chowchilla, CA 93610",37.1247165,-120.248469,1400000US06039000202,54615
19482,0101000020E6100000401EB0613C0F5EC050E3DEFC86204240,ELEC,Harris Ranch Inn and Restaurant - Tesla,24505 W Dorris Ave,I-5 Exit 334,,877-798-3752,E,,Public,"24 hours daily; for Tesla use only",,,,,,,6,,Tesla,http://www.teslamotors.com/supercharger,05/05/2015,52671,2015-05-05 11:42:30+00,P,,,06/01/2013,,,,,TESLA,"24505 W Dorris Ave
Coalinga, CA 93210",36.2541195,-120.2380604,1400000US06019007902,54625
2247,0101000020E61000002009FB76124A5DC076F9D687F5904040,ELEC,California State University San Marcos,333 S Twin Oaks Valley Rd,"Front of parking lot

Front of parking lot

Front of parking lot

Front of parking lot

Front of parking lot

Front of parking lot
",,888-998-2546,E,,Private,MON: 24 hours | TUE: 24 hours | WED: 24 hours | THU: 24 hours | FRI: 24 hours | SAT: 24 hours | SUN: 24 hours,,,,,,6,,,Blink Network,http://www.blinknetwork.com/,10/09/2015,51519,2015-10-09 07:13:56+00,,,,,,,,,J1772,"333 S Twin Oaks Valley Rd
San Marcos, CA 92078",33.132493,-117.157377,1400000US06073020306,54677
16167,0101000020E6100000B713DB9376735EC07AB1E6B633574240,ELEC,CITY OF MARINA,211 Cypress Ave,"MARINA 2
MARINA 1",,888-758-4389,E,,Public,24 hours daily,,,,,2,2,,,ChargePoint Network,http://www.mychargepoint.net/,10/09/2015,53376,2015-10-09 07:52:00+00,,,,,,,,,NEMA520 J1772,"211 Cypress Ave
Marina, CA 93933",36.6812657,-121.8041124,1400000US06053014201,54741
1567,0101000020E6100000DC7F643A749D5DC0AA27F38FBE234140,ELEC,Providence Holy Cross Medical Center - Cancer Research Center,15031 Rinaldi Street,,,888-998-2546,E,,Public,MON: 24 hours | TUE: 24 hours | WED: 24 hours | THU: 24 hours | FRI: 24 hours | SAT: 24 hours | SUN: 24 hours,,,,,,10,,,Blink Network,http://www.blinknetwork.com/,10/09/2015,55589,2015-10-09 07:13:54+00,,,,,,,,,J1772,"15031 Rinaldi Street
Mission Hills, CA 91345",34.279253,-118.460219,1400000US06037109100,54777
9493,0101000020E6100000E3DEFC86899D5DC08944A165DD234140,ELEC,Providence Holy Cross Medical Center - General Parking,15031 Rinaldi Street,,,888-998-2546,E,,Public,MON: 24 hours | TUE: 24 hours | WED: 24 hours | THU: 24 hours | FRI: 24 hours | SAT: 24 hours | SUN: 24 hours,,,,,,6,,,Blink Network,http://www.blinknetwork.com/,10/09/2015,55586,2015-10-09 07:13:53+00,,,,,,,,,J1772,"15031 Rinaldi Street
Mission Hills, CA 91345",34.280194,-118.461519,1400000US06037109100,54777
8930,0101000020E610000001E61027E69D5DC012B1D2EEA1224140,ELEC,Nissan of Mission Hills,11000 Sepulveda Blvd,,,818-838-4444,E,,Public - Call ahead,Dealership business hours,,,,,,1,,,,,07/08/2015,39910,2015-07-08 14:25:35+00,P,,,03/15/2011,,,,,J1772,"11000 Sepulveda Blvd
Mission Hills, CA 91345",34.2705668,-118.4671724,1400000US06037109100,54777
3030,0101000020E610000001E61027E69D5DC012B1D2EEA1224140,ELEC,Nissan of Mission Hills,11000 Sepulveda Blvd,,,818-838-4444,E,,Private,,,,,,,1,,,,,07/08/2015,48123,2015-07-08 14:25:35+00,P,,,03/15/2011,,,,,J1772,"11000 Sepulveda Blvd
Mission Hills, CA 91345",34.2705668,-118.4671724,1400000US06037109100,54777
437,0101000020E61000006EE0698D1CB85EC05B24ED461F504340,ELEC,DRY CREEK INN,198 Dry Creek Rd,"DCI#1; Opposite hotel lobby
DCI#2; Opposite hotel lobby",,888-758-4389,E,,Public,24 hours daily,,,,,,3,,,ChargePoint Network,http://www.mychargepoint.net/,10/09/2015,66611,2015-10-09 07:43:55+00,,,,,,,,,J1772,"198 Dry Creek Rd
Healdsburg, CA 95448",38.6259545,-122.8767427,1400000US06097153902,54814
9895,0101000020E6100000F4B8B942E9B75EC06F4CAA11554E4340,ELEC,CITY HALL,401 Grove St,"CITY HALL 1; -
CITY HALL 2; -
CITY HALL 3; -
CITY HALL 4; -",,888-758-4389,E,,Public,24 hours daily,,,,,,6,,,ChargePoint Network,http://www.mychargepoint.net/,10/09/2015,52727,2015-10-09 07:46:15+00,,,,,,,,,J1772,"401 Grove St
Healdsburg, CA 95448",38.6119711,-122.8736121,1400000US06097153902,54814
20792,0101000020E6100000F2B0506B9AB75EC031C6D166E64D4340,ELEC,E & M Electric,126 Mill St,,,866-693-2636,E,,Public - Call ahead,"8am-5pm daily; employees have first priority",,,,,,2,,,,,05/05/2015,45240,2015-05-05 11:55:02+00,P,,,05/01/2011,,,,,J1772,"126 Mill St
Healdsburg, CA 95448",38.6085938,-122.8688,1400000US06097153902,54814
12243,0101000020E6100000927DEB1E34B75EC0661C7E92964D4340,ELEC,Hudson Street Wineries,428 Hudson St,,,707-433-2364,E,,Public,"11am-5pm Th-M; see front desk for passcode",,,,,,1,,,,,05/05/2015,51214,2015-05-05 11:54:44+00,P,,,06/01/2012,,,,,J1772,"428 Hudson St
Healdsburg, CA 95448",38.6061576,-122.8625562,1400000US06097153902,54814
3753,0101000020E6100000C9BBD9D59A875EC06682E15CC3DB4240,ELEC,ALAMEDA,2500 Fairmont Dr,"JJC 001; Turn left at entrance. Charging Stations are behind building.
JJC 002; Turn left at entrance. Charging Stations are behind building.
JJC 005; Turn left at JJC entrance. Charger is at handicap accessible spot on the far left. 
JJC 003; Turn left at entrance. Charging Stations are behind building.
JJC 004; Turn left at entrance. Charging Stations are behind building.",,888-758-4389,E,,Public,24 hours daily,,,,,5,5,,,ChargePoint Network,http://www.mychargepoint.net/,10/09/2015,51247,2015-10-09 07:46:33+00,,,,,,,,,NEMA520 J1772,"2500 Fairmont Dr
San Leandro, CA 94578",37.7168995,-122.1188254,1400000US06001430500,54824
331,0101000020E6100000D40E7F4DD6225EC072BF4351A0A74340,ELEC,Cisco Grove Chevron,90 Cisco Rd,,,888-998-2546,E,,Public,MON: 24 hours | TUE: 24 hours | WED: 24 hours | THU: 24 hours | FRI: 24 hours | SAT: 24 hours | SUN: 24 hours,,,,,,1,,,Blink Network,http://www.blinknetwork.com/,10/09/2015,67014,2015-10-09 07:10:10+00,,,,,,,,,J1772,"90 Cisco Rd
Cisco Grove, CA 95728",39.30958,-120.54433,1400000US06061022013,54825
15746,0101000020E61000004205871744595EC0DB148F8B6A354340,ELEC,City of Elk Grove - Police Department,8400 Laguna Palms Way,,,,E,,Private,For city use only,,,,,,1,,,,,10/06/2015,69979,2015-10-06 22:10:07+00,LG,,,09/01/2014,,,,,J1772,"8400 Laguna Palms Way
Elk Grove, CA 95758",38.417314,-121.394781,1400000US06067009611,54952
11793,0101000020E61000005FD0420246595EC0683F524486354340,ELEC,City of Elk Grove - City Hall,8401 Laguna Palms Way,,,916-691-2489,E,,Public,24 hours daily,,,,,,2,,,,,10/06/2015,69980,2015-10-06 21:56:46+00,LG,,,09/01/2014,,,,,J1772,"8401 Laguna Palms Way
Elk Grove, CA 95758",38.41816,-121.394898,1400000US06067009611,54952
10404,0101000020E6100000CF96BDB6C8045EC0DDB419A7217D4240,ELEC,Madera Chevrolet,1300 Country Club Dr,,,559-674-9000,E,,Private,Service center use only,,,,,,1,,,,,08/04/2015,68387,2015-08-04 13:08:57+00,P,,,04/01/2015,,,,,J1772,"1300 Country Club Dr
Madera, CA 93638",36.9775895,-120.0747506,1400000US06039000507,54965
21307,0101000020E61000007B4B395FEC4B5DC0E411DC48D9624040,ELEC,USD-Mission Main,5821 Marian Way,,,888-998-2546,E,,Private,MON: 24 hours | TUE: 24 hours | WED: 24 hours | THU: 24 hours | FRI: 24 hours | SAT: 24 hours | SUN: 24 hours,,,,,,8,,,Blink Network,http://www.blinknetwork.com/,10/09/2015,50968,2015-10-09 07:10:48+00,,,,,,,,,J1772,"5821 Marian Way
San Diego, CA 92110",32.772256,-117.186302,1400000US06073009106,55000
9292,0101000020E6100000BE326FD5754C5DC053245F09A4624040,ELEC,USD-IPJ Kroc,5555 Marian Way,,,888-998-2546,E,,Private,MON: 24 hours | TUE: 24 hours | WED: 24 hours | THU: 24 hours | FRI: 24 hours | SAT: 24 hours | SUN: 24 hours,,,,,,8,,,Blink Network,http://www.blinknetwork.com/,10/09/2015,50966,2015-10-09 07:10:47+00,,,,,,,,,J1772,"5555 Marian Way
San Diego, CA 92110",32.770631,-117.194692,1400000US06073009106,55000
5389,0101000020E6100000C2C7BB7E1C8B5DC0A607AAEBF5074140,ELEC,CAL STATE LA,5151 State University Dr,"LOT 10 E T 01; Enter Parking Lot 10  from Circle Dr, stations on right
LOT 10 E T 02; Enter Parking Lot 10 from Circle Dr., stations on right.
LOT 3 ST 01; Station is at Lot 3, an outdoor lot.
STRUCTURE C 01; Station is at Level 1F, on the South side of the garage.
STRUCTURE A 01; Station is on Lower Level.
LOT 06 ST 01; Enter Lot 6 from Circle Dr.,stations are by the strage area IT116.
LOT 10 E T 03; Enter Lot 10 from Circle Dr., stations are on the right.
LOT 3 ST 03; Station is at Lot 3, an outdoor lot.
STRUCTURE B 01; Station is in Structure B, ground level..",,888-758-4389,E,,Public,24 hours daily,,,,,,15,,,ChargePoint Network,http://www.mychargepoint.net/,10/09/2015,38910,2015-10-09 08:25:50+00,,,,,,,,,J1772,"5151 State University Dr
Los Angeles, CA 90032",34.0621924,-118.1736142,1400000US06037201700,55000
18467,0101000020E6100000DA9255116E485DC03411363CBD4A4040,ELEC,Port of San Diego-Imperial Beach Parking Lot,3165 Pacific Highway,,,888-998-2546,E,,Public,MON: 24 hours | TUE: 24 hours | WED: 24 hours | THU: 24 hours | FRI: 24 hours | SAT: 24 hours | SUN: 24 hours,,,,,,1,,,Blink Network,http://www.blinknetwork.com/,10/09/2015,68286,2015-10-09 07:10:03+00,,,,,,,,,J1772,"3165 Pacific Highway
Imperial Beach, CA 91932",32.5839,-117.131718,1400000US06073010200,55019
16322,0101000020E61000006DED331D70485DC00BF54FCB6A4A4040,ELEC,PIER SOUTH RESO,800 Seacoast Dr,"STATION 1; -",,888-758-4389,E,,Public,24 hours daily,,,,,,2,,,ChargePoint Network,http://www.mychargepoint.net/,10/09/2015,61837,2015-10-09 07:43:25+00,,,,,,,,,J1772,"800 Seacoast Dr
Imperial Beach, CA 91932",32.5813841,-117.1318429,1400000US06073010200,55019
722,0101000020E6100000B86D293119B45EC0E7DE686C54464340,ELEC,TOWN OF WINDSOR,9291 Old Redwood Hwy,"BUILDING 200 3; -
BUILDING 200 2; -
BUILDING 200 1; -",,888-758-4389,E,,Public,24 hours daily,,,,,3,3,,,ChargePoint Network,http://www.mychargepoint.net/,10/09/2015,51731,2015-10-09 08:14:31+00,,,,,,,,,NEMA520 J1772,"9291 Old Redwood Hwy
Windsor, CA 95492",38.5494514,-122.8140376,1400000US06097153808,55153
1473,0101000020E61000007A17EFC7EDEF5DC08D7A884677384140,ELEC,Best Western Plus Pepper Tree Inn,3850 State St,,,805-687-5511,E,,Public,"24 hours daily; pay lot for public; guests charge free",,,,,,2,,,,,05/05/2015,50157,2015-05-05 11:51:35+00,P,,,12/20/2012,,,,,J1772,"3850 State St
Santa Barbara, CA 93105",34.44114,-119.748888,1400000US06083000102,55172
7961,0101000020E61000006E6C76A4FA8E5DC0003CA24275ED4040,ELEC,Southern California Edison - Dominguez Hills Service Station,1924 Cashdan St,,,,E,,Private,,,,,,,3,,1 LP Inductive  14 SP Inductive,,,06/02/2015,27308,2015-06-02 18:06:10+00,T,,,07/15/2005,,,,,J1772,"1924 Cashdan St
Compton, CA 90224",33.855141,-118.234048,1400000US06037543305,55227
6990,0101000020E6100000AF61E17F06B05EC041930E208D384340,ELEC,CITYOFSANTAROSA,55 Stony Point Rd,MSC-NORTH #3,,888-758-4389,E,,Public,24 hours daily,,,,,1,1,,,ChargePoint Network,http://www.mychargepoint.net/,10/09/2015,48146,2015-10-09 07:58:05+00,,,,,,,,,NEMA520 J1772,"55 Stony Point Rd
Santa Rosa, CA 95401",38.4418068,-122.7503967,1400000US06097153006,55293
3173,0101000020E6100000EC89AE0B3F985DC01F80D4264E044140,ELEC,Extra Space Storage,2645 La Cienega Ave,,,310-836-8358,E,,Public - Call ahead,9:30am-6pm M-F,,,,,,1,,,,,07/08/2015,64773,2015-07-08 15:00:39+00,T,,,09/01/2014,,,,,J1772,"2645 La Cienega Ave
Los Angeles, CA 90034",34.033635,-118.378848,1400000US06037270200,55306
14825,0101000020E610000087BB1F5CA6985DC06F55C84BED034140,ELEC,Helms Bakery Building,8800 Venice Blvd,,,310-204-1865,T,,TEMPORARILY UNAVAILABLE (Public),24 hours daily,,,,,,2,,1 SP Inductive,,,05/05/2015,21525,2015-05-05 11:54:30+00,P,,,,,,,,J1772,"8800 Venice Blvd
Los Angeles, CA 90034",34.0306792,-118.3851538,1400000US06037270200,55306
14274,0101000020E610000026D8C92A364F5DC095E535C016724040,ELEC,JOHN HOPKINS,3545 John Hopkins Ct,"HOPKINS 1; -",,888-758-4389,E,,Public,24 hours daily,,,,,,2,,,ChargePoint Network,http://www.mychargepoint.net/,10/09/2015,63274,2015-10-09 07:48:46+00,,,,,,,,,J1772,"3545 John Hopkins Ct
San Diego, CA 92121",32.8913193,-117.2376811,1400000US06073008339,55326
7683,0101000020E6100000008BFCFA214D5DC0066344A2D0704040,ELEC,IRVINE CO OFC,4770 Eastgate Mall,"EASTGATE 01; Stations are on the North side of the 4770 Eastgate Mall Building
EASTGATE 03; Stations are on the North side of the 4770 Eastgate Mall building.
EASTGATE 02; Stations are on the North side of the 4770 Eastgate Mall building.",,888-758-4389,E,,Public,24 hours daily,,,,,,5,,,ChargePoint Network,http://www.mychargepoint.net/,10/09/2015,65358,2015-10-09 07:44:28+00,,,,,,,,,J1772,"4770 Eastgate Mall
San Diego, CA 92121",32.881367,-117.205199,1400000US06073008339,55326
12512,0101000020E6100000040F1D4C544D5DC05BB05417F06F4040,ELEC,Embassy Suites - Tesla,4550 La Jolla Village Dr,,,858-453-0400  877-798-3752,E,,Public,"24 hours daily; for Tesla use only; for guest use only; see front desk for access",,,,,,2,,,Tesla,http://www.teslamotors.com/supercharger,09/02/2015,68964,2015-09-02 02:45:36+00,P,,,04/01/2015,,,,,TESLA,"4550 La Jolla Village Dr
San Diego, CA 92122",32.8745145,-117.2082701,1400000US06073008339,55326
10888,0101000020E61000009363FC459A4D5DC0DAF11593ED6F4040,ELEC,IRVINE CO OFC,4365 Executive Drive,"THE PLAZA PL 02; Stations are on the Plaza Level near stairs",,888-758-4389,E,,Public,24 hours daily,,,,,,2,,,ChargePoint Network,http://www.mychargepoint.net/,10/09/2015,53392,2015-10-09 07:44:07+00,,,,,,,,,J1772,"4365 Executive Drive
San Diego, CA 92121",32.8744377,-117.2125411,1400000US06073008339,55326
1880,0101000020E6100000B5842117414D5DC07214C550F36F4040,ELEC,IRVINE CO OFC,4660 La Jolla Village Dr,"4660 LJVD P2 03; Station is on P2, follow signs.
4660 LJVD P2 02; Stations are in the parking structure on P2 by La Jolla Village Dr entrance.
4660 LJVD P2 01; Stations are on P2, follow signs.
4660 LJVD P2 04; Stations are in the parking structure, P2 near La Jolla Village Dr. entrance, follow signs",,888-758-4389,E,,Public,24 hours daily,,,,,,4,,,ChargePoint Network,http://www.mychargepoint.net/,10/09/2015,48169,2015-10-09 07:44:00+00,,,,,,,,,J1772,"4660 La Jolla Village Dr
San Diego, CA 92122",32.8746129,-117.2070978,1400000US06073008339,55326
17777,0101000020E6100000A33B889D294F5DC0DBFB54151A744040,ELEC,11085 & 11095 Torreyana Road Business Plaza,"11085 Torreyana Rd, #95",,,888-998-2546,E,,Public,MON: 24 hours | TUE: 24 hours | WED: 24 hours | THU: 24 hours | FRI: 24 hours | SAT: 24 hours | SUN: 24 hours,,,,,,5,,,Blink Network,http://www.blinknetwork.com/,10/09/2015,65318,2015-10-09 07:10:37+00,,,,,,,,,J1772,"11085 Torreyana Rd, #95
La Jolla, CA 92037",32.907046,-117.236915,1400000US06073008339,55326
18388,0101000020E6100000C39904148F4D5DC0BFB10C16F36F4040,ELEC,IRVINE CO OFC,4365Executive Dr,"THE PLAZA LL 01; Stations are on the Lobby Level near the stairs
THE PLAZA PL 04; Stations are on the Plaza Level Near Stairs",,888-758-4389,E,,Public,24 hours daily,,,,,,3,,,ChargePoint Network,http://www.mychargepoint.net/,10/09/2015,55985,2015-10-09 07:44:05+00,,,,,,,,,J1772,"4365Executive Dr
San Diego, CA 92122",32.8746059,-117.2118578,1400000US06073008339,55326
14919,0101000020E610000046370C303D4F5DC0FA30D692E9734040,ELEC,Vertex Pharmaceuticals Worldwide,11010 Torreyana Rd,,,888-998-2546,E,,Public,MON: 24 hours | TUE: 24 hours | WED: 24 hours | THU: 24 hours | FRI: 24 hours | SAT: 24 hours | SUN: 24 hours,,,,,,2,,,Blink Network,http://www.blinknetwork.com/,10/09/2015,52354,2015-10-09 07:13:34+00,,,,,,,,,J1772,"11010 Torreyana Rd
San Diego, CA 92121",32.9055656,-117.2381096,1400000US06073008339,55326
13259,0101000020E6100000F316597CD44B5EC038E9C77086F24240,ELEC,CHCF,7707 Austin Rd,"CHCF 02; -
CHCF 03
CHCF 01",,888-758-4389,E,,Public,24 hours daily,,,,,,6,,,ChargePoint Network,http://www.mychargepoint.net/,10/09/2015,67019,2015-10-09 07:45:31+00,,,,,,,,,J1772,"7707 Austin Rd
Stockton, CA 95215",37.8947278,-121.1848441,1400000US06077005131,55417
6985,0101000020E6100000F4DE180280A65DC091F12895F0174140,ELEC,WESTFIELD,6439-6463 Owensmouth Ave,"STATION 9; Top deck 4th floor, Southeast corner 
STATION 8; Top deck 4th floor, Southeast corner 
STATION 5; -
STATION 4; In new parking structure
STATION 11; Top deck 4th floor, Southeast corner 
STATION 6; -
STATION 10; Top deck 4th floor, Southeast corner 
STATION 3; -
STATION 12; Mezzanie level",,888-758-4389,E,,Public,24 hours daily,,,,,,18,,,ChargePoint Network,http://www.mychargepoint.net/,10/09/2015,69898,2015-10-09 07:41:21+00,,,,,,,,,J1772,"6439-6463 Owensmouth Ave
LA, CA 91303",34.1870295,-118.601563,1400000US06037135114,55419
13882,0101000020E6100000F97601E5A5A65DC0EF6E0AD05B184140,ELEC,WESTFIELD,6465 Owensmouth Ave,"STATION 7; Top deck 4th floor, Southeast corner ",,888-758-4389,E,,Public,24 hours daily,,,,,,2,,,ChargePoint Network,http://www.mychargepoint.net/,10/09/2015,69899,2015-10-09 07:41:26+00,,,,,,,,,J1772,"6465 Owensmouth Ave
LA, CA 91303",34.1903019,-118.6038754,1400000US06037135114,55419
12199,0101000020E61000005CA8A1B286A65DC02E9919EC3C184140,ELEC,WESTFIELD,6573-6585 Owensmouth Ave,"STATION 01; First level Owensmouth Ave parking garage closest to Nordstrom",,888-758-4389,E,,Public,24 hours daily,,,,,,1,,,ChargePoint Network,http://www.mychargepoint.net/,10/09/2015,65243,2015-10-09 07:41:20+00,,,,,,,,,J1772,"6573-6585 Owensmouth Ave
LA, CA 91303",34.1893592,-118.6019713,1400000US06037135114,55419
20155,0101000020E61000006C5A2904F2415DC066248CB0F2DE4040,ELEC,Inland Chevrolet,350 Carriage Cir,,,,E,,Private,,,,,,,1,1,,,,12/31/2013,53904,2015-01-08 22:01:38+00,P,,,11/01/2013,,,,,J1772 CHADEMO,"350 Carriage Cir
Hemet, CA 92545",33.7417813,-117.0303965,1400000US06065043504,55430
13229,0101000020E6100000C24B70EA03425DC01118906225DE4040,ELEC,TE Connectivity - Tesla,5733 W Whittier Ave,,,951-492-3333  877-798-3752,E,,Public,"24 hours daily; for Tesla use only; for guest use only; see front desk for access",,,,,,2,,,Tesla,http://www.teslamotors.com/supercharger,,70394,2015-10-09 20:33:26+00,P,,,08/01/2015,,,,,TESLA,"5733 W Whittier Ave
Hemet, CA 92545",33.7355159,-117.031489,1400000US06065043504,55430
14698,0101000020E610000015527E52ED415DC0F50F221972DE4040,ELEC,Gosch Ford,150 Carriage Cir,,,,E,,Private,,,,,,,1,1,,,,12/31/2013,53903,2015-01-08 22:01:27+00,P,,,11/01/2013,,,,,J1772 CHADEMO,"150 Carriage Cir
Hemet, CA 92545",33.737857,-117.03011,1400000US06065043504,55430
6090,0101000020E61000008A20CEC309425DC0C6C4E6E3DADE4040,ELEC,Pedder Nissan,200 Carriage Cir,,,951-766-1446,E,,Public - Call ahead,Dealership business hours,,,,,,1,,,,,07/08/2015,39902,2015-07-08 14:26:06+00,P,,,03/15/2011,,,,,J1772,"200 Carriage Cir
Hemet, CA 92545",33.741055,-117.031846,1400000US06065043504,55430
3151,0101000020E61000008A20CEC309425DC0C6C4E6E3DADE4040,ELEC,Pedder Nissan,200 Carriage Cir,,,951-766-1446,E,,Private,,,,,,,1,,,,,07/08/2015,48192,2015-07-08 14:26:06+00,P,,,03/15/2011,,,,,J1772,"200 Carriage Cir
Hemet, CA 92545",33.741055,-117.031846,1400000US06065043504,55430
11577,0101000020E6100000881057CE5E7E5DC0D2CD59FA2B0D4140,ELEC,Department of Public Health ,5050 Commerce Dr,In rear of building,,323-267-2023,P,07/01/2015 12:00:00 AM,PLANNED - not yet accessible (Public),"6am-6pm M-F; keypad activated, instructions on EVSE",,,,,,6,,,,,06/02/2015,67307,2015-09-23 13:11:07+00,LG,,,,,,,,J1772,"5050 Commerce Dr
Baldwin Park, CA 91706",34.1029046,-117.9745365,1400000US06037405001,55455
10994,0101000020E6100000FD1F162040EC5DC09C4D470037344140,ELEC,CITY OF SB EV2,401 Shoreline Dr,"STATION 8
STATION 7",,888-758-4389,E,,Public,24 hours daily,,,,,2,2,,,ChargePoint Network,http://www.mychargepoint.net/,10/09/2015,48985,2015-10-09 07:50:34+00,,,,,,,,,NEMA520 J1772,"401 Shoreline Dr
Santa Barbara, CA 93109",34.4079285,-119.6914139,1400000US06083001206,55526
4085,0101000020E6100000E4326E6AA0EC5DC07C0F971C77344140,ELEC,Brisas Del Mar Inn at the Beach,223 Castillo St,,,805-966-2219,E,,Public,"24 hours daily; guest use only",,,,,1,1,,,,,05/05/2015,51954,2015-05-05 11:43:52+00,P,,,05/01/2013,,,,,NEMA520 J1772,"223 Castillo St
Santa Barbara, CA 93101",34.409885,-119.697291,1400000US06083001206,55526
18442,0101000020E6100000F853E3A59BEC5DC039622D3E05344140,ELEC,Santa Barbara City College,721 Cliff Dr,Located in lot 4A,,805-965-0581,E,,Public,"Staff only 7am-10:30am; public use 10:30am-10pm",,,,,,4,,,,,05/05/2015,50792,2015-05-05 11:55:41+00,P,,,01/23/2013,,,,,J1772,"721 Cliff Dr
Santa Barbara, CA 93109",34.40641,-119.697,1400000US06083001206,55526
6273,0101000020E6100000F4609C0997475DC0BD67C988B0744040,ELEC,Miramar College - Parking Structure - 1st Floor,10440 Black Mountain Road,,,888-998-2546,E,,Public,MON: 6:00am-11:00pm | TUE: 6:00am-11:00pm | WED: 6:00am-11:00pm | THU: 6:00am-11:00pm | FRI: 6:00am-5:00pm,,,,,,5,,,Blink Network,http://www.blinknetwork.com/,10/09/2015,46753,2015-10-09 07:11:35+00,,,,,,,,,J1772,"10440 Black Mountain Road
San Diego, CA 92126",32.9116374,-117.1185936,1400000US06073008359,55550
4916,0101000020E61000004C16F71F196C5DC0E794FC5F60044140,ELEC,Albertson's - Chino Country Fair,12013 Central Ave,,,877-455-3833,E,,Public - Card key at all times,"24 hours daily; EVgo network subscription and key fob required",,,,,,1,2,,eVgo Network,https://www.evgonetwork.com/,10/09/2015,69361,2015-10-09 08:50:51+00,,,,,,,,,CHADEMO J1772,"12013 Central Ave
Chino, CA 91710",34.03419113,-117.6890335,1400000US06071000404,55568
11563,0101000020E610000059BF99982E6D5DC01327F73B140D4140,ELEC,CMC EVSE Location,500 9th Street,,,888-998-2546,E,,Public,MON: 24 hours | TUE: 24 hours | WED: 24 hours | THU: 24 hours | FRI: 24 hours | SAT: 24 hours | SUN: 24 hours,,,,,,4,,,Blink Network,http://www.blinknetwork.com/,10/09/2015,51774,2015-10-09 07:11:17+00,,,,,,,,,J1772,"500 9th Street
Claremont, CA 91711",34.10218,-117.705969,1400000US06037401901,55625
16835,0101000020E610000096ED43DE72455DC0A7203F1BB96C4140,ELEC,Country Inn and Suites - Tesla,2812 Lenwood Rd,I-5 Exit 178,,877-798-3752,E,,Public,"24 hours daily; for Tesla use only",,,,,,,8,,Tesla,http://www.teslamotors.com/supercharger,05/05/2015,52668,2015-05-05 11:41:31+00,P,,,06/01/2013,,,,,TESLA,"2812 Lenwood Rd
Barstow, CA 92311",34.849399,-117.085136,1400000US06071011800,55625
16139,0101000020E610000081E03B7B786D5DC06F5DD669490C4140,ELEC,POMONA COLLEGE,169-299 Amherst Ave,"SOUTH PARKING#2; Parking Sturcture @ NE Corner of E 1st and Columbia",,888-758-4389,E,,Public,24 hours daily,,,,,1,1,,,ChargePoint Network,http://www.mychargepoint.net/,10/09/2015,65829,2015-10-09 07:59:53+00,,,,,,,,,NEMA520 J1772,"169-299 Amherst Ave
Claremont, CA 91711",34.0959904,-117.7104786,1400000US06037401901,55625
15409,0101000020E61000006F8104C58F6D5DC057314BF1A70D4140,ELEC,PARSONS,260 E Foothill Blvd,"BLEAKNEY; Foothill Blvd east of Dartmouth Ave. Turn right into parking lot, make quick left, unit is at the far side of lot next to building",,888-758-4389,E,,Public,24 hours daily,,,,,,2,,,ChargePoint Network,http://www.mychargepoint.net/,10/09/2015,65307,2015-10-09 07:47:53+00,,,,,,,,,J1772,"260 E Foothill Blvd
Claremont, CA 91711",34.1066877,-117.7119,1400000US06037401901,55625
14137,0101000020E6100000FC82273E886D5DC07A71E2AB1D0C4140,ELEC,POMONA COLLEGE,295 E 1st St,"SOUTH PARKING#1; Parking Sturcture @ NE Corner of E 1st and Columbia
SOUTH PARKING#5; Charger located in South Campus Parking Structure
SOUTH PARKING#6; Charger located in South Campus Parking Structure
SOUTH PARKING#3; Parking Structure @ NE corner of E 1st and Columbia
SOUTH PARKING#4; Parking Sturcture @ NE Corner of E 1st and Columbia",,888-758-4389,E,,Public,24 hours daily,,,,,2,8,,,ChargePoint Network,http://www.mychargepoint.net/,10/09/2015,62255,2015-10-09 07:59:52+00,,,,,,,,,J1772 NEMA520,"295 E 1st St
Claremont, CA 91711",34.0946555,-117.7114406,1400000US06037401901,55625
11859,0101000020E610000024F0879FFF755EC01EA8531EDDE04340,ELEC,Chico Nissan,575 Manzanita Ave,,,530-891-1777,E,,Private,,,,,,,1,,,,,07/08/2015,47596,2015-07-08 14:24:12+00,P,,,03/15/2011,,,,,J1772,"575 Manzanita Ave
Chico, CA 95926",39.756748,-121.843727,1400000US06007000102,55641
8630,0101000020E61000004EFFA380FE755EC01EA8531EDDE04340,ELEC,NISSAN-CHICO,575 Manzanita Ave,"QUICK CHARGER 1; In the dealership parking lot",,888-758-4389,E,,Public,24 hours daily,,,,,,,1,,ChargePoint Network,http://www.mychargepoint.net/,10/09/2015,60164,2015-10-09 07:51:58+00,,,,,,,,,CHADEMO,"575 Manzanita Ave
Chico, CA 95926",39.756748,-121.8436586,1400000US06007000102,55641
3363,0101000020E610000024F0879FFF755EC01EA8531EDDE04340,ELEC,Chico Nissan,575 Manzanita Ave,,,530-891-1777,E,,Public - Call ahead,Dealership business hours,,,,,,1,,,,,07/08/2015,39876,2015-07-08 14:24:12+00,P,,,03/15/2011,,,,,J1772,"575 Manzanita Ave
Chico, CA 95926",39.756748,-121.843727,1400000US06007000102,55641
17347,0101000020E6100000BA490C022B7F5EC0B0AC3429052D4340,ELEC,Vacaville Regional Transport Center,190 Hickory Ln,,,707-449-5424,E,,Public,24 hours daily,,,,,,3,,1 SP Inductive,Tesla,http://www.teslamotors.com/supercharger,06/02/2015,25515,2015-06-02 18:10:47+00,LG,,,06/15/2004,,,,,TESLA J1772,"190 Hickory Ln
Vacaville, CA 95688",38.35172,-121.987,1400000US06095253101,55645
2256,0101000020E61000002CD49AE61D7F5EC0E25CC30C8D2D4340,ELEC,KUIC Parking Lot - Lot 9,500 Catherine St,At Davis St,,707-449-5424,E,,Public,24 hours daily,,,,,,1,,1 SP Inductive,,,06/02/2015,25517,2015-06-02 18:10:43+00,LG,,,06/15/2004,,,,,J1772,"500 Catherine St
Vacaville, CA 95688",38.355867,-121.9862,1400000US06095253101,55645
20214,0101000020E6100000E3491CC3AD7F5EC006ED7A0ED12C4340,ELEC,Vacaville Police Headquarters,660 Merchant St,,,,E,,Private - Government only,,,,,,,,,2 SP Inductive,,,06/02/2015,29862,2015-06-02 18:17:03+00,LG,,,08/15/2006,,,,,,"660 Merchant St
Vacaville, CA 95688",38.3501299,-121.9949806,1400000US06095253101,55645
18965,0101000020E610000048E17A14AE7F5EC037C30DF8FC2C4340,ELEC,Vacaville City Hall,650 Merchant St,,,,E,,Private - Government only,,,,,,,3,,3 SP Inductive,,,06/02/2015,25518,2015-06-02 18:10:44+00,LG,,,06/15/2004,,,,,J1772,"650 Merchant St
Vacaville, CA 95688",38.35147,-121.995,1400000US06095253101,55645
20927,0101000020E6100000A60A462575525EC021C8410933114340,ELEC,Lodi City Hall,221 W Pine St,,,209-333-6815,E,,Public,24 hours daily,,,,,,2,,1 SP Inductive,,,05/05/2015,49122,2015-05-05 11:51:41+00,LG,,,07/24/2012,,,,,J1772,"221 W Pine St
Lodi, CA 95240",38.13437,-121.2884,1400000US06077004201,55701
7773,0101000020E6100000706479B276385EC0E2033BFE0BC14240,ELEC,Smith Chevrolet Cadillac,1601 Auto Mall Dr,,,,E,,Private,Service center use only,,,,,,1,,,,,08/04/2015,68403,2015-08-04 13:09:09+00,P,,,04/01/2015,,,,,J1772,"1601 Auto Mall Dr
Turlock, CA 95380",37.5081785,-120.8822447,1400000US06099003603,55776
22180,0101000020E61000002B8A5759DB885EC04C4F58E201BB4240,ELEC,IKEA - East Palo Alto,1700 E. Bayshore Rd,"Located on ground floor near isle K row

Located on ground floor near isle K row
",,888-998-2546,E,,Public,MON: 24 hours | TUE: 24 hours | WED: 24 hours | THU: 24 hours | FRI: 24 hours | SAT: 24 hours | SUN: 24 hours,,,,,,2,,,Blink Network,http://www.blinknetwork.com/,10/09/2015,45256,2015-10-09 07:11:19+00,,,,,,,,,J1772,"1700 E. Bayshore Rd
Palo Alto, CA 94303",37.460995,-122.138388,1400000US06081611900,55781
14295,0101000020E6100000E7A90EB919BF5DC07ADE324C12D34240,ELEC,Westin Monache Resort - Tesla,50 Hillside Dr,,,760-934-0400  877-798-3752,E,,Public,"24 hours daily; for Tesla use only; for guest use only; see front desk for access",,,,,,3,,,Tesla,http://www.teslamotors.com/supercharger,,70430,2015-10-09 20:46:30+00,P,,,08/01/2015,,,,,TESLA,"50 Hillside Dr
Mammoth Lakes, CA 93546",37.6489959,-118.985945,1400000US06051000200,55799
17724,0101000020E6100000ED629AE95EBF5DC0D90A9A9658D14240,ELEC,Juniper Springs Resort - Tesla,4000 Meridian Blvd,,,760-924-1102  877-798-3752,E,,Public,"24 hours daily; for Tesla use only; for guest use only; see front desk for access",,,,,,4,,,Tesla,http://www.teslamotors.com/supercharger,,70270,2015-10-07 21:14:43+00,P,,,05/01/2015,,,,,TESLA,"4000 Meridian Blvd
Mammoth Lakes, CA 93546",37.635516,-118.990168,1400000US06051000200,55799
13864,0101000020E610000037DCECB45AC25DC0635639FE55D34240,ELEC,The Village Lodge at Mammoth - Tesla,10001 Minaret Rd,,,760-934-1982  877-798-3752,E,,Public - Call ahead,"24 hours daily; for Tesla use only; for guest use only",,,,,,4,,,Tesla,http://www.teslamotors.com/supercharger,,70418,2015-10-09 20:43:31+00,P,,,08/01/2015,,,,,TESLA,"10001 Minaret Rd
Mammoth Lakes, CA 93546",37.6510618,-119.0367863,1400000US06051000200,55799
10305,0101000020E6100000FFEE78EE982A5EC061F6573442BE4140,ELEC,Rabobank - Atascadero,6950 El Camino Real,,,805-466-2325,E,,Public,24 hours daily,,,,,,1,,,,,06/02/2015,35468,2015-06-02 18:14:16+00,P,,,09/15/2009,,,,,J1772,"6950 El Camino Real
Atascadero, CA 93422",35.4863954,-120.6655842,1400000US06079012502,55878
19389,0101000020E6100000E223BD03972A5EC0A1BFD02346BE4140,ELEC,Rabobank - Tesla,6950 El Camino Real,101 at CA-41,,877-798-3752,E,,Public,"24 hours daily; for Tesla use only",,,,,,,8,,Tesla,http://www.teslamotors.com/supercharger,05/05/2015,52667,2015-05-05 11:44:33+00,P,,,06/01/2013,,,,,TESLA,"6950 El Camino Real
Atascadero, CA 93422",35.4865155,-120.6654672,1400000US06079012502,55878
18665,0101000020E6100000AF6E06C9CC705DC029BE90C4810E4140,ELEC,KOHL'S,2229 Foothill Blvd,10599 LA VERNE,,888-758-4389,E,,Public,24 hours daily,,,,,,2,,,ChargePoint Network,http://www.mychargepoint.net/,10/09/2015,49979,2015-10-09 08:32:23+00,,,,,,,,,J1772,"2229 Foothill Blvd
La Verne, CA 91750",34.1133352,-117.7624991,1400000US06037401601,55882
10512,0101000020E61000009EEFA7C64B775DC0A852B3075A114140,ELEC,City of Glendora - City Hall,114 S Vista Bonita Ave,,,626-914-8200,E,,Public,24 hours daily,,,,,,2,,,,,05/05/2015,21498,2015-05-05 11:55:09+00,LG,,,04/30/2002,,,,,J1772,"114 S Vista Bonita Ave
Glendora, CA 91741",34.13556,-117.864,1400000US06037401102,55974
12174,0101000020E610000072FDBB3E73755DC075E789E76CE34040,ELEC,Caltrans District 12 - Orange Maintenance Station,691 S Tustin St,,,,E,,Private,,,,,,,1,,,,,10/06/2015,70023,2015-10-06 22:10:27+00,SG,,,09/22/2015,,,,,J1772,"691 S Tustin St
Orange, CA 92866",33.776761,-117.835159,1400000US06059075806,56037
8720,0101000020E6100000673744262A5B5EC0D45A3DCC03DE4240,ELEC,CITY OF TRACY,50 6th St,TRANSIT STATION,,888-758-4389,E,,Public,24 hours daily,,,,,,2,,,ChargePoint Network,http://www.mychargepoint.net/,10/09/2015,60530,2015-10-09 08:18:31+00,,,,,,,,,J1772,"50 6th St
Tracy, CA 95376",37.7344909,-121.4244476,1400000US06077005405,56042
20964,0101000020E61000002789809EE18D5DC05749BFD8D6114140,ELEC,COMFORT_INN_ER,2300 Colorado Blvd,"LOBBY_POOL; Enter Comfort Inn sign, 3rd and 4th parking space on your right by the pool. Station behind 2nd column. Let us know you are here charging.  Thank you! ",,888-758-4389,E,,Public,24 hours daily,,,,,,2,,,ChargePoint Network,http://www.mychargepoint.net/,10/09/2015,61825,2015-10-09 07:49:32+00,,,,,,,,,J1772,"2300 Colorado Blvd
Los Angeles, CA 90041",34.1393691,-118.2168957,1400000US06037181400,56086
13642,0101000020E61000002F6EA301BC845DC0A4E029E44A574140,ELEC,Antelope Valley Union School District - Eastside High School,3200 E Ave J8,,,,E,,Private,Employee use only,,,,,,2,,,,,01/06/2015,42253,2015-05-20 14:38:01+00,LG,,,11/15/2011,,,,,J1772,"3200 E Ave J8
Lancaster, CA 93535",34.681973,-118.073975,1400000US06037900508,56092
21703,0101000020E610000086E7A562E3215DC013CB773AA1E64040,ELEC,La Maison Hotel - Tesla,1600 E Palm Canyon Dr,,,855-699-1600  877-798-3752,E,,Public,"24 hours daily; for Tesla use only; for guest use only",,,,,,1,,,Tesla,http://www.teslamotors.com/supercharger,,70273,2015-10-07 21:15:08+00,P,,,03/01/2015,,,,,TESLA,"1600 E Palm Canyon Dr
Palm Springs, CA 92264",33.8017953,-116.5295035,1400000US06065044805,56113
15408,0101000020E6100000F5F75278D0465DC01FBFB7E9CF8E4040,ELEC,Mossy Nissan - Escondido,1546 Auto Park Way,,,760-746-5050,E,,Private,,,,,,,1,,,,,07/08/2015,47609,2015-07-08 14:25:07+00,P,,,03/15/2011,,,,,J1772,"1546 Auto Park Way
Escondido, CA 92029",33.11572,-117.106474,1400000US06073020307,56140
16519,0101000020E610000058569A9402475DC03F9AA03CE28E4040,ELEC,BMWOFESCONDIDO,1557 Auto Park Way,"STATION 01; -",,888-758-4389,E,,Public,24 hours daily,,,,,,1,,,ChargePoint Network,http://www.mychargepoint.net/,10/09/2015,62256,2015-10-09 08:23:27+00,,,,,,,,,J1772,"1557 Auto Park Way
Escondido, CA 92029",33.1162792,-117.1095325,1400000US06073020307,56140
11445,0101000020E61000006747AAEFFC465DC07C7C4276DE8E4040,ELEC,Honda of Escondido,1700 Auto Park Way,,,760-737-3200,E,,Public,Dealership business hours,,,,,,1,,,,,05/05/2015,53900,2015-05-05 11:54:31+00,P,,,09/01/2012,,,,,J1772,"1700 Auto Park Way
Escondido, CA 92029",33.116164,-117.109188,1400000US06073020307,56140
14052,0101000020E6100000F5F75278D0465DC01FBFB7E9CF8E4040,ELEC,Mossy Nissan - Escondido,1546 Auto Park Way,,,760-746-5050,E,,Public - Call ahead,Dealership business hours,,,,,,1,,,,,07/08/2015,39889,2015-07-08 14:25:07+00,P,,,03/15/2011,,,,,J1772,"1546 Auto Park Way
Escondido, CA 92029",33.11572,-117.106474,1400000US06073020307,56140
3120,0101000020E6100000D31CB4B2D8465DC0DEE8BEF7928E4040,ELEC,North County Kia,1501 Auto Park Way S,,,855-900-7584,E,,Public,24 hours daily,,,,,,,2,,Greenlots,http://greenlots.com/,08/04/2015,68322,2015-08-04 12:55:50+00,P,,,11/01/2014,,,,,CHADEMO J1772COMBO,"1501 Auto Park Way S
Escondido, CA 92029",33.1138601,-117.1069762,1400000US06073020307,56140
5753,0101000020E6100000560E2DB29D475DC0D72FD80DDB8E4040,ELEC,Stone Brewing World Bistro & Gardens,1999 Citracado Pkwy,,,760-471-4999,E,,Public,24 hours daily,,,,,,2,,,,,05/05/2015,46723,2015-05-05 11:49:35+00,P,,,02/07/2012,,,,,J1772,"1999 Citracado Pkwy
Escondido, CA 92029",33.11606,-117.119,1400000US06073020307,56140
11370,0101000020E61000002FDB4E5B23515EC0A6AEC62302634340,ELEC,ROSEVILLE,1125 Galleria Blvd,"GALLERIA #TWO; Ground level parking structure between JC Penny & Macy's
GALLERIA GARAGE; Ground level parking structure between JC PENNY & Macy's",,888-758-4389,E,,Public,24 hours daily,,,,,2,2,,,ChargePoint Network,http://www.mychargepoint.net/,10/09/2015,41323,2015-10-09 08:04:29+00,,,,,,,,,NEMA520 J1772,"1125 Galleria Blvd
Roseville, CA 95678",38.7735028,-121.267783,1400000US06061021003,56176
2888,0101000020E6100000419479F53B515EC095EDE82400634340,ELEC,Westfield Galleria - Tesla,1151 Galleria Blvd,I-80,,877-798-3752,E,,Public,"24 hours daily; for Tesla use only",,,,,,,7,,Tesla,http://www.teslamotors.com/supercharger,05/05/2015,61543,2015-05-05 11:42:20+00,P,,,04/15/2014,,,,,TESLA,"1151 Galleria Blvd
Roseville, CA 95678",38.7734419,-121.2692846,1400000US06061021003,56176
10187,0101000020E61000001AE6BADFD7C45DC0D2CE1F894DB84140,ELEC,HAMPTON INN NRT,8818 Spectrum Park Way,"HAMPTON INN ONE; Take Exit 31 from Hwy 99",,888-758-4389,E,,Public,24 hours daily,,,,,,2,,,ChargePoint Network,http://www.mychargepoint.net/,10/09/2015,62623,2015-10-09 07:50:18+00,,,,,,,,,J1772,"8818 Spectrum Park Way
Bakersfield, CA 93308",35.4398662,-119.0756759,1400000US06029000101,56187
22031,0101000020E61000001F2C634337985DC04C1AA375540B4140,ELEC,Ramada Plaza West Hollywood,8585 Santa Monica Blvd.,"Units in parking structure adjacent to 
lobby. Parking Fees: First 15 mins are 
free. After that ea 20 mins = $2.50. 
After 3 hrs, flat rate of $29.00 per 
day.

Units in parking structure adjacent to 
lobby. Parking Fees: First 15 mins are 
free. After that ea 20 mins = $2.50. 
After 3 hrs, flat rate of $29.00 per 
day.

Units in parking structure adjacent to 
lobby. Parking Fees: First 15 mins are 
free. After that ea 20 mins = $2.50. 
After 3 hrs, flat rate of $29.00 per 
day.

Units in parking structure adjacent to 
lobby. Parking Fees: First 15 mins are 
free. After that ea 20 mins = $2.50. 
After 3 hrs, flat rate of $29.00 per 
day.

Units in parking structure adjacent to 
lobby. Parking Fees: First 15 mins are 
free. After that ea 20 mins = $2.50. 
After 3 hrs, flat rate of $29.00 per 
day.

Units in parking structure adjacent to 
lobby. Parking Fees: First 15 mins are 
free. After that ea 20 mins = $2.50. 
After 3 hrs, flat rate of $29.00 per 
day.

Units in parking structure adjacent to 
lobby. Parking Fees: First 15 mins are 
free. After that ea 20 mins = $2.50. 
After 3 hrs, flat rate of $29.00 per 
day.

Units in parking structure adjacent to 
lobby. Parking Fees: First 15 mins are 
free. After that ea 20 mins = $2.50. 
After 3 hrs, flat rate of $29.00 per 
day.
",,888-998-2546,E,,Public,MON: 24 hours | TUE: 24 hours | WED: 24 hours | THU: 24 hours | FRI: 24 hours | SAT: 24 hours | SUN: 24 hours,,,,,,8,,,Blink Network,http://www.blinknetwork.com/,10/09/2015,48843,2015-10-09 07:12:28+00,,,,,,,,,J1772,"8585 Santa Monica Blvd.
West Hollywood, CA 90069",34.088515,-118.378373,1400000US06037700502,56195
9958,0101000020E610000041D076F123985DC063224A20CA0B4140,ELEC,Sunset Marquis Hotel -Tesla,1200 Alta Loma Rd,,,310-657-1333  877-798-3752,E,,Public,"24 hours daily; for Tesla use only; for guest use only; see front desk for access",,,,,,6,,,Tesla,http://www.teslamotors.com/supercharger,,70393,2015-10-09 20:33:07+00,P,,,07/01/2015,,,,,TESLA,"1200 Alta Loma Rd
West Hollywood, CA 90069",34.0921059,-118.3771938,1400000US06037700502,56195
11897,0101000020E61000003C855CA967985DC0A54DD53DB20B4140,ELEC,STP EV STATION,8730 Sunset Blvd,"STP EV STATION; The station is located on the G1 level of a parking garage",,888-758-4389,E,,Public,24 hours daily,,,,,,2,,,ChargePoint Network,http://www.mychargepoint.net/,10/09/2015,68032,2015-10-09 07:44:50+00,,,,,,,,,J1772,"8730 Sunset Blvd
West Hollywood, CA 90069",34.091377,-118.381327,1400000US06037700502,56195
3117,0101000020E6100000CDCCCCCCCC645DC01A69A9BC1D094140,ELEC,Ontario Airport Hilton,700 N Haven Ave,,,909-980-0400,E,,Public,"24 hours daily; guest use only",,,,,,1,,,,,05/05/2015,7194,2015-05-05 11:54:46+00,P,,,06/15/1998,,,,,J1772,"700 N Haven Ave
Ontario, CA 91764",34.07122,-117.575,1400000US06071002109,56217
11570,0101000020E6100000742502D53F635DC0F3C7B4368D094140,ELEC,Ontario Mills,One Mills Circle,,,888-998-2546,E,,Public,MON: 24 hours | TUE: 24 hours | WED: 24 hours | THU: 24 hours | FRI: 24 hours | SAT: 24 hours | SUN: 24 hours,,,,,,2,,,Blink Network,http://www.blinknetwork.com/,10/09/2015,67119,2015-10-09 07:09:14+00,,,,,,,,,J1772,"One Mills Circle
Ontario, CA 91764",34.074622,-117.550771,1400000US06071002109,56217
2501,0101000020E610000013EBF93F2C635DC0526FFC3F3D094140,ELEC,Ontario Mills Shopping Mall,1 E. Mills Circle,,,877-455-3833,E,,Public - Card key at all times,"24 hours daily; EVgo network subscription and key fob required",,,,,,1,2,,eVgo Network,https://www.evgonetwork.com/,10/09/2015,69413,2015-10-09 08:52:06+00,,,,,,,,,CHADEMO J1772,"1 E. Mills Circle
Ontario, CA 91764",34.0721817,-117.5495758,1400000US06071002109,56217
22241,0101000020E61000006C4C3E2C8A635DC0C408E1D1C6094140,ELEC,Ontario Mills Mall,1 Ontario Mills Circle,,,800-663-5633,E,,Public - Card key at all times,"MO: Not Specified; TU: Not Specified; WE: Not Specified; TH: Not Specified; FR: Not Specified; SA: Not Specified; SU: Not Specified",,,,,,2,,,SemaCharge Network,http://www.semacharge.com/,10/09/2015,42973,2015-10-09 07:36:16+00,,,,,,,,,J1772,"1 Ontario Mills Circle
Ontario, CA 91764",34.07638,-117.5553084,1400000US06071002109,56217
11137,0101000020E6100000C2E2CB9FCA635DC018B14F00C5094140,ELEC,KOHL'S,1051 N Milliken Ave,"10601 ONTARIO; EV Charging for Kohl's Customers Only - 4 hour Max",,888-758-4389,E,,Public,24 hours daily,,,,,1,1,,,ChargePoint Network,http://www.mychargepoint.net/,10/09/2015,42263,2015-10-09 08:06:34+00,,,,,,,,,NEMA520 J1772,"1051 N Milliken Ave
Ontario, CA 91764",34.0763245,-117.5592422,1400000US06071002109,56217
7317,0101000020E6100000655AF67F69565DC067A8FEFF873C4140,ELEC,The Mall of Victor Valley,14402 Bear Valley Rd.,,,877-455-3833,E,,Public - Card key at all times,"24 hours daily; EVgo network subscription and key fob required",,,,,,1,2,,eVgo Network,https://www.evgonetwork.com/,10/09/2015,69378,2015-10-09 08:51:14+00,,,,,,,,,CHADEMO J1772,"14402 Bear Valley Rd.
Victorville, CA 92392",34.47290039,-117.3501892,1400000US06071009910,56250
7399,0101000020E61000009DE0F65FC26A5EC07DCAD69F69564240,ELEC,HARTNELLCOLLEGE,411 Central Ave,MAIN CAMPUS,,888-758-4389,E,,Public,24 hours daily,,,,,1,1,,,ChargePoint Network,http://www.mychargepoint.net/,10/09/2015,49336,2015-10-09 08:14:44+00,,,,,,,,,NEMA520 J1772,"411 Central Ave
Salinas, CA 93901",36.6750984,-121.6681137,1400000US06053001400,56354
17963,0101000020E6100000DA869B9D56CC5DC0E6CE4C309C224140,ELEC,CITY OF VENTURA,901 S Kimball Rd,"901 KIMBALL RD1; Parking Lot near ball fields
901 KIMBALL RD2; Parkling Log near ballfields",,888-758-4389,E,,Public,24 hours daily,,,,,,4,,,ChargePoint Network,http://www.mychargepoint.net/,10/09/2015,65934,2015-10-09 07:47:12+00,,,,,,,,,J1772,"901 S Kimball Rd
Ventura, CA 93004",34.2703915,-119.1927866,1400000US06111001503,56429
3908,0101000020E61000005567B5C01ECD5DC06C239EEC66224140,ELEC,SERVICEBLDG1,855 Partridge Dr,HUMANSRVCSBLDG,,888-758-4389,E,,Public,24 hours daily,,,,,,2,,,ChargePoint Network,http://www.mychargepoint.net/,10/09/2015,69607,2015-10-09 07:40:46+00,,,,,,,,,J1772,"855 Partridge Dr
Ventura, CA 93003",34.268766,-119.205002,1400000US06111001503,56429
9137,0101000020E6100000E86A2BF697CD5DC09642209738224140,ELEC,Ventura County Government Center,800 S Victoria Ave,,,805-477-1917,E,,Public,8am-5pm daily,,,,,,3,,,,,07/08/2015,21606,2015-07-08 15:02:19+00,LG,,,10/19/2012,,,,,J1772,"800 S Victoria Ave
Ventura, CA 93009",34.267352,-119.2124,1400000US06111001503,56429
17649,0101000020E610000061A351265ACD5DC0CF87C2C2A4224140,ELEC,SERVICEBLDG1,John F. Johnston Dr,"VENTURA COUNTY; Enter the Ventura County Gov. Ctr. loop rd.(John F. Johnson  Dr) from Victoria Ave. of Telephone Rd. Continue around the until the Service Bldg. Enter the lot and station is left",,888-758-4389,E,,Public,24 hours daily,,,,,,2,,,ChargePoint Network,http://www.mychargepoint.net/,10/09/2015,61112,2015-10-09 07:40:44+00,,,,,,,,,J1772,"John F. Johnston Dr
Ventura, CA 93003",34.2706531,-119.2086273,1400000US06111001503,56429
2424,0101000020E610000017878E788D9F5DC03980D99832014140,ELEC,Loews Santa Monica Beach Hotel - Tesla,1700 Ocean Ave,,,310-458-6700  877-798-3752,E,,Public,"24 hours daily; for Tesla use only; for guest use only; see valet for access",,,,,,4,,,Tesla,http://www.teslamotors.com/supercharger,,70325,2015-10-08 18:33:30+00,P,,,06/01/2015,,,,,TESLA,"1700 Ocean Ave
Santa Monica, CA 90401",34.0093566,-118.4930097,1400000US06037701902,56450
22094,0101000020E610000098405B18B39F5DC04CF6741A0E024140,ELEC,SANTA MONICA,328-395 Santa Monica Pl,"G7 #1; Charger is located in SW corner of Level 1 of parking garage
G7 #2",,888-758-4389,E,,Public,24 hours daily,,,,,2,2,,,ChargePoint Network,http://www.mychargepoint.net/,10/09/2015,56785,2015-10-09 08:02:58+00,,,,,,,,,NEMA520 J1772,"328-395 Santa Monica Pl
Santa Monica, CA 90401",34.0160554,-118.4953061,1400000US06037701902,56450
7241,0101000020E6100000DA6F928B569F5DC052ED783826014140,ELEC,City of Santa Monica - Civic Auditorium Solar Port,1855 Main St,,,310-458-8516,E,,Public,"24 hours daily; pay lot",,,,,,3,,5 SP Inductive,,,02/03/2015,38515,2015-02-03 18:14:42+00,LG,,,11/15/2010,,,,,J1772,"1855 Main St
Santa Monica, CA 90401",34.0089789,-118.4896573,1400000US06037701902,56450
14234,0101000020E6100000EE6F1AEC979F5DC0456051B6ED014140,ELEC,Santa Monica Place Mall Garage #7 Civic Center ,395 Broadway,1st floor of parking garage,,310-458-8516,E,,Public,"24 hours daily; pay lot",,,,,,3,,1 SP Inductive,,,02/03/2015,6377,2015-02-03 18:14:48+00,LG,,,07/30/1997,,,,,J1772,"395 Broadway
Santa Monica, CA 90401",34.0150669,-118.4936476,1400000US06037701902,56450
8901,0101000020E610000001DE02098A9F5DC0F7AFAC3429014140,ELEC,Loews Santa Monica Beach Hotel,1700 Ocean Ave,,,310-458-6700  877-798-3752,E,,Public,"24 hours daily; for guest use only; see valet for access",,,,,,6,,,Tesla,http://www.teslamotors.com/supercharger,09/02/2015,21575,2015-09-02 02:32:26+00,P,,,09/14/2012,,,,,J1772 TESLA,"1700 Ocean Ave
Santa Monica, CA 90401",34.00907,-118.4928,1400000US06037701902,56450
20605,0101000020E6100000511B30A3B39F5DC0D0DAC8D00C024140,ELEC,SANTA MONICA,328 Santa Monica Pl,"G7 #4
G7 #3",,888-758-4389,E,,Public,24 hours daily,,,,,2,2,,,ChargePoint Network,http://www.mychargepoint.net/,10/09/2015,38935,2015-10-09 08:05:17+00,,,,,,,,,NEMA520 J1772,"328 Santa Monica Pl
Santa Monica, CA 90401",34.0160161,-118.4953392,1400000US06037701902,56450
13073,0101000020E6100000217DEE5FB49F5DC08D00FABF9B014140,ELEC,"Shore Hotel, CA",1515 Ocean Ave.,,,877-455-3833,E,,Public - Card key at all times,"24 hours daily; EVgo network subscription and key fob required",,,,,,,1,,eVgo Network,https://www.evgonetwork.com/,10/09/2015,69593,2015-10-09 08:55:19+00,,,,,,,,,CHADEMO,"1515 Ocean Ave.
Santa Monica, CA 90401",34.01256561,-118.4953842,1400000US06037701902,56450
7835,0101000020E61000002C6519E2589F5DC09DD843FB58014140,ELEC,City of Santa Monica - Civic Parking Garage,333 Civic Center Dr,1st floor of parking garage,,310-458-8516,E,,Public,"24 hours daily; pay lot",,,,,,7,,,,,02/03/2015,38521,2015-02-03 18:14:40+00,LG,,,11/15/2010,,,,,J1772,"333 Civic Center Dr
Santa Monica, CA 90401",34.010528,-118.4898,1400000US06037701902,56450
13150,0101000020E61000003733FAD1709F5DC03A3B191C25014140,ELEC,The Seychelle,1755 Ocean Drive,,,888-998-2546,E,,Public,MON: 24 hours | TUE: 24 hours | WED: 24 hours | THU: 24 hours | FRI: 24 hours | SAT: 24 hours | SUN: 24 hours,,,,,,1,,,Blink Network,http://www.blinknetwork.com/,10/09/2015,66320,2015-10-09 07:10:39+00,,,,,,,,,J1772,"1755 Ocean Drive
Santa Monica, CA 90401",34.008945,-118.491261,1400000US06037701902,56450
4181,0101000020E61000000CDF67017F9F5DC003CBB6781D024140,ELEC,Sway Santa Monica,525 Broadway,,,800-663-5633,E,,Public - Card key at all times,"MO: 08:00am-02:00am; TU: 08:00am-02:00am; WE: 08:00am-02:00am; TH: 08:00am-02:00am; FR: 08:00am-02:00am; SA: 08:00am-02:00am; SU: 08:00am-02:00am",,,,,,3,,,SemaCharge Network,http://www.semacharge.com/,10/09/2015,67834,2015-10-09 07:37:24+00,,,,,,,,,J1772,"525 Broadway
Santa Monica, CA 90401",34.0165244,-118.4921268,1400000US06037701902,56450
19345,0101000020E610000052CB2088BD9F5DC075A7E095C9014140,ELEC,City of Santa Monica - Garage #6,1443 2nd St,,,310-458-8411,E,,Public,24 hours daily,,,,,,30,,,,,02/03/2015,65080,2015-02-03 18:08:09+00,LG,,,01/01/2013,,,,,J1772,"1443 2nd St
Santa Monica, CA 90403",34.0139644,-118.4959431,1400000US06037701902,56450
6003,0101000020E61000002A0307B4F49A5EC0DBD2B4D5F6E34240,ELEC,OPERA PLAZA,600-698 Golden Gate Ave,"GARAGE CHARGER1; -",,888-758-4389,E,,Public,24 hours daily,,,,,,1,,,ChargePoint Network,http://www.mychargepoint.net/,10/09/2015,51949,2015-10-09 07:57:44+00,,,,,,,,,J1772,"600-698 Golden Gate Ave
San Francisco, CA 94102",37.7809703,-122.4211855,1400000US06075016000,56458
3309,0101000020E6100000E072ABD6F89A5EC0D3C7D7F912E44240,ELEC,OPERA PLAZA,601 Van Ness Ave,"GARAGE CHARGER2; Valet park with attendants and provide your chargepoint FOB.",,888-758-4389,E,,Public,24 hours daily,,,,,,1,,,ChargePoint Network,http://www.mychargepoint.net/,10/09/2015,49995,2015-10-09 07:57:43+00,,,,,,,,,J1772,"601 Van Ness Ave
San Francisco, CA 94102",37.7818291,-122.4214379,1400000US06075016000,56458
12104,0101000020E6100000B7A5C46460AD5EC00206932C71294340,ELEC,CITY OF COTATI,216 E School St,"COMMUNITYCENTR1; Across Community Center on School St, diagonal parking
COMMUNITYCENTR2; Across Community Center on School St, diagonal parking
COMMUNITYCENTR3; Across Community Center on School St, diagonal parking",,888-758-4389,E,,Public,24 hours daily,,,,,3,3,,,ChargePoint Network,http://www.mychargepoint.net/,10/09/2015,48179,2015-10-09 08:14:41+00,,,,,,,,,NEMA520 J1772,"216 E School St
Cotati, CA 94931",38.3237663,-122.7090084,1400000US06097151204,56462
21157,0101000020E610000084B1CFAD21035EC01525D7039C9F4340,ELEC,LIBERTY,701 National Ave,"LIBERTY NLT 1; As you enter the parking lot, turn right.  Stations by the drive-up window.",,888-758-4389,E,,Public,24 hours daily,,,,,,2,,,ChargePoint Network,http://www.mychargepoint.net/,10/09/2015,62441,2015-10-09 08:25:48+00,,,,,,,,,J1772,"701 National Ave
Tahoe Vista, CA 96148",39.2469487,-120.0489306,1400000US06061020106,56500
15803,0101000020E6100000A83462669F035EC0A3906456EF9E4340,ELEC,Cedar Glen Lodge,6589 N Lake Blvd,,,530-546-4281  877-798-3752,E,,Public,"24 hours daily; for guest use only; see front desk for access",,,,,,2,,,Tesla,http://www.teslamotors.com/supercharger,09/02/2015,68932,2015-09-02 02:44:11+00,P,,,04/01/2015,,,,,TESLA J1772,"6589 N Lake Blvd
Tahoe Vista, CA 96148",39.241679,-120.056604,1400000US06061020106,56500
388,0101000020E610000046A9CEB40E035EC0A78D8FBBAD9E4340,ELEC,Firelite Lodge,7035 N Lake Blvd,,,530-546-7222,E,,Public - Call ahead,"8am-10pm daily; guest use only",,,,,,2,,,,,06/02/2015,52098,2015-06-02 18:04:16+00,P,,,02/01/2014,,,,,J1772,"7035 N Lake Blvd
Tahoe Vista, CA 96148",39.2396769,-120.0477726,1400000US06061020106,56500
12489,0101000020E6100000EBAC16D8637A5DC050C8CEDBD8EA4040,ELEC,Anaheim City Hall,200 South Anaheim Blvd,,,888-998-2546,E,,Public,MON: 24 hours | TUE: 24 hours | WED: 24 hours | THU: 24 hours | FRI: 24 hours | SAT: 24 hours | SUN: 24 hours,,,,,,2,,,Blink Network,http://www.blinknetwork.com/,10/09/2015,52344,2015-10-09 07:09:40+00,,,,,,,,,J1772,"200 South Anaheim Blvd
Anaheim, CA 92805",33.834743,-117.912344,1400000US06059087300,56618
5585,0101000020E61000003DC8FCED7C7A5DC02E2C6E92D5EA4040,ELEC,CITY OF ANAHEIM,201 S. Anaheim Blvd,"AWT 1ST FLR 002; Enter from Center Street Promenade, stations on left.
AWT 1ST FLR 001; Enter from Center Street Promenade, stations on left.",,888-758-4389,E,,Public,24 hours daily,,,,,1,2,,,ChargePoint Network,http://www.mychargepoint.net/,10/09/2015,36344,2015-10-09 08:14:09+00,,,,,,,,,NEMA520 J1772,"201 S. Anaheim Blvd
Anaheim, CA 92805",33.8346427,-117.9138751,1400000US06059087300,56618
6163,0101000020E610000089A18B3C7F7A5DC058552FBFD3EA4040,ELEC,Anaheim West Tower Parking,201 S. Anaheim Blvd.,,,888-998-2546,E,,Private,MON: 24 hours | TUE: 24 hours | WED: 24 hours | THU: 24 hours | FRI: 24 hours | SAT: 24 hours | SUN: 24 hours,,,,,,4,,,Blink Network,http://www.blinknetwork.com/,10/09/2015,52292,2015-10-09 07:09:40+00,,,,,,,,,J1772,"201 S. Anaheim Blvd.
Anaheim, CA 92805",33.834587,-117.9140159,1400000US06059087300,56618
18483,0101000020E61000001290E513687A5DC0A0F3BF01D2EA4040,ELEC,CITY OF ANAHEIM,200 S. Anaheim Blvd.,"CITYHALL GRND04; Enter City Hall parking structure, stations on the Grnd Flr.
CITYHALL GRND03; Enter City parking structure, stations are on the Grnd Flr.",,888-758-4389,E,,Public,24 hours daily,,,,,,2,,,ChargePoint Network,http://www.mychargepoint.net/,10/09/2015,41313,2015-10-09 08:07:32+00,,,,,,,,,J1772,"200 S. Anaheim Blvd.
Anaheim, CA 92805",33.8345339,-117.9126024,1400000US06059087300,56618
482,0101000020E6100000DF6DDE3829925EC085268925E5EA4240,ELEC,AC Transit,1177 47th St,Located in the employee parking structure,,,E,,Private,Employee use only,,,,,,2,,,OpConnect,http://www.opconnect.com/,03/04/2015,65914,2015-03-04 01:17:12+00,P,,,01/01/2015,,,,,J1772,"1177 47th St
Emeryville, CA 94608",37.835118,-122.283766,1400000US06001425104,56654
21140,0101000020E6100000B81E85EB51585DC07CF2B0506B024140,ELEC,Inland Empire Foods,5425 Wilson St,,,951-682-8222,E,,Public,"24 hours M-Th, 12am-4:30pm F",,,,,,2,,,,,05/05/2015,7206,2015-05-05 11:55:21+00,P,,,05/30/1998,,,,,J1772,"5425 Wilson St
Riverside, CA 92509",34.0189,-117.38,1400000US06065040101,56667
17294,0101000020E610000083F7FAFF5D975DC0A0D3FBDF740C4140,ELEC,8000 Sunset,8000 Sunset Boulevard,,,877-455-3833,E,,Public - Card key at all times,"24 hours daily; EVgo network subscription and key fob required",,,,,,1,2,,eVgo Network,https://www.evgonetwork.com/,10/09/2015,69388,2015-10-09 08:51:27+00,,,,,,,,,CHADEMO J1772,"8000 Sunset Boulevard
Los Angeles, CA 90046",34.09731674,-118.3651123,1400000US06037189800,56769
16997,0101000020E610000096766A2E37975DC0A329F16F860C4140,ELEC,Directors Guild of America,7920 Sunset Blvd,Suite 401,,,E,,Private,,,,,,,2,,,,,03/04/2015,46732,2015-03-04 14:10:23+00,P,,,02/11/2012,,,,,J1772,"7920 Sunset Blvd
Los Angeles, CA 90046",34.0978527,-118.362743,1400000US06037189800,56769
18477,0101000020E610000002DC87179F805DC0C47762D68BE84040,ELEC,EVSP WALGREENS,3446 W Ball Rd,"STORE 6954; The station is located right of the store's entrance",,888-758-4389,E,,Public,24 hours daily,,,,,,1,,,ChargePoint Network,http://www.mychargepoint.net/,10/09/2015,44406,2015-10-09 07:43:07+00,,,,,,,,,J1772,"3446 W Ball Rd
Anaheim, CA 92804",33.8167675,-118.0097102,1400000US06059087801,56782
20160,0101000020E61000008890042B98985DC0583A1F9E25F94040,ELEC,Los Angeles Airport Marriott,5855 W Century Blvd,,,310-641-5700  877-798-3752,E,,Public,"24 hours daily; for guest use only; see front desk for access",,,,,,3,,,Tesla,http://www.teslamotors.com/supercharger,,70279,2015-10-07 21:11:22+00,P,,,03/01/2015,,,,,TESLA J1772,"5855 W Century Blvd
Los Angeles, CA 90045",33.9464605,-118.3842876,1400000US06037277200,56789
18435,0101000020E6100000D50968226C985DC0861F9C4F1DF94040,ELEC,Hilton - Los Angeles International Airport - Tesla,5711 W Century Blvd,,,310-410-4000  877-798-3752,E,,Public,"24 hours daily; for Tesla use only; for guest use only; see valet for access",,,,,,2,,1 LP Inductive,Tesla,http://www.teslamotors.com/supercharger,03/04/2015,7180,2015-10-07 21:45:51+00,P,,,08/01/2015,,,,,TESLA,"5711 W Century Blvd
Los Angeles, CA 90045",33.946207,-118.3816,1400000US06037277200,56789
15882,0101000020E6100000713D0AD7A3985DC07DAEB6627FF94040,ELEC,Marriott - Renaissance Los Angeles Airport Hotel,9620 Airport Blvd,,,310-337-2800,E,,Public,"24 hours daily; pay lot",,,,,,2,,,,,05/05/2015,48362,2015-05-05 11:54:48+00,P,,,01/01/2012,,,,,J1772,"9620 Airport Blvd
Los Angeles, CA 90045",33.9492,-118.385,1400000US06037277200,56789
4923,0101000020E610000035913E52E9985DC0883BCDB85F094140,ELEC,Four Seasons Hotel - Tesla,300 S Doheny Dr,,,310-273-2222  877-798-3752,E,,Public,"24 hours daily; for Tesla use only; for guest use only; see valet for access",,,,,,2,,,Tesla,http://www.teslamotors.com/supercharger,09/02/2015,68973,2015-09-02 02:45:37+00,P,,,03/01/2015,,,,,TESLA,"300 S Doheny Dr
Los Angeles, CA 90048",34.0732337,-118.3892408,1400000US06037214901,56893
6152,0101000020E6100000680586AC6E675DC02C9FE57970114140,ELEC,City of Rancho Cucamonga - Beryl Park West,6501 Carnelian St,,,909-477-2700,E,,Public,24 hours daily,,,,,,1,,,,,05/05/2015,51131,2015-05-05 11:58:33+00,LG,,,02/27/2013,,,,,J1772,"6501 Carnelian St
Rancho Cucamonga, CA 91701",34.136245,-117.61613,1400000US06071002013,56949
13348,0101000020E61000005DA626C19B895DC0CE12094BE10A4140,ELEC,Public Works Headquarters,900 S Fremont Ave,Located in front and near the motorpool area,,323-267-2023,E,,Public,"6am-6pm M-F; keypad activated, instructions on EVSE",,,,,,8,,,,,06/02/2015,63041,2015-06-02 18:01:14+00,LG,,,08/01/2014,,,,,J1772,"900 S Fremont Ave
Alhambra, CA 91803",34.0850004,-118.1501315,1400000US06037480802,56991
9508,0101000020E6100000AFC1B11DC2895DC02500A4DBB70A4140,ELEC,Public Works Annex,901 S Fremont Ave,Northside of Annex by driveway,,323-267-2023,E,,Public,"6am-6pm M-F; keypad activated, instructions on EVSE",,,,,,3,,,,,06/02/2015,63042,2015-06-02 18:01:45+00,LG,,,08/01/2014,,,,,J1772,"901 S Fremont Ave
Alhambra, CA 91803",34.0837359,-118.1524729,1400000US06037480802,56991
13496,0101000020E61000004DA3C9C5187C5DC0C8E1DDDB3EE34040,ELEC,CCC,12901 S Euclid St,"CCC GG; -",,888-758-4389,E,,Public,24 hours daily,,,,,,2,,,ChargePoint Network,http://www.mychargepoint.net/,10/09/2015,69036,2015-10-09 07:42:45+00,,,,,,,,,J1772,"12901 S Euclid St
Garden Grove, CA 92843",33.7753558,-117.939012,1400000US06059088602,57000
6984,0101000020E61000009E5099AC1B7C5DC0E099756B3EE34040,ELEC,CCC,10961 Marian Dr,"CCC GGB; -",,888-758-4389,E,,Public,24 hours daily,,,,,,2,,,ChargePoint Network,http://www.mychargepoint.net/,10/09/2015,69049,2015-10-09 08:24:11+00,,,,,,,,,J1772,"10961 Marian Dr
Garden Grove, CA 92840",33.7753424,-117.9391891,1400000US06059088602,57000
20114,0101000020E61000009AD42BC0D2905EC01844FF5FD0E54240,ELEC,Laney College,900 Fallon St,,,877-455-3833,E,,Public - Card key at all times,"24 hours daily; EVgo network subscription and key fob required",,,,,,,1,,eVgo Network,https://www.evgonetwork.com/,10/09/2015,69538,2015-10-09 08:54:28+00,,,,,,,,,CHADEMO,"900 Fallon St
Oakland, CA 94607",37.7954216,-122.2628632,1400000US06001403300,57064
18040,0101000020E6100000CD902A8A574D5DC0CADDE7F868654040,ELEC,City of San Diego Mission Bay Park Playa I,2590 E. Mission Bay Dr,,,888-998-2546,E,,Public,MON: 24 hours | TUE: 24 hours | WED: 24 hours | THU: 24 hours | FRI: 24 hours | SAT: 24 hours | SUN: 24 hours,,,,,,4,,,Blink Network,http://www.blinknetwork.com/,10/09/2015,50955,2015-10-09 07:13:26+00,,,,,,,,,J1772,"2590 E. Mission Bay Dr
San Diego, CA 92109",32.792266,-117.208468,1400000US06073007600,57083
19531,0101000020E61000003E7AC37DE44F5DC09DBD33DAAA624040,ELEC,City of San Diego Mission Bay Park Bonita Cove,1100 West Mission Bay Drive,"Located in parking lot across the 
street from the Bahia Hotel.

Located in parking lot across the 
street from the Bahia Hotel.

Located in parking lot across the 
street from the Bahia Hotel.

Located in parking lot across the 
street from the Bahia Hotel.
",,888-998-2546,E,,Public,MON: 24 hours | TUE: 24 hours | WED: 24 hours | THU: 24 hours | FRI: 24 hours | SAT: 24 hours | SUN: 24 hours,,,,,,4,,,Blink Network,http://www.blinknetwork.com/,10/09/2015,50954,2015-10-09 07:13:02+00,,,,,,,,,J1772,"1100 West Mission Bay Drive
San Diego, CA 92109",32.770839,-117.248321,1400000US06073007600,57083
6724,0101000020E61000007D06D49B514F5DC01EA7E8482E634040,ELEC,Paradise Point Resort,1404 Vacation Road,,,888-998-2546,E,,Private,MON: 24 hours | TUE: 24 hours | WED: 24 hours | THU: 24 hours | FRI: 24 hours | SAT: 24 hours | SUN: 24 hours,,,,,,5,,,Blink Network,http://www.blinknetwork.com/,10/09/2015,55180,2015-10-09 07:12:33+00,,,,,,,,,J1772,"1404 Vacation Road
San Diego, CA 92109",32.77485,-117.239356,1400000US06073007600,57083
19161,0101000020E61000007D06D49B514F5DC01EA7E8482E634040,ELEC,Paradise Point Resort,1404 Vacation Road,,,888-998-2546,E,,Public,MON: 24 hours | TUE: 24 hours | WED: 24 hours | THU: 24 hours | FRI: 24 hours | SAT: 24 hours | SUN: 24 hours,,,,,,1,,,Blink Network,http://www.blinknetwork.com/,10/09/2015,49139,2015-10-09 07:11:30+00,,,,,,,,,J1772,"1404 Vacation Road
San Diego, CA 92109",32.77485,-117.239356,1400000US06073007600,57083
5083,0101000020E61000005EFCC808834E5DC004D89134C9614040,ELEC,SEAWORLD SD,500 Seaworld Drive,"SEAWORLD1; Parking Rates may apply
SEAWORLD2; Parking Rates may apply",,888-758-4389,E,,Public,24 hours daily,,,,,,4,,,ChargePoint Network,http://www.mychargepoint.net/,10/09/2015,43214,2015-10-09 08:11:13+00,,,,,,,,,J1772,"500 Seaworld Drive
San Diego, CA 92109",32.7639528,-117.2267477,1400000US06073007600,57083
10415,0101000020E61000008FC2F5285C575EC0EEEBC039235A4340,ELEC,North Highlands Library,4235 Antelope Rd,,,916-264-2700,E,,Public,24 hours daily,,,,,,2,,,,,07/08/2015,25497,2015-07-08 15:11:03+00,LG,,,06/01/2004,,,,,J1772,"4235 Antelope Rd
Antelope, CA 95843",38.7042,-121.365,1400000US06067007427,57176
19901,0101000020E6100000BA69334E43185DC03AE97DE36BDD4040,ELEC,City of Palm Desert - Park View Building,73710 Fred Waring Dr,,,760-776-6416,E,,Private,Employee use only with keycard,,,,,,1,,,,,05/05/2015,51717,2015-05-05 11:43:49+00,LG,,,04/01/2013,,,,,J1772,"73710 Fred Waring Dr
Palm Desert, CA 92260",33.729855,-116.379108,1400000US06065045119,57230
16734,0101000020E61000007F130A1170185DC01EC3633F8BDD4040,ELEC,City of Palm Desert - City Hall,73510 Fred Waring Dr,,,760-776-6416,E,,Public,24 hours daily,,,,,,4,,,,,05/05/2015,51516,2015-05-05 11:44:34+00,LG,,,04/01/2013,,,,,J1772,"73510 Fred Waring Dr
Palm Desert, CA 92260",33.730812,-116.38184,1400000US06065045119,57230
22499,0101000020E6100000BA69334E43185DC03AE97DE36BDD4040,ELEC,City of Palm Desert - Park View Building,73710 Fred Waring Dr,,,760-776-6416,E,,Public,24 hours daily,,,,,,1,,,,,05/05/2015,51716,2015-05-05 11:43:49+00,LG,,,04/01/2013,,,,,J1772,"73710 Fred Waring Dr
Palm Desert, CA 92260",33.729855,-116.379108,1400000US06065045119,57230
1547,0101000020E61000000BCF4BC5C6275EC0FD9FC37C798F4140,ELEC,City of Grover Beach - City Hall,154 8th St,,,805-473-4520,E,,Public,"8am-5pm daily; one hour charging limit",,,,,,1,,,,,05/05/2015,48718,2015-05-05 11:49:29+00,LG,,,01/01/2012,,,,,J1772,"154 8th St
Grover Beach, CA 93433",35.120895,-120.621507,1400000US06079012102,57244
13982,0101000020E610000072874D64E64B5EC03BC5AA4198E34240,ELEC,1st Light Energy,1869 Moffat Blvd,,,848-228-6922,E,,Public,8am-5pm daily,,,,,,1,,,,,07/08/2015,64395,2015-07-08 15:00:21+00,P,,,06/01/2013,,,,,J1772,"1869 Moffat Blvd
Manteca, CA 95336",37.778084,-121.185937,1400000US06077005110,57297
3263,0101000020E61000004A1F5FE7CB7A5DC0FDDE01F96DD64040,ELEC,NISSAN-CONNELL,2850 Harbor Blvd,"QUICK CHARGER 1; In the dealership parking lot",,888-758-4389,E,,Public,24 hours daily,,,,,,,1,,ChargePoint Network,http://www.mychargepoint.net/,10/09/2015,58340,2015-10-09 07:50:29+00,,,,,,,,,CHADEMO,"2850 Harbor Blvd
Costa Mesa, CA 92626",33.6752311,-117.9186953,1400000US06059063902,57313
6380,0101000020E6100000AAB46A7CCB7A5DC0DEE7F86871D64040,ELEC,Connell Nissan,2850 Harbor Blvd,,,714-444-4220,E,,Private,,,,,,,1,,,,,07/08/2015,47602,2015-07-08 14:24:16+00,P,,,03/15/2011,,,,,J1772,"2850 Harbor Blvd
Costa Mesa, CA 92626",33.675336,-117.9186698,1400000US06059063902,57313
6657,0101000020E6100000AAB46A7CCB7A5DC0DEE7F86871D64040,ELEC,Connell Nissan,2850 Harbor Blvd,,,714-444-4220,E,,Public - Call ahead,Dealership business hours,,,,,,1,,,,,07/08/2015,39882,2015-07-08 14:24:16+00,P,,,03/15/2011,,,,,J1772,"2850 Harbor Blvd
Costa Mesa, CA 92626",33.675336,-117.9186698,1400000US06059063902,57313
1263,0101000020E6100000AD78D9652E7A5DC09ADCDE24BCD54040,ELEC,OCC,2701 Fairview Rd,"OCC 1B; -
OCC 3B; -
OCC 3A; -
OCC 1A; -
OCC 2A; -
OCC 2B; -",,888-758-4389,E,,Public,24 hours daily,,,,,,12,,,ChargePoint Network,http://www.mychargepoint.net/,10/09/2015,69065,2015-10-09 07:42:47+00,,,,,,,,,J1772,"2701 Fairview Rd
Costa Mesa, CA 92626",33.6698042,-117.9090819,1400000US06059063902,57313
8862,0101000020E6100000BD5296218ED55DC0429946938B354140,ELEC,Lake Casitas Municipal Water District - Recreational Area,Casitas Pass Rd & Baldwin Rd,Baldwin Road/Casitas Pass Road,,805-649-2233,E,,Public,8am-5pm daily,,,,,3,1,,,,,05/05/2015,21566,2015-05-05 11:54:33+00,P,,,05/30/2002,,,,,NEMA520 J1772,"Casitas Pass Rd &amp; Baldwin Rd
Oak View, CA 93022",34.418322,-119.3368,1400000US06111001001,57315
1215,0101000020E6100000FA08A128F5895EC02EED2F16E1DC4240,ELEC,SAN LEANDRO,120 Estudillo Ave,"PARKINGGARAGE02; Ground floor level
PARKINGGARAGE01; 4th level of parking garage",,888-758-4389,E,,Public,24 hours daily,,,,,,4,,,ChargePoint Network,http://www.mychargepoint.net/,10/09/2015,66693,2015-10-09 07:45:23+00,,,,,,,,,J1772,"120 Estudillo Ave
San Leandro, CA 94577",37.7256191,-122.1555883,1400000US06001432600,57340
14653,0101000020E61000002300EE68528B5DC0B0B8EE9C1C5C4140,ELEC,AVFA,2551 W Avenue H,"LOT E; -",,888-758-4389,E,,Public,24 hours daily,,,,,,2,,,ChargePoint Network,http://www.mychargepoint.net/,10/09/2015,52522,2015-10-09 07:55:00+00,,,,,,,,,J1772,"2551 W Avenue H
Lancaster, CA 93536",34.7196232,-118.1769049,1400000US06037900900,57361
20789,0101000020E61000008A6C8C4237C25DC01C8645FB0EA74140,ELEC,BMW BAKERSFIELD,5400 Gasoline Alley Dr,STATION 01,,888-758-4389,E,,Public,24 hours daily,,,,,,2,,,ChargePoint Network,http://www.mychargepoint.net/,10/09/2015,60641,2015-10-09 08:21:16+00,,,,,,,,,J1772,"5400 Gasoline Alley Dr
Bakersfield, CA 93313",35.3051447,-119.0346228,1400000US06029003114,57411
549,0101000020E61000001A53B0C659615EC0150B32B89C4F4340,ELEC,CCC,2870 Gateway Oaks Dr,"STATION 1; -",,888-758-4389,E,,Public,24 hours daily,,,,,1,1,,,ChargePoint Network,http://www.mychargepoint.net/,10/09/2015,53679,2015-10-09 07:56:00+00,,,,,,,,,NEMA520 J1772,"2870 Gateway Oaks Dr
Sacramento, CA 95833",38.6219702,-121.5211045,1400000US06067007010,57478
10368,0101000020E610000086BAFE1312615EC0A79196CADB4E4340,ELEC,Gateway Oaks Metro Center,2710 Gateway Oaks Dr,,,916-921-5005,E,,Public,24 hours daily,,,,,,1,,,,,07/08/2015,25500,2015-07-08 15:00:05+00,P,,,05/30/2004,,,,,J1772,"2710 Gateway Oaks Dr
Sacramento, CA 95833",38.6160825,-121.5167284,1400000US06067007010,57478
13998,0101000020E6100000705F07CE19745DC08EAED2DD75064140,ELEC,Southern California Edison - Innovation Village Office,3 Innovation Way,,,,E,,Private,Employee use only,,,,,4,4,,,Greenlots,http://greenlots.com/,04/03/2015,66304,2015-04-03 17:07:46+00,T,,,10/06/2014,,,,,NEMA520 J1772,"3 Innovation Way
Pomona, CA 91768",34.050472,-117.814075,1400000US06037402403,57500
11699,0101000020E6100000001DE6CB0B745DC025D291B7B7064140,ELEC,Southern California Edison - Innovation Village Office,1 Innovation Way,,,,E,,Private,,,,,,,1,,1 Conductive,,,04/03/2015,48712,2015-04-03 17:10:39+00,T,,,06/01/2011,,,,,J1772,"1 Innovation Way
Pomona, CA 91768",34.0524816,-117.81322,1400000US06037402403,57500
1638,0101000020E6100000001DE6CB0B745DC025D291B7B7064140,ELEC,Southern California Edison - Innovation Village Office,1 Innovation Way,,,,E,,Private,Employee use only,,,,,4,4,,,Greenlots,http://greenlots.com/,04/03/2015,66300,2015-04-03 17:10:39+00,T,,,01/01/2015,,,,,NEMA520 J1772,"1 Innovation Way
Pomona, CA 91768",34.0524816,-117.81322,1400000US06037402403,57500
17542,0101000020E61000001E673FF78A865DC0F7FAA42435F64040,ELEC,MCKENNA BMW,10900 Firestone Blvd,"STATION 01; -",,888-758-4389,E,,Public,24 hours daily,,,,,,2,,,ChargePoint Network,http://www.mychargepoint.net/,10/09/2015,62215,2015-10-09 08:21:46+00,,,,,,,,,J1772,"10900 Firestone Blvd
Norwalk, CA 90650",33.9234968,-118.1022318,1400000US06037550300,57568
5112,0101000020E61000002AEDC330169F5DC0739C80CB08024140,ELEC,S.M. HYBRID,825 Olympic Blvd,"** SM HYBRID **; -",,888-758-4389,E,,Public,24 hours daily,,,,,,2,,,ChargePoint Network,http://www.mychargepoint.net/,10/09/2015,69905,2015-10-09 08:26:46+00,,,,,,,,,J1772,"825 Olympic Blvd
Santa Monica, CA 90404",34.0158934,-118.4857294,1400000US06037701802,57569
2260,0101000020E6100000DC57D4160D545EC0B38EF4B3A25A4340,ELEC,Sacramento Municipal Utility District,7825 Lichen Dr,I-80 and Antelope Road Exit,,916-517-0363,E,,Public,24 hours daily,A D M V,,,,,1,2,,Greenlots,http://greenlots.com/,08/04/2015,66812,2015-08-04 13:12:34+00,LG,,,04/10/2015,,,,,J1772 CHADEMO J1772COMBO,"7825 Lichen Dr
Citrus Heights, CA 95621",38.7080903,-121.3132989,1400000US06067008127,57571
22257,0101000020E6100000D4FCE71FB3915EC0C111EEDF06254340,ELEC,GASSER BUILDING,433 Soscol Ave,"STATION ONE; -",,888-758-4389,E,,Public,24 hours daily,,,,,,2,,,ChargePoint Network,http://www.mychargepoint.net/,10/09/2015,46739,2015-10-09 07:54:47+00,,,,,,,,,J1772,"433 Soscol Ave
Napa, CA 94559",38.2892723,-122.2765579,1400000US06055200301,57619
3056,0101000020E6100000BADFFCE1C2915EC07594DE9277254340,ELEC,Napa Nissan,510 Soscol Ave,,,707-253-1551,E,,Public - Call ahead,Dealership business hours,,,,,,1,,,,,07/08/2015,39914,2015-07-08 14:25:18+00,P,,,03/15/2011,,,,,J1772,"510 Soscol Ave
Napa, CA 94559",38.2927116,-122.2775197,1400000US06055200301,57619
12550,0101000020E6100000D9EBDD1FEF915EC0E8E390C316264340,ELEC,NCTPA,625 Burnell St,"STATION 01; Rear of building - Back lot
STATION 03
STATION 02",,888-758-4389,E,,Public,24 hours daily,,,,,,6,,,ChargePoint Network,http://www.mychargepoint.net/,10/09/2015,67792,2015-10-09 08:25:34+00,,,,,,,,,J1772,"625 Burnell St
Napa, CA 94559",38.2975697,-122.28022,1400000US06055200301,57619
11503,0101000020E6100000BADFFCE1C2915EC07594DE9277254340,ELEC,Napa Nissan,510 Soscol Ave,,,707-253-1551,E,,Private,,,,,,,1,,,,,07/08/2015,48130,2015-07-08 14:25:18+00,P,,,03/15/2011,,,,,J1772,"510 Soscol Ave
Napa, CA 94559",38.2927116,-122.2775197,1400000US06055200301,57619
10379,0101000020E6100000F30016F9F5915EC0C0B2D2A414264340,ELEC,Soscol Transit Center,Corner of 4th & Burnell Streets,,,888-998-2546,E,,Private,MON: 24 hours | TUE: 24 hours | WED: 24 hours | THU: 24 hours | FRI: 24 hours | SAT: 24 hours | SUN: 24 hours,,,,,,1,,,Blink Network,http://www.blinknetwork.com/,10/09/2015,50947,2015-10-09 07:12:18+00,,,,,,,,,J1772,"Corner of 4th &amp; Burnell Streets
Napa, CA 94559",38.297505,-122.280638,1400000US06055200301,57619
6982,0101000020E61000007C6308008E4A5DC0B0E8D66B7A624040,ELEC,Bloomingdales - Fashion Valley - San Diego CA,7017 Friars Road,"North entrance of mall on Friars Rd. 
Units are left of the entrance. 
Directly in front of Bloomingdales.

North entrance of mall on Friars Rd. 
Units are left of the entrance. 
Directly in front of Bloomingdales.

North entrance of mall on Friars Rd. 
Units are left of the entrance. 
Directly in front of Bloomingdales.

North entrance of mall on Friars Rd. 
Units are left of the entrance. 
Directly in front of Bloomingdales.
",,888-998-2546,E,,Public,MON: 24 hours | TUE: 24 hours | WED: 24 hours | THU: 24 hours | FRI: 24 hours | SAT: 24 hours | SUN: 24 hours,,,,,,4,,,Blink Network,http://www.blinknetwork.com/,10/09/2015,49136,2015-10-09 07:11:31+00,,,,,,,,,J1772,"7017 Friars Road
San Diego, CA 92108",32.769361,-117.164917,1400000US06073008902,57642
8364,0101000020E6100000603F1FC07D4A5DC060AAFCDF4F624040,ELEC,Fashion Valley,7007 Friars Rd,,,877-455-3833,E,,Public - Card key at all times,"24 hours daily; EVgo network subscription and key fob required",,,,,,1,2,,eVgo Network,https://www.evgonetwork.com/,10/09/2015,69599,2015-10-09 08:55:27+00,,,,,,,,,CHADEMO J1772 J1772COMBO,"7007 Friars Rd
San Diego, CA 92108",32.76806259,-117.1639252,1400000US06073008902,57642
20220,0101000020E6100000AD1809C872A25EC02C1DBD2BCC004340,ELEC,4040 CIVIC,4040 Civic Center Dr,"4040 CIVIC; North Visitor Parking",,888-758-4389,E,,Public,24 hours daily,,,,,,2,,,ChargePoint Network,http://www.mychargepoint.net/,10/09/2015,68941,2015-10-09 07:42:53+00,,,,,,,,,J1772,"4040 Civic Center Dr
San Rafael, CA 94903",38.0062308,-122.5382557,1400000US06041106001,57700
19273,0101000020E6100000DD43C2F7FEBF5DC02BC24D46951B4140,ELEC,VCOE,5100 Adolfo Rd,"VCOE 1; -
VCOE 2; -",,888-758-4389,E,,Public,24 hours daily,,,,,,4,,,ChargePoint Network,http://www.mychargepoint.net/,10/09/2015,63784,2015-10-09 07:48:55+00,,,,,,,,,J1772,"5100 Adolfo Rd
Camarillo, CA 93012",34.215493,-118.999937,1400000US06111005304,57720
3543,0101000020E61000003FE603029D905DC0B6B9D683EE054140,ELEC,ESSEX,801 S Hope St,"8TH & HOPE 02; 8th. St.
8TH & HOPE 04; 8th st.
8TH & HOPE 01; 8th st.
8TH & HOPE 03; 8th. St.",,888-758-4389,E,,Public,24 hours daily,,,,,,8,,,ChargePoint Network,http://www.mychargepoint.net/,10/09/2015,69105,2015-10-09 07:42:16+00,,,,,,,,,J1772,"801 S Hope St
LA, CA 90017",34.0463414,-118.259583,1400000US06037207710,57801
671,0101000020E61000004BAE62F19B905DC0FC8C0B0742064140,ELEC,Downtown Properties,"818 West Seventh Street, Suite 410",,,888-998-2546,E,,Public,MON: 24 hours | TUE: 24 hours | WED: 24 hours | THU: 24 hours | FRI: 24 hours | SAT: 24 hours | SUN: 24 hours,,,,,,2,,,Blink Network,http://www.blinknetwork.com/,10/09/2015,45238,2015-10-09 07:14:04+00,,,,,,,,,J1772,"818 West Seventh Street, Suite 410
Los Angeles, CA 90017",34.04889,-118.259518,1400000US06037207710,57801
932,0101000020E6100000B1FE2A1B31915DC0B054BC36C0054140,ELEC,L.A. LIVE EV CH,1005 Chick Hearn Ct,"UNIT 4; West Garage, Level P2
UNIT 2; West Garage, Level G1
UNIT 1; West Garage, Level G1
UNIT 3; West Garage, Level G1",,888-758-4389,E,,Public,24 hours daily,,,,,,8,,,ChargePoint Network,http://www.mychargepoint.net/,10/09/2015,67675,2015-10-09 07:45:07+00,,,,,,,,,J1772,"1005 Chick Hearn Ct
LA, CA 90015",34.0449284,-118.2686222,1400000US06037207710,57801
8054,0101000020E610000059DB148F8B905DC0B8CCE9B298064140,ELEC,Jonathan Club,545 South Figueroa Street,,,888-998-2546,E,,Private,MON: 24 hours | TUE: 24 hours | WED: 24 hours | THU: 24 hours | FRI: 24 hours | SAT: 24 hours | SUN: 24 hours,,,,,,3,,,Blink Network,http://www.blinknetwork.com/,10/09/2015,47616,2015-10-09 07:13:19+00,,,,,,,,,J1772,"545 South Figueroa Street
Los Angeles, CA 90071",34.051535,-118.258518,1400000US06037207710,57801
21316,0101000020E6100000DA3C693C6C905DC0D77B3BD395064140,ELEC,CITYNATNL PLAZA,505 S Flower St,"A-LVL #2; Located on Level A
CITYNATNL-CLVL3; Located on Level C
CITYNATNL-CLVL5; Located on Level C
CITYNATNL-CLVL4; Located on Level C
A-LVL #1; Located on Level A",,888-758-4389,E,,Public,24 hours daily,,,,,,5,,,ChargePoint Network,http://www.mychargepoint.net/,10/09/2015,42258,2015-10-09 07:59:41+00,,,,,,,,,J1772,"505 S Flower St
Los Angeles, CA 90071",34.0514473,-118.2566062,1400000US06037207710,57801
8761,0101000020E6100000D88EF3484D905DC065E65D503A064140,ELEC,PACMUTUAL,523 W 6th St,"STATION 1
STATION 2",,888-758-4389,E,,Public,24 hours daily,,,,,,2,,,ChargePoint Network,http://www.mychargepoint.net/,10/09/2015,48964,2015-10-09 07:49:32+00,,,,,,,,,J1772,"523 W 6th St
Los Angeles, CA 90014",34.0486546,-118.2547171,1400000US06037207710,57801
2362,0101000020E6100000B254CD6298905DC04C384FD081064140,ELEC,BROOKFIELD WEST,601 S. Figueroa St,"601 S FIG EV7-8; Stations are on P5 near elevator.
601 S FIG EV5-6; Stations are on P5 near Elevator",,888-758-4389,E,,Public,24 hours daily,,,,,,4,,,ChargePoint Network,http://www.mychargepoint.net/,10/09/2015,66658,2015-10-09 07:48:12+00,,,,,,,,,J1772,"601 S. Figueroa St
LA, CA 90017",34.0508366,-118.2593009,1400000US06037207710,57801
2398,0101000020E61000007C2F192202915DC07EF2C17CC3054140,ELEC,L.A. LIVE EV CH,888 W Olympic Blvd,"UNIT 8; East Garage, Level P2
UNIT 6; East Garage, Level P1
UNIT 7; East Garage, Level P2
UNIT 5; East Garage, Level P1",,888-758-4389,E,,Public,24 hours daily,,,,,,8,,,ChargePoint Network,http://www.mychargepoint.net/,10/09/2015,67676,2015-10-09 07:45:07+00,,,,,,,,,J1772,"888 W Olympic Blvd
LA, CA 90015",34.0450283,-118.2657552,1400000US06037207710,57801
19037,0101000020E6100000B254CD6298905DC04C384FD081064140,ELEC,BROOKFIELD WEST,601 S Figueroa St,"601 S FIG EV1; Enter garage, valet will direct you, station on P1.
601 S FIG EV3; Enter garage, valet will direct you, stations are on P1.
601 S FIG EV2; Enter garage, valet will direct you, stations are on P1",,888-758-4389,E,,Public,24 hours daily,,,,,,4,,,ChargePoint Network,http://www.mychargepoint.net/,10/09/2015,42256,2015-10-09 07:48:08+00,,,,,,,,,J1772,"601 S Figueroa St
Los Angeles, CA 90017",34.0508366,-118.2593009,1400000US06037207710,57801
10925,0101000020E61000002F51BD35B0905DC01407D0EFFB054140,ELEC,LAZ Parking - 833 Flower Street Garage,833 Flower Street,,,888-998-2546,E,,Private,MON: 24 hours | TUE: 24 hours | WED: 24 hours | THU: 24 hours | FRI: 24 hours | SAT: 24 hours | SUN: 24 hours,,,,,,2,,,Blink Network,http://www.blinknetwork.com/,10/09/2015,65788,2015-10-09 07:13:03+00,,,,,,,,,J1772,"833 Flower Street
Los Angeles, CA 90017",34.046751,-118.260755,1400000US06037207710,57801
19317,0101000020E61000003C889D2974905DC0616F62484E064140,ELEC,CARCHARGING / 707 WILSHIRE,707 Wilshire Blvd,,,888-998-2546,E,,Public,MON: 24 hours | TUE: 24 hours | WED: 24 hours | THU: 24 hours | FRI: 24 hours | SAT: 24 hours | SUN: 24 hours,,,,,,1,,,Blink Network,http://www.blinknetwork.com/,10/09/2015,70117,2015-10-09 07:12:25+00,,,,,,,,,J1772,"707 Wilshire Blvd
Los Angeles, CA 90017",34.049264,-118.25709,1400000US06037207710,57801
20001,0101000020E6100000883B2872D2905DC0CD188B4BFA054140,ELEC,865 S. FIGUEROA,865 S Figueroa St,"865 EV 1; Valet Station",,888-758-4389,E,,Public,24 hours daily,,,,,,2,,,ChargePoint Network,http://www.mychargepoint.net/,10/09/2015,67074,2015-10-09 08:20:25+00,,,,,,,,,J1772,"865 S Figueroa St
LA, CA 90015",34.0467009,-118.2628446,1400000US06037207710,57801
16884,0101000020E6100000BC5D8A0604915DC0101C3CB8E0054140,ELEC,Residence Inn - Tesla,901 W Olympic Blvd,,,231-443-9200  877-798-3752,E,,Public,"24 hours daily; for Tesla use only; for guest use only; see valet desk for access",,,,,,1,,,Tesla,http://www.teslamotors.com/supercharger,09/02/2015,68957,2015-10-08 16:44:50+00,P,,,02/01/2015,,,,,TESLA,"901 W Olympic Blvd
Los Angeles, CA 90015",34.0459204,-118.2658707,1400000US06037207710,57801
19451,0101000020E6100000EA7AA2EBC2905DC085D1AC6C1F064140,ELEC,Figueroa Tower Parking Garage,801 S Figueroa St,,,310-777-5000,E,,Public,"Garage business hours; pay lot",,,,,,4,,,,,08/04/2015,1527,2015-08-04 12:46:49+00,P,,,09/01/1995,,,,,J1772,"801 S Figueroa St
Los Angeles, CA 90017",34.047834,-118.261897,1400000US06037207710,57801
16629,0101000020E61000008A75AA7CCF905DC0E82C584F52064140,ELEC,945 W 8TH ST AD,945 W. 8th Street,"LVL 7 SEC C 06; Go to Level 7, stations on NE side near Rome elevator
LVL 7 SEC C 03; Go to Level 7, stations on NE side near Level 7 elevator
LVL 7 SEC C 05; Go to Level 7, stations on the NE side near Rome elevator
LVL 7 SEC C 04; Go to Level 7, stations are on NE side near Level 7 Elevator
LVL 7 SEC C 02; Go to Level 7, stations are on the NE side of the garage near the  Level 7 elevator.
LVL 7 SEC C 01; Go to Level 7, stations are on the NE side of the garage near Level 7 elevator",,888-758-4389,E,,Public,24 hours daily,,,,,,8,,,ChargePoint Network,http://www.mychargepoint.net/,10/09/2015,41791,2015-10-09 07:47:58+00,,,,,,,,,J1772,"945 W. 8th Street
Los Angeles, CA 90017",34.0493869,-118.262664,1400000US06037207710,57801
18425,0101000020E6100000BFB5132521795EC0A88FC01F7E4C4240,ELEC,A Shade Above - Tesla,528 Abrego St,,,831-649-9100  877-798-3752,E,,Public - Call ahead,"8:30am-4:30pm M-F; for Tesla use only; for guest use only; see front desk for access",,,,,,2,,,Tesla,http://www.teslamotors.com/supercharger,09/02/2015,68892,2015-09-02 02:42:38+00,P,,,04/01/2015,,,,,TESLA,"528 Abrego St
Monterey, CA 93940",36.597599,-121.892648,1400000US06053012700,57857
16992,0101000020E61000005C4299A14C795EC0C3E050AEDF4C4240,ELEC,Monterey Marriott - Tesla,350 Calle Principal,,,831-649-4234  877-798-3752,E,,Public,"24 hours daily; for Tesla use only; for guest use only; see front desk for access",,,,,,2,,,Tesla,http://www.teslamotors.com/supercharger,,70336,2015-10-08 18:35:01+00,P,,,08/01/2015,,,,,TESLA,"350 Calle Principal
Monterey, CA 93940",36.6005762,-121.8953022,1400000US06053012700,57857
4967,0101000020E610000087EDDDD5E1195DC01460B3B7EFDC4040,ELEC,PD,72399 CA-111,"DESERT CROSSING; S/B on Hwy 111 turn right into center and drive to DSW Show store area",,888-758-4389,E,,Public,24 hours daily,,,,,,2,,,ChargePoint Network,http://www.mychargepoint.net/,10/09/2015,64721,2015-10-09 08:26:26+00,,,,,,,,,J1772,"72399 CA-111
Palm Desert, CA 92260",33.7260656,-116.4044089,1400000US06065045124,57857
3079,0101000020E610000029ED0DBE30795EC0374F75C8CD4C4240,ELEC,West Custom House Garage,340 Tyler St,Between Franklin St and Del Monte Ave. Connectors provided for stations to be compatible with all PEVs.,,831-646-3953,E,,Public,"24 hours daily; 4 hour parking 9am-6pm M-F",,,,,,2,,,,,05/05/2015,33566,2015-05-05 11:55:51+00,P,,,09/30/2008,,,,,J1772,"340 Tyler St
Monterey, CA 93940",36.60003,-121.8936,1400000US06053012700,57857
5659,0101000020E6100000C6E061DA37525EC0A0336953754B4340,ELEC,City of Rancho Cordova - City Hall,2729 Prospect Park Dr,,,916-851-8710,E,,Public,24 hours daily,,,,,,4,,,,,10/06/2015,70064,2015-10-06 21:57:23+00,LG,,,07/01/2015,,,,,J1772,"2729 Prospect Park Dr
Rancho Cordova, CA 95670",38.589518,-121.284659,1400000US06067009010,57935
2447,0101000020E6100000D15790662C515EC00F2BDCF2914C4340,ELEC,City of Rancho Cordova  - Neighborhood Services Building,2880 Gold Tailings Court,,,,E,,Private,Employee use only,,,,,,1,,,,,10/06/2015,70065,2015-10-06 21:57:20+00,LG,,,07/01/2015,,,,,J1772,"2880 Gold Tailings Court
Rancho Cordova, CA 95670",38.598204,-121.268335,1400000US06067009010,57935
11199,0101000020E6100000192D5107C3975DC0359B221BA3F64040,ELEC,PAC CON,5211 Pacific Concourse Dr,"STATION 1; back of building",,888-758-4389,E,,Public,24 hours daily,,,,,,2,,,ChargePoint Network,http://www.mychargepoint.net/,10/09/2015,70089,2015-10-09 07:40:43+00,,,,,,,,,J1772,"5211 Pacific Concourse Dr
Los Angeles, CA 90045",33.9268526,-118.3712786,1400000US06037602200,58074
10763,0101000020E6100000CCF6D7E19E795EC0FB2FC676AD4A4240,ELEC,CARCHARGING,1410 Del Monte Center,"DEL MONTE CTR 1; Located near escalators on the North side of the parking lot
